time_step,topic,uid,real_comments,profile_text,batch_mf,pre_pos,pre_neu,pre_neg,dist_t0_pos,dist_t0_neu,dist_t0_neg,dist_t1_pos,dist_t1_neu,dist_t1_neg,dist_t2_pos,dist_t2_neu,dist_t2_neg,dist_t3_pos,dist_t3_neu,dist_t3_neg,dist_t4_pos,dist_t4_neu,dist_t4_neg,dist_t5_pos,dist_t5_neu,dist_t5_neg,dist_t6_pos,dist_t6_neu,dist_t6_neg,dist_t7_pos,dist_t7_neu,dist_t7_neg,dist_t8_pos,dist_t8_neu,dist_t8_neg,dist_t9_pos,dist_t9_neu,dist_t9_neg,dist_t10_pos,dist_t10_neu,dist_t10_neg
4,《建党伟业》将在北美主流院线全面公映。片中一些演员非常兴奋，作品终于在自己的国家上映了。,1728987182,转发微博。,对传统文化和历史有认同，同时表达了对现实的积极态度和对未来的乐观期望情绪宣泄，乐观积极，关注民生，宏大叙事这位用户表现出对传统文化的尊重和对现实的积极态度。他们经常分享关于节日、生活和未来的积极信息，表达了对家庭和社会和谐的重视。他们的语言风格充满乐观和正能量，经常使用宏大叙事来描述对未来的期望。这位用户在社交媒体上是一个活跃的参与者，他们的言论通常能够激发他人的积极情绪，并鼓励人们面对困难时保持乐观。,根据以上信息可以得知，在此次的话题讨论中，绝大部分网友持反对的态度，认为这部电影在国内已经足够成功，没必要再去海外推广。此外，还有少量网友表示希望看到外国版本的《建党伟业》，但是总体上看并没有太多人对其抱有很大的期望值。从情绪的角度来看，大多数人的情绪比较低落和沮丧，而对于这个话题本身的真实性也存在一定的怀疑。最后，可以看出这些网友更多的是通过转发来传播相关信息，而不是直接参与对话或者发表个人看法。,0.03125,0.921875,0.046875,0.0,0.875,0.125,0.0625,0.8125,0.125,0.0,0.875,0.125,0.125,0.8125,0.0625,0.0,0.875,0.125,0.0,0.875,0.125,0.0,0.0,1.0,0.0,0.0,1.0,0.0,0.0,1.0,0.0,0.0,1.0,0.0,0.0,1.0
4,《建党伟业》将在北美主流院线全面公映。片中一些演员非常兴奋，作品终于在自己的国家上映了。,1936895764,//建党伟业演员国籍： 美国：吴彦祖，陈冲，陈凯歌，陈红，甄子丹，刘亦菲，邬君梅，宁静，王姬。加拿大：童安格，蒋大为，徐帆。英国：张铁林。日本：许晴。澳洲：沈小岑。新西兰：苏瑾。新加坡：李连杰。瑞士：斯琴高娃。泰国：胡兵。【中国：汤唯。】唉，好不容易有个中国人还被删了。,对体育赛事和商业活动持积极态度，但对政治和社会议题较为中立情绪宣泄，宏大叙事，精英视角，自我中心，关注民生该用户对体育赛事和商业活动表现出浓厚的兴趣，经常转发相关内容并发表评论。在表达上，他倾向于情绪宣泄和宏大叙事，同时展现出精英视角和自我中心的特征。在社会议题上，他保持中立态度，不倾向于发表强烈的政治立场。他的语言风格活泼，善于使用网络流行语和表情符号，体现出对生活的热爱和对新鲜事物的追求。,根据以上信息可以得知，在此次的话题讨论中，绝大部分网友持反对的态度，认为这部电影在国内已经足够成功，没必要再去海外推广。此外，还有少量网友表示希望看到外国版本的《建党伟业》，但是总体上看并没有太多人对其抱有很大的期望值。从情绪的角度来看，大多数人的情绪比较低落和沮丧，而对于这个话题本身的真实性也存在一定的怀疑。最后，可以看出这些网友更多的是通过转发来传播相关信息，而不是直接参与对话或者发表个人看法。,0.03125,0.921875,0.046875,0.0,0.875,0.125,0.0625,0.8125,0.125,0.0,0.875,0.125,0.125,0.8125,0.0625,0.0,0.875,0.125,0.0,0.875,0.125,0.0,0.0,1.0,0.0,0.0,1.0,0.0,0.0,1.0,0.0,0.0,1.0,0.0,0.0,1.0
4,《建党伟业》将在北美主流院线全面公映。片中一些演员非常兴奋，作品终于在自己的国家上映了。,1561244980,"冇错,有了这部电影的指引,大家都产生了建党的决心.",转发活动微博并参与讨论，但原创内容偏向生活分享，未表现出明显的反建制或批判态度情绪宣泄，关注民生，精英视角，底层共情该用户关注社会现象，但表达观点较为温和，倾向于参与群体活动。在日常生活中，关注生活品质，对民生问题有所关注，但不会过于激进。语言风格偏向于关注民生和底层共情，同时展现出一定的精英视角。,根据以上信息可以得知，在此次的话题讨论中，绝大部分网友持反对的态度，认为这部电影在国内已经足够成功，没必要再去海外推广。此外，还有少量网友表示希望看到外国版本的《建党伟业》，但是总体上看并没有太多人对其抱有很大的期望值。从情绪的角度来看，大多数人的情绪比较低落和沮丧，而对于这个话题本身的真实性也存在一定的怀疑。最后，可以看出这些网友更多的是通过转发来传播相关信息，而不是直接参与对话或者发表个人看法。,0.03125,0.921875,0.046875,0.0,0.875,0.125,0.0625,0.8125,0.125,0.0,0.875,0.125,0.125,0.8125,0.0625,0.0,0.875,0.125,0.0,0.875,0.125,0.0,0.0,1.0,0.0,0.0,1.0,0.0,0.0,1.0,0.0,0.0,1.0,0.0,0.0,1.0
4,《建党伟业》将在北美主流院线全面公映。片中一些演员非常兴奋，作品终于在自己的国家上映了。,1790253681,转发微博。,对新技术和产品持积极态度，但对某些社会议题表现出批判性思考情绪宣泄，关注民生，精英视角，自我中心，逻辑缜密该用户对新技术和产品表现出浓厚的兴趣，乐于分享和体验。在表达个人观点时，既关注民生问题，又保持一定的精英视角。对社会议题持有批判性思考，但总体上倾向于温和建制派立场。在语言风格上，逻辑性强，但有时会表现出情绪化的倾向。作为高频活跃者，该用户在社交媒体上积极参与讨论，并具有一定的影响力。,根据以上信息可以得知，在此次的话题讨论中，绝大部分网友持反对的态度，认为这部电影在国内已经足够成功，没必要再去海外推广。此外，还有少量网友表示希望看到外国版本的《建党伟业》，但是总体上看并没有太多人对其抱有很大的期望值。从情绪的角度来看，大多数人的情绪比较低落和沮丧，而对于这个话题本身的真实性也存在一定的怀疑。最后，可以看出这些网友更多的是通过转发来传播相关信息，而不是直接参与对话或者发表个人看法。,0.03125,0.921875,0.046875,0.0,0.875,0.125,0.0625,0.8125,0.125,0.0,0.875,0.125,0.125,0.8125,0.0625,0.0,0.875,0.125,0.0,0.875,0.125,0.0,0.0,1.0,0.0,0.0,1.0,0.0,0.0,1.0,0.0,0.0,1.0,0.0,0.0,1.0
5,《建党伟业》将在北美主流院线全面公映。片中一些演员非常兴奋，作品终于在自己的国家上映了。,1780978867,转发微博。,关注社会问题，转发公益信息，但同时也参与商业活动的转发情绪宣泄，关注民生，精英视角，底层共情，自我中心该用户关注社会问题，尤其是民生问题，转发公益信息，表现出对弱势群体的同情。同时，也参与商业活动的转发，显示出对多样信息的接受态度。在表达上，既有情绪宣泄的一面，也有对民生问题的关注，同时保持一定的精英视角和底层共情。在社交活动中，该用户表现出一定的自我中心，但总体上是一个积极参与社会讨论的普通参与者。,根据上述分析可知，大多数网友对于电影在中国的成功并不感到惊讶或失望，因此他们的立场较为客观；同时，也有少数网友表达了对该影片在国外市场的期待与关注。关于观众们的主要观点，则集中在是否有必要将此部电影推向国外市场以及其真实性和可信度等方面。总的来说，虽然部分网友对此类问题有不同态度，但整体上大家的关注程度较高且普遍表现出一种乐观的心态。,0.025,0.9125,0.0625,0.0625,0.8125,0.125,0.0,0.875,0.125,0.125,0.8125,0.0625,0.0,0.875,0.125,0.0,0.875,0.125,0.0,0.0,1.0,0.0,0.0,1.0,0.0,0.0,1.0,0.0,0.0,1.0,0.0,0.0,1.0,0.0,0.0,1.0
5,《建党伟业》将在北美主流院线全面公映。片中一些演员非常兴奋，作品终于在自己的国家上映了。,1340494037,[哈哈],情绪宣泄，攻击性强，关注民生，逐利投机者该用户表现出强烈的逐利倾向，频繁转发与促销、抽奖、优惠相关的微博，显示其对个人利益的关注。在表达上，倾向于情绪化的宣泄和攻击性语言，同时关注民生话题。该用户在社交媒体上活跃度高，可能是为了获取利益或吸引关注。,根据上述分析可知，大多数网友对于电影在中国的成功并不感到惊讶或失望，因此他们的立场较为客观；同时，也有少数网友表达了对该影片在国外市场的期待与关注。关于观众们的主要观点，则集中在是否有必要将此部电影推向国外市场以及其真实性和可信度等方面。总的来说，虽然部分网友对此类问题有不同态度，但整体上大家的关注程度较高且普遍表现出一种乐观的心态。,0.025,0.9125,0.0625,0.0625,0.8125,0.125,0.0,0.875,0.125,0.125,0.8125,0.0625,0.0,0.875,0.125,0.0,0.875,0.125,0.0,0.0,1.0,0.0,0.0,1.0,0.0,0.0,1.0,0.0,0.0,1.0,0.0,0.0,1.0,0.0,0.0,1.0
5,《建党伟业》将在北美主流院线全面公映。片中一些演员非常兴奋，作品终于在自己的国家上映了。,1681305717,转发微博。,转发内容多为正面，对官方和名人言论持认同态度，但未表现出强烈的政治立场情绪宣泄，关注民生，精英视角，底层共情，自我中心该用户关注个人成长与幸福，对生活充满热情。转发内容多为正面，对官方和名人言论持认同态度，但未表现出强烈的政治立场。在表达上，既有情绪宣泄的一面，也关注民生问题，同时展现出精英视角和底层共情。在社交活动中，该用户较为活跃，但并非意见领袖。,根据上述分析可知，大多数网友对于电影在中国的成功并不感到惊讶或失望，因此他们的立场较为客观；同时，也有少数网友表达了对该影片在国外市场的期待与关注。关于观众们的主要观点，则集中在是否有必要将此部电影推向国外市场以及其真实性和可信度等方面。总的来说，虽然部分网友对此类问题有不同态度，但整体上大家的关注程度较高且普遍表现出一种乐观的心态。,0.025,0.9125,0.0625,0.0625,0.8125,0.125,0.0,0.875,0.125,0.125,0.8125,0.0625,0.0,0.875,0.125,0.0,0.875,0.125,0.0,0.0,1.0,0.0,0.0,1.0,0.0,0.0,1.0,0.0,0.0,1.0,0.0,0.0,1.0,0.0,0.0,1.0
5,《建党伟业》将在北美主流院线全面公映。片中一些演员非常兴奋，作品终于在自己的国家上映了。,1136590475,转发微博。,倾向于温和建制派，对官方和正面内容有一般认同，但偶尔表现出对某些现象的讽刺和调侃情绪宣泄，反讽嘲弄，关注民生，自我中心该用户在社交媒体上表现出一种轻松幽默的态度，对官方和正面内容有一定的认同，但同时也展现出对某些现象的讽刺和调侃。在表达观点时，倾向于使用情绪化的语言和反讽的修辞手法，关注民生问题，但同时也表现出一定的自我中心倾向。在面对不同类型的事件时，可能会表现出对快乐的追求和对现实的批判，同时以轻松幽默的方式表达自己的观点。,根据上述分析可知，大多数网友对于电影在中国的成功并不感到惊讶或失望，因此他们的立场较为客观；同时，也有少数网友表达了对该影片在国外市场的期待与关注。关于观众们的主要观点，则集中在是否有必要将此部电影推向国外市场以及其真实性和可信度等方面。总的来说，虽然部分网友对此类问题有不同态度，但整体上大家的关注程度较高且普遍表现出一种乐观的心态。,0.025,0.9125,0.0625,0.0625,0.8125,0.125,0.0,0.875,0.125,0.125,0.8125,0.0625,0.0,0.875,0.125,0.0,0.875,0.125,0.0,0.0,1.0,0.0,0.0,1.0,0.0,0.0,1.0,0.0,0.0,1.0,0.0,0.0,1.0,0.0,0.0,1.0
5,《建党伟业》将在北美主流院线全面公映。片中一些演员非常兴奋，作品终于在自己的国家上映了。,1958568223,转发微博。,转发内容多样，对某些事件有个人看法，但整体上倾向于温和改良派立场情绪宣泄，关注民生，精英视角，底层共情该用户关注社会热点事件，对某些事件有强烈的个人情感反应，同时也会转发一些与民生相关的内容。在表达上，既有情绪宣泄的一面，也有对民生问题的关注。整体上，该用户表现出一定的社会参与意识，但并非意见领袖，更倾向于作为一个普通参与者。,根据上述分析可知，大多数网友对于电影在中国的成功并不感到惊讶或失望，因此他们的立场较为客观；同时，也有少数网友表达了对该影片在国外市场的期待与关注。关于观众们的主要观点，则集中在是否有必要将此部电影推向国外市场以及其真实性和可信度等方面。总的来说，虽然部分网友对此类问题有不同态度，但整体上大家的关注程度较高且普遍表现出一种乐观的心态。,0.025,0.9125,0.0625,0.0625,0.8125,0.125,0.0,0.875,0.125,0.125,0.8125,0.0625,0.0,0.875,0.125,0.0,0.875,0.125,0.0,0.0,1.0,0.0,0.0,1.0,0.0,0.0,1.0,0.0,0.0,1.0,0.0,0.0,1.0,0.0,0.0,1.0
5,《建党伟业》将在北美主流院线全面公映。片中一些演员非常兴奋，作品终于在自己的国家上映了。,1850864857,转发微博。,对房产市场持关注态度，倾向于官方叙事关注民生，精英视角，数据考据，宏大叙事，逻辑缜密该用户对无锡房产市场动态高度关注，倾向于官方叙事，注重数据与事实。在表达上，他展现出对民生的关注和精英视角，逻辑缜密，善于分析。在面对不同事件时，他预期会以理性客观的态度进行评论，并强调数据与事实的重要性。其语言风格特征表现为宏大叙事和逻辑性强的特点。,根据上述分析可知，大多数网友对于电影在中国的成功并不感到惊讶或失望，因此他们的立场较为客观；同时，也有少数网友表达了对该影片在国外市场的期待与关注。关于观众们的主要观点，则集中在是否有必要将此部电影推向国外市场以及其真实性和可信度等方面。总的来说，虽然部分网友对此类问题有不同态度，但整体上大家的关注程度较高且普遍表现出一种乐观的心态。,0.025,0.9125,0.0625,0.0625,0.8125,0.125,0.0,0.875,0.125,0.125,0.8125,0.0625,0.0,0.875,0.125,0.0,0.875,0.125,0.0,0.0,1.0,0.0,0.0,1.0,0.0,0.0,1.0,0.0,0.0,1.0,0.0,0.0,1.0,0.0,0.0,1.0
5,《建党伟业》将在北美主流院线全面公映。片中一些演员非常兴奋，作品终于在自己的国家上映了。,1971062677,转发微博。,转发内容多为正面，对官方和名人言论持认同态度，但未表现出强烈的政治立场情绪宣泄，关注民生，精英视角，底层共情，自我中心该用户关注个人成长与幸福，对生活充满热情。转发内容多为正面，对官方和名人言论持认同态度，但未表现出强烈的政治立场。在表达上，既有情绪宣泄的一面，也关注民生问题，同时展现出精英视角和底层共情。在社交活动中，该用户较为活跃，但并非意见领袖。,根据上述分析可知，大多数网友对于电影在中国的成功并不感到惊讶或失望，因此他们的立场较为客观；同时，也有少数网友表达了对该影片在国外市场的期待与关注。关于观众们的主要观点，则集中在是否有必要将此部电影推向国外市场以及其真实性和可信度等方面。总的来说，虽然部分网友对此类问题有不同态度，但整体上大家的关注程度较高且普遍表现出一种乐观的心态。,0.025,0.9125,0.0625,0.0625,0.8125,0.125,0.0,0.875,0.125,0.125,0.8125,0.0625,0.0,0.875,0.125,0.0,0.875,0.125,0.0,0.0,1.0,0.0,0.0,1.0,0.0,0.0,1.0,0.0,0.0,1.0,0.0,0.0,1.0,0.0,0.0,1.0
5,《建党伟业》将在北美主流院线全面公映。片中一些演员非常兴奋，作品终于在自己的国家上映了。,1855705371,转发微博。,情绪宣泄，关注民生，精英视角，底层共情，自我中心该用户表现出温和的建制派倾向，关注个人利益的同时，也关心社会秩序和稳定。在表达上，倾向于情绪宣泄和关注民生问题，同时展现出精英视角和底层共情。在人际交往中，倾向于简单明了，避免复杂的人际关系。在面对不同事件时，可能会表现出焦虑和忐忑，同时也期待能够取得满意的成绩。,根据上述分析可知，大多数网友对于电影在中国的成功并不感到惊讶或失望，因此他们的立场较为客观；同时，也有少数网友表达了对该影片在国外市场的期待与关注。关于观众们的主要观点，则集中在是否有必要将此部电影推向国外市场以及其真实性和可信度等方面。总的来说，虽然部分网友对此类问题有不同态度，但整体上大家的关注程度较高且普遍表现出一种乐观的心态。,0.025,0.9125,0.0625,0.0625,0.8125,0.125,0.0,0.875,0.125,0.125,0.8125,0.0625,0.0,0.875,0.125,0.0,0.875,0.125,0.0,0.0,1.0,0.0,0.0,1.0,0.0,0.0,1.0,0.0,0.0,1.0,0.0,0.0,1.0,0.0,0.0,1.0
5,《建党伟业》将在北美主流院线全面公映。片中一些演员非常兴奋，作品终于在自己的国家上映了。,2098211624,转发微博。,温和建制派，对日常生活话题有较强兴趣，转发内容多与娱乐、美食相关情绪宣泄，关注民生，自我中心，幽默风趣，攻击性强该用户表现出温和的体制拥护态度，对日常生活话题有浓厚兴趣，转发内容多涉及娱乐、美食等轻松话题。在表达上，善于使用幽默和情绪化的语言，关注个人情感和日常生活。作为高频活跃者，该用户在社交媒体上积极参与互动，展现出较强的社交活跃度。,根据上述分析可知，大多数网友对于电影在中国的成功并不感到惊讶或失望，因此他们的立场较为客观；同时，也有少数网友表达了对该影片在国外市场的期待与关注。关于观众们的主要观点，则集中在是否有必要将此部电影推向国外市场以及其真实性和可信度等方面。总的来说，虽然部分网友对此类问题有不同态度，但整体上大家的关注程度较高且普遍表现出一种乐观的心态。,0.025,0.9125,0.0625,0.0625,0.8125,0.125,0.0,0.875,0.125,0.125,0.8125,0.0625,0.0,0.875,0.125,0.0,0.875,0.125,0.0,0.0,1.0,0.0,0.0,1.0,0.0,0.0,1.0,0.0,0.0,1.0,0.0,0.0,1.0,0.0,0.0,1.0
5,《建党伟业》将在北美主流院线全面公映。片中一些演员非常兴奋，作品终于在自己的国家上映了。,1476781914,这《建党伟业》真被网友们说中了，这票房估计想不超10亿都难，这几天来，已收到人家朋友或客户T玛公司的许多赠票了！[浮云] 啊[浮云],转发内容多样，对某些事件有个人看法，但整体上倾向于温和改良派立场情绪宣泄，关注民生，精英视角，底层共情该用户关注社会热点事件，对某些事件有强烈的个人情感反应，同时也会转发一些与民生相关的内容。在表达上，既有情绪宣泄的一面，也有对民生问题的关注。整体上，该用户表现出一定的社会参与意识，但并非意见领袖，更倾向于作为一个普通参与者。,根据上述分析可知，大多数网友对于电影在中国的成功并不感到惊讶或失望，因此他们的立场较为客观；同时，也有少数网友表达了对该影片在国外市场的期待与关注。关于观众们的主要观点，则集中在是否有必要将此部电影推向国外市场以及其真实性和可信度等方面。总的来说，虽然部分网友对此类问题有不同态度，但整体上大家的关注程度较高且普遍表现出一种乐观的心态。,0.025,0.9125,0.0625,0.0625,0.8125,0.125,0.0,0.875,0.125,0.125,0.8125,0.0625,0.0,0.875,0.125,0.0,0.875,0.125,0.0,0.0,1.0,0.0,0.0,1.0,0.0,0.0,1.0,0.0,0.0,1.0,0.0,0.0,1.0,0.0,0.0,1.0
5,《建党伟业》将在北美主流院线全面公映。片中一些演员非常兴奋，作品终于在自己的国家上映了。,1735475640,转发微博。,转发内容多涉及官方和正面信息，显示对体制的认同，但偶尔转发涉及社会问题的内容，可能对某些政策或现象持有保留态度情绪宣泄，关注民生，精英视角，底层共情，自我中心该用户对体制持有一定程度的认同，但同时也关注社会问题，转发内容多涉及官方和正面信息，显示对群体压力的敏感性。在表达上，倾向于情绪宣泄和关注民生，同时具有精英视角和底层共情的特点。在政治倾向上，可能表现为对体制的复杂性有认识，对不同类型事件可能既有支持也有批判，语言风格特征为情绪化且关注社会现实。,根据上述分析可知，大多数网友对于电影在中国的成功并不感到惊讶或失望，因此他们的立场较为客观；同时，也有少数网友表达了对该影片在国外市场的期待与关注。关于观众们的主要观点，则集中在是否有必要将此部电影推向国外市场以及其真实性和可信度等方面。总的来说，虽然部分网友对此类问题有不同态度，但整体上大家的关注程度较高且普遍表现出一种乐观的心态。,0.025,0.9125,0.0625,0.0625,0.8125,0.125,0.0,0.875,0.125,0.125,0.8125,0.0625,0.0,0.875,0.125,0.0,0.875,0.125,0.0,0.0,1.0,0.0,0.0,1.0,0.0,0.0,1.0,0.0,0.0,1.0,0.0,0.0,1.0,0.0,0.0,1.0
5,《建党伟业》将在北美主流院线全面公映。片中一些演员非常兴奋，作品终于在自己的国家上映了。,1707405220,转发微博。,转发官方内容较多，但有时会表达个人情感或观点情绪宣泄，宏大叙事，关注民生，自我中心，阴阳怪气该用户在社交媒体上表现出一定的活跃度，倾向于转发官方和正面内容，同时在个人原创内容中表达情感和观点。他对民生问题关注较多，但同时也表现出一定的自我中心倾向。在语言风格上，他善于使用情绪化的表达，并喜欢宏大叙事。总体而言，他是一个温和的建制派，对体制持支持态度，但同时也保持一定的独立思考和个人情感表达。,根据上述分析可知，大多数网友对于电影在中国的成功并不感到惊讶或失望，因此他们的立场较为客观；同时，也有少数网友表达了对该影片在国外市场的期待与关注。关于观众们的主要观点，则集中在是否有必要将此部电影推向国外市场以及其真实性和可信度等方面。总的来说，虽然部分网友对此类问题有不同态度，但整体上大家的关注程度较高且普遍表现出一种乐观的心态。,0.025,0.9125,0.0625,0.0625,0.8125,0.125,0.0,0.875,0.125,0.125,0.8125,0.0625,0.0,0.875,0.125,0.0,0.875,0.125,0.0,0.0,1.0,0.0,0.0,1.0,0.0,0.0,1.0,0.0,0.0,1.0,0.0,0.0,1.0,0.0,0.0,1.0
5,《建党伟业》将在北美主流院线全面公映。片中一些演员非常兴奋，作品终于在自己的国家上映了。,1462435873,[偷笑],转发内容多为正面，对官方和名人言论持认同态度，但未表现出强烈的政治立场情绪宣泄，关注民生，精英视角，底层共情，自我中心该用户关注个人成长与幸福，对生活充满热情。转发内容多为正面，对官方和名人言论持认同态度，但未表现出强烈的政治立场。在表达上，既有情绪宣泄的一面，也关注民生问题，同时展现出精英视角和底层共情。在社交活动中，该用户较为活跃，但并非意见领袖。,根据上述分析可知，大多数网友对于电影在中国的成功并不感到惊讶或失望，因此他们的立场较为客观；同时，也有少数网友表达了对该影片在国外市场的期待与关注。关于观众们的主要观点，则集中在是否有必要将此部电影推向国外市场以及其真实性和可信度等方面。总的来说，虽然部分网友对此类问题有不同态度，但整体上大家的关注程度较高且普遍表现出一种乐观的心态。,0.025,0.9125,0.0625,0.0625,0.8125,0.125,0.0,0.875,0.125,0.125,0.8125,0.0625,0.0,0.875,0.125,0.0,0.875,0.125,0.0,0.0,1.0,0.0,0.0,1.0,0.0,0.0,1.0,0.0,0.0,1.0,0.0,0.0,1.0,0.0,0.0,1.0
