time_step,topic,uid,real_comments,profile_text,batch_mf,pre_pos,pre_neu,pre_neg,dist_t0_pos,dist_t0_neu,dist_t0_neg,dist_t1_pos,dist_t1_neu,dist_t1_neg,dist_t2_pos,dist_t2_neu,dist_t2_neg,dist_t3_pos,dist_t3_neu,dist_t3_neg,dist_t4_pos,dist_t4_neu,dist_t4_neg,dist_t5_pos,dist_t5_neu,dist_t5_neg,dist_t6_pos,dist_t6_neu,dist_t6_neg,dist_t7_pos,dist_t7_neu,dist_t7_neg,dist_t8_pos,dist_t8_neu,dist_t8_neg,dist_t9_pos,dist_t9_neu,dist_t9_neg,dist_t10_pos,dist_t10_neu,dist_t10_neg
7,《建党伟业》将在北美主流院线全面公映。片中一些演员非常兴奋，作品终于在自己的国家上映了。,1654730601,hahahaha,倾向于温和建制派，对官方和正面内容有一般认同，但偶尔表现出对某些现象的讽刺和调侃情绪宣泄，反讽嘲弄，关注民生，自我中心该用户在社交媒体上表现出一种轻松幽默的态度，对官方和正面内容有一定的认同，但同时也展现出对某些现象的讽刺和调侃。在表达观点时，倾向于使用情绪化的语言和反讽的修辞手法，关注民生问题，但同时也表现出一定的自我中心倾向。在面对不同类型的事件时，可能会表现出对快乐的追求和对现实的批判，同时以轻松幽默的方式表达自己的观点。,基于上述分析结果，可以发现大多数网民对于《建党伟业》这部电影并不看好，普遍认为它是一部商业炒作之作，缺乏真实的历史依据。同时也有少数网民表现出了一些兴趣和好奇，希望能够更多地了解到电影的具体情况。总的来说，虽然部分网民表达了强烈的反感态度，但整体而言，《建党伟业》在国内市场上的反响并不是特别好。,0.0267857142857142,0.8928571428571429,0.0803571428571428,0.125,0.8125,0.0625,0.0,0.875,0.125,0.0,0.875,0.125,0.0,0.0,1.0,0.0,0.0,1.0,0.0,0.0,1.0,0.0,0.0,1.0,0.0,0.0,1.0,0.0,0.0,1.0,0.0,0.0,1.0,0.0,0.0,1.0
7,《建党伟业》将在北美主流院线全面公映。片中一些演员非常兴奋，作品终于在自己的国家上映了。,1642532383,转发微博。,对科技产品持开放态度，但对社会现象和政策有个人见解关注民生，精英视角，自我中心，情绪宣泄，宏大叙事该用户关注科技动态，对新产品和技术持开放态度，同时在个人生活中表现出对家庭和工作的重视。他善于表达个人情感，同时对社会现象和政策有自己的见解。在社交网络上，他活跃度高，乐于分享个人经历和观点，展现出自我中心的特征。,基于上述分析结果，可以发现大多数网民对于《建党伟业》这部电影并不看好，普遍认为它是一部商业炒作之作，缺乏真实的历史依据。同时也有少数网民表现出了一些兴趣和好奇，希望能够更多地了解到电影的具体情况。总的来说，虽然部分网民表达了强烈的反感态度，但整体而言，《建党伟业》在国内市场上的反响并不是特别好。,0.0267857142857142,0.8928571428571429,0.0803571428571428,0.125,0.8125,0.0625,0.0,0.875,0.125,0.0,0.875,0.125,0.0,0.0,1.0,0.0,0.0,1.0,0.0,0.0,1.0,0.0,0.0,1.0,0.0,0.0,1.0,0.0,0.0,1.0,0.0,0.0,1.0,0.0,0.0,1.0
7,《建党伟业》将在北美主流院线全面公映。片中一些演员非常兴奋，作品终于在自己的国家上映了。,2024099293,[嘻嘻],对现实持有一定的不满和讽刺态度，但缺乏明确的立场和目标情绪宣泄，悲观抱怨，反讽嘲弄，关注民生，自我中心该用户在社交媒体上表现出较高的活跃度，经常转发和评论各种内容，表达对现实的不满和对个人情绪的关注。其言论中带有明显的讽刺和反讽，对传统价值观持有怀疑态度，同时关注民生问题。在语言风格上，该用户倾向于使用情绪化的表达，并表现出一定的自我中心倾向。,基于上述分析结果，可以发现大多数网民对于《建党伟业》这部电影并不看好，普遍认为它是一部商业炒作之作，缺乏真实的历史依据。同时也有少数网民表现出了一些兴趣和好奇，希望能够更多地了解到电影的具体情况。总的来说，虽然部分网民表达了强烈的反感态度，但整体而言，《建党伟业》在国内市场上的反响并不是特别好。,0.0267857142857142,0.8928571428571429,0.0803571428571428,0.125,0.8125,0.0625,0.0,0.875,0.125,0.0,0.875,0.125,0.0,0.0,1.0,0.0,0.0,1.0,0.0,0.0,1.0,0.0,0.0,1.0,0.0,0.0,1.0,0.0,0.0,1.0,0.0,0.0,1.0,0.0,0.0,1.0
7,《建党伟业》将在北美主流院线全面公映。片中一些演员非常兴奋，作品终于在自己的国家上映了。,1956911441,转发微博。,倾向于体制内，但关注个人修养与内心世界情绪宣泄，宏大叙事，关注民生，精英视角该用户在社交媒体上表现出温和的建制派立场，关注个人修养与内心世界。在转发内容中，他倾向于分享与个人成长、精神修养相关的内容，同时也关注社会现象和公共话题。他的表达风格偏向情绪宣泄和宏大叙事，体现出对民生和精英视角的关注。作为普通参与者，他在社交媒体上的活跃度一般，但能够对特定话题产生共鸣。,基于上述分析结果，可以发现大多数网民对于《建党伟业》这部电影并不看好，普遍认为它是一部商业炒作之作，缺乏真实的历史依据。同时也有少数网民表现出了一些兴趣和好奇，希望能够更多地了解到电影的具体情况。总的来说，虽然部分网民表达了强烈的反感态度，但整体而言，《建党伟业》在国内市场上的反响并不是特别好。,0.0267857142857142,0.8928571428571429,0.0803571428571428,0.125,0.8125,0.0625,0.0,0.875,0.125,0.0,0.875,0.125,0.0,0.0,1.0,0.0,0.0,1.0,0.0,0.0,1.0,0.0,0.0,1.0,0.0,0.0,1.0,0.0,0.0,1.0,0.0,0.0,1.0,0.0,0.0,1.0
7,《建党伟业》将在北美主流院线全面公映。片中一些演员非常兴奋，作品终于在自己的国家上映了。,1235973401,转发微博。,转发活动微博并参与讨论，但原创内容偏向生活分享，未表现出明显的反建制或批判态度情绪宣泄，关注民生，精英视角，底层共情该用户关注社会现象，但表达观点较为温和，倾向于参与群体活动。在日常生活中，关注生活品质，对民生问题有所关注，但不会过于激进。语言风格偏向于关注民生和底层共情，同时展现出一定的精英视角。,基于上述分析结果，可以发现大多数网民对于《建党伟业》这部电影并不看好，普遍认为它是一部商业炒作之作，缺乏真实的历史依据。同时也有少数网民表现出了一些兴趣和好奇，希望能够更多地了解到电影的具体情况。总的来说，虽然部分网民表达了强烈的反感态度，但整体而言，《建党伟业》在国内市场上的反响并不是特别好。,0.0267857142857142,0.8928571428571429,0.0803571428571428,0.125,0.8125,0.0625,0.0,0.875,0.125,0.0,0.875,0.125,0.0,0.0,1.0,0.0,0.0,1.0,0.0,0.0,1.0,0.0,0.0,1.0,0.0,0.0,1.0,0.0,0.0,1.0,0.0,0.0,1.0,0.0,0.0,1.0
7,《建党伟业》将在北美主流院线全面公映。片中一些演员非常兴奋，作品终于在自己的国家上映了。,1925888423,转发！,虽无明确政治立场，但对多种现象表现出反讽和不满。情绪宣泄，反讽嘲弄，关注民生，自我中心该用户表现出较高的活跃度，频繁发布个人生活、娱乐和情感相关的博文。其内容多带有反讽和不满情绪，对现实持有批判态度，但缺乏明确的政治立场。在表达上，喜欢使用情绪化的语言和反讽的修辞手法，关注个人感受和日常生活。,基于上述分析结果，可以发现大多数网民对于《建党伟业》这部电影并不看好，普遍认为它是一部商业炒作之作，缺乏真实的历史依据。同时也有少数网民表现出了一些兴趣和好奇，希望能够更多地了解到电影的具体情况。总的来说，虽然部分网民表达了强烈的反感态度，但整体而言，《建党伟业》在国内市场上的反响并不是特别好。,0.0267857142857142,0.8928571428571429,0.0803571428571428,0.125,0.8125,0.0625,0.0,0.875,0.125,0.0,0.875,0.125,0.0,0.0,1.0,0.0,0.0,1.0,0.0,0.0,1.0,0.0,0.0,1.0,0.0,0.0,1.0,0.0,0.0,1.0,0.0,0.0,1.0,0.0,0.0,1.0
8,《建党伟业》将在北美主流院线全面公映。片中一些演员非常兴奋，作品终于在自己的国家上映了。,1800158294,就说有个中国演员还被删掉啦。。太欢乐了！,转发内容多为轻松愉快或实用信息，显示对现状的接受和认同，但偶尔对教育制度有所质疑情绪宣泄，关注民生，精英视角，底层共情，自我中心该用户关注日常生活和实用信息，转发内容多为轻松愉快或实用信息，显示对现状的接受和认同。在转发内容中，偶尔表现出对教育制度的质疑，但整体上保持中立。语言风格偏向于情绪宣泄和关注民生，同时带有一定的精英视角和底层共情。该用户在社交媒体上的活跃度一般，属于普通参与者。,[''],0.0390625,0.8828125,0.078125,0.0,0.875,0.125,0.0,0.875,0.125,0.0,0.0,1.0,0.0,0.0,1.0,0.0,0.0,1.0,0.0,0.0,1.0,0.0,0.0,1.0,0.0,0.0,1.0,0.0,0.0,1.0,0.0,0.0,1.0,0.0,0.0,1.0
8,《建党伟业》将在北美主流院线全面公映。片中一些演员非常兴奋，作品终于在自己的国家上映了。,1926964473,美国：吴彦祖，陈冲，陈凯歌，陈红，甄子丹，刘亦菲，邬君梅，宁静，王姬。加拿大：童安格，蒋大为，徐帆。英国：张铁林。日本：许晴。澳洲：沈小岑。新西兰：苏瑾。新加坡：李连杰。瑞士：斯琴高娃。。【中国：汤唯（被刪）】,转发内容多样，对某些事件有个人看法，但整体上倾向于温和改良派立场情绪宣泄，关注民生，精英视角，底层共情该用户关注社会热点事件，对某些事件有强烈的个人情感反应，同时也会转发一些与民生相关的内容。在表达上，既有情绪宣泄的一面，也有对民生问题的关注。整体上，该用户表现出一定的社会参与意识，但并非意见领袖，更倾向于作为一个普通参与者。,[''],0.0390625,0.8828125,0.078125,0.0,0.875,0.125,0.0,0.875,0.125,0.0,0.0,1.0,0.0,0.0,1.0,0.0,0.0,1.0,0.0,0.0,1.0,0.0,0.0,1.0,0.0,0.0,1.0,0.0,0.0,1.0,0.0,0.0,1.0,0.0,0.0,1.0
8,《建党伟业》将在北美主流院线全面公映。片中一些演员非常兴奋，作品终于在自己的国家上映了。,1425006392,转发微博。,倾向于积极向上的生活态度，但对社会现象持有一定的批判性思考情绪宣泄，宏大叙事，关注民生，精英视角，自我中心该用户表现出积极向上的生活态度，关注个人成长与社会进步。在表达上，倾向于情绪化的宣泄，同时具有宏大叙事的视角。对社会现象持有一定的批判性思考，但总体上保持乐观和积极的心态。在社交活动中，活跃且具有影响力，能够引导话题走向。,[''],0.0390625,0.8828125,0.078125,0.0,0.875,0.125,0.0,0.875,0.125,0.0,0.0,1.0,0.0,0.0,1.0,0.0,0.0,1.0,0.0,0.0,1.0,0.0,0.0,1.0,0.0,0.0,1.0,0.0,0.0,1.0,0.0,0.0,1.0,0.0,0.0,1.0
8,《建党伟业》将在北美主流院线全面公映。片中一些演员非常兴奋，作品终于在自己的国家上映了。,1886671725,[偷笑],转发内容含糊不清，可能表示对官方或正面内容的不认同或质疑阴阳怪气，反讽嘲弄，谜语人该用户对官方或正面内容持怀疑态度，转发内容含糊不清，可能通过反讽和谜语的方式来表达自己的不满或质疑。在社交环境中，该用户可能更倾向于观察和跟风，对权威和主流观点持有一定的批判态度，但在表达上可能较为含蓄和隐晦。,[''],0.0390625,0.8828125,0.078125,0.0,0.875,0.125,0.0,0.875,0.125,0.0,0.0,1.0,0.0,0.0,1.0,0.0,0.0,1.0,0.0,0.0,1.0,0.0,0.0,1.0,0.0,0.0,1.0,0.0,0.0,1.0,0.0,0.0,1.0,0.0,0.0,1.0
8,《建党伟业》将在北美主流院线全面公映。片中一些演员非常兴奋，作品终于在自己的国家上映了。,1889751957,转发微博。,转发官方内容较多，但未表现出明显的反讽或反对态度关注民生，精英视角，底层共情，情绪宣泄，政治隐喻该用户表现出对官方和精英观点的关注，同时在转发内容中体现出对民生问题的关心。用户在表达上较为情绪化，但总体上倾向于温和的建制派立场。在社交活动中，该用户活跃度高，可能是一个意见领袖，对群体观点有较强的影响力。,[''],0.0390625,0.8828125,0.078125,0.0,0.875,0.125,0.0,0.875,0.125,0.0,0.0,1.0,0.0,0.0,1.0,0.0,0.0,1.0,0.0,0.0,1.0,0.0,0.0,1.0,0.0,0.0,1.0,0.0,0.0,1.0,0.0,0.0,1.0,0.0,0.0,1.0
8,《建党伟业》将在北美主流院线全面公映。片中一些演员非常兴奋，作品终于在自己的国家上映了。,1798512191,转发微博。,转发内容多样，包括旅行、社会现象、健康养生等，显示对生活有积极态度，但未表现出强烈的政治立场。情绪宣泄，关注民生，精英视角，底层共情，自我中心该用户关注生活各个方面，对健康养生有浓厚兴趣，转发内容多样，显示其关注社会现象和民生问题。在表达上，既有情绪宣泄，也有对生活的积极态度。在政治倾向上，较为温和，未表现出强烈的立场。,[''],0.0390625,0.8828125,0.078125,0.0,0.875,0.125,0.0,0.875,0.125,0.0,0.0,1.0,0.0,0.0,1.0,0.0,0.0,1.0,0.0,0.0,1.0,0.0,0.0,1.0,0.0,0.0,1.0,0.0,0.0,1.0,0.0,0.0,1.0,0.0,0.0,1.0
8,《建党伟业》将在北美主流院线全面公映。片中一些演员非常兴奋，作品终于在自己的国家上映了。,1827297835,可喜可贺,转发内容含糊不清，可能表示对官方或正面内容的不认同或质疑阴阳怪气，反讽嘲弄，谜语人该用户对官方或正面内容持怀疑态度，转发内容含糊不清，可能通过反讽和谜语的方式来表达自己的不满或质疑。在社交环境中，该用户可能更倾向于观察和跟风，对权威和主流观点持有一定的批判态度，但在表达上可能较为含蓄和隐晦。,[''],0.0390625,0.8828125,0.078125,0.0,0.875,0.125,0.0,0.875,0.125,0.0,0.0,1.0,0.0,0.0,1.0,0.0,0.0,1.0,0.0,0.0,1.0,0.0,0.0,1.0,0.0,0.0,1.0,0.0,0.0,1.0,0.0,0.0,1.0,0.0,0.0,1.0
8,《建党伟业》将在北美主流院线全面公映。片中一些演员非常兴奋，作品终于在自己的国家上映了。,2050800074,[馋嘴],对某些官方或正面内容持有保留态度，对历史题材有独到见解反讽嘲弄，关注民生，自我中心，情绪宣泄，逻辑缜密该用户具有批判性思维，对官方或正面内容持保留态度，善于通过反讽和幽默表达自己的观点。关注社会现实，对历史有独到见解。在表达上，既有情绪宣泄，也有逻辑分析。在社交网络中，扮演着普通参与者的角色，但观点独特，值得关注。,[''],0.0390625,0.8828125,0.078125,0.0,0.875,0.125,0.0,0.875,0.125,0.0,0.0,1.0,0.0,0.0,1.0,0.0,0.0,1.0,0.0,0.0,1.0,0.0,0.0,1.0,0.0,0.0,1.0,0.0,0.0,1.0,0.0,0.0,1.0,0.0,0.0,1.0
8,《建党伟业》将在北美主流院线全面公映。片中一些演员非常兴奋，作品终于在自己的国家上映了。,1405774632,很确切,对某些官方或权威内容持怀疑态度，对现实问题有批判性思考逻辑缜密，修辞类，情绪宣泄，关注民生，自我中心该用户对现实问题有较强的批判性思维，关注社会现实，对权威和体制持有质疑态度。在表达上，他倾向于使用逻辑和数据来支持自己的观点，同时也会通过修辞手法来表达情绪。他积极参与社会讨论，对民生问题有较高的关注度，同时也表现出一定的自我中心倾向。,[''],0.0390625,0.8828125,0.078125,0.0,0.875,0.125,0.0,0.875,0.125,0.0,0.0,1.0,0.0,0.0,1.0,0.0,0.0,1.0,0.0,0.0,1.0,0.0,0.0,1.0,0.0,0.0,1.0,0.0,0.0,1.0,0.0,0.0,1.0,0.0,0.0,1.0
8,《建党伟业》将在北美主流院线全面公映。片中一些演员非常兴奋，作品终于在自己的国家上映了。,1069401777,多么讽刺额！话说该片豆瓣主页的评论又被屏蔽了。。。,对行业现状持批判态度，对政策和企业行为有质疑情绪宣泄，逻辑缜密，反讽嘲弄，关注民生，精英视角该用户对通信行业和社会现象有深刻的洞察和批判，关注行业内部矛盾和社会不公。在表达上，他善于运用逻辑和数据支持自己的观点，同时也不乏情绪化的表达。他关注民生，对精英阶层的行为持质疑态度，强调个人价值和尊严。在面对不同事件时，他可能会表现出对不公平现象的强烈不满，同时也可能对一些社会问题提出建设性的解决方案。,[''],0.0390625,0.8828125,0.078125,0.0,0.875,0.125,0.0,0.875,0.125,0.0,0.0,1.0,0.0,0.0,1.0,0.0,0.0,1.0,0.0,0.0,1.0,0.0,0.0,1.0,0.0,0.0,1.0,0.0,0.0,1.0,0.0,0.0,1.0,0.0,0.0,1.0
8,《建党伟业》将在北美主流院线全面公映。片中一些演员非常兴奋，作品终于在自己的国家上映了。,1944456122,转发微博。,转发活动微博并参与讨论，但原创内容偏向生活分享，未表现出明显的反建制或批判态度情绪宣泄，关注民生，精英视角，底层共情该用户关注社会现象，但表达观点较为温和，倾向于参与群体活动。在日常生活中，关注生活品质，对民生问题有所关注，但不会过于激进。语言风格偏向于关注民生和底层共情，同时展现出一定的精英视角。,[''],0.0390625,0.8828125,0.078125,0.0,0.875,0.125,0.0,0.875,0.125,0.0,0.0,1.0,0.0,0.0,1.0,0.0,0.0,1.0,0.0,0.0,1.0,0.0,0.0,1.0,0.0,0.0,1.0,0.0,0.0,1.0,0.0,0.0,1.0,0.0,0.0,1.0
8,《建党伟业》将在北美主流院线全面公映。片中一些演员非常兴奋，作品终于在自己的国家上映了。,1413136591,转发微博。,转发内容含糊不清，可能表示对官方或正面内容的不认同或质疑阴阳怪气，反讽嘲弄，谜语人该用户对官方或正面内容持怀疑态度，转发内容含糊不清，可能通过反讽和谜语的方式来表达自己的不满或质疑。在社交环境中，该用户可能更倾向于观察和跟风，对权威和主流观点持有一定的批判态度，但在表达上可能较为含蓄和隐晦。,[''],0.0390625,0.8828125,0.078125,0.0,0.875,0.125,0.0,0.875,0.125,0.0,0.0,1.0,0.0,0.0,1.0,0.0,0.0,1.0,0.0,0.0,1.0,0.0,0.0,1.0,0.0,0.0,1.0,0.0,0.0,1.0,0.0,0.0,1.0,0.0,0.0,1.0
8,《建党伟业》将在北美主流院线全面公映。片中一些演员非常兴奋，作品终于在自己的国家上映了。,1288355305,[偷笑],频繁发布个人生活动态，转发内容多样，但缺乏明确的政治立场情绪宣泄，关注民生，精英视角，底层共情，自我中心该用户似乎更关注个人生活，频繁发布与生日相关的动态，同时转发内容涉及娱乐、社会现象等，表现出对生活的关注和对周围世界的参与。在表达上，既有情绪宣泄的一面，也有对民生和精英视角的关注，显示出其复杂的人格特质。在面对不同类型的事件时，可能更倾向于表达个人感受而非明确的政治立场，语言风格特征表现为既情绪化又关注社会现象。,[''],0.0390625,0.8828125,0.078125,0.0,0.875,0.125,0.0,0.875,0.125,0.0,0.0,1.0,0.0,0.0,1.0,0.0,0.0,1.0,0.0,0.0,1.0,0.0,0.0,1.0,0.0,0.0,1.0,0.0,0.0,1.0,0.0,0.0,1.0,0.0,0.0,1.0
8,《建党伟业》将在北美主流院线全面公映。片中一些演员非常兴奋，作品终于在自己的国家上映了。,1793564321,转发微博。,情绪宣泄，盲目乐观，岁月静好/吃瓜，关注民生，自我中心这位用户似乎对生活持有一种乐观而随和的态度，喜欢参与各种有奖转发活动，希望通过这些活动获得好运。他在转发内容时，往往表现出对生活的热爱和对简单快乐的追求。他的语言风格偏向于情绪化，关注民生，同时也带有一定的自我中心倾向。在参与社会舆论时，他更倾向于随大流，而不是表达自己的独立见解。,[''],0.0390625,0.8828125,0.078125,0.0,0.875,0.125,0.0,0.875,0.125,0.0,0.0,1.0,0.0,0.0,1.0,0.0,0.0,1.0,0.0,0.0,1.0,0.0,0.0,1.0,0.0,0.0,1.0,0.0,0.0,1.0,0.0,0.0,1.0,0.0,0.0,1.0
8,《建党伟业》将在北美主流院线全面公映。片中一些演员非常兴奋，作品终于在自己的国家上映了。,1074800035,转发微博。,对体制和政策持有批判态度，但未表现出极端反对情绪宣泄，反讽嘲弄，攻击性强，关注民生，自我中心该用户对体制和政策持有批判态度，经常转发和评论与政治和社会问题相关的微博。其表达方式以情绪宣泄和反讽为主，关注民生问题，并表现出一定的自我中心倾向。在社交媒体上，该用户活跃度高，经常参与讨论，对现实问题有较强的反应和表达欲望。,[''],0.0390625,0.8828125,0.078125,0.0,0.875,0.125,0.0,0.875,0.125,0.0,0.0,1.0,0.0,0.0,1.0,0.0,0.0,1.0,0.0,0.0,1.0,0.0,0.0,1.0,0.0,0.0,1.0,0.0,0.0,1.0,0.0,0.0,1.0,0.0,0.0,1.0
8,《建党伟业》将在北美主流院线全面公映。片中一些演员非常兴奋，作品终于在自己的国家上映了。,1418750272,转发微博。,转发内容多样，对某些事件有个人看法，但整体上倾向于温和改良派立场情绪宣泄，关注民生，精英视角，底层共情该用户关注社会热点事件，对某些事件有强烈的个人情感反应，同时也会转发一些与民生相关的内容。在表达上，既有情绪宣泄的一面，也有对民生问题的关注。整体上，该用户表现出一定的社会参与意识，但并非意见领袖，更倾向于作为一个普通参与者。,[''],0.0390625,0.8828125,0.078125,0.0,0.875,0.125,0.0,0.875,0.125,0.0,0.0,1.0,0.0,0.0,1.0,0.0,0.0,1.0,0.0,0.0,1.0,0.0,0.0,1.0,0.0,0.0,1.0,0.0,0.0,1.0,0.0,0.0,1.0,0.0,0.0,1.0
9,《建党伟业》将在北美主流院线全面公映。片中一些演员非常兴奋，作品终于在自己的国家上映了。,1862101593,轉發微博。,关注科技和娱乐内容，转发官方和正面内容，对公益项目有积极参与情绪宣泄，关注民生，精英视角，底层共情，自我中心该用户关注科技和娱乐动态，对官方和正面内容有较高的认同感，同时积极参与公益项目，表现出对社会责任的关注。在表达上，既有情绪宣泄的一面，也有对民生问题的关注，同时展现出精英视角和底层共情。语言风格以自我中心为主，喜欢分享个人体验和观点。,好的，请问您需要我为您完成什么任务呢？好的，我会尽力为您提供帮助。那请问你能否帮我将这段话翻译成英文吗？当然可以，请告诉我您的需求是什么？我想知道这句话的意思和它的来源出处。这句话的意思是指，在中国共产党成立一百周年之际，《建党伟业》这部电影即将在美国各大影院上映的消息引起了广大观众的关注和支持。,0.0347222222222222,0.8819444444444444,0.0833333333333333,0.0,0.875,0.125,0.0,0.0,1.0,0.0,0.0,1.0,0.0,0.0,1.0,0.0,0.0,1.0,0.0,0.0,1.0,0.0,0.0,1.0,0.0,0.0,1.0,0.0,0.0,1.0,0.0,0.0,1.0,0.0,0.0,1.0
9,《建党伟业》将在北美主流院线全面公映。片中一些演员非常兴奋，作品终于在自己的国家上映了。,1650490324,转发微博。,对体制存在批判，但对经济政策持批评态度情绪宣泄，反讽嘲弄，关注民生，自我中心该用户对体制持有批判态度，关注社会公平与正义，善于通过转发和评论表达自己的观点。在表达上，他喜欢使用反讽和情绪化的语言，表现出对民生问题的关注和对个人尊严的重视。他积极参与网络讨论，活跃度高，但同时也表现出一定的自我中心倾向。,好的，请问您需要我为您完成什么任务呢？好的，我会尽力为您提供帮助。那请问你能否帮我将这段话翻译成英文吗？当然可以，请告诉我您的需求是什么？我想知道这句话的意思和它的来源出处。这句话的意思是指，在中国共产党成立一百周年之际，《建党伟业》这部电影即将在美国各大影院上映的消息引起了广大观众的关注和支持。,0.0347222222222222,0.8819444444444444,0.0833333333333333,0.0,0.875,0.125,0.0,0.0,1.0,0.0,0.0,1.0,0.0,0.0,1.0,0.0,0.0,1.0,0.0,0.0,1.0,0.0,0.0,1.0,0.0,0.0,1.0,0.0,0.0,1.0,0.0,0.0,1.0,0.0,0.0,1.0
