time_step,topic,uid,real_comments,profile_text,batch_mf,pre_pos,pre_neu,pre_neg,dist_t0_pos,dist_t0_neu,dist_t0_neg,dist_t1_pos,dist_t1_neu,dist_t1_neg,dist_t2_pos,dist_t2_neu,dist_t2_neg,dist_t3_pos,dist_t3_neu,dist_t3_neg,dist_t4_pos,dist_t4_neu,dist_t4_neg,dist_t5_pos,dist_t5_neu,dist_t5_neg,dist_t6_pos,dist_t6_neu,dist_t6_neg,dist_t7_pos,dist_t7_neu,dist_t7_neg,dist_t8_pos,dist_t8_neu,dist_t8_neg,dist_t9_pos,dist_t9_neu,dist_t9_neg,dist_t10_pos,dist_t10_neu,dist_t10_neg
0,【幼女遭老师强奸大出血３小时】如果此案仍以嫖宿幼妓判处，你的心理底线会怎样：河南南阳宛城区红泥湾镇一7岁二年级女生明明(化名)放学后被班主任老师刘翔宇叫到办公室，１小时后回到家神情异常，伴有下身大出血。自述班主任刘翔宇让她脱掉裤子... 这畜生罪过！快转起来！http://t.cn/htQJ72 @张小云,2367071910,【幼女遭老师强奸大出血３小时】如果此案仍以嫖宿幼妓判处，你的心理底线会怎样：河南南阳宛城区红泥湾镇一7岁二年级女生明明(化名)放学后被班主任老师刘翔宇叫到办公室，１小时后回到家神情异常，伴有下身大出血。自述班主任刘翔宇让她脱掉裤子... 这畜生罪过！快转起来！http://t.cn/htQJ72 @张小云,虽是体制拥护派，但对经济政策持批评态度，关注市场秩序和法治恢复逻辑缜密，关注民生，精英视角，底层共情，自我中心该用户表现出对经济政策和市场秩序的深刻关注，倾向于理性分析问题，同时关注民生和底层共情。在表达上，他展现出精英视角和自我中心的特征。在舆论环境中，他既是信息的传播者，也是意见的引领者，具有较高的活跃度和影响力。,,0.0,1.0,0.0,0.0,0.4375,0.5625,0.0,0.0625,0.9375,0.0,0.0625,0.9375,0.0,0.3125,0.6875,0.0,0.1875,0.8125,0.0,0.25,0.75,0.0,0.0625,0.9375,0.0,0.0625,0.9375,0.0,0.0,1.0,0.0,0.1875,0.8125,0.0,0.25,0.75
0,【幼女遭老师强奸大出血３小时】如果此案仍以嫖宿幼妓判处，你的心理底线会怎样：河南南阳宛城区红泥湾镇一7岁二年级女生明明(化名)放学后被班主任老师刘翔宇叫到办公室，１小时后回到家神情异常，伴有下身大出血。自述班主任刘翔宇让她脱掉裤子... 这畜生罪过！快转起来！http://t.cn/htQJ72 @张小云,1890956154,转发微博。,对传统文化和历史有认同，同时表达了对现实的积极态度和对未来的乐观期望情绪宣泄，乐观积极，关注民生，宏大叙事这位用户表现出对传统文化的尊重和对现实的积极态度。他们经常分享关于节日、生活和未来的积极信息，表达了对家庭和社会和谐的重视。他们的语言风格充满乐观和正能量，经常使用宏大叙事来描述对未来的期望。这位用户在社交媒体上是一个活跃的参与者，他们的言论通常能够激发他人的积极情绪，并鼓励人们面对困难时保持乐观。,,0.0,1.0,0.0,0.0,0.4375,0.5625,0.0,0.0625,0.9375,0.0,0.0625,0.9375,0.0,0.3125,0.6875,0.0,0.1875,0.8125,0.0,0.25,0.75,0.0,0.0625,0.9375,0.0,0.0625,0.9375,0.0,0.0,1.0,0.0,0.1875,0.8125,0.0,0.25,0.75
0,【幼女遭老师强奸大出血３小时】如果此案仍以嫖宿幼妓判处，你的心理底线会怎样：河南南阳宛城区红泥湾镇一7岁二年级女生明明(化名)放学后被班主任老师刘翔宇叫到办公室，１小时后回到家神情异常，伴有下身大出血。自述班主任刘翔宇让她脱掉裤子... 这畜生罪过！快转起来！http://t.cn/htQJ72 @张小云,1850376267,转发微博,对传统文化和历史有认同，同时表达了对现实的积极态度和对未来的乐观期望情绪宣泄，乐观积极，关注民生，宏大叙事这位用户表现出对传统文化的尊重和对现实的积极态度。他们经常分享关于节日、生活和未来的积极信息，表达了对家庭和社会和谐的重视。他们的语言风格充满乐观和正能量，经常使用宏大叙事来描述对未来的期望。这位用户在社交媒体上是一个活跃的参与者，他们的言论通常能够激发他人的积极情绪，并鼓励人们面对困难时保持乐观。,,0.0,1.0,0.0,0.0,0.4375,0.5625,0.0,0.0625,0.9375,0.0,0.0625,0.9375,0.0,0.3125,0.6875,0.0,0.1875,0.8125,0.0,0.25,0.75,0.0,0.0625,0.9375,0.0,0.0625,0.9375,0.0,0.0,1.0,0.0,0.1875,0.8125,0.0,0.25,0.75
0,【幼女遭老师强奸大出血３小时】如果此案仍以嫖宿幼妓判处，你的心理底线会怎样：河南南阳宛城区红泥湾镇一7岁二年级女生明明(化名)放学后被班主任老师刘翔宇叫到办公室，１小时后回到家神情异常，伴有下身大出血。自述班主任刘翔宇让她脱掉裤子... 这畜生罪过！快转起来！http://t.cn/htQJ72 @张小云,2651245431,无耻,转发官方和正面内容较多，但未表现出明显的反讽或潜台词，倾向于温和建制派情绪宣泄，关注民生，精英视角，自我中心该用户表现出对生活的热爱和对娱乐的追求，转发内容以官方和正面信息为主，同时关注民生话题，体现出一定的精英视角。在表达上，情绪宣泄和自我中心的特点较为明显。对于不同类型的事件，该用户可能会表现出对个人兴趣的关注，同时也会对社会热点事件有所关注，并倾向于从个人角度出发进行评论。语言风格上，既有情绪化的表达，也有对生活细节的关注，体现出多元化的表达方式。,,0.0,1.0,0.0,0.0,0.4375,0.5625,0.0,0.0625,0.9375,0.0,0.0625,0.9375,0.0,0.3125,0.6875,0.0,0.1875,0.8125,0.0,0.25,0.75,0.0,0.0625,0.9375,0.0,0.0625,0.9375,0.0,0.0,1.0,0.0,0.1875,0.8125,0.0,0.25,0.75
0,【幼女遭老师强奸大出血３小时】如果此案仍以嫖宿幼妓判处，你的心理底线会怎样：河南南阳宛城区红泥湾镇一7岁二年级女生明明(化名)放学后被班主任老师刘翔宇叫到办公室，１小时后回到家神情异常，伴有下身大出血。自述班主任刘翔宇让她脱掉裤子... 这畜生罪过！快转起来！http://t.cn/htQJ72 @张小云,1910387685,[汗],倾向于体制内，但关注个人修养与内心世界情绪宣泄，宏大叙事，关注民生，精英视角该用户在社交媒体上表现出温和的建制派立场，关注个人修养与内心世界。在转发内容中，他倾向于分享与个人成长、精神修养相关的内容，同时也关注社会现象和公共话题。他的表达风格偏向情绪宣泄和宏大叙事，体现出对民生和精英视角的关注。作为普通参与者，他在社交媒体上的活跃度一般，但能够对特定话题产生共鸣。,,0.0,1.0,0.0,0.0,0.4375,0.5625,0.0,0.0625,0.9375,0.0,0.0625,0.9375,0.0,0.3125,0.6875,0.0,0.1875,0.8125,0.0,0.25,0.75,0.0,0.0625,0.9375,0.0,0.0625,0.9375,0.0,0.0,1.0,0.0,0.1875,0.8125,0.0,0.25,0.75
0,【幼女遭老师强奸大出血３小时】如果此案仍以嫖宿幼妓判处，你的心理底线会怎样：河南南阳宛城区红泥湾镇一7岁二年级女生明明(化名)放学后被班主任老师刘翔宇叫到办公室，１小时后回到家神情异常，伴有下身大出血。自述班主任刘翔宇让她脱掉裤子... 这畜生罪过！快转起来！http://t.cn/htQJ72 @张小云,1891977524,MLGB的现在老湿都tmd是狗么,转发内容多为娱乐、美食、生活相关，对政治话题较少涉及，显示温和的体制拥护态度情绪宣泄，关注民生，精英视角，自我中心该用户在社交媒体上以转发娱乐、美食等内容为主，表现出对生活细节的关注和追求个人情感体验的态度。在政治和社会问题上，该用户较为被动，倾向于旁观而非积极参与。语言风格偏向情绪化，表达上带有一定的自我中心倾向。,,0.0,1.0,0.0,0.0,0.4375,0.5625,0.0,0.0625,0.9375,0.0,0.0625,0.9375,0.0,0.3125,0.6875,0.0,0.1875,0.8125,0.0,0.25,0.75,0.0,0.0625,0.9375,0.0,0.0625,0.9375,0.0,0.0,1.0,0.0,0.1875,0.8125,0.0,0.25,0.75
0,【幼女遭老师强奸大出血３小时】如果此案仍以嫖宿幼妓判处，你的心理底线会怎样：河南南阳宛城区红泥湾镇一7岁二年级女生明明(化名)放学后被班主任老师刘翔宇叫到办公室，１小时后回到家神情异常，伴有下身大出血。自述班主任刘翔宇让她脱掉裤子... 这畜生罪过！快转起来！http://t.cn/htQJ72 @张小云,1890956154,[抓狂][泪],关注社会问题，对官方和体制持有一定程度的质疑和批评情绪宣泄，反讽嘲弄，关注民生，自我中心该用户关注社会问题，对官方和体制持有一定程度的质疑和批评。在表达上，他倾向于情绪宣泄和反讽嘲弄，同时关注民生问题，并表现出一定的自我中心倾向。他具有较高的活跃度，积极参与社会议题的讨论，希望通过舆论推动社会变革。,,0.0,1.0,0.0,0.0,0.4375,0.5625,0.0,0.0625,0.9375,0.0,0.0625,0.9375,0.0,0.3125,0.6875,0.0,0.1875,0.8125,0.0,0.25,0.75,0.0,0.0625,0.9375,0.0,0.0625,0.9375,0.0,0.0,1.0,0.0,0.1875,0.8125,0.0,0.25,0.75
0,【幼女遭老师强奸大出血３小时】如果此案仍以嫖宿幼妓判处，你的心理底线会怎样：河南南阳宛城区红泥湾镇一7岁二年级女生明明(化名)放学后被班主任老师刘翔宇叫到办公室，１小时后回到家神情异常，伴有下身大出血。自述班主任刘翔宇让她脱掉裤子... 这畜生罪过！快转起来！http://t.cn/htQJ72 @张小云,1858770344,应该凌迟！,对特定艺人有高度关注和认同，可能表现出一定的粉丝倾向情绪宣泄，宏大叙事，精英视角，自我中心，盲目乐观这位用户表现出对特定艺人的强烈兴趣和追随，经常在社交媒体上分享与该艺人相关的信息。他们可能在表达上较为情绪化，倾向于使用宏大叙事和精英视角来描述自己的兴趣和经历。这位用户在社交媒体上的活跃度很高，可能是该艺人的忠实粉丝，对相关话题有较高的参与度和影响力。他们的语言风格特征包括情绪宣泄和盲目乐观，可能对个人兴趣和偶像的追随有着极高的忠诚度。,,0.0,1.0,0.0,0.0,0.4375,0.5625,0.0,0.0625,0.9375,0.0,0.0625,0.9375,0.0,0.3125,0.6875,0.0,0.1875,0.8125,0.0,0.25,0.75,0.0,0.0625,0.9375,0.0,0.0625,0.9375,0.0,0.0,1.0,0.0,0.1875,0.8125,0.0,0.25,0.75
0,【幼女遭老师强奸大出血３小时】如果此案仍以嫖宿幼妓判处，你的心理底线会怎样：河南南阳宛城区红泥湾镇一7岁二年级女生明明(化名)放学后被班主任老师刘翔宇叫到办公室，１小时后回到家神情异常，伴有下身大出血。自述班主任刘翔宇让她脱掉裤子... 这畜生罪过！快转起来！http://t.cn/htQJ72 @张小云,1465381657,转发微博,对官方和正面内容持一般认同态度，但也会转发一些具有新看点的内容，显示对新鲜事物的关注。关注民生，精英视角，自我中心，情绪宣泄，理性客观该用户对官方和正面内容持一般认同态度，但同时也关注社会发展和新鲜事物。在表达上，他关注民生，具有精英视角，同时表现出一定的自我中心情绪。他善于理性客观地分析问题，并在社交媒体上保持高频活跃。在面对不同类型的事件时，他可能会表现出情绪宣泄的一面，但总体上保持理性。,,0.0,1.0,0.0,0.0,0.4375,0.5625,0.0,0.0625,0.9375,0.0,0.0625,0.9375,0.0,0.3125,0.6875,0.0,0.1875,0.8125,0.0,0.25,0.75,0.0,0.0625,0.9375,0.0,0.0625,0.9375,0.0,0.0,1.0,0.0,0.1875,0.8125,0.0,0.25,0.75
0,【幼女遭老师强奸大出血３小时】如果此案仍以嫖宿幼妓判处，你的心理底线会怎样：河南南阳宛城区红泥湾镇一7岁二年级女生明明(化名)放学后被班主任老师刘翔宇叫到办公室，１小时后回到家神情异常，伴有下身大出血。自述班主任刘翔宇让她脱掉裤子... 这畜生罪过！快转起来！http://t.cn/htQJ72 @张小云,2000466703,转发微博,转发内容多样，对某些事件有个人看法，但整体上倾向于温和改良派立场情绪宣泄，关注民生，精英视角，底层共情该用户关注社会热点事件，对某些事件有强烈的个人情感反应，同时也会转发一些与民生相关的内容。在表达上，既有情绪宣泄的一面，也有对民生问题的关注。整体上，该用户表现出一定的社会参与意识，但并非意见领袖，更倾向于作为一个普通参与者。,,0.0,1.0,0.0,0.0,0.4375,0.5625,0.0,0.0625,0.9375,0.0,0.0625,0.9375,0.0,0.3125,0.6875,0.0,0.1875,0.8125,0.0,0.25,0.75,0.0,0.0625,0.9375,0.0,0.0625,0.9375,0.0,0.0,1.0,0.0,0.1875,0.8125,0.0,0.25,0.75
0,【幼女遭老师强奸大出血３小时】如果此案仍以嫖宿幼妓判处，你的心理底线会怎样：河南南阳宛城区红泥湾镇一7岁二年级女生明明(化名)放学后被班主任老师刘翔宇叫到办公室，１小时后回到家神情异常，伴有下身大出血。自述班主任刘翔宇让她脱掉裤子... 这畜生罪过！快转起来！http://t.cn/htQJ72 @张小云,2040344623,转发微博,对某些社会现象持批判态度，但并非极端反对派情绪宣泄，逻辑缜密，反讽嘲弄，攻击性强，关注民生该用户对社会现象持有批判态度，关注社会公平与正义，善于通过逻辑和数据进行分析。在表达上，喜欢使用反讽和嘲弄的手法，对权力和既得利益持强烈的批判态度。在社交网络上，活跃度高，积极参与讨论，但同时也表现出一定的攻击性。,,0.0,1.0,0.0,0.0,0.4375,0.5625,0.0,0.0625,0.9375,0.0,0.0625,0.9375,0.0,0.3125,0.6875,0.0,0.1875,0.8125,0.0,0.25,0.75,0.0,0.0625,0.9375,0.0,0.0625,0.9375,0.0,0.0,1.0,0.0,0.1875,0.8125,0.0,0.25,0.75
0,【幼女遭老师强奸大出血３小时】如果此案仍以嫖宿幼妓判处，你的心理底线会怎样：河南南阳宛城区红泥湾镇一7岁二年级女生明明(化名)放学后被班主任老师刘翔宇叫到办公室，１小时后回到家神情异常，伴有下身大出血。自述班主任刘翔宇让她脱掉裤子... 这畜生罪过！快转起来！http://t.cn/htQJ72 @张小云,2135674773,不如畜生,对某些事件表现出批判态度，但对其他内容则较为中立情绪宣泄，关注民生，自我中心，宏大叙事，攻击性强该用户在社交媒体上表现出较高的活跃度，对各种社会现象和个人情感有着强烈的表达欲望。他关注民生，对社会事件持有批判态度，但同时也表现出一定的自我中心倾向。在语言风格上，他倾向于使用情绪化的表达，并喜欢在宏大叙事的背景下讨论问题。尽管对权威和体制持有一定程度的怀疑，但他也愿意参与社会讨论，并在某些问题上表现出积极的参与态度。,,0.0,1.0,0.0,0.0,0.4375,0.5625,0.0,0.0625,0.9375,0.0,0.0625,0.9375,0.0,0.3125,0.6875,0.0,0.1875,0.8125,0.0,0.25,0.75,0.0,0.0625,0.9375,0.0,0.0625,0.9375,0.0,0.0,1.0,0.0,0.1875,0.8125,0.0,0.25,0.75
0,【幼女遭老师强奸大出血３小时】如果此案仍以嫖宿幼妓判处，你的心理底线会怎样：河南南阳宛城区红泥湾镇一7岁二年级女生明明(化名)放学后被班主任老师刘翔宇叫到办公室，１小时后回到家神情异常，伴有下身大出血。自述班主任刘翔宇让她脱掉裤子... 这畜生罪过！快转起来！http://t.cn/htQJ72 @张小云,1736836747,,对某些社会现象持批判态度，但并非极端反对派情绪宣泄，关注民生，自我中心，政治隐喻，逻辑缜密该用户对社会现象持有批判态度，关注民生问题，善于表达个人观点。在社交媒体上活跃，转发和评论内容涉及社会热点和科技话题，表现出对公共事务的关注。语言风格上，既有情绪宣泄，也有逻辑分析，善于使用政治隐喻来表达自己的观点。,,0.0,1.0,0.0,0.0,0.4375,0.5625,0.0,0.0625,0.9375,0.0,0.0625,0.9375,0.0,0.3125,0.6875,0.0,0.1875,0.8125,0.0,0.25,0.75,0.0,0.0625,0.9375,0.0,0.0625,0.9375,0.0,0.0,1.0,0.0,0.1875,0.8125,0.0,0.25,0.75
0,【幼女遭老师强奸大出血３小时】如果此案仍以嫖宿幼妓判处，你的心理底线会怎样：河南南阳宛城区红泥湾镇一7岁二年级女生明明(化名)放学后被班主任老师刘翔宇叫到办公室，１小时后回到家神情异常，伴有下身大出血。自述班主任刘翔宇让她脱掉裤子... 这畜生罪过！快转起来！http://t.cn/htQJ72 @张小云,1813285272,转发微博,频繁发布与生日相关的博文，并转发娱乐内容，表现出一种轻松愉快的氛围，但缺乏明确的立场和价值观。情绪宣泄，盲目乐观，关注民生，自我中心这位用户似乎是一个追求快乐和轻松生活的人，经常在社交媒体上分享与生日、娱乐相关的内容。他们对于社会和政治问题缺乏明确的立场，更倾向于关注个人情感和娱乐活动。在语言风格上，他们表现出情绪化的特点，同时也有自我中心的倾向。,,0.0,1.0,0.0,0.0,0.4375,0.5625,0.0,0.0625,0.9375,0.0,0.0625,0.9375,0.0,0.3125,0.6875,0.0,0.1875,0.8125,0.0,0.25,0.75,0.0,0.0625,0.9375,0.0,0.0625,0.9375,0.0,0.0,1.0,0.0,0.1875,0.8125,0.0,0.25,0.75
0,【幼女遭老师强奸大出血３小时】如果此案仍以嫖宿幼妓判处，你的心理底线会怎样：河南南阳宛城区红泥湾镇一7岁二年级女生明明(化名)放学后被班主任老师刘翔宇叫到办公室，１小时后回到家神情异常，伴有下身大出血。自述班主任刘翔宇让她脱掉裤子... 这畜生罪过！快转起来！http://t.cn/htQJ72 @张小云,1171588851,不是人啊，这个世界肿么了？,对某些社会现象持有批判态度，但总体上倾向于温和改良情绪宣泄，关注民生，宏大叙事，自我中心，攻击性强该用户在社交媒体上表现出对个人情感和社会现象的关注，倾向于表达自己的情绪和观点。他对某些社会现象持有批判态度，但总体上倾向于温和改良。在表达方式上，他倾向于情绪宣泄和宏大叙事，同时表现出一定的自我中心倾向。他积极参与社交媒体活动，但并非高频活跃者。,,0.0,1.0,0.0,0.0,0.4375,0.5625,0.0,0.0625,0.9375,0.0,0.0625,0.9375,0.0,0.3125,0.6875,0.0,0.1875,0.8125,0.0,0.25,0.75,0.0,0.0625,0.9375,0.0,0.0625,0.9375,0.0,0.0,1.0,0.0,0.1875,0.8125,0.0,0.25,0.75
0,【幼女遭老师强奸大出血３小时】如果此案仍以嫖宿幼妓判处，你的心理底线会怎样：河南南阳宛城区红泥湾镇一7岁二年级女生明明(化名)放学后被班主任老师刘翔宇叫到办公室，１小时后回到家神情异常，伴有下身大出血。自述班主任刘翔宇让她脱掉裤子... 这畜生罪过！快转起来！http://t.cn/htQJ72 @张小云,2687534831,怎么天天有这种事,转发官方内容时表现出一般认同，但偶尔对某些现象表示反对，如对校服的评论显示对现状的不满情绪宣泄，关注民生，精英视角，自我中心，宏大叙事该用户关注社会现象和个人兴趣，对某些现象持有批评态度，但总体上倾向于温和的建制派立场。在表达上，喜欢情绪化的表达，同时也关注民生问题。在社交网络上，表现为普通参与者，偶尔发表个人观点，但整体上较为被动。,,0.0,1.0,0.0,0.0,0.4375,0.5625,0.0,0.0625,0.9375,0.0,0.0625,0.9375,0.0,0.3125,0.6875,0.0,0.1875,0.8125,0.0,0.25,0.75,0.0,0.0625,0.9375,0.0,0.0625,0.9375,0.0,0.0,1.0,0.0,0.1875,0.8125,0.0,0.25,0.75
1,【幼女遭老师强奸大出血３小时】如果此案仍以嫖宿幼妓判处，你的心理底线会怎样：河南南阳宛城区红泥湾镇一7岁二年级女生明明(化名)放学后被班主任老师刘翔宇叫到办公室，１小时后回到家神情异常，伴有下身大出血。自述班主任刘翔宇让她脱掉裤子... 这畜生罪过！快转起来！http://t.cn/htQJ72 @张小云,1617768561,转发微博,对房产市场持关注态度，倾向于官方叙事关注民生，精英视角，数据考据，宏大叙事，逻辑缜密该用户对无锡房产市场动态高度关注，倾向于官方叙事，注重数据与事实。在表达上，他展现出对民生的关注和精英视角，逻辑缜密，善于分析。在面对不同事件时，他预期会以理性客观的态度进行评论，并强调数据与事实的重要性。其语言风格特征表现为宏大叙事和逻辑性强的特点。,[''],0.0,0.4375,0.5625,0.0,0.0625,0.9375,0.0,0.0625,0.9375,0.0,0.3125,0.6875,0.0,0.1875,0.8125,0.0,0.25,0.75,0.0,0.0625,0.9375,0.0,0.0625,0.9375,0.0,0.0,1.0,0.0,0.1875,0.8125,0.0,0.25,0.75,0.0,0.125,0.875
1,【幼女遭老师强奸大出血３小时】如果此案仍以嫖宿幼妓判处，你的心理底线会怎样：河南南阳宛城区红泥湾镇一7岁二年级女生明明(化名)放学后被班主任老师刘翔宇叫到办公室，１小时后回到家神情异常，伴有下身大出血。自述班主任刘翔宇让她脱掉裤子... 这畜生罪过！快转起来！http://t.cn/htQJ72 @张小云,1794795635,禽兽太多了。刑乱世用重典！,虽是体制拥护派但对部分社会现象持批判态度情绪宣泄，反讽嘲弄，关注民生，自我中心该用户表现出对日常生活和情感表达的浓厚兴趣，同时在转发和评论中展现出对社会现象的批判性思考。他/她倾向于使用反讽和情绪化的语言来表达观点，关注民生问题，并在社交媒体上活跃参与讨论。尽管倾向于体制拥护，但用户对某些社会现象持有批判态度，显示出复杂的政治倾向。,[''],0.0,0.4375,0.5625,0.0,0.0625,0.9375,0.0,0.0625,0.9375,0.0,0.3125,0.6875,0.0,0.1875,0.8125,0.0,0.25,0.75,0.0,0.0625,0.9375,0.0,0.0625,0.9375,0.0,0.0,1.0,0.0,0.1875,0.8125,0.0,0.25,0.75,0.0,0.125,0.875
1,【幼女遭老师强奸大出血３小时】如果此案仍以嫖宿幼妓判处，你的心理底线会怎样：河南南阳宛城区红泥湾镇一7岁二年级女生明明(化名)放学后被班主任老师刘翔宇叫到办公室，１小时后回到家神情异常，伴有下身大出血。自述班主任刘翔宇让她脱掉裤子... 这畜生罪过！快转起来！http://t.cn/htQJ72 @张小云,1394517537,法院不判死刑，家长自己去剁了他！,对某些社会现象持批判态度，但并非极端反对派情绪宣泄，关注民生，自我中心，政治隐喻，逻辑缜密该用户对社会现象持有批判态度，关注民生问题，善于表达个人观点。在社交媒体上活跃，转发和评论内容涉及社会热点和科技话题，表现出对公共事务的关注。语言风格上，既有情绪宣泄，也有逻辑分析，善于使用政治隐喻来表达自己的观点。,[''],0.0,0.4375,0.5625,0.0,0.0625,0.9375,0.0,0.0625,0.9375,0.0,0.3125,0.6875,0.0,0.1875,0.8125,0.0,0.25,0.75,0.0,0.0625,0.9375,0.0,0.0625,0.9375,0.0,0.0,1.0,0.0,0.1875,0.8125,0.0,0.25,0.75,0.0,0.125,0.875
1,【幼女遭老师强奸大出血３小时】如果此案仍以嫖宿幼妓判处，你的心理底线会怎样：河南南阳宛城区红泥湾镇一7岁二年级女生明明(化名)放学后被班主任老师刘翔宇叫到办公室，１小时后回到家神情异常，伴有下身大出血。自述班主任刘翔宇让她脱掉裤子... 这畜生罪过！快转起来！http://t.cn/htQJ72 @张小云,1838230844,[怒],对特定艺人有高度关注和认同，可能表现出一定的粉丝倾向情绪宣泄，宏大叙事，精英视角，自我中心，盲目乐观这位用户表现出对特定艺人的强烈兴趣和追随，经常在社交媒体上分享与该艺人相关的信息。他们可能在表达上较为情绪化，倾向于使用宏大叙事和精英视角来描述自己的兴趣和经历。这位用户在社交媒体上的活跃度很高，可能是该艺人的忠实粉丝，对相关话题有较高的参与度和影响力。他们的语言风格特征包括情绪宣泄和盲目乐观，可能对个人兴趣和偶像的追随有着极高的忠诚度。,[''],0.0,0.4375,0.5625,0.0,0.0625,0.9375,0.0,0.0625,0.9375,0.0,0.3125,0.6875,0.0,0.1875,0.8125,0.0,0.25,0.75,0.0,0.0625,0.9375,0.0,0.0625,0.9375,0.0,0.0,1.0,0.0,0.1875,0.8125,0.0,0.25,0.75,0.0,0.125,0.875
1,【幼女遭老师强奸大出血３小时】如果此案仍以嫖宿幼妓判处，你的心理底线会怎样：河南南阳宛城区红泥湾镇一7岁二年级女生明明(化名)放学后被班主任老师刘翔宇叫到办公室，１小时后回到家神情异常，伴有下身大出血。自述班主任刘翔宇让她脱掉裤子... 这畜生罪过！快转起来！http://t.cn/htQJ72 @张小云,1749287700,[怒][怒][怒][怒][怒],虽是体制拥护派但对环境问题表达不满情绪宣泄，关注民生，精英视角，自我中心，宏大叙事该用户表现出对体制的基本认同，但同时也关注环境和个人健康问题。在表达上，他倾向于情绪宣泄和关注个人经历，同时展现出对宏观环境的关注。他参与度一般，更倾向于分享个人生活和工作经验，偶尔对公共话题发表意见。,[''],0.0,0.4375,0.5625,0.0,0.0625,0.9375,0.0,0.0625,0.9375,0.0,0.3125,0.6875,0.0,0.1875,0.8125,0.0,0.25,0.75,0.0,0.0625,0.9375,0.0,0.0625,0.9375,0.0,0.0,1.0,0.0,0.1875,0.8125,0.0,0.25,0.75,0.0,0.125,0.875
