time_step,topic,uid,real_comments,profile_text,batch_mf,pre_pos,pre_neu,pre_neg,dist_t0_pos,dist_t0_neu,dist_t0_neg,dist_t1_pos,dist_t1_neu,dist_t1_neg,dist_t2_pos,dist_t2_neu,dist_t2_neg,dist_t3_pos,dist_t3_neu,dist_t3_neg,dist_t4_pos,dist_t4_neu,dist_t4_neg,dist_t5_pos,dist_t5_neu,dist_t5_neg,dist_t6_pos,dist_t6_neu,dist_t6_neg,dist_t7_pos,dist_t7_neu,dist_t7_neg,dist_t8_pos,dist_t8_neu,dist_t8_neg,dist_t9_pos,dist_t9_neu,dist_t9_neg,dist_t10_pos,dist_t10_neu,dist_t10_neg
43,【幼女遭老师强奸大出血３小时】如果此案仍以嫖宿幼妓判处，你的心理底线会怎样：河南南阳宛城区红泥湾镇一7岁二年级女生明明(化名)放学后被班主任老师刘翔宇叫到办公室，１小时后回到家神情异常，伴有下身大出血。自述班主任刘翔宇让她脱掉裤子... 这畜生罪过！快转起来！http://t.cn/htQJ72 @张小云,1893630743,//@胜券在握717: 转发微博。,情绪宣泄，盲目乐观，岁月静好/吃瓜，关注民生，自我中心这位用户似乎对生活持有一种乐观而随和的态度，喜欢参与各种有奖转发活动，希望通过这些活动获得好运。他在转发内容时，往往表现出对生活的热爱和对简单快乐的追求。他的语言风格偏向于情绪化，关注民生，同时也带有一定的自我中心倾向。在参与社会舆论时，他更倾向于随大流，而不是表达自己的独立见解。,要求：答案要包含上述所有方面的要点。,0.002906976744186,0.1220930232558139,0.875,0.0,0.125,0.875,0.0625,0.125,0.8125,0.0,0.0,1.0,0.0,0.0625,0.9375,0.0,0.125,0.875,0.0,0.125,0.875,0.0,0.3125,0.6875,0.0,0.0625,0.9375,0.0,0.0,1.0,0.0625,0.0,0.9375,0.0,0.0,1.0
43,【幼女遭老师强奸大出血３小时】如果此案仍以嫖宿幼妓判处，你的心理底线会怎样：河南南阳宛城区红泥湾镇一7岁二年级女生明明(化名)放学后被班主任老师刘翔宇叫到办公室，１小时后回到家神情异常，伴有下身大出血。自述班主任刘翔宇让她脱掉裤子... 这畜生罪过！快转起来！http://t.cn/htQJ72 @张小云,1466862493,转发微博,对新技术和产品持积极态度，但对某些社会议题表现出批判性思考情绪宣泄，关注民生，精英视角，自我中心，逻辑缜密该用户对新技术和产品表现出浓厚的兴趣，乐于分享和体验。在表达个人观点时，既关注民生问题，又保持一定的精英视角。对社会议题持有批判性思考，但总体上倾向于温和建制派立场。在语言风格上，逻辑性强，但有时会表现出情绪化的倾向。作为高频活跃者，该用户在社交媒体上积极参与讨论，并具有一定的影响力。,要求：答案要包含上述所有方面的要点。,0.002906976744186,0.1220930232558139,0.875,0.0,0.125,0.875,0.0625,0.125,0.8125,0.0,0.0,1.0,0.0,0.0625,0.9375,0.0,0.125,0.875,0.0,0.125,0.875,0.0,0.3125,0.6875,0.0,0.0625,0.9375,0.0,0.0,1.0,0.0625,0.0,0.9375,0.0,0.0,1.0
43,【幼女遭老师强奸大出血３小时】如果此案仍以嫖宿幼妓判处，你的心理底线会怎样：河南南阳宛城区红泥湾镇一7岁二年级女生明明(化名)放学后被班主任老师刘翔宇叫到办公室，１小时后回到家神情异常，伴有下身大出血。自述班主任刘翔宇让她脱掉裤子... 这畜生罪过！快转起来！http://t.cn/htQJ72 @张小云,1664910901,畜生，200去寻只鸡钞票还伐肯出的啊,温和建制派，对日常生活话题有较强兴趣，转发内容多与娱乐、美食相关情绪宣泄，关注民生，自我中心，幽默风趣，攻击性强该用户表现出温和的体制拥护态度，对日常生活话题有浓厚兴趣，转发内容多涉及娱乐、美食等轻松话题。在表达上，善于使用幽默和情绪化的语言，关注个人情感和日常生活。作为高频活跃者，该用户在社交媒体上积极参与互动，展现出较强的社交活跃度。,要求：答案要包含上述所有方面的要点。,0.002906976744186,0.1220930232558139,0.875,0.0,0.125,0.875,0.0625,0.125,0.8125,0.0,0.0,1.0,0.0,0.0625,0.9375,0.0,0.125,0.875,0.0,0.125,0.875,0.0,0.3125,0.6875,0.0,0.0625,0.9375,0.0,0.0,1.0,0.0625,0.0,0.9375,0.0,0.0,1.0
44,【幼女遭老师强奸大出血３小时】如果此案仍以嫖宿幼妓判处，你的心理底线会怎样：河南南阳宛城区红泥湾镇一7岁二年级女生明明(化名)放学后被班主任老师刘翔宇叫到办公室，１小时后回到家神情异常，伴有下身大出血。自述班主任刘翔宇让她脱掉裤子... 这畜生罪过！快转起来！http://t.cn/htQJ72 @张小云,1745127741,现在的教师?,关注军事动态，对政府楼盘点持批评态度，转发内容涉及媒体责任和环境保护问题，显示对现状的不满和对变革的渴望情绪宣泄，关注民生，批判性强，政治隐喻，关注社会问题该用户关注社会动态，对政府和社会问题持有批判态度，善于表达自己的情绪和观点。在转发和评论中，他经常表现出对社会不公和环境污染的关注，以及对媒体责任的质疑。他的语言风格带有一定的政治隐喻，表现出对社会现象的深刻洞察。在政治倾向上，他更倾向于批判变革类，但同时也展现出对民生问题的关注。,要求：答案要包含上述所有方面的要点。,0.002840909090909,0.1221590909090909,0.875,0.0625,0.125,0.8125,0.0,0.0,1.0,0.0,0.0625,0.9375,0.0,0.125,0.875,0.0,0.125,0.875,0.0,0.3125,0.6875,0.0,0.0625,0.9375,0.0,0.0,1.0,0.0625,0.0,0.9375,0.0,0.0,1.0,0.0,0.0,1.0
44,【幼女遭老师强奸大出血３小时】如果此案仍以嫖宿幼妓判处，你的心理底线会怎样：河南南阳宛城区红泥湾镇一7岁二年级女生明明(化名)放学后被班主任老师刘翔宇叫到办公室，１小时后回到家神情异常，伴有下身大出血。自述班主任刘翔宇让她脱掉裤子... 这畜生罪过！快转起来！http://t.cn/htQJ72 @张小云,1733913053,严惩，严惩！,对新技术持开放态度，转发官方内容时表现出一般认同，但偶尔对某些社会现象表达个人看法。情绪宣泄，关注民生，精英视角，自我中心该用户对新技术持开放态度，乐于分享个人生活体验和对社会现象的观察。在表达个人观点时，倾向于使用情绪化的语言，同时关注民生问题。在社会事件中，表现出一定的精英视角，但总体上保持中立。语言风格以自我中心为主，喜欢分享个人感受和看法。,要求：答案要包含上述所有方面的要点。,0.002840909090909,0.1221590909090909,0.875,0.0625,0.125,0.8125,0.0,0.0,1.0,0.0,0.0625,0.9375,0.0,0.125,0.875,0.0,0.125,0.875,0.0,0.3125,0.6875,0.0,0.0625,0.9375,0.0,0.0,1.0,0.0625,0.0,0.9375,0.0,0.0,1.0,0.0,0.0,1.0
44,【幼女遭老师强奸大出血３小时】如果此案仍以嫖宿幼妓判处，你的心理底线会怎样：河南南阳宛城区红泥湾镇一7岁二年级女生明明(化名)放学后被班主任老师刘翔宇叫到办公室，１小时后回到家神情异常，伴有下身大出血。自述班主任刘翔宇让她脱掉裤子... 这畜生罪过！快转起来！http://t.cn/htQJ72 @张小云,1911639815,班主任又不是局座，应该可以入强奸罪[挖鼻屎],对某些官方或正面内容持有保留态度，对历史题材有独到见解反讽嘲弄，关注民生，自我中心，情绪宣泄，逻辑缜密该用户具有批判性思维，对官方或正面内容持保留态度，善于通过反讽和幽默表达自己的观点。关注社会现实，对历史有独到见解。在表达上，既有情绪宣泄，也有逻辑分析。在社交网络中，扮演着普通参与者的角色，但观点独特，值得关注。,要求：答案要包含上述所有方面的要点。,0.002840909090909,0.1221590909090909,0.875,0.0625,0.125,0.8125,0.0,0.0,1.0,0.0,0.0625,0.9375,0.0,0.125,0.875,0.0,0.125,0.875,0.0,0.3125,0.6875,0.0,0.0625,0.9375,0.0,0.0,1.0,0.0625,0.0,0.9375,0.0,0.0,1.0,0.0,0.0,1.0
44,【幼女遭老师强奸大出血３小时】如果此案仍以嫖宿幼妓判处，你的心理底线会怎样：河南南阳宛城区红泥湾镇一7岁二年级女生明明(化名)放学后被班主任老师刘翔宇叫到办公室，１小时后回到家神情异常，伴有下身大出血。自述班主任刘翔宇让她脱掉裤子... 这畜生罪过！快转起来！http://t.cn/htQJ72 @张小云,1700624455,禽兽死不光,用户内容以日常生活和个人情感为主，无明显政治立场倾向情绪宣泄，关注民生，自我中心，宏大叙事，底层共情该用户关注日常生活和个人情感，对政治和社会议题较少关注。在表达上，倾向于情绪宣泄和自我表达，同时也会关注家庭和孩子的成长。在社交网络上，该用户表现为一个普通参与者，偶尔分享个人生活点滴，对周围环境的变化反应较为直接。,要求：答案要包含上述所有方面的要点。,0.002840909090909,0.1221590909090909,0.875,0.0625,0.125,0.8125,0.0,0.0,1.0,0.0,0.0625,0.9375,0.0,0.125,0.875,0.0,0.125,0.875,0.0,0.3125,0.6875,0.0,0.0625,0.9375,0.0,0.0,1.0,0.0625,0.0,0.9375,0.0,0.0,1.0,0.0,0.0,1.0
44,【幼女遭老师强奸大出血３小时】如果此案仍以嫖宿幼妓判处，你的心理底线会怎样：河南南阳宛城区红泥湾镇一7岁二年级女生明明(化名)放学后被班主任老师刘翔宇叫到办公室，１小时后回到家神情异常，伴有下身大出血。自述班主任刘翔宇让她脱掉裤子... 这畜生罪过！快转起来！http://t.cn/htQJ72 @张小云,1769164685,畜生国度,对日常生活持有积极态度，对体制有基本认同，但对社会现象持有批判性思考情绪宣泄，乐观积极，关注民生，自我中心该用户对日常生活持有积极态度，乐于分享个人经历和情感体验，对体制有基本认同，但对社会现象持有批判性思考。在表达上，善于用情绪化的语言表达个人感受，同时关注民生问题，表现出一定的自我中心倾向。在面对不同类型的事件时，预期会以个人情感体验为出发点，表达自己的观点和态度。语言风格特征为乐观积极，但有时会带有情绪化的表达。,要求：答案要包含上述所有方面的要点。,0.002840909090909,0.1221590909090909,0.875,0.0625,0.125,0.8125,0.0,0.0,1.0,0.0,0.0625,0.9375,0.0,0.125,0.875,0.0,0.125,0.875,0.0,0.3125,0.6875,0.0,0.0625,0.9375,0.0,0.0,1.0,0.0625,0.0,0.9375,0.0,0.0,1.0,0.0,0.0,1.0
44,【幼女遭老师强奸大出血３小时】如果此案仍以嫖宿幼妓判处，你的心理底线会怎样：河南南阳宛城区红泥湾镇一7岁二年级女生明明(化名)放学后被班主任老师刘翔宇叫到办公室，１小时后回到家神情异常，伴有下身大出血。自述班主任刘翔宇让她脱掉裤子... 这畜生罪过！快转起来！http://t.cn/htQJ72 @张小云,1689304583,[怒],关注民生，对经济政策持批评态度情绪宣泄，关注民生，精英视角，底层共情，自我中心该用户表现出对民生问题的关注，同时在转发和评论中展现出对经济政策的批评态度。他/她具有较高的活跃度，转发内容涉及多个领域，包括购物攻略、美食推荐、社会新闻等。用户在表达上倾向于情绪宣泄和自我中心，同时关注底层共情和精英视角。,要求：答案要包含上述所有方面的要点。,0.002840909090909,0.1221590909090909,0.875,0.0625,0.125,0.8125,0.0,0.0,1.0,0.0,0.0625,0.9375,0.0,0.125,0.875,0.0,0.125,0.875,0.0,0.3125,0.6875,0.0,0.0625,0.9375,0.0,0.0,1.0,0.0625,0.0,0.9375,0.0,0.0,1.0,0.0,0.0,1.0
44,【幼女遭老师强奸大出血３小时】如果此案仍以嫖宿幼妓判处，你的心理底线会怎样：河南南阳宛城区红泥湾镇一7岁二年级女生明明(化名)放学后被班主任老师刘翔宇叫到办公室，１小时后回到家神情异常，伴有下身大出血。自述班主任刘翔宇让她脱掉裤子... 这畜生罪过！快转起来！http://t.cn/htQJ72 @张小云,1829500235,把他干死！！草,对新技术和产品持积极态度，但对某些社会议题表现出批判性思考情绪宣泄，关注民生，精英视角，自我中心，逻辑缜密该用户对新技术和产品表现出浓厚的兴趣，乐于分享和体验。在表达个人观点时，既关注民生问题，又保持一定的精英视角。对社会议题持有批判性思考，但总体上倾向于温和建制派立场。在语言风格上，逻辑性强，但有时会表现出情绪化的倾向。作为高频活跃者，该用户在社交媒体上积极参与讨论，并具有一定的影响力。,要求：答案要包含上述所有方面的要点。,0.002840909090909,0.1221590909090909,0.875,0.0625,0.125,0.8125,0.0,0.0,1.0,0.0,0.0625,0.9375,0.0,0.125,0.875,0.0,0.125,0.875,0.0,0.3125,0.6875,0.0,0.0625,0.9375,0.0,0.0,1.0,0.0625,0.0,0.9375,0.0,0.0,1.0,0.0,0.0,1.0
44,【幼女遭老师强奸大出血３小时】如果此案仍以嫖宿幼妓判处，你的心理底线会怎样：河南南阳宛城区红泥湾镇一7岁二年级女生明明(化名)放学后被班主任老师刘翔宇叫到办公室，１小时后回到家神情异常，伴有下身大出血。自述班主任刘翔宇让她脱掉裤子... 这畜生罪过！快转起来！http://t.cn/htQJ72 @张小云,1801971724,ca!!!!!!!!!![怒],表现出一定的消极情绪和对现状的不满，但未明确表现出强烈的政治立场情绪宣泄，悲观抱怨，关注民生，自我中心该用户表现出一定的消极情绪和对现状的不满，但同时也关注民生问题。在表达上，倾向于情绪宣泄和个人情感释放，同时表现出对自身利益的关注。在社交活动中，以普通参与者的身份出现，对事件的态度较为被动，更倾向于表达个人感受而非主动引导舆论。,要求：答案要包含上述所有方面的要点。,0.002840909090909,0.1221590909090909,0.875,0.0625,0.125,0.8125,0.0,0.0,1.0,0.0,0.0625,0.9375,0.0,0.125,0.875,0.0,0.125,0.875,0.0,0.3125,0.6875,0.0,0.0625,0.9375,0.0,0.0,1.0,0.0625,0.0,0.9375,0.0,0.0,1.0,0.0,0.0,1.0
44,【幼女遭老师强奸大出血３小时】如果此案仍以嫖宿幼妓判处，你的心理底线会怎样：河南南阳宛城区红泥湾镇一7岁二年级女生明明(化名)放学后被班主任老师刘翔宇叫到办公室，１小时后回到家神情异常，伴有下身大出血。自述班主任刘翔宇让她脱掉裤子... 这畜生罪过！快转起来！http://t.cn/htQJ72 @张小云,1922121170,阉了之后扔给色情男星奸尸肢解,对奢侈品品牌和官方活动有较高兴趣，但转发内容中未表现出明显的反讽或反对态度情绪宣泄，关注民生，精英视角，自我中心该用户对奢侈品品牌和官方活动有较高的兴趣，转发内容多与时尚、品牌相关，同时关注民生话题。在表达上，倾向于情绪宣泄和自我中心，表现出一定的精英视角。在舆论环境中，可能扮演着意见领袖的角色，对品牌和官方活动的态度可能对周围人产生影响。,要求：答案要包含上述所有方面的要点。,0.002840909090909,0.1221590909090909,0.875,0.0625,0.125,0.8125,0.0,0.0,1.0,0.0,0.0625,0.9375,0.0,0.125,0.875,0.0,0.125,0.875,0.0,0.3125,0.6875,0.0,0.0625,0.9375,0.0,0.0,1.0,0.0625,0.0,0.9375,0.0,0.0,1.0,0.0,0.0,1.0
44,【幼女遭老师强奸大出血３小时】如果此案仍以嫖宿幼妓判处，你的心理底线会怎样：河南南阳宛城区红泥湾镇一7岁二年级女生明明(化名)放学后被班主任老师刘翔宇叫到办公室，１小时后回到家神情异常，伴有下身大出血。自述班主任刘翔宇让她脱掉裤子... 这畜生罪过！快转起来！http://t.cn/htQJ72 @张小云,2332462307,[怒][怒][怒],转发内容多为实用信息和生活技巧，显示对日常生活细节的关注，但未表现出明显的政治立场情绪宣泄，关注民生，精英视角，底层共情该用户关注日常生活，转发实用信息和生活技巧，表现出对日常生活的热爱和对细节的关注。在政治立场方面，没有明显的倾向，更倾向于关注个人生活和社会现象。语言风格偏向于情绪宣泄和关注民生，体现出对生活的积极态度和对社会现象的敏感。,要求：答案要包含上述所有方面的要点。,0.002840909090909,0.1221590909090909,0.875,0.0625,0.125,0.8125,0.0,0.0,1.0,0.0,0.0625,0.9375,0.0,0.125,0.875,0.0,0.125,0.875,0.0,0.3125,0.6875,0.0,0.0625,0.9375,0.0,0.0,1.0,0.0625,0.0,0.9375,0.0,0.0,1.0,0.0,0.0,1.0
44,【幼女遭老师强奸大出血３小时】如果此案仍以嫖宿幼妓判处，你的心理底线会怎样：河南南阳宛城区红泥湾镇一7岁二年级女生明明(化名)放学后被班主任老师刘翔宇叫到办公室，１小时后回到家神情异常，伴有下身大出血。自述班主任刘翔宇让她脱掉裤子... 这畜生罪过！快转起来！http://t.cn/htQJ72 @张小云,2623485517,畜生[怒],对某些社会现象持有批判态度，但总体上倾向于温和改良情绪宣泄，关注民生，宏大叙事，自我中心，攻击性强该用户在社交媒体上表现出对个人情感和社会现象的关注，倾向于表达自己的情绪和观点。他对某些社会现象持有批判态度，但总体上倾向于温和改良。在表达方式上，他倾向于情绪宣泄和宏大叙事，同时表现出一定的自我中心倾向。他积极参与社交媒体活动，但并非高频活跃者。,要求：答案要包含上述所有方面的要点。,0.002840909090909,0.1221590909090909,0.875,0.0625,0.125,0.8125,0.0,0.0,1.0,0.0,0.0625,0.9375,0.0,0.125,0.875,0.0,0.125,0.875,0.0,0.3125,0.6875,0.0,0.0625,0.9375,0.0,0.0,1.0,0.0625,0.0,0.9375,0.0,0.0,1.0,0.0,0.0,1.0
44,【幼女遭老师强奸大出血３小时】如果此案仍以嫖宿幼妓判处，你的心理底线会怎样：河南南阳宛城区红泥湾镇一7岁二年级女生明明(化名)放学后被班主任老师刘翔宇叫到办公室，１小时后回到家神情异常，伴有下身大出血。自述班主任刘翔宇让她脱掉裤子... 这畜生罪过！快转起来！http://t.cn/htQJ72 @张小云,1677632333,嫖宿幼女罪一出 会让社会上的恋童癖们蠢蠢欲动 肆意妄为 连法律都没有良心了 谁来保护孩子们？,用户表现出对日常琐事的关注，转发内容多涉及娱乐和体育，但评论较少，显示出一种消极和混沌的态度。情绪宣泄，关注民生，精英视角，底层共情，自我中心这位用户似乎更关注个人生活和娱乐，对社交媒体上的内容持一种轻松的态度。他/她转发的内容多与娱乐和体育相关，显示出对日常生活的兴趣。然而，用户在评论和表达观点方面相对较少，这可能表明他/她对更广泛的社会问题缺乏兴趣或参与。他/她的语言风格偏向于情绪化和自我中心，但同时也表现出对民生和精英视角的关注。,要求：答案要包含上述所有方面的要点。,0.002840909090909,0.1221590909090909,0.875,0.0625,0.125,0.8125,0.0,0.0,1.0,0.0,0.0625,0.9375,0.0,0.125,0.875,0.0,0.125,0.875,0.0,0.3125,0.6875,0.0,0.0625,0.9375,0.0,0.0,1.0,0.0625,0.0,0.9375,0.0,0.0,1.0,0.0,0.0,1.0
44,【幼女遭老师强奸大出血３小时】如果此案仍以嫖宿幼妓判处，你的心理底线会怎样：河南南阳宛城区红泥湾镇一7岁二年级女生明明(化名)放学后被班主任老师刘翔宇叫到办公室，１小时后回到家神情异常，伴有下身大出血。自述班主任刘翔宇让她脱掉裤子... 这畜生罪过！快转起来！http://t.cn/htQJ72 @张小云,1738252752,没有背景也敢搞幼女？靠，你以为人人都能定嫖宿幼女？傻波一,频繁发布个人生活动态，转发内容多样，但缺乏明确的政治立场情绪宣泄，关注民生，精英视角，底层共情，自我中心该用户似乎更关注个人生活，频繁发布与生日相关的动态，同时转发内容涉及娱乐、社会现象等，表现出对生活的关注和对周围世界的参与。在表达上，既有情绪宣泄的一面，也有对民生和精英视角的关注，显示出其复杂的人格特质。在面对不同类型的事件时，可能更倾向于表达个人感受而非明确的政治立场，语言风格特征表现为既情绪化又关注社会现象。,要求：答案要包含上述所有方面的要点。,0.002840909090909,0.1221590909090909,0.875,0.0625,0.125,0.8125,0.0,0.0,1.0,0.0,0.0625,0.9375,0.0,0.125,0.875,0.0,0.125,0.875,0.0,0.3125,0.6875,0.0,0.0625,0.9375,0.0,0.0,1.0,0.0625,0.0,0.9375,0.0,0.0,1.0,0.0,0.0,1.0
44,【幼女遭老师强奸大出血３小时】如果此案仍以嫖宿幼妓判处，你的心理底线会怎样：河南南阳宛城区红泥湾镇一7岁二年级女生明明(化名)放学后被班主任老师刘翔宇叫到办公室，１小时后回到家神情异常，伴有下身大出血。自述班主任刘翔宇让她脱掉裤子... 这畜生罪过！快转起来！http://t.cn/htQJ72 @张小云,1476882272,ZTM，怎么什么B人都有,对国家发展和军事力量持积极态度，但对某些社会现象和政策调整持有质疑。情绪宣泄，关注民生，精英视角，自我中心该用户对国家发展和军事力量持积极态度，转发相关内容时表现出对国家实力的自豪。同时，对某些社会现象和政策调整持有质疑，表现出一定的批判性思维。在表达上，倾向于情绪宣泄和关注民生，同时展现出精英视角和自我中心的特征。,要求：答案要包含上述所有方面的要点。,0.002840909090909,0.1221590909090909,0.875,0.0625,0.125,0.8125,0.0,0.0,1.0,0.0,0.0625,0.9375,0.0,0.125,0.875,0.0,0.125,0.875,0.0,0.3125,0.6875,0.0,0.0625,0.9375,0.0,0.0,1.0,0.0625,0.0,0.9375,0.0,0.0,1.0,0.0,0.0,1.0
44,【幼女遭老师强奸大出血３小时】如果此案仍以嫖宿幼妓判处，你的心理底线会怎样：河南南阳宛城区红泥湾镇一7岁二年级女生明明(化名)放学后被班主任老师刘翔宇叫到办公室，１小时后回到家神情异常，伴有下身大出血。自述班主任刘翔宇让她脱掉裤子... 这畜生罪过！快转起来！http://t.cn/htQJ72 @张小云,1935866363,废了他,关注民生，对一些社会现象持批判态度，但总体上倾向于温和改良情绪宣泄，关注民生，自我中心，宏大叙事，辩证思考该用户关注社会现象，对一些问题持有批判态度，但总体上倾向于温和改良。在表达上，善于情绪宣泄，关注民生问题，同时具有自我中心的倾向。在社交活动中，具有较高的活跃度，喜欢分享个人观点和对社会现象的思考。,要求：答案要包含上述所有方面的要点。,0.002840909090909,0.1221590909090909,0.875,0.0625,0.125,0.8125,0.0,0.0,1.0,0.0,0.0625,0.9375,0.0,0.125,0.875,0.0,0.125,0.875,0.0,0.3125,0.6875,0.0,0.0625,0.9375,0.0,0.0,1.0,0.0625,0.0,0.9375,0.0,0.0,1.0,0.0,0.0,1.0
44,【幼女遭老师强奸大出血３小时】如果此案仍以嫖宿幼妓判处，你的心理底线会怎样：河南南阳宛城区红泥湾镇一7岁二年级女生明明(化名)放学后被班主任老师刘翔宇叫到办公室，１小时后回到家神情异常，伴有下身大出血。自述班主任刘翔宇让她脱掉裤子... 这畜生罪过！快转起来！http://t.cn/htQJ72 @张小云,1890064447,转发微博。,转发内容多为正面，对官方和名人言论持认同态度，但未表现出强烈的政治立场情绪宣泄，关注民生，精英视角，底层共情，自我中心该用户关注个人成长与幸福，对生活充满热情。转发内容多为正面，对官方和名人言论持认同态度，但未表现出强烈的政治立场。在表达上，既有情绪宣泄的一面，也关注民生问题，同时展现出精英视角和底层共情。在社交活动中，该用户较为活跃，但并非意见领袖。,要求：答案要包含上述所有方面的要点。,0.002840909090909,0.1221590909090909,0.875,0.0625,0.125,0.8125,0.0,0.0,1.0,0.0,0.0625,0.9375,0.0,0.125,0.875,0.0,0.125,0.875,0.0,0.3125,0.6875,0.0,0.0625,0.9375,0.0,0.0,1.0,0.0625,0.0,0.9375,0.0,0.0,1.0,0.0,0.0,1.0
45,【幼女遭老师强奸大出血３小时】如果此案仍以嫖宿幼妓判处，你的心理底线会怎样：河南南阳宛城区红泥湾镇一7岁二年级女生明明(化名)放学后被班主任老师刘翔宇叫到办公室，１小时后回到家神情异常，伴有下身大出血。自述班主任刘翔宇让她脱掉裤子... 这畜生罪过！快转起来！http://t.cn/htQJ72 @张小云,2712602852,化学阉割都不足以平民愤,用户内容以日常生活和个人情感为主，无明显政治立场倾向情绪宣泄，关注民生，自我中心，宏大叙事，底层共情该用户关注日常生活和个人情感，对政治和社会议题较少关注。在表达上，倾向于情绪宣泄和自我表达，同时也会关注家庭和孩子的成长。在社交网络上，该用户表现为一个普通参与者，偶尔分享个人生活点滴，对周围环境的变化反应较为直接。,[''],0.0041666666666666,0.1222222222222222,0.8736111111111111,0.0,0.0,1.0,0.0,0.0625,0.9375,0.0,0.125,0.875,0.0,0.125,0.875,0.0,0.3125,0.6875,0.0,0.0625,0.9375,0.0,0.0,1.0,0.0625,0.0,0.9375,0.0,0.0,1.0,0.0,0.0,1.0,0.0,0.125,0.875
