time_step,topic,uid,real_comments,profile_text,batch_mf,pre_pos,pre_neu,pre_neg,dist_t0_pos,dist_t0_neu,dist_t0_neg,dist_t1_pos,dist_t1_neu,dist_t1_neg,dist_t2_pos,dist_t2_neu,dist_t2_neg,dist_t3_pos,dist_t3_neu,dist_t3_neg,dist_t4_pos,dist_t4_neu,dist_t4_neg,dist_t5_pos,dist_t5_neu,dist_t5_neg,dist_t6_pos,dist_t6_neu,dist_t6_neg,dist_t7_pos,dist_t7_neu,dist_t7_neg,dist_t8_pos,dist_t8_neu,dist_t8_neg,dist_t9_pos,dist_t9_neu,dist_t9_neg,dist_t10_pos,dist_t10_neu,dist_t10_neg
28,【幼女遭老师强奸大出血３小时】如果此案仍以嫖宿幼妓判处，你的心理底线会怎样：河南南阳宛城区红泥湾镇一7岁二年级女生明明(化名)放学后被班主任老师刘翔宇叫到办公室，１小时后回到家神情异常，伴有下身大出血。自述班主任刘翔宇让她脱掉裤子... 这畜生罪过！快转起来！http://t.cn/htQJ72 @张小云,1678268120,转发微博,对传统文化和历史有认同，同时表达了对现实的积极态度和对未来的乐观期望情绪宣泄，乐观积极，关注民生，宏大叙事这位用户表现出对传统文化的尊重和对现实的积极态度。他们经常分享关于节日、生活和未来的积极信息，表达了对家庭和社会和谐的重视。他们的语言风格充满乐观和正能量，经常使用宏大叙事来描述对未来的期望。这位用户在社交媒体上是一个活跃的参与者，他们的言论通常能够激发他人的积极情绪，并鼓励人们面对困难时保持乐观。,要求：答案要包含上述所有方面的要点。,0.0044642857142857,0.1294642857142857,0.8660714285714286,0.0,0.1875,0.8125,0.0,0.3125,0.6875,0.0,0.0625,0.9375,0.0,0.25,0.75,0.0,0.125,0.875,0.0,0.1875,0.8125,0.0,0.0625,0.9375,0.0,0.0,1.0,0.0,0.0,1.0,0.0,0.0625,0.9375,0.0,0.0,1.0
28,【幼女遭老师强奸大出血３小时】如果此案仍以嫖宿幼妓判处，你的心理底线会怎样：河南南阳宛城区红泥湾镇一7岁二年级女生明明(化名)放学后被班主任老师刘翔宇叫到办公室，１小时后回到家神情异常，伴有下身大出血。自述班主任刘翔宇让她脱掉裤子... 这畜生罪过！快转起来！http://t.cn/htQJ72 @张小云,1678268120,杀,对传统文化和历史有认同，同时表达了对现实的积极态度和对未来的乐观期望情绪宣泄，乐观积极，关注民生，宏大叙事这位用户表现出对传统文化的尊重和对现实的积极态度。他们经常分享关于节日、生活和未来的积极信息，表达了对家庭和社会和谐的重视。他们的语言风格充满乐观和正能量，经常使用宏大叙事来描述对未来的期望。这位用户在社交媒体上是一个活跃的参与者，他们的言论通常能够激发他人的积极情绪，并鼓励人们面对困难时保持乐观。,要求：答案要包含上述所有方面的要点。,0.0044642857142857,0.1294642857142857,0.8660714285714286,0.0,0.1875,0.8125,0.0,0.3125,0.6875,0.0,0.0625,0.9375,0.0,0.25,0.75,0.0,0.125,0.875,0.0,0.1875,0.8125,0.0,0.0625,0.9375,0.0,0.0,1.0,0.0,0.0,1.0,0.0,0.0625,0.9375,0.0,0.0,1.0
28,【幼女遭老师强奸大出血３小时】如果此案仍以嫖宿幼妓判处，你的心理底线会怎样：河南南阳宛城区红泥湾镇一7岁二年级女生明明(化名)放学后被班主任老师刘翔宇叫到办公室，１小时后回到家神情异常，伴有下身大出血。自述班主任刘翔宇让她脱掉裤子... 这畜生罪过！快转起来！http://t.cn/htQJ72 @张小云,2187480834,转发微博,关注军事动态，对政府楼盘点持批评态度，转发内容涉及媒体责任和环境保护问题，显示对现状的不满和对变革的渴望情绪宣泄，关注民生，批判性强，政治隐喻，关注社会问题该用户关注社会动态，对政府和社会问题持有批判态度，善于表达自己的情绪和观点。在转发和评论中，他经常表现出对社会不公和环境污染的关注，以及对媒体责任的质疑。他的语言风格带有一定的政治隐喻，表现出对社会现象的深刻洞察。在政治倾向上，他更倾向于批判变革类，但同时也展现出对民生问题的关注。,要求：答案要包含上述所有方面的要点。,0.0044642857142857,0.1294642857142857,0.8660714285714286,0.0,0.1875,0.8125,0.0,0.3125,0.6875,0.0,0.0625,0.9375,0.0,0.25,0.75,0.0,0.125,0.875,0.0,0.1875,0.8125,0.0,0.0625,0.9375,0.0,0.0,1.0,0.0,0.0,1.0,0.0,0.0625,0.9375,0.0,0.0,1.0
28,【幼女遭老师强奸大出血３小时】如果此案仍以嫖宿幼妓判处，你的心理底线会怎样：河南南阳宛城区红泥湾镇一7岁二年级女生明明(化名)放学后被班主任老师刘翔宇叫到办公室，１小时后回到家神情异常，伴有下身大出血。自述班主任刘翔宇让她脱掉裤子... 这畜生罪过！快转起来！http://t.cn/htQJ72 @张小云,1072152880,這種豬狗不如的畜生還是班主任？,表现出对日常生活的无奈和自嘲，但无明显政治立场情绪宣泄，悲观抱怨，关注民生，自我中心该用户对日常生活持有一种自嘲和无奈的态度，经常在社交媒体上分享个人的小确幸和不幸。在政治倾向上，没有明显的立场，更倾向于关注个人情感和生活琐事。在语言风格上，表现出情绪化的特点，同时也会关注民生问题，但总体上以自我为中心。在面对不同类型的事件时，可能会表现出悲观和抱怨的情绪，但同时也能够保持乐观，享受生活中的小确幸。,要求：答案要包含上述所有方面的要点。,0.0044642857142857,0.1294642857142857,0.8660714285714286,0.0,0.1875,0.8125,0.0,0.3125,0.6875,0.0,0.0625,0.9375,0.0,0.25,0.75,0.0,0.125,0.875,0.0,0.1875,0.8125,0.0,0.0625,0.9375,0.0,0.0,1.0,0.0,0.0,1.0,0.0,0.0625,0.9375,0.0,0.0,1.0
29,【幼女遭老师强奸大出血３小时】如果此案仍以嫖宿幼妓判处，你的心理底线会怎样：河南南阳宛城区红泥湾镇一7岁二年级女生明明(化名)放学后被班主任老师刘翔宇叫到办公室，１小时后回到家神情异常，伴有下身大出血。自述班主任刘翔宇让她脱掉裤子... 这畜生罪过！快转起来！http://t.cn/htQJ72 @张小云,1627654701,这种人枪毙都太便宜他[怒][怒],关注民生，对经济政策持批评态度情绪宣泄，关注民生，精英视角，底层共情，自我中心该用户表现出对民生问题的关注，同时在转发和评论中展现出对经济政策的批评态度。他/她具有较高的活跃度，转发内容涉及多个领域，包括购物攻略、美食推荐、社会新闻等。用户在表达上倾向于情绪宣泄和自我中心，同时关注底层共情和精英视角。,要求：答案要包含上述所有方面的要点。,0.0043103448275862,0.1314655172413793,0.8642241379310345,0.0,0.3125,0.6875,0.0,0.0625,0.9375,0.0,0.25,0.75,0.0,0.125,0.875,0.0,0.1875,0.8125,0.0,0.0625,0.9375,0.0,0.0,1.0,0.0,0.0,1.0,0.0,0.0625,0.9375,0.0,0.0,1.0,0.0,0.1875,0.8125
29,【幼女遭老师强奸大出血３小时】如果此案仍以嫖宿幼妓判处，你的心理底线会怎样：河南南阳宛城区红泥湾镇一7岁二年级女生明明(化名)放学后被班主任老师刘翔宇叫到办公室，１小时后回到家神情异常，伴有下身大出血。自述班主任刘翔宇让她脱掉裤子... 这畜生罪过！快转起来！http://t.cn/htQJ72 @张小云,2212587957,又是河南人！,对新技术和娱乐内容持开放态度，但对政治和社会问题较为谨慎情绪宣泄，关注民生，自我中心，宏大叙事，幽默风趣一位对新技术和娱乐内容充满好奇的温和建制派用户，善于表达个人情感和观点。在社交平台上活跃，关注民生问题，同时以幽默风趣的方式分享生活点滴。对社会现象有自己独特的见解，但不会过于激进。,要求：答案要包含上述所有方面的要点。,0.0043103448275862,0.1314655172413793,0.8642241379310345,0.0,0.3125,0.6875,0.0,0.0625,0.9375,0.0,0.25,0.75,0.0,0.125,0.875,0.0,0.1875,0.8125,0.0,0.0625,0.9375,0.0,0.0,1.0,0.0,0.0,1.0,0.0,0.0625,0.9375,0.0,0.0,1.0,0.0,0.1875,0.8125
29,【幼女遭老师强奸大出血３小时】如果此案仍以嫖宿幼妓判处，你的心理底线会怎样：河南南阳宛城区红泥湾镇一7岁二年级女生明明(化名)放学后被班主任老师刘翔宇叫到办公室，１小时后回到家神情异常，伴有下身大出血。自述班主任刘翔宇让她脱掉裤子... 这畜生罪过！快转起来！http://t.cn/htQJ72 @张小云,2284237657,给这个畜牲上10大酷刑[怒][怒][怒][怒],转发内容多为娱乐性内容，表达上缺乏明确的政治立场，更倾向于娱乐和轻松话题。情绪宣泄，盲目乐观，关注民生，自我中心该用户在社交媒体上表现出较高的活跃度，转发内容多为娱乐、搞笑和轻松话题，表达上倾向于情绪化和自我中心。在政治和社会议题上，该用户表现出消极和混沌的态度，更关注个人情感体验而非深层次的社会问题。语言风格上，该用户喜欢使用情绪化的词汇和表达方式，同时也会关注民生问题，但整体上缺乏明确的政治立场。,要求：答案要包含上述所有方面的要点。,0.0043103448275862,0.1314655172413793,0.8642241379310345,0.0,0.3125,0.6875,0.0,0.0625,0.9375,0.0,0.25,0.75,0.0,0.125,0.875,0.0,0.1875,0.8125,0.0,0.0625,0.9375,0.0,0.0,1.0,0.0,0.0,1.0,0.0,0.0625,0.9375,0.0,0.0,1.0,0.0,0.1875,0.8125
29,【幼女遭老师强奸大出血３小时】如果此案仍以嫖宿幼妓判处，你的心理底线会怎样：河南南阳宛城区红泥湾镇一7岁二年级女生明明(化名)放学后被班主任老师刘翔宇叫到办公室，１小时后回到家神情异常，伴有下身大出血。自述班主任刘翔宇让她脱掉裤子... 这畜生罪过！快转起来！http://t.cn/htQJ72 @张小云,1911813911,[怒][怒][怒],频繁转发官方和正面内容，但内容主要集中在个人生活，未表现出明显的政治立场偏差情绪宣泄，宏大叙事，自我中心，关注民生，精英视角该用户表现出对个人生活的关注，频繁分享个人动态和生日信息，同时在社交平台上积极参与话题讨论，显示出对群体认同的重视。用户在表达上倾向于情绪化和宏大叙事，同时关注民生和精英视角，反映出一种追求个人幸福和社交认同的价值观。在政治倾向上，用户未表现出明显的批判或支持，更倾向于体制拥护类。,要求：答案要包含上述所有方面的要点。,0.0043103448275862,0.1314655172413793,0.8642241379310345,0.0,0.3125,0.6875,0.0,0.0625,0.9375,0.0,0.25,0.75,0.0,0.125,0.875,0.0,0.1875,0.8125,0.0,0.0625,0.9375,0.0,0.0,1.0,0.0,0.0,1.0,0.0,0.0625,0.9375,0.0,0.0,1.0,0.0,0.1875,0.8125
29,【幼女遭老师强奸大出血３小时】如果此案仍以嫖宿幼妓判处，你的心理底线会怎样：河南南阳宛城区红泥湾镇一7岁二年级女生明明(化名)放学后被班主任老师刘翔宇叫到办公室，１小时后回到家神情异常，伴有下身大出血。自述班主任刘翔宇让她脱掉裤子... 这畜生罪过！快转起来！http://t.cn/htQJ72 @张小云,2156729212,同右！,对奢侈品品牌和官方活动有较高兴趣，但转发内容中未表现出明显的反讽或反对态度情绪宣泄，关注民生，精英视角，自我中心该用户对奢侈品品牌和官方活动有较高的兴趣，转发内容多与时尚、品牌相关，同时关注民生话题。在表达上，倾向于情绪宣泄和自我中心，表现出一定的精英视角。在舆论环境中，可能扮演着意见领袖的角色，对品牌和官方活动的态度可能对周围人产生影响。,要求：答案要包含上述所有方面的要点。,0.0043103448275862,0.1314655172413793,0.8642241379310345,0.0,0.3125,0.6875,0.0,0.0625,0.9375,0.0,0.25,0.75,0.0,0.125,0.875,0.0,0.1875,0.8125,0.0,0.0625,0.9375,0.0,0.0,1.0,0.0,0.0,1.0,0.0,0.0625,0.9375,0.0,0.0,1.0,0.0,0.1875,0.8125
29,【幼女遭老师强奸大出血３小时】如果此案仍以嫖宿幼妓判处，你的心理底线会怎样：河南南阳宛城区红泥湾镇一7岁二年级女生明明(化名)放学后被班主任老师刘翔宇叫到办公室，１小时后回到家神情异常，伴有下身大出血。自述班主任刘翔宇让她脱掉裤子... 这畜生罪过！快转起来！http://t.cn/htQJ72 @张小云,2001830807,我只想说这种畜生怎么还活在世上，真丢南阳的脸，直接推出去凌迟，然后把肉拿去喂狗、喂狗、喂狗。王八蛋还为人师表。作为南阳人很心痛遇到这种杂碎[泪][怒][霹雳],对体制和政策持有批判态度，但未表现出极端反对情绪宣泄，反讽嘲弄，攻击性强，关注民生，自我中心该用户对体制和政策持有批判态度，经常转发和评论与政治和社会问题相关的微博。其表达方式以情绪宣泄和反讽为主，关注民生问题，并表现出一定的自我中心倾向。在社交媒体上，该用户活跃度高，经常参与讨论，对现实问题有较强的反应和表达欲望。,要求：答案要包含上述所有方面的要点。,0.0043103448275862,0.1314655172413793,0.8642241379310345,0.0,0.3125,0.6875,0.0,0.0625,0.9375,0.0,0.25,0.75,0.0,0.125,0.875,0.0,0.1875,0.8125,0.0,0.0625,0.9375,0.0,0.0,1.0,0.0,0.0,1.0,0.0,0.0625,0.9375,0.0,0.0,1.0,0.0,0.1875,0.8125
29,【幼女遭老师强奸大出血３小时】如果此案仍以嫖宿幼妓判处，你的心理底线会怎样：河南南阳宛城区红泥湾镇一7岁二年级女生明明(化名)放学后被班主任老师刘翔宇叫到办公室，１小时后回到家神情异常，伴有下身大出血。自述班主任刘翔宇让她脱掉裤子... 这畜生罪过！快转起来！http://t.cn/htQJ72 @张小云,1877372213,转发微博,转发官方和正面内容较多，但未表现出明显的反讽或潜台词，倾向于温和建制派情绪宣泄，关注民生，精英视角，自我中心该用户表现出对生活的热爱和对娱乐的追求，转发内容以官方和正面信息为主，同时关注民生话题，体现出一定的精英视角。在表达上，情绪宣泄和自我中心的特点较为明显。对于不同类型的事件，该用户可能会表现出对个人兴趣的关注，同时也会对社会热点事件有所关注，并倾向于从个人角度出发进行评论。语言风格上，既有情绪化的表达，也有对生活细节的关注，体现出多元化的表达方式。,要求：答案要包含上述所有方面的要点。,0.0043103448275862,0.1314655172413793,0.8642241379310345,0.0,0.3125,0.6875,0.0,0.0625,0.9375,0.0,0.25,0.75,0.0,0.125,0.875,0.0,0.1875,0.8125,0.0,0.0625,0.9375,0.0,0.0,1.0,0.0,0.0,1.0,0.0,0.0625,0.9375,0.0,0.0,1.0,0.0,0.1875,0.8125
29,【幼女遭老师强奸大出血３小时】如果此案仍以嫖宿幼妓判处，你的心理底线会怎样：河南南阳宛城区红泥湾镇一7岁二年级女生明明(化名)放学后被班主任老师刘翔宇叫到办公室，１小时后回到家神情异常，伴有下身大出血。自述班主任刘翔宇让她脱掉裤子... 这畜生罪过！快转起来！http://t.cn/htQJ72 @张小云,1962206301,转发微博,转发活动微博并参与讨论，但原创内容偏向生活分享，未表现出明显的反建制或批判态度情绪宣泄，关注民生，精英视角，底层共情该用户关注社会现象，但表达观点较为温和，倾向于参与群体活动。在日常生活中，关注生活品质，对民生问题有所关注，但不会过于激进。语言风格偏向于关注民生和底层共情，同时展现出一定的精英视角。,要求：答案要包含上述所有方面的要点。,0.0043103448275862,0.1314655172413793,0.8642241379310345,0.0,0.3125,0.6875,0.0,0.0625,0.9375,0.0,0.25,0.75,0.0,0.125,0.875,0.0,0.1875,0.8125,0.0,0.0625,0.9375,0.0,0.0,1.0,0.0,0.0,1.0,0.0,0.0625,0.9375,0.0,0.0,1.0,0.0,0.1875,0.8125
29,【幼女遭老师强奸大出血３小时】如果此案仍以嫖宿幼妓判处，你的心理底线会怎样：河南南阳宛城区红泥湾镇一7岁二年级女生明明(化名)放学后被班主任老师刘翔宇叫到办公室，１小时后回到家神情异常，伴有下身大出血。自述班主任刘翔宇让她脱掉裤子... 这畜生罪过！快转起来！http://t.cn/htQJ72 @张小云,1160324900,畜生！@小细君 @Zeake_Bo,情绪宣泄，宏大叙事，关注民生，精英视角，底层共情这位用户热爱生活，喜欢分享生活中的点滴，对自然景观和美食有着浓厚的兴趣。他关注社会现象，但更倾向于以旁观者的角度去观察和思考。他的语言风格偏向于情绪宣泄和宏大叙事，同时也能体现出对民生和精英视角的关注。他是一位普通参与者，活跃度不高，但能带来积极向上的氛围。,要求：答案要包含上述所有方面的要点。,0.0043103448275862,0.1314655172413793,0.8642241379310345,0.0,0.3125,0.6875,0.0,0.0625,0.9375,0.0,0.25,0.75,0.0,0.125,0.875,0.0,0.1875,0.8125,0.0,0.0625,0.9375,0.0,0.0,1.0,0.0,0.0,1.0,0.0,0.0625,0.9375,0.0,0.0,1.0,0.0,0.1875,0.8125
29,【幼女遭老师强奸大出血３小时】如果此案仍以嫖宿幼妓判处，你的心理底线会怎样：河南南阳宛城区红泥湾镇一7岁二年级女生明明(化名)放学后被班主任老师刘翔宇叫到办公室，１小时后回到家神情异常，伴有下身大出血。自述班主任刘翔宇让她脱掉裤子... 这畜生罪过！快转起来！http://t.cn/htQJ72 @张小云,1883743874,不是官员，以QJ幼女定罪啊！,关注社会问题，转发公益信息，但同时也参与商业活动的转发情绪宣泄，关注民生，精英视角，底层共情，自我中心该用户关注社会问题，尤其是民生问题，转发公益信息，表现出对弱势群体的同情。同时，也参与商业活动的转发，显示出对多样信息的接受态度。在表达上，既有情绪宣泄的一面，也有对民生问题的关注，同时保持一定的精英视角和底层共情。在社交活动中，该用户表现出一定的自我中心，但总体上是一个积极参与社会讨论的普通参与者。,要求：答案要包含上述所有方面的要点。,0.0043103448275862,0.1314655172413793,0.8642241379310345,0.0,0.3125,0.6875,0.0,0.0625,0.9375,0.0,0.25,0.75,0.0,0.125,0.875,0.0,0.1875,0.8125,0.0,0.0625,0.9375,0.0,0.0,1.0,0.0,0.0,1.0,0.0,0.0625,0.9375,0.0,0.0,1.0,0.0,0.1875,0.8125
29,【幼女遭老师强奸大出血３小时】如果此案仍以嫖宿幼妓判处，你的心理底线会怎样：河南南阳宛城区红泥湾镇一7岁二年级女生明明(化名)放学后被班主任老师刘翔宇叫到办公室，１小时后回到家神情异常，伴有下身大出血。自述班主任刘翔宇让她脱掉裤子... 这畜生罪过！快转起来！http://t.cn/htQJ72 @张小云,2017025247,畜生[怒]阉了他[怒][怒][怒],对奢侈品品牌和官方活动有较高兴趣，但转发内容中未表现出明显的反讽或反对态度情绪宣泄，关注民生，精英视角，自我中心该用户对奢侈品品牌和官方活动有较高的兴趣，转发内容多与时尚、品牌相关，同时关注民生话题。在表达上，倾向于情绪宣泄和自我中心，表现出一定的精英视角。在舆论环境中，可能扮演着意见领袖的角色，对品牌和官方活动的态度可能对周围人产生影响。,要求：答案要包含上述所有方面的要点。,0.0043103448275862,0.1314655172413793,0.8642241379310345,0.0,0.3125,0.6875,0.0,0.0625,0.9375,0.0,0.25,0.75,0.0,0.125,0.875,0.0,0.1875,0.8125,0.0,0.0625,0.9375,0.0,0.0,1.0,0.0,0.0,1.0,0.0,0.0625,0.9375,0.0,0.0,1.0,0.0,0.1875,0.8125
29,【幼女遭老师强奸大出血３小时】如果此案仍以嫖宿幼妓判处，你的心理底线会怎样：河南南阳宛城区红泥湾镇一7岁二年级女生明明(化名)放学后被班主任老师刘翔宇叫到办公室，１小时后回到家神情异常，伴有下身大出血。自述班主任刘翔宇让她脱掉裤子... 这畜生罪过！快转起来！http://t.cn/htQJ72 @张小云,2427414620,看了视频，CN只男宁就应该卵斩特。[怒][怒][怒][怒][怒][怒][怒][怒][怒][怒][怒][怒],转发内容多为实用信息和生活技巧，显示对日常生活细节的关注，但未表现出明显的政治立场情绪宣泄，关注民生，精英视角，底层共情该用户关注日常生活，转发实用信息和生活技巧，表现出对日常生活的热爱和对细节的关注。在政治立场方面，没有明显的倾向，更倾向于关注个人生活和社会现象。语言风格偏向于情绪宣泄和关注民生，体现出对生活的积极态度和对社会现象的敏感。,要求：答案要包含上述所有方面的要点。,0.0043103448275862,0.1314655172413793,0.8642241379310345,0.0,0.3125,0.6875,0.0,0.0625,0.9375,0.0,0.25,0.75,0.0,0.125,0.875,0.0,0.1875,0.8125,0.0,0.0625,0.9375,0.0,0.0,1.0,0.0,0.0,1.0,0.0,0.0625,0.9375,0.0,0.0,1.0,0.0,0.1875,0.8125
29,【幼女遭老师强奸大出血３小时】如果此案仍以嫖宿幼妓判处，你的心理底线会怎样：河南南阳宛城区红泥湾镇一7岁二年级女生明明(化名)放学后被班主任老师刘翔宇叫到办公室，１小时后回到家神情异常，伴有下身大出血。自述班主任刘翔宇让她脱掉裤子... 这畜生罪过！快转起来！http://t.cn/htQJ72 @张小云,1766599542,看到很揪心[泪],频繁发布个人生活动态，转发内容多样，但缺乏明确的政治立场情绪宣泄，关注民生，精英视角，底层共情，自我中心该用户似乎更关注个人生活，频繁发布与生日相关的动态，同时转发内容涉及娱乐、社会现象等，表现出对生活的关注和对周围世界的参与。在表达上，既有情绪宣泄的一面，也有对民生和精英视角的关注，显示出其复杂的人格特质。在面对不同类型的事件时，可能更倾向于表达个人感受而非明确的政治立场，语言风格特征表现为既情绪化又关注社会现象。,要求：答案要包含上述所有方面的要点。,0.0043103448275862,0.1314655172413793,0.8642241379310345,0.0,0.3125,0.6875,0.0,0.0625,0.9375,0.0,0.25,0.75,0.0,0.125,0.875,0.0,0.1875,0.8125,0.0,0.0625,0.9375,0.0,0.0,1.0,0.0,0.0,1.0,0.0,0.0625,0.9375,0.0,0.0,1.0,0.0,0.1875,0.8125
29,【幼女遭老师强奸大出血３小时】如果此案仍以嫖宿幼妓判处，你的心理底线会怎样：河南南阳宛城区红泥湾镇一7岁二年级女生明明(化名)放学后被班主任老师刘翔宇叫到办公室，１小时后回到家神情异常，伴有下身大出血。自述班主任刘翔宇让她脱掉裤子... 这畜生罪过！快转起来！http://t.cn/htQJ72 @张小云,1615040481,现在的老师都是怎么了,表现出一定的消极情绪和对现状的不满，但未明确表现出强烈的政治立场情绪宣泄，悲观抱怨，关注民生，自我中心该用户表现出一定的消极情绪和对现状的不满，但同时也关注民生问题。在表达上，倾向于情绪宣泄和个人情感释放，同时表现出对自身利益的关注。在社交活动中，以普通参与者的身份出现，对事件的态度较为被动，更倾向于表达个人感受而非主动引导舆论。,要求：答案要包含上述所有方面的要点。,0.0043103448275862,0.1314655172413793,0.8642241379310345,0.0,0.3125,0.6875,0.0,0.0625,0.9375,0.0,0.25,0.75,0.0,0.125,0.875,0.0,0.1875,0.8125,0.0,0.0625,0.9375,0.0,0.0,1.0,0.0,0.0,1.0,0.0,0.0625,0.9375,0.0,0.0,1.0,0.0,0.1875,0.8125
29,【幼女遭老师强奸大出血３小时】如果此案仍以嫖宿幼妓判处，你的心理底线会怎样：河南南阳宛城区红泥湾镇一7岁二年级女生明明(化名)放学后被班主任老师刘翔宇叫到办公室，１小时后回到家神情异常，伴有下身大出血。自述班主任刘翔宇让她脱掉裤子... 这畜生罪过！快转起来！http://t.cn/htQJ72 @张小云,1712334423,MLGB啊！允许我说粗话！,对某些官方或权威内容持怀疑态度，对现实问题有批判性思考逻辑缜密，修辞类，情绪宣泄，关注民生，自我中心该用户对现实问题有较强的批判性思维，关注社会现实，对权威和体制持有质疑态度。在表达上，他倾向于使用逻辑和数据来支持自己的观点，同时也会通过修辞手法来表达情绪。他积极参与社会讨论，对民生问题有较高的关注度，同时也表现出一定的自我中心倾向。,要求：答案要包含上述所有方面的要点。,0.0043103448275862,0.1314655172413793,0.8642241379310345,0.0,0.3125,0.6875,0.0,0.0625,0.9375,0.0,0.25,0.75,0.0,0.125,0.875,0.0,0.1875,0.8125,0.0,0.0625,0.9375,0.0,0.0,1.0,0.0,0.0,1.0,0.0,0.0625,0.9375,0.0,0.0,1.0,0.0,0.1875,0.8125
