time_step,topic,uid,real_comments,profile_text,batch_mf,pre_pos,pre_neu,pre_neg,dist_t0_pos,dist_t0_neu,dist_t0_neg,dist_t1_pos,dist_t1_neu,dist_t1_neg,dist_t2_pos,dist_t2_neu,dist_t2_neg,dist_t3_pos,dist_t3_neu,dist_t3_neg,dist_t4_pos,dist_t4_neu,dist_t4_neg,dist_t5_pos,dist_t5_neu,dist_t5_neg,dist_t6_pos,dist_t6_neu,dist_t6_neg,dist_t7_pos,dist_t7_neu,dist_t7_neg,dist_t8_pos,dist_t8_neu,dist_t8_neg,dist_t9_pos,dist_t9_neu,dist_t9_neg,dist_t10_pos,dist_t10_neu,dist_t10_neg
14,【幼女遭老师强奸大出血３小时】如果此案仍以嫖宿幼妓判处，你的心理底线会怎样：河南南阳宛城区红泥湾镇一7岁二年级女生明明(化名)放学后被班主任老师刘翔宇叫到办公室，１小时后回到家神情异常，伴有下身大出血。自述班主任刘翔宇让她脱掉裤子... 这畜生罪过！快转起来！http://t.cn/htQJ72 @张小云,2143675695,株他九族！,用户内容以日常生活和个人情感为主，无明显政治立场倾向情绪宣泄，关注民生，自我中心，宏大叙事，底层共情该用户关注日常生活和个人情感，对政治和社会议题较少关注。在表达上，倾向于情绪宣泄和自我表达，同时也会关注家庭和孩子的成长。在社交网络上，该用户表现为一个普通参与者，偶尔分享个人生活点滴，对周围环境的变化反应较为直接。,[''],0.0,0.15625,0.84375,0.0,0.0625,0.9375,0.0,0.0,1.0,0.0,0.25,0.75,0.0625,0.125,0.8125,0.0,0.0,1.0,0.0,0.125,0.875,0.0,0.0625,0.9375,0.0,0.25,0.75,0.0,0.25,0.75,0.0625,0.125,0.8125,0.0,0.0625,0.9375
14,【幼女遭老师强奸大出血３小时】如果此案仍以嫖宿幼妓判处，你的心理底线会怎样：河南南阳宛城区红泥湾镇一7岁二年级女生明明(化名)放学后被班主任老师刘翔宇叫到办公室，１小时后回到家神情异常，伴有下身大出血。自述班主任刘翔宇让她脱掉裤子... 这畜生罪过！快转起来！http://t.cn/htQJ72 @张小云,2033217362,[bed凌乱],转发官方内容时表现出一般认同，但偶尔对某些现象表示反对，如对校服的评论显示对现状的不满情绪宣泄，关注民生，精英视角，自我中心，宏大叙事该用户关注社会现象和个人兴趣，对某些现象持有批评态度，但总体上倾向于温和的建制派立场。在表达上，喜欢情绪化的表达，同时也关注民生问题。在社交网络上，表现为普通参与者，偶尔发表个人观点，但整体上较为被动。,[''],0.0,0.15625,0.84375,0.0,0.0625,0.9375,0.0,0.0,1.0,0.0,0.25,0.75,0.0625,0.125,0.8125,0.0,0.0,1.0,0.0,0.125,0.875,0.0,0.0625,0.9375,0.0,0.25,0.75,0.0,0.25,0.75,0.0625,0.125,0.8125,0.0,0.0625,0.9375
14,【幼女遭老师强奸大出血３小时】如果此案仍以嫖宿幼妓判处，你的心理底线会怎样：河南南阳宛城区红泥湾镇一7岁二年级女生明明(化名)放学后被班主任老师刘翔宇叫到办公室，１小时后回到家神情异常，伴有下身大出血。自述班主任刘翔宇让她脱掉裤子... 这畜生罪过！快转起来！http://t.cn/htQJ72 @张小云,2245028145,变态的人越来越多该怎么办啊[衰][衰],用户内容以日常生活和个人情感为主，无明显政治立场倾向情绪宣泄，关注民生，自我中心，宏大叙事，底层共情该用户关注日常生活和个人情感，对政治和社会议题较少关注。在表达上，倾向于情绪宣泄和自我表达，同时也会关注家庭和孩子的成长。在社交网络上，该用户表现为一个普通参与者，偶尔分享个人生活点滴，对周围环境的变化反应较为直接。,[''],0.0,0.15625,0.84375,0.0,0.0625,0.9375,0.0,0.0,1.0,0.0,0.25,0.75,0.0625,0.125,0.8125,0.0,0.0,1.0,0.0,0.125,0.875,0.0,0.0625,0.9375,0.0,0.25,0.75,0.0,0.25,0.75,0.0625,0.125,0.8125,0.0,0.0625,0.9375
14,【幼女遭老师强奸大出血３小时】如果此案仍以嫖宿幼妓判处，你的心理底线会怎样：河南南阳宛城区红泥湾镇一7岁二年级女生明明(化名)放学后被班主任老师刘翔宇叫到办公室，１小时后回到家神情异常，伴有下身大出血。自述班主任刘翔宇让她脱掉裤子... 这畜生罪过！快转起来！http://t.cn/htQJ72 @张小云,1017803121,不转不行,对多种内容表现出兴趣，但缺乏明确的政治立场，倾向于娱乐和轻松话题情绪宣泄，关注民生，自我中心，阴阳怪气，反讽嘲弄这位用户似乎对各种内容都抱有好奇心，但缺乏坚定的政治立场。他/她更倾向于转发轻松和娱乐性的内容，同时也会对一些社会现象和事件发表个人看法，但通常带有一定的讽刺和娱乐性质。在社交网络上，他/她更像是一个观察者和参与者，而不是一个活跃的推动者或意见领袖。,[''],0.0,0.15625,0.84375,0.0,0.0625,0.9375,0.0,0.0,1.0,0.0,0.25,0.75,0.0625,0.125,0.8125,0.0,0.0,1.0,0.0,0.125,0.875,0.0,0.0625,0.9375,0.0,0.25,0.75,0.0,0.25,0.75,0.0625,0.125,0.8125,0.0,0.0625,0.9375
14,【幼女遭老师强奸大出血３小时】如果此案仍以嫖宿幼妓判处，你的心理底线会怎样：河南南阳宛城区红泥湾镇一7岁二年级女生明明(化名)放学后被班主任老师刘翔宇叫到办公室，１小时后回到家神情异常，伴有下身大出血。自述班主任刘翔宇让她脱掉裤子... 这畜生罪过！快转起来！http://t.cn/htQJ72 @张小云,1685025843,都干嘛呢 快点拉出去枪毙呀,对日常生活细节关注较多，对官方和正面内容有一般认同，但也会表达个人观点。情绪宣泄，关注民生，精英视角，底层共情，自我中心该用户关注日常生活，对官方和正面内容有基本认同，但也会表达个人观点。在表达上，情绪宣泄和关注民生是其主要风格，同时展现出精英视角和底层共情。在社交活动中，该用户活跃度高，善于分享个人经历和感受，同时也关注社会热点。,[''],0.0,0.15625,0.84375,0.0,0.0625,0.9375,0.0,0.0,1.0,0.0,0.25,0.75,0.0625,0.125,0.8125,0.0,0.0,1.0,0.0,0.125,0.875,0.0,0.0625,0.9375,0.0,0.25,0.75,0.0,0.25,0.75,0.0625,0.125,0.8125,0.0,0.0625,0.9375
14,【幼女遭老师强奸大出血３小时】如果此案仍以嫖宿幼妓判处，你的心理底线会怎样：河南南阳宛城区红泥湾镇一7岁二年级女生明明(化名)放学后被班主任老师刘翔宇叫到办公室，１小时后回到家神情异常，伴有下身大出血。自述班主任刘翔宇让她脱掉裤子... 这畜生罪过！快转起来！http://t.cn/htQJ72 @张小云,1997673135,7岁啊。不是17岁啊。,对行业现状持批判态度，对政策和企业行为有质疑情绪宣泄，逻辑缜密，反讽嘲弄，关注民生，精英视角该用户对通信行业和社会现象有深刻的洞察和批判，关注行业内部矛盾和社会不公。在表达上，他善于运用逻辑和数据支持自己的观点，同时也不乏情绪化的表达。他关注民生，对精英阶层的行为持质疑态度，强调个人价值和尊严。在面对不同事件时，他可能会表现出对不公平现象的强烈不满，同时也可能对一些社会问题提出建设性的解决方案。,[''],0.0,0.15625,0.84375,0.0,0.0625,0.9375,0.0,0.0,1.0,0.0,0.25,0.75,0.0625,0.125,0.8125,0.0,0.0,1.0,0.0,0.125,0.875,0.0,0.0625,0.9375,0.0,0.25,0.75,0.0,0.25,0.75,0.0625,0.125,0.8125,0.0,0.0625,0.9375
14,【幼女遭老师强奸大出血３小时】如果此案仍以嫖宿幼妓判处，你的心理底线会怎样：河南南阳宛城区红泥湾镇一7岁二年级女生明明(化名)放学后被班主任老师刘翔宇叫到办公室，１小时后回到家神情异常，伴有下身大出血。自述班主任刘翔宇让她脱掉裤子... 这畜生罪过！快转起来！http://t.cn/htQJ72 @张小云,1420829867,强奸未成年幼女，应当枪毙，枪毙，枪毙！！！！！！！！！,关注民生，对特定事件有强烈情感反应，对政治事件有批判态度情绪宣泄，关注民生，攻击性强，宏大叙事，自我中心该用户表现出对民生问题的关注和对特定事件的强烈情感反应，同时在表达上具有攻击性和自我中心的特点。在政治事件上，该用户倾向于批判态度，同时受到情绪煽动的影响较大。该用户在社交媒体上活跃度高，喜欢分享个人观点和对社会事件的评论，表现出对群体利益的关注和对社会公正的追求。,[''],0.0,0.15625,0.84375,0.0,0.0625,0.9375,0.0,0.0,1.0,0.0,0.25,0.75,0.0625,0.125,0.8125,0.0,0.0,1.0,0.0,0.125,0.875,0.0,0.0625,0.9375,0.0,0.25,0.75,0.0,0.25,0.75,0.0625,0.125,0.8125,0.0,0.0625,0.9375
14,【幼女遭老师强奸大出血３小时】如果此案仍以嫖宿幼妓判处，你的心理底线会怎样：河南南阳宛城区红泥湾镇一7岁二年级女生明明(化名)放学后被班主任老师刘翔宇叫到办公室，１小时后回到家神情异常，伴有下身大出血。自述班主任刘翔宇让她脱掉裤子... 这畜生罪过！快转起来！http://t.cn/htQJ72 @张小云,1822295690,[哼][怒],关注移民政策、环保问题，对现状持批评态度，但未表现出极端反对情绪宣泄，宏大叙事，关注民生，政治隐喻，攻击性强该用户关注社会问题，尤其是移民政策和环境污染，对现状持批评态度。在表达上，倾向于情绪宣泄和宏大叙事，关注民生问题，并使用政治隐喻进行表达。该用户在社交媒体上活跃度高，经常转发和评论相关话题，表现出对环境和社会变革的追求。,[''],0.0,0.15625,0.84375,0.0,0.0625,0.9375,0.0,0.0,1.0,0.0,0.25,0.75,0.0625,0.125,0.8125,0.0,0.0,1.0,0.0,0.125,0.875,0.0,0.0625,0.9375,0.0,0.25,0.75,0.0,0.25,0.75,0.0625,0.125,0.8125,0.0,0.0625,0.9375
14,【幼女遭老师强奸大出血３小时】如果此案仍以嫖宿幼妓判处，你的心理底线会怎样：河南南阳宛城区红泥湾镇一7岁二年级女生明明(化名)放学后被班主任老师刘翔宇叫到办公室，１小时后回到家神情异常，伴有下身大出血。自述班主任刘翔宇让她脱掉裤子... 这畜生罪过！快转起来！http://t.cn/htQJ72 @张小云,2570155383,班主任么完了呀，要是村长兴许还有救,虽表现出对生活的热爱，但转发内容中透露出对现实的不满和对秩序的渴望情绪宣泄，宏大叙事，关注民生，自我中心，悲观抱怨该用户表现出对生活的热爱和对个人情感的强烈表达，同时在转发和评论中透露出对现实的不满和对秩序的渴望。他关注民生，但同时也表现出自我中心的倾向。在语言风格上，他倾向于情绪宣泄和宏大叙事，同时关注民生问题。他是一位高频活跃者，但他的观点和态度可能较为消极和混沌。,[''],0.0,0.15625,0.84375,0.0,0.0625,0.9375,0.0,0.0,1.0,0.0,0.25,0.75,0.0625,0.125,0.8125,0.0,0.0,1.0,0.0,0.125,0.875,0.0,0.0625,0.9375,0.0,0.25,0.75,0.0,0.25,0.75,0.0625,0.125,0.8125,0.0,0.0625,0.9375
14,【幼女遭老师强奸大出血３小时】如果此案仍以嫖宿幼妓判处，你的心理底线会怎样：河南南阳宛城区红泥湾镇一7岁二年级女生明明(化名)放学后被班主任老师刘翔宇叫到办公室，１小时后回到家神情异常，伴有下身大出血。自述班主任刘翔宇让她脱掉裤子... 这畜生罪过！快转起来！http://t.cn/htQJ72 @张小云,1109402673,娘额LB'内依驢剪掉,关注军事动态，对政府楼盘点持批评态度，转发内容涉及媒体责任和环境保护问题，显示对现状的不满和对变革的渴望情绪宣泄，关注民生，批判性强，政治隐喻，关注社会问题该用户关注社会动态，对政府和社会问题持有批判态度，善于表达自己的情绪和观点。在转发和评论中，他经常表现出对社会不公和环境污染的关注，以及对媒体责任的质疑。他的语言风格带有一定的政治隐喻，表现出对社会现象的深刻洞察。在政治倾向上，他更倾向于批判变革类，但同时也展现出对民生问题的关注。,[''],0.0,0.15625,0.84375,0.0,0.0625,0.9375,0.0,0.0,1.0,0.0,0.25,0.75,0.0625,0.125,0.8125,0.0,0.0,1.0,0.0,0.125,0.875,0.0,0.0625,0.9375,0.0,0.25,0.75,0.0,0.25,0.75,0.0625,0.125,0.8125,0.0,0.0625,0.9375
14,【幼女遭老师强奸大出血３小时】如果此案仍以嫖宿幼妓判处，你的心理底线会怎样：河南南阳宛城区红泥湾镇一7岁二年级女生明明(化名)放学后被班主任老师刘翔宇叫到办公室，１小时后回到家神情异常，伴有下身大出血。自述班主任刘翔宇让她脱掉裤子... 这畜生罪过！快转起来！http://t.cn/htQJ72 @张小云,2271719614,[怒][怒][怒],虽是体制拥护派但对某些社会现象持有批评态度情绪宣泄，幽默风趣，关注民生，自我中心该用户表现出对体制的拥护，但同时也对某些社会现象持有批评态度。他善于用幽默和讽刺的方式表达自己的观点，关注民生问题，同时以自我为中心。在社交平台上，他活跃度高，经常转发和评论各类内容，以表达自己的看法。,[''],0.0,0.15625,0.84375,0.0,0.0625,0.9375,0.0,0.0,1.0,0.0,0.25,0.75,0.0625,0.125,0.8125,0.0,0.0,1.0,0.0,0.125,0.875,0.0,0.0625,0.9375,0.0,0.25,0.75,0.0,0.25,0.75,0.0625,0.125,0.8125,0.0,0.0625,0.9375
14,【幼女遭老师强奸大出血３小时】如果此案仍以嫖宿幼妓判处，你的心理底线会怎样：河南南阳宛城区红泥湾镇一7岁二年级女生明明(化名)放学后被班主任老师刘翔宇叫到办公室，１小时后回到家神情异常，伴有下身大出血。自述班主任刘翔宇让她脱掉裤子... 这畜生罪过！快转起来！http://t.cn/htQJ72 @张小云,1736836747,,虽是体制拥护派但对某些社会现象持有批评态度情绪宣泄，幽默风趣，关注民生，自我中心该用户表现出对体制的拥护，但同时也对某些社会现象持有批评态度。他善于用幽默和讽刺的方式表达自己的观点，关注民生问题，同时以自我为中心。在社交平台上，他活跃度高，经常转发和评论各类内容，以表达自己的看法。,[''],0.0,0.15625,0.84375,0.0,0.0625,0.9375,0.0,0.0,1.0,0.0,0.25,0.75,0.0625,0.125,0.8125,0.0,0.0,1.0,0.0,0.125,0.875,0.0,0.0625,0.9375,0.0,0.25,0.75,0.0,0.25,0.75,0.0625,0.125,0.8125,0.0,0.0625,0.9375
14,【幼女遭老师强奸大出血３小时】如果此案仍以嫖宿幼妓判处，你的心理底线会怎样：河南南阳宛城区红泥湾镇一7岁二年级女生明明(化名)放学后被班主任老师刘翔宇叫到办公室，１小时后回到家神情异常，伴有下身大出血。自述班主任刘翔宇让她脱掉裤子... 这畜生罪过！快转起来！http://t.cn/htQJ72 @张小云,1960548074,[怒]中桑啊~~,对新技术和产品持积极态度，但对某些社会议题表现出批判性思考情绪宣泄，关注民生，精英视角，自我中心，逻辑缜密该用户对新技术和产品表现出浓厚的兴趣，乐于分享和体验。在表达个人观点时，既关注民生问题，又保持一定的精英视角。对社会议题持有批判性思考，但总体上倾向于温和建制派立场。在语言风格上，逻辑性强，但有时会表现出情绪化的倾向。作为高频活跃者，该用户在社交媒体上积极参与讨论，并具有一定的影响力。,[''],0.0,0.15625,0.84375,0.0,0.0625,0.9375,0.0,0.0,1.0,0.0,0.25,0.75,0.0625,0.125,0.8125,0.0,0.0,1.0,0.0,0.125,0.875,0.0,0.0625,0.9375,0.0,0.25,0.75,0.0,0.25,0.75,0.0625,0.125,0.8125,0.0,0.0625,0.9375
15,【幼女遭老师强奸大出血３小时】如果此案仍以嫖宿幼妓判处，你的心理底线会怎样：河南南阳宛城区红泥湾镇一7岁二年级女生明明(化名)放学后被班主任老师刘翔宇叫到办公室，１小时后回到家神情异常，伴有下身大出血。自述班主任刘翔宇让她脱掉裤子... 这畜生罪过！快转起来！http://t.cn/htQJ72 @张小云,2371224530,CN,关注民生，对一些社会现象持批判态度，但总体上倾向于温和改良情绪宣泄，关注民生，自我中心，宏大叙事，辩证思考该用户关注社会现象，对一些问题持有批判态度，但总体上倾向于温和改良。在表达上，善于情绪宣泄，关注民生问题，同时具有自我中心的倾向。在社交活动中，具有较高的活跃度，喜欢分享个人观点和对社会现象的思考。,要求：答案要包含上述所有方面的要点。,0.0,0.15,0.85,0.0,0.0,1.0,0.0,0.25,0.75,0.0625,0.125,0.8125,0.0,0.0,1.0,0.0,0.125,0.875,0.0,0.0625,0.9375,0.0,0.25,0.75,0.0,0.25,0.75,0.0625,0.125,0.8125,0.0,0.0625,0.9375,0.0,0.0,1.0
15,【幼女遭老师强奸大出血３小时】如果此案仍以嫖宿幼妓判处，你的心理底线会怎样：河南南阳宛城区红泥湾镇一7岁二年级女生明明(化名)放学后被班主任老师刘翔宇叫到办公室，１小时后回到家神情异常，伴有下身大出血。自述班主任刘翔宇让她脱掉裤子... 这畜生罪过！快转起来！http://t.cn/htQJ72 @张小云,2010635207,阉了他，畜生!,对某些事件表现出批判态度，但对其他内容则较为中立情绪宣泄，关注民生，自我中心，宏大叙事，攻击性强该用户在社交媒体上表现出较高的活跃度，对各种社会现象和个人情感有着强烈的表达欲望。他关注民生，对社会事件持有批判态度，但同时也表现出一定的自我中心倾向。在语言风格上，他倾向于使用情绪化的表达，并喜欢在宏大叙事的背景下讨论问题。尽管对权威和体制持有一定程度的怀疑，但他也愿意参与社会讨论，并在某些问题上表现出积极的参与态度。,要求：答案要包含上述所有方面的要点。,0.0,0.15,0.85,0.0,0.0,1.0,0.0,0.25,0.75,0.0625,0.125,0.8125,0.0,0.0,1.0,0.0,0.125,0.875,0.0,0.0625,0.9375,0.0,0.25,0.75,0.0,0.25,0.75,0.0625,0.125,0.8125,0.0,0.0625,0.9375,0.0,0.0,1.0
15,【幼女遭老师强奸大出血３小时】如果此案仍以嫖宿幼妓判处，你的心理底线会怎样：河南南阳宛城区红泥湾镇一7岁二年级女生明明(化名)放学后被班主任老师刘翔宇叫到办公室，１小时后回到家神情异常，伴有下身大出血。自述班主任刘翔宇让她脱掉裤子... 这畜生罪过！快转起来！http://t.cn/htQJ72 @张小云,1655340107,又是中原！[怒],关注民生，对现有体制有一定认同，但对社会问题持批判态度情绪宣泄，关注民生，精英视角，自我中心，悲观抱怨该用户关注社会民生，对社会问题有自己独到的见解，同时关注个人成长与价值实现。在表达上，既有情绪宣泄的一面，也有理性分析的一面。对社会现状持有批判态度，但同时也表现出对未来的担忧和迷茫。语言风格上，既有自我中心的倾向，也有对民生问题的关注。,要求：答案要包含上述所有方面的要点。,0.0,0.15,0.85,0.0,0.0,1.0,0.0,0.25,0.75,0.0625,0.125,0.8125,0.0,0.0,1.0,0.0,0.125,0.875,0.0,0.0625,0.9375,0.0,0.25,0.75,0.0,0.25,0.75,0.0625,0.125,0.8125,0.0,0.0625,0.9375,0.0,0.0,1.0
15,【幼女遭老师强奸大出血３小时】如果此案仍以嫖宿幼妓判处，你的心理底线会怎样：河南南阳宛城区红泥湾镇一7岁二年级女生明明(化名)放学后被班主任老师刘翔宇叫到办公室，１小时后回到家神情异常，伴有下身大出血。自述班主任刘翔宇让她脱掉裤子... 这畜生罪过！快转起来！http://t.cn/htQJ72 @张小云,2005209710,畜生，枪毙太便宜它了！,对林志颖等偶像的喜爱表现为对特定群体的认同情绪宣泄，关注民生，精英视角，底层共情该用户表现出对特定偶像的强烈喜爱，并通过转发和评论相关内容来展示自己的支持。在表达上，既有情绪化的宣泄，也关注民生问题，同时展现出精英视角和底层共情。用户在社交媒体上活跃，积极参与相关话题的讨论，表现出对特定群体的强烈认同。,要求：答案要包含上述所有方面的要点。,0.0,0.15,0.85,0.0,0.0,1.0,0.0,0.25,0.75,0.0625,0.125,0.8125,0.0,0.0,1.0,0.0,0.125,0.875,0.0,0.0625,0.9375,0.0,0.25,0.75,0.0,0.25,0.75,0.0625,0.125,0.8125,0.0,0.0625,0.9375,0.0,0.0,1.0
15,【幼女遭老师强奸大出血３小时】如果此案仍以嫖宿幼妓判处，你的心理底线会怎样：河南南阳宛城区红泥湾镇一7岁二年级女生明明(化名)放学后被班主任老师刘翔宇叫到办公室，１小时后回到家神情异常，伴有下身大出血。自述班主任刘翔宇让她脱掉裤子... 这畜生罪过！快转起来！http://t.cn/htQJ72 @张小云,1870425295,禽兽不如啊～！怪不得人家要幼儿园的老师都是女的。,对奢侈品品牌和官方活动有较高兴趣，但转发内容中未表现出明显的反讽或反对态度情绪宣泄，关注民生，精英视角，自我中心该用户对奢侈品品牌和官方活动有较高的兴趣，转发内容多与时尚、品牌相关，同时关注民生话题。在表达上，倾向于情绪宣泄和自我中心，表现出一定的精英视角。在舆论环境中，可能扮演着意见领袖的角色，对品牌和官方活动的态度可能对周围人产生影响。,要求：答案要包含上述所有方面的要点。,0.0,0.15,0.85,0.0,0.0,1.0,0.0,0.25,0.75,0.0625,0.125,0.8125,0.0,0.0,1.0,0.0,0.125,0.875,0.0,0.0625,0.9375,0.0,0.25,0.75,0.0,0.25,0.75,0.0625,0.125,0.8125,0.0,0.0625,0.9375,0.0,0.0,1.0
15,【幼女遭老师强奸大出血３小时】如果此案仍以嫖宿幼妓判处，你的心理底线会怎样：河南南阳宛城区红泥湾镇一7岁二年级女生明明(化名)放学后被班主任老师刘翔宇叫到办公室，１小时后回到家神情异常，伴有下身大出血。自述班主任刘翔宇让她脱掉裤子... 这畜生罪过！快转起来！http://t.cn/htQJ72 @张小云,1854604910,我操！,转发内容多为娱乐、美食、旅行等日常话题，未发现明显的反讽或潜台词，倾向于温和建制派情绪宣泄，关注民生，精英视角，底层共情，自我中心该用户关注日常生活和个人兴趣，转发内容多为娱乐、美食、旅行等，表现出对日常生活的热爱和对社会热点的关注，但更倾向于以轻松的态度面对。在表达上，既有情绪宣泄的一面，也有对民生和精英视角的关注，同时表现出一定的自我中心倾向。在面对不同类型的事件时，可能会表现出对美好生活的向往和对社会现象的理性思考。,要求：答案要包含上述所有方面的要点。,0.0,0.15,0.85,0.0,0.0,1.0,0.0,0.25,0.75,0.0625,0.125,0.8125,0.0,0.0,1.0,0.0,0.125,0.875,0.0,0.0625,0.9375,0.0,0.25,0.75,0.0,0.25,0.75,0.0625,0.125,0.8125,0.0,0.0625,0.9375,0.0,0.0,1.0
15,【幼女遭老师强奸大出血３小时】如果此案仍以嫖宿幼妓判处，你的心理底线会怎样：河南南阳宛城区红泥湾镇一7岁二年级女生明明(化名)放学后被班主任老师刘翔宇叫到办公室，１小时后回到家神情异常，伴有下身大出血。自述班主任刘翔宇让她脱掉裤子... 这畜生罪过！快转起来！http://t.cn/htQJ72 @张小云,1822123795,中国也需要化学阉割！//,关注民生，对经济政策持批评态度情绪宣泄，关注民生，精英视角，底层共情，自我中心该用户表现出对民生问题的关注，同时在转发和评论中展现出对经济政策的批评态度。他/她具有较高的活跃度，转发内容涉及多个领域，包括购物攻略、美食推荐、社会新闻等。用户在表达上倾向于情绪宣泄和自我中心，同时关注底层共情和精英视角。,要求：答案要包含上述所有方面的要点。,0.0,0.15,0.85,0.0,0.0,1.0,0.0,0.25,0.75,0.0625,0.125,0.8125,0.0,0.0,1.0,0.0,0.125,0.875,0.0,0.0625,0.9375,0.0,0.25,0.75,0.0,0.25,0.75,0.0625,0.125,0.8125,0.0,0.0625,0.9375,0.0,0.0,1.0
15,【幼女遭老师强奸大出血３小时】如果此案仍以嫖宿幼妓判处，你的心理底线会怎样：河南南阳宛城区红泥湾镇一7岁二年级女生明明(化名)放学后被班主任老师刘翔宇叫到办公室，１小时后回到家神情异常，伴有下身大出血。自述班主任刘翔宇让她脱掉裤子... 这畜生罪过！快转起来！http://t.cn/htQJ72 @张小云,1685025843,不是畜生 畜生不如,对日常生活持有积极态度，对体制有基本认同，但对社会现象持有批判性思考情绪宣泄，乐观积极，关注民生，自我中心该用户对日常生活持有积极态度，乐于分享个人经历和情感体验，对体制有基本认同，但对社会现象持有批判性思考。在表达上，善于用情绪化的语言表达个人感受，同时关注民生问题，表现出一定的自我中心倾向。在面对不同类型的事件时，预期会以个人情感体验为出发点，表达自己的观点和态度。语言风格特征为乐观积极，但有时会带有情绪化的表达。,要求：答案要包含上述所有方面的要点。,0.0,0.15,0.85,0.0,0.0,1.0,0.0,0.25,0.75,0.0625,0.125,0.8125,0.0,0.0,1.0,0.0,0.125,0.875,0.0,0.0625,0.9375,0.0,0.25,0.75,0.0,0.25,0.75,0.0625,0.125,0.8125,0.0,0.0625,0.9375,0.0,0.0,1.0
