time_step,topic,uid,real_comments,profile_text,batch_mf,pre_pos,pre_neu,pre_neg,dist_t0_pos,dist_t0_neu,dist_t0_neg,dist_t1_pos,dist_t1_neu,dist_t1_neg,dist_t2_pos,dist_t2_neu,dist_t2_neg,dist_t3_pos,dist_t3_neu,dist_t3_neg,dist_t4_pos,dist_t4_neu,dist_t4_neg,dist_t5_pos,dist_t5_neu,dist_t5_neg,dist_t6_pos,dist_t6_neu,dist_t6_neg,dist_t7_pos,dist_t7_neu,dist_t7_neg,dist_t8_pos,dist_t8_neu,dist_t8_neg,dist_t9_pos,dist_t9_neu,dist_t9_neg,dist_t10_pos,dist_t10_neu,dist_t10_neg
4,【三星赔了苹果30卡车硬币】今天上午，30辆装满5美分硬币的卡车停在了加利福尼亚州苹果公司的总部。最初，苹果公司的安保部门以为是这些卡车转移错了地方，但是在数分钟之后，蒂姆·库克收到一个来自三星CEO的电话，电话中解释道这就是他们将要支付给美国苹果公司的10亿美元的罚款。,1684546592,真的假的啊？,对现实持有一定的不满和讽刺态度，但缺乏明确的立场和目标情绪宣泄，悲观抱怨，反讽嘲弄，关注民生，自我中心该用户在社交媒体上表现出较高的活跃度，经常转发和评论各种内容，表达对现实的不满和对个人情绪的关注。其言论中带有明显的讽刺和反讽，对传统价值观持有怀疑态度，同时关注民生问题。在语言风格上，该用户倾向于使用情绪化的表达，并表现出一定的自我中心倾向。,根据上述分析和总结，可以得出如下结论：1. 多数网友都表示反对或不赞同此事，其中以愤怒为主导情绪。2. 主要观点包括：三星公司违反合同条款；三星公司行为不可接受；三星公司缺乏诚信等。3. 在情感上，大多数网友感到愤慨和不满，但也有部分网友表达了怀疑的态度。4. 对于这个话题的真实性和可信度，多数网友并不确定，但也有人坚信这是真的。5. 这些网友更多地通过转发来表达自己的看法，而不是直接发言。6. 总体来说，这些网友的主要目的是传递他们的想法和感受，而非获取更多信息或者寻求解答问题的答案。,0.25,0.234375,0.515625,0.1875,0.4375,0.375,0.375,0.25,0.375,0.1875,0.3125,0.5,0.3125,0.25,0.4375,0.25,0.0625,0.6875,0.0,0.0,1.0,0.0,0.0,1.0,0.0,0.0,1.0,0.0,0.0,1.0,0.0,0.0,1.0,0.0,0.0,1.0
4,【三星赔了苹果30卡车硬币】今天上午，30辆装满5美分硬币的卡车停在了加利福尼亚州苹果公司的总部。最初，苹果公司的安保部门以为是这些卡车转移错了地方，但是在数分钟之后，蒂姆·库克收到一个来自三星CEO的电话，电话中解释道这就是他们将要支付给美国苹果公司的10亿美元的罚款。,1445597851,三星和苹果两高手过招！,情绪宣泄，关注民生，精英视角该用户表现出温和的建制派倾向，关注家庭和社会的和谐。在转发内容中，表现出对明星家庭关系的关注，显示出对家庭温暖和亲情的向往。语言风格偏向情绪宣泄，关注民生问题，同时带有一定的精英视角。在社交活动中，该用户更倾向于作为普通参与者，对事件持温和态度，期待和谐的社会环境。,根据上述分析和总结，可以得出如下结论：1. 多数网友都表示反对或不赞同此事，其中以愤怒为主导情绪。2. 主要观点包括：三星公司违反合同条款；三星公司行为不可接受；三星公司缺乏诚信等。3. 在情感上，大多数网友感到愤慨和不满，但也有部分网友表达了怀疑的态度。4. 对于这个话题的真实性和可信度，多数网友并不确定，但也有人坚信这是真的。5. 这些网友更多地通过转发来表达自己的看法，而不是直接发言。6. 总体来说，这些网友的主要目的是传递他们的想法和感受，而非获取更多信息或者寻求解答问题的答案。,0.25,0.234375,0.515625,0.1875,0.4375,0.375,0.375,0.25,0.375,0.1875,0.3125,0.5,0.3125,0.25,0.4375,0.25,0.0625,0.6875,0.0,0.0,1.0,0.0,0.0,1.0,0.0,0.0,1.0,0.0,0.0,1.0,0.0,0.0,1.0,0.0,0.0,1.0
5,【三星赔了苹果30卡车硬币】今天上午，30辆装满5美分硬币的卡车停在了加利福尼亚州苹果公司的总部。最初，苹果公司的安保部门以为是这些卡车转移错了地方，但是在数分钟之后，蒂姆·库克收到一个来自三星CEO的电话，电话中解释道这就是他们将要支付给美国苹果公司的10亿美元的罚款。,2789847187,[偷笑],转发内容多样，涉及娱乐、科技、体育等，但多带有调侃和娱乐性质，缺乏明显的政治立场。情绪宣泄，反讽嘲弄，关注民生，自我中心该用户在社交媒体上以娱乐和轻松的态度转发各类内容，多涉及娱乐、科技、体育等领域。其转发内容往往带有调侃和娱乐性质，缺乏明显的政治立场。用户在社交互动中表现出一定的群体压力敏感性，倾向于跟随大众观点。在语言风格上，用户善于使用反讽和调侃，同时也关注民生话题，但整体上以自我为中心。,根据以上的数据分析结果，我们可以看出，在这次事件中，绝大多数的网友都是持反对态度的，认为三星的行为不可接受并且涉嫌违约。同时，也有一些人提出了不同的观点，比如有些人觉得这可能是三星为了宣传而故意制造出来的噱头等等。总的来说，这场风波引起了大家的关注和热议，同时也让人们更加关注到商业道德和社会责任的重要性。基于以上数据，请问哪些方面的评论比较受欢迎呢？从上面的数据来看，大多数人对于这件事情的看法是比较负面的，因此正面的情绪较少出现。但是我们也可以看到一些人在谈论这件事的时候会表现出一定的兴趣和好奇心，所以这种类型的评论也是值得关注的。,0.2375,0.275,0.4875,0.375,0.25,0.375,0.1875,0.3125,0.5,0.3125,0.25,0.4375,0.25,0.0625,0.6875,0.0,0.0,1.0,0.0,0.0,1.0,0.0,0.0,1.0,0.0,0.0,1.0,0.0,0.0,1.0,0.0,0.0,1.0,0.0,0.0,1.0
5,【三星赔了苹果30卡车硬币】今天上午，30辆装满5美分硬币的卡车停在了加利福尼亚州苹果公司的总部。最初，苹果公司的安保部门以为是这些卡车转移错了地方，但是在数分钟之后，蒂姆·库克收到一个来自三星CEO的电话，电话中解释道这就是他们将要支付给美国苹果公司的10亿美元的罚款。,1735972795,转发微博,转发官方内容较多，但有时会表达个人情感或观点情绪宣泄，宏大叙事，关注民生，自我中心，阴阳怪气该用户在社交媒体上表现出一定的活跃度，倾向于转发官方和正面内容，同时在个人原创内容中表达情感和观点。他对民生问题关注较多，但同时也表现出一定的自我中心倾向。在语言风格上，他善于使用情绪化的表达，并喜欢宏大叙事。总体而言，他是一个温和的建制派，对体制持支持态度，但同时也保持一定的独立思考和个人情感表达。,根据以上的数据分析结果，我们可以看出，在这次事件中，绝大多数的网友都是持反对态度的，认为三星的行为不可接受并且涉嫌违约。同时，也有一些人提出了不同的观点，比如有些人觉得这可能是三星为了宣传而故意制造出来的噱头等等。总的来说，这场风波引起了大家的关注和热议，同时也让人们更加关注到商业道德和社会责任的重要性。基于以上数据，请问哪些方面的评论比较受欢迎呢？从上面的数据来看，大多数人对于这件事情的看法是比较负面的，因此正面的情绪较少出现。但是我们也可以看到一些人在谈论这件事的时候会表现出一定的兴趣和好奇心，所以这种类型的评论也是值得关注的。,0.2375,0.275,0.4875,0.375,0.25,0.375,0.1875,0.3125,0.5,0.3125,0.25,0.4375,0.25,0.0625,0.6875,0.0,0.0,1.0,0.0,0.0,1.0,0.0,0.0,1.0,0.0,0.0,1.0,0.0,0.0,1.0,0.0,0.0,1.0,0.0,0.0,1.0
5,【三星赔了苹果30卡车硬币】今天上午，30辆装满5美分硬币的卡车停在了加利福尼亚州苹果公司的总部。最初，苹果公司的安保部门以为是这些卡车转移错了地方，但是在数分钟之后，蒂姆·库克收到一个来自三星CEO的电话，电话中解释道这就是他们将要支付给美国苹果公司的10亿美元的罚款。,1173504491,三星CEO太有才了[偷笑][偷笑][偷笑][偷笑][偷笑][挖鼻屎]@科美通信,对房产市场持关注态度，倾向于官方叙事关注民生，精英视角，数据考据，宏大叙事，逻辑缜密该用户对无锡房产市场动态高度关注，倾向于官方叙事，注重数据与事实。在表达上，他展现出对民生的关注和精英视角，逻辑缜密，善于分析。在面对不同事件时，他预期会以理性客观的态度进行评论，并强调数据与事实的重要性。其语言风格特征表现为宏大叙事和逻辑性强的特点。,根据以上的数据分析结果，我们可以看出，在这次事件中，绝大多数的网友都是持反对态度的，认为三星的行为不可接受并且涉嫌违约。同时，也有一些人提出了不同的观点，比如有些人觉得这可能是三星为了宣传而故意制造出来的噱头等等。总的来说，这场风波引起了大家的关注和热议，同时也让人们更加关注到商业道德和社会责任的重要性。基于以上数据，请问哪些方面的评论比较受欢迎呢？从上面的数据来看，大多数人对于这件事情的看法是比较负面的，因此正面的情绪较少出现。但是我们也可以看到一些人在谈论这件事的时候会表现出一定的兴趣和好奇心，所以这种类型的评论也是值得关注的。,0.2375,0.275,0.4875,0.375,0.25,0.375,0.1875,0.3125,0.5,0.3125,0.25,0.4375,0.25,0.0625,0.6875,0.0,0.0,1.0,0.0,0.0,1.0,0.0,0.0,1.0,0.0,0.0,1.0,0.0,0.0,1.0,0.0,0.0,1.0,0.0,0.0,1.0
5,【三星赔了苹果30卡车硬币】今天上午，30辆装满5美分硬币的卡车停在了加利福尼亚州苹果公司的总部。最初，苹果公司的安保部门以为是这些卡车转移错了地方，但是在数分钟之后，蒂姆·库克收到一个来自三星CEO的电话，电话中解释道这就是他们将要支付给美国苹果公司的10亿美元的罚款。,1818597123,转发微博。,关注科技和娱乐内容，转发官方和正面内容，对公益项目有积极参与情绪宣泄，关注民生，精英视角，底层共情，自我中心该用户关注科技和娱乐动态，对官方和正面内容有较高的认同感，同时积极参与公益项目，表现出对社会责任的关注。在表达上，既有情绪宣泄的一面，也有对民生问题的关注，同时展现出精英视角和底层共情。语言风格以自我中心为主，喜欢分享个人体验和观点。,根据以上的数据分析结果，我们可以看出，在这次事件中，绝大多数的网友都是持反对态度的，认为三星的行为不可接受并且涉嫌违约。同时，也有一些人提出了不同的观点，比如有些人觉得这可能是三星为了宣传而故意制造出来的噱头等等。总的来说，这场风波引起了大家的关注和热议，同时也让人们更加关注到商业道德和社会责任的重要性。基于以上数据，请问哪些方面的评论比较受欢迎呢？从上面的数据来看，大多数人对于这件事情的看法是比较负面的，因此正面的情绪较少出现。但是我们也可以看到一些人在谈论这件事的时候会表现出一定的兴趣和好奇心，所以这种类型的评论也是值得关注的。,0.2375,0.275,0.4875,0.375,0.25,0.375,0.1875,0.3125,0.5,0.3125,0.25,0.4375,0.25,0.0625,0.6875,0.0,0.0,1.0,0.0,0.0,1.0,0.0,0.0,1.0,0.0,0.0,1.0,0.0,0.0,1.0,0.0,0.0,1.0,0.0,0.0,1.0
5,【三星赔了苹果30卡车硬币】今天上午，30辆装满5美分硬币的卡车停在了加利福尼亚州苹果公司的总部。最初，苹果公司的安保部门以为是这些卡车转移错了地方，但是在数分钟之后，蒂姆·库克收到一个来自三星CEO的电话，电话中解释道这就是他们将要支付给美国苹果公司的10亿美元的罚款。,1353476873,转发微博,对新技术和产品持积极态度，但对某些社会议题表现出批判性思考情绪宣泄，关注民生，精英视角，自我中心，逻辑缜密该用户对新技术和产品表现出浓厚的兴趣，乐于分享和体验。在表达个人观点时，既关注民生问题，又保持一定的精英视角。对社会议题持有批判性思考，但总体上倾向于温和建制派立场。在语言风格上，逻辑性强，但有时会表现出情绪化的倾向。作为高频活跃者，该用户在社交媒体上积极参与讨论，并具有一定的影响力。,根据以上的数据分析结果，我们可以看出，在这次事件中，绝大多数的网友都是持反对态度的，认为三星的行为不可接受并且涉嫌违约。同时，也有一些人提出了不同的观点，比如有些人觉得这可能是三星为了宣传而故意制造出来的噱头等等。总的来说，这场风波引起了大家的关注和热议，同时也让人们更加关注到商业道德和社会责任的重要性。基于以上数据，请问哪些方面的评论比较受欢迎呢？从上面的数据来看，大多数人对于这件事情的看法是比较负面的，因此正面的情绪较少出现。但是我们也可以看到一些人在谈论这件事的时候会表现出一定的兴趣和好奇心，所以这种类型的评论也是值得关注的。,0.2375,0.275,0.4875,0.375,0.25,0.375,0.1875,0.3125,0.5,0.3125,0.25,0.4375,0.25,0.0625,0.6875,0.0,0.0,1.0,0.0,0.0,1.0,0.0,0.0,1.0,0.0,0.0,1.0,0.0,0.0,1.0,0.0,0.0,1.0,0.0,0.0,1.0
5,【三星赔了苹果30卡车硬币】今天上午，30辆装满5美分硬币的卡车停在了加利福尼亚州苹果公司的总部。最初，苹果公司的安保部门以为是这些卡车转移错了地方，但是在数分钟之后，蒂姆·库克收到一个来自三星CEO的电话，电话中解释道这就是他们将要支付给美国苹果公司的10亿美元的罚款。,2759981555,转发微博,转发内容多样，包括官方内容、正能量内容、生活感悟等，显示对体制的认同，但对一些社会现象持幽默态度情绪宣泄，关注民生，精英视角，幽默风趣，自我中心该用户关注社会现象，转发内容多样，包括官方内容、正能量内容、生活感悟等，显示对体制的认同。在表达上，喜欢用幽默的方式看待问题，同时关注民生，具有一定的精英视角。在语言风格上，幽默风趣，但有时也表现出自我中心的特点。,根据以上的数据分析结果，我们可以看出，在这次事件中，绝大多数的网友都是持反对态度的，认为三星的行为不可接受并且涉嫌违约。同时，也有一些人提出了不同的观点，比如有些人觉得这可能是三星为了宣传而故意制造出来的噱头等等。总的来说，这场风波引起了大家的关注和热议，同时也让人们更加关注到商业道德和社会责任的重要性。基于以上数据，请问哪些方面的评论比较受欢迎呢？从上面的数据来看，大多数人对于这件事情的看法是比较负面的，因此正面的情绪较少出现。但是我们也可以看到一些人在谈论这件事的时候会表现出一定的兴趣和好奇心，所以这种类型的评论也是值得关注的。,0.2375,0.275,0.4875,0.375,0.25,0.375,0.1875,0.3125,0.5,0.3125,0.25,0.4375,0.25,0.0625,0.6875,0.0,0.0,1.0,0.0,0.0,1.0,0.0,0.0,1.0,0.0,0.0,1.0,0.0,0.0,1.0,0.0,0.0,1.0,0.0,0.0,1.0
5,【三星赔了苹果30卡车硬币】今天上午，30辆装满5美分硬币的卡车停在了加利福尼亚州苹果公司的总部。最初，苹果公司的安保部门以为是这些卡车转移错了地方，但是在数分钟之后，蒂姆·库克收到一个来自三星CEO的电话，电话中解释道这就是他们将要支付给美国苹果公司的10亿美元的罚款。,2440471855,。。。。。'',对新技术和产品持积极态度，但对某些社会议题表现出批判性思考情绪宣泄，关注民生，精英视角，自我中心，逻辑缜密该用户对新技术和产品表现出浓厚的兴趣，乐于分享和体验。在表达个人观点时，既关注民生问题，又保持一定的精英视角。对社会议题持有批判性思考，但总体上倾向于温和建制派立场。在语言风格上，逻辑性强，但有时会表现出情绪化的倾向。作为高频活跃者，该用户在社交媒体上积极参与讨论，并具有一定的影响力。,根据以上的数据分析结果，我们可以看出，在这次事件中，绝大多数的网友都是持反对态度的，认为三星的行为不可接受并且涉嫌违约。同时，也有一些人提出了不同的观点，比如有些人觉得这可能是三星为了宣传而故意制造出来的噱头等等。总的来说，这场风波引起了大家的关注和热议，同时也让人们更加关注到商业道德和社会责任的重要性。基于以上数据，请问哪些方面的评论比较受欢迎呢？从上面的数据来看，大多数人对于这件事情的看法是比较负面的，因此正面的情绪较少出现。但是我们也可以看到一些人在谈论这件事的时候会表现出一定的兴趣和好奇心，所以这种类型的评论也是值得关注的。,0.2375,0.275,0.4875,0.375,0.25,0.375,0.1875,0.3125,0.5,0.3125,0.25,0.4375,0.25,0.0625,0.6875,0.0,0.0,1.0,0.0,0.0,1.0,0.0,0.0,1.0,0.0,0.0,1.0,0.0,0.0,1.0,0.0,0.0,1.0,0.0,0.0,1.0
5,【三星赔了苹果30卡车硬币】今天上午，30辆装满5美分硬币的卡车停在了加利福尼亚州苹果公司的总部。最初，苹果公司的安保部门以为是这些卡车转移错了地方，但是在数分钟之后，蒂姆·库克收到一个来自三星CEO的电话，电话中解释道这就是他们将要支付给美国苹果公司的10亿美元的罚款。,1507607541,三星，你是要逆天吗？苹果不会放过你的[抓狂],用户表现出对现状的不满和对传统观念的质疑，但缺乏明确的立场和主张情绪宣泄，阴阳怪气，关注民生，自我中心该用户对现状持有一定的批评态度，但缺乏明确的立场和主张。他关注个人兴趣和娱乐，喜欢分享生活中的点滴，同时也对一些社会现象表示不满。在表达上，他倾向于情绪宣泄和阴阳怪气，但同时也关注民生问题。他的语言风格以自我为中心，表现出对现状的不满和对传统观念的质疑。,根据以上的数据分析结果，我们可以看出，在这次事件中，绝大多数的网友都是持反对态度的，认为三星的行为不可接受并且涉嫌违约。同时，也有一些人提出了不同的观点，比如有些人觉得这可能是三星为了宣传而故意制造出来的噱头等等。总的来说，这场风波引起了大家的关注和热议，同时也让人们更加关注到商业道德和社会责任的重要性。基于以上数据，请问哪些方面的评论比较受欢迎呢？从上面的数据来看，大多数人对于这件事情的看法是比较负面的，因此正面的情绪较少出现。但是我们也可以看到一些人在谈论这件事的时候会表现出一定的兴趣和好奇心，所以这种类型的评论也是值得关注的。,0.2375,0.275,0.4875,0.375,0.25,0.375,0.1875,0.3125,0.5,0.3125,0.25,0.4375,0.25,0.0625,0.6875,0.0,0.0,1.0,0.0,0.0,1.0,0.0,0.0,1.0,0.0,0.0,1.0,0.0,0.0,1.0,0.0,0.0,1.0,0.0,0.0,1.0
5,【三星赔了苹果30卡车硬币】今天上午，30辆装满5美分硬币的卡车停在了加利福尼亚州苹果公司的总部。最初，苹果公司的安保部门以为是这些卡车转移错了地方，但是在数分钟之后，蒂姆·库克收到一个来自三星CEO的电话，电话中解释道这就是他们将要支付给美国苹果公司的10亿美元的罚款。,1744062475,牛逼！！！,倾向于积极向上的生活态度，但对社会现象持有一定的批判性思考情绪宣泄，宏大叙事，关注民生，精英视角，自我中心该用户表现出积极向上的生活态度，关注个人成长与社会进步。在表达上，倾向于情绪化的宣泄，同时具有宏大叙事的视角。对社会现象持有一定的批判性思考，但总体上保持乐观和积极的心态。在社交活动中，活跃且具有影响力，能够引导话题走向。,根据以上的数据分析结果，我们可以看出，在这次事件中，绝大多数的网友都是持反对态度的，认为三星的行为不可接受并且涉嫌违约。同时，也有一些人提出了不同的观点，比如有些人觉得这可能是三星为了宣传而故意制造出来的噱头等等。总的来说，这场风波引起了大家的关注和热议，同时也让人们更加关注到商业道德和社会责任的重要性。基于以上数据，请问哪些方面的评论比较受欢迎呢？从上面的数据来看，大多数人对于这件事情的看法是比较负面的，因此正面的情绪较少出现。但是我们也可以看到一些人在谈论这件事的时候会表现出一定的兴趣和好奇心，所以这种类型的评论也是值得关注的。,0.2375,0.275,0.4875,0.375,0.25,0.375,0.1875,0.3125,0.5,0.3125,0.25,0.4375,0.25,0.0625,0.6875,0.0,0.0,1.0,0.0,0.0,1.0,0.0,0.0,1.0,0.0,0.0,1.0,0.0,0.0,1.0,0.0,0.0,1.0,0.0,0.0,1.0
5,【三星赔了苹果30卡车硬币】今天上午，30辆装满5美分硬币的卡车停在了加利福尼亚州苹果公司的总部。最初，苹果公司的安保部门以为是这些卡车转移错了地方，但是在数分钟之后，蒂姆·库克收到一个来自三星CEO的电话，电话中解释道这就是他们将要支付给美国苹果公司的10亿美元的罚款。,1357112263,[哈哈],对某些官方或正面内容表示认同，但更倾向于分享个人情感和生活体验情绪宣泄，宏大叙事，关注民生，自我中心，阴阳怪气该用户表现出温和的建制派倾向，关注个人情感和生活体验的分享。在表达上，倾向于情绪宣泄和宏大叙事，同时关注民生问题。用户在转发内容时，更倾向于情感煽动，表现出对情感共鸣的追求。在政治倾向上，用户既关注个人情感，又认同社会秩序和稳定。,根据以上的数据分析结果，我们可以看出，在这次事件中，绝大多数的网友都是持反对态度的，认为三星的行为不可接受并且涉嫌违约。同时，也有一些人提出了不同的观点，比如有些人觉得这可能是三星为了宣传而故意制造出来的噱头等等。总的来说，这场风波引起了大家的关注和热议，同时也让人们更加关注到商业道德和社会责任的重要性。基于以上数据，请问哪些方面的评论比较受欢迎呢？从上面的数据来看，大多数人对于这件事情的看法是比较负面的，因此正面的情绪较少出现。但是我们也可以看到一些人在谈论这件事的时候会表现出一定的兴趣和好奇心，所以这种类型的评论也是值得关注的。,0.2375,0.275,0.4875,0.375,0.25,0.375,0.1875,0.3125,0.5,0.3125,0.25,0.4375,0.25,0.0625,0.6875,0.0,0.0,1.0,0.0,0.0,1.0,0.0,0.0,1.0,0.0,0.0,1.0,0.0,0.0,1.0,0.0,0.0,1.0,0.0,0.0,1.0
5,【三星赔了苹果30卡车硬币】今天上午，30辆装满5美分硬币的卡车停在了加利福尼亚州苹果公司的总部。最初，苹果公司的安保部门以为是这些卡车转移错了地方，但是在数分钟之后，蒂姆·库克收到一个来自三星CEO的电话，电话中解释道这就是他们将要支付给美国苹果公司的10亿美元的罚款。,2556434275,真的么?收不收点钞费[挖鼻屎],对张敬轩等个人偶像有强烈支持，同时关注社会议题，表现出一定的民族主义倾向情绪宣泄，关注民生，自我中心，宏大叙事，攻击性强该用户对个人偶像张敬轩表现出强烈的情感支持，同时在微博上积极参与各种话题讨论，表现出对民生和社会议题的关注。其语言风格以情绪宣泄和关注民生为主，同时带有一定的攻击性。在政治倾向上，该用户表现出对民族主义的认同，但同时也表现出对个人情感的重视。,根据以上的数据分析结果，我们可以看出，在这次事件中，绝大多数的网友都是持反对态度的，认为三星的行为不可接受并且涉嫌违约。同时，也有一些人提出了不同的观点，比如有些人觉得这可能是三星为了宣传而故意制造出来的噱头等等。总的来说，这场风波引起了大家的关注和热议，同时也让人们更加关注到商业道德和社会责任的重要性。基于以上数据，请问哪些方面的评论比较受欢迎呢？从上面的数据来看，大多数人对于这件事情的看法是比较负面的，因此正面的情绪较少出现。但是我们也可以看到一些人在谈论这件事的时候会表现出一定的兴趣和好奇心，所以这种类型的评论也是值得关注的。,0.2375,0.275,0.4875,0.375,0.25,0.375,0.1875,0.3125,0.5,0.3125,0.25,0.4375,0.25,0.0625,0.6875,0.0,0.0,1.0,0.0,0.0,1.0,0.0,0.0,1.0,0.0,0.0,1.0,0.0,0.0,1.0,0.0,0.0,1.0,0.0,0.0,1.0
