time_step,topic,uid,real_comments,profile_text,batch_mf,pre_pos,pre_neu,pre_neg,dist_t0_pos,dist_t0_neu,dist_t0_neg,dist_t1_pos,dist_t1_neu,dist_t1_neg,dist_t2_pos,dist_t2_neu,dist_t2_neg,dist_t3_pos,dist_t3_neu,dist_t3_neg,dist_t4_pos,dist_t4_neu,dist_t4_neg,dist_t5_pos,dist_t5_neu,dist_t5_neg,dist_t6_pos,dist_t6_neu,dist_t6_neg,dist_t7_pos,dist_t7_neu,dist_t7_neg,dist_t8_pos,dist_t8_neu,dist_t8_neg,dist_t9_pos,dist_t9_neu,dist_t9_neg,dist_t10_pos,dist_t10_neu,dist_t10_neg
7,【三星赔了苹果30卡车硬币】今天上午，30辆装满5美分硬币的卡车停在了加利福尼亚州苹果公司的总部。最初，苹果公司的安保部门以为是这些卡车转移错了地方，但是在数分钟之后，蒂姆·库克收到一个来自三星CEO的电话，电话中解释道这就是他们将要支付给美国苹果公司的10亿美元的罚款。,1310739122,转发微博,转发官方内容较多，但有时会表达个人情感或观点情绪宣泄，宏大叙事，关注民生，自我中心，阴阳怪气该用户在社交媒体上表现出一定的活跃度，倾向于转发官方和正面内容，同时在个人原创内容中表达情感和观点。他对民生问题关注较多，但同时也表现出一定的自我中心倾向。在语言风格上，他善于使用情绪化的表达，并喜欢宏大叙事。总体而言，他是一个温和的建制派，对体制持支持态度，但同时也保持一定的独立思考和个人情感表达。,根据以上的数据统计结果可以看出，在此次事件中，绝大多数网友都是持反对态度的，而其中也存在一些支持者。同时，大家对于此事的看法也是多种多样，既有批评指责的声音，也有赞扬认可的态度。此外，从发言者的角度来看，大多数人会选择转发这条消息来分享他们的想法与感受，而对于那些想要获取更多信息的人来说，则会通过评论的方式来获得更多的资讯。综上所述，我们可以看出这次事件引起了广泛的关注和热议，同时也引发了人们对于商业道德和社会责任等问题的思考。,0.25,0.2767857142857143,0.4732142857142857,0.3125,0.25,0.4375,0.25,0.0625,0.6875,0.0,0.0,1.0,0.0,0.0,1.0,0.0,0.0,1.0,0.0,0.0,1.0,0.0,0.0,1.0,0.0,0.0,1.0,0.0,0.0,1.0,0.0,0.0,1.0,0.0,0.0,1.0
7,【三星赔了苹果30卡车硬币】今天上午，30辆装满5美分硬币的卡车停在了加利福尼亚州苹果公司的总部。最初，苹果公司的安保部门以为是这些卡车转移错了地方，但是在数分钟之后，蒂姆·库克收到一个来自三星CEO的电话，电话中解释道这就是他们将要支付给美国苹果公司的10亿美元的罚款。,2919252284,//@Cheng-junwei: 玩大了！棒子的最后必杀技,转发官方和正面内容较多，但未表现出明显的反讽或潜台词，倾向于温和建制派情绪宣泄，关注民生，精英视角，自我中心该用户表现出对生活的热爱和对娱乐的追求，转发内容以官方和正面信息为主，同时关注民生话题，体现出一定的精英视角。在表达上，情绪宣泄和自我中心的特点较为明显。对于不同类型的事件，该用户可能会表现出对个人兴趣的关注，同时也会对社会热点事件有所关注，并倾向于从个人角度出发进行评论。语言风格上，既有情绪化的表达，也有对生活细节的关注，体现出多元化的表达方式。,根据以上的数据统计结果可以看出，在此次事件中，绝大多数网友都是持反对态度的，而其中也存在一些支持者。同时，大家对于此事的看法也是多种多样，既有批评指责的声音，也有赞扬认可的态度。此外，从发言者的角度来看，大多数人会选择转发这条消息来分享他们的想法与感受，而对于那些想要获取更多信息的人来说，则会通过评论的方式来获得更多的资讯。综上所述，我们可以看出这次事件引起了广泛的关注和热议，同时也引发了人们对于商业道德和社会责任等问题的思考。,0.25,0.2767857142857143,0.4732142857142857,0.3125,0.25,0.4375,0.25,0.0625,0.6875,0.0,0.0,1.0,0.0,0.0,1.0,0.0,0.0,1.0,0.0,0.0,1.0,0.0,0.0,1.0,0.0,0.0,1.0,0.0,0.0,1.0,0.0,0.0,1.0,0.0,0.0,1.0
7,【三星赔了苹果30卡车硬币】今天上午，30辆装满5美分硬币的卡车停在了加利福尼亚州苹果公司的总部。最初，苹果公司的安保部门以为是这些卡车转移错了地方，但是在数分钟之后，蒂姆·库克收到一个来自三星CEO的电话，电话中解释道这就是他们将要支付给美国苹果公司的10亿美元的罚款。,2129297731,这也太玩人了吧，数钱那个惨了,转发活动微博并参与讨论，但原创内容偏向生活分享，未表现出明显的反建制或批判态度情绪宣泄，关注民生，精英视角，底层共情该用户关注社会现象，但表达观点较为温和，倾向于参与群体活动。在日常生活中，关注生活品质，对民生问题有所关注，但不会过于激进。语言风格偏向于关注民生和底层共情，同时展现出一定的精英视角。,根据以上的数据统计结果可以看出，在此次事件中，绝大多数网友都是持反对态度的，而其中也存在一些支持者。同时，大家对于此事的看法也是多种多样，既有批评指责的声音，也有赞扬认可的态度。此外，从发言者的角度来看，大多数人会选择转发这条消息来分享他们的想法与感受，而对于那些想要获取更多信息的人来说，则会通过评论的方式来获得更多的资讯。综上所述，我们可以看出这次事件引起了广泛的关注和热议，同时也引发了人们对于商业道德和社会责任等问题的思考。,0.25,0.2767857142857143,0.4732142857142857,0.3125,0.25,0.4375,0.25,0.0625,0.6875,0.0,0.0,1.0,0.0,0.0,1.0,0.0,0.0,1.0,0.0,0.0,1.0,0.0,0.0,1.0,0.0,0.0,1.0,0.0,0.0,1.0,0.0,0.0,1.0,0.0,0.0,1.0
7,【三星赔了苹果30卡车硬币】今天上午，30辆装满5美分硬币的卡车停在了加利福尼亚州苹果公司的总部。最初，苹果公司的安保部门以为是这些卡车转移错了地方，但是在数分钟之后，蒂姆·库克收到一个来自三星CEO的电话，电话中解释道这就是他们将要支付给美国苹果公司的10亿美元的罚款。,2230616582,大萍果莫名成5美分,对房产市场持关注态度，倾向于官方叙事关注民生，精英视角，数据考据，宏大叙事，逻辑缜密该用户对无锡房产市场动态高度关注，倾向于官方叙事，注重数据与事实。在表达上，他展现出对民生的关注和精英视角，逻辑缜密，善于分析。在面对不同事件时，他预期会以理性客观的态度进行评论，并强调数据与事实的重要性。其语言风格特征表现为宏大叙事和逻辑性强的特点。,根据以上的数据统计结果可以看出，在此次事件中，绝大多数网友都是持反对态度的，而其中也存在一些支持者。同时，大家对于此事的看法也是多种多样，既有批评指责的声音，也有赞扬认可的态度。此外，从发言者的角度来看，大多数人会选择转发这条消息来分享他们的想法与感受，而对于那些想要获取更多信息的人来说，则会通过评论的方式来获得更多的资讯。综上所述，我们可以看出这次事件引起了广泛的关注和热议，同时也引发了人们对于商业道德和社会责任等问题的思考。,0.25,0.2767857142857143,0.4732142857142857,0.3125,0.25,0.4375,0.25,0.0625,0.6875,0.0,0.0,1.0,0.0,0.0,1.0,0.0,0.0,1.0,0.0,0.0,1.0,0.0,0.0,1.0,0.0,0.0,1.0,0.0,0.0,1.0,0.0,0.0,1.0,0.0,0.0,1.0
7,【三星赔了苹果30卡车硬币】今天上午，30辆装满5美分硬币的卡车停在了加利福尼亚州苹果公司的总部。最初，苹果公司的安保部门以为是这些卡车转移错了地方，但是在数分钟之后，蒂姆·库克收到一个来自三星CEO的电话，电话中解释道这就是他们将要支付给美国苹果公司的10亿美元的罚款。,1730286134,。。。三星真小心眼。,虽是体制拥护派但对某些现象持批评态度情绪宣泄，反讽嘲弄，关注民生，自我中心该用户对体制持一定认同，但同时也关注社会现象，表达上带有情绪宣泄和反讽的成分，关注民生问题，同时表现出一定的自我中心。在处理不同类型事件时，可能会表现出对体制的批评，但在群体中更倾向于保持中立，不会过于激进。语言风格上，喜欢使用反讽和幽默，但同时也关注实际生活，对个人利益有较高的追求。,根据以上的数据统计结果可以看出，在此次事件中，绝大多数网友都是持反对态度的，而其中也存在一些支持者。同时，大家对于此事的看法也是多种多样，既有批评指责的声音，也有赞扬认可的态度。此外，从发言者的角度来看，大多数人会选择转发这条消息来分享他们的想法与感受，而对于那些想要获取更多信息的人来说，则会通过评论的方式来获得更多的资讯。综上所述，我们可以看出这次事件引起了广泛的关注和热议，同时也引发了人们对于商业道德和社会责任等问题的思考。,0.25,0.2767857142857143,0.4732142857142857,0.3125,0.25,0.4375,0.25,0.0625,0.6875,0.0,0.0,1.0,0.0,0.0,1.0,0.0,0.0,1.0,0.0,0.0,1.0,0.0,0.0,1.0,0.0,0.0,1.0,0.0,0.0,1.0,0.0,0.0,1.0,0.0,0.0,1.0
7,【三星赔了苹果30卡车硬币】今天上午，30辆装满5美分硬币的卡车停在了加利福尼亚州苹果公司的总部。最初，苹果公司的安保部门以为是这些卡车转移错了地方，但是在数分钟之后，蒂姆·库克收到一个来自三星CEO的电话，电话中解释道这就是他们将要支付给美国苹果公司的10亿美元的罚款。,1784308823,[good]@Tommy流浪记 @aReThA_cHeNg @PeiShan珮姗 @aicogirlwithu @Lili-Wtnb,对科技产品持积极态度，对官方政策有一定认同，但对某些政策执行有担忧情绪宣泄，乐观积极，关注民生，精英视角，自我中心该用户对科技产品充满兴趣，乐于分享个人体验，对官方政策持一定认同，但同时也关注社会问题，表达个人观点。在社交平台上，他积极参与讨论，乐于分享生活点滴，同时展现出对热点事件的关注。他的语言风格积极乐观，但有时也流露出对某些社会现象的担忧。,根据以上的数据统计结果可以看出，在此次事件中，绝大多数网友都是持反对态度的，而其中也存在一些支持者。同时，大家对于此事的看法也是多种多样，既有批评指责的声音，也有赞扬认可的态度。此外，从发言者的角度来看，大多数人会选择转发这条消息来分享他们的想法与感受，而对于那些想要获取更多信息的人来说，则会通过评论的方式来获得更多的资讯。综上所述，我们可以看出这次事件引起了广泛的关注和热议，同时也引发了人们对于商业道德和社会责任等问题的思考。,0.25,0.2767857142857143,0.4732142857142857,0.3125,0.25,0.4375,0.25,0.0625,0.6875,0.0,0.0,1.0,0.0,0.0,1.0,0.0,0.0,1.0,0.0,0.0,1.0,0.0,0.0,1.0,0.0,0.0,1.0,0.0,0.0,1.0,0.0,0.0,1.0,0.0,0.0,1.0
7,【三星赔了苹果30卡车硬币】今天上午，30辆装满5美分硬币的卡车停在了加利福尼亚州苹果公司的总部。最初，苹果公司的安保部门以为是这些卡车转移错了地方，但是在数分钟之后，蒂姆·库克收到一个来自三星CEO的电话，电话中解释道这就是他们将要支付给美国苹果公司的10亿美元的罚款。,2108941540,转发微博,情绪宣泄，盲目乐观，关注民生，精英视角，自我中心该用户对娱乐和明星充满热情，频繁转发和评论与明星相关的微博，表达自己的喜爱和情感。在语言风格上，倾向于情绪化的表达，关注个人喜好，同时展现出一定的精英视角和自我中心的特点。在面对不同类型的事件时，预期会表现出对娱乐和明星的强烈兴趣，以及对个人情感的重视。,根据以上的数据统计结果可以看出，在此次事件中，绝大多数网友都是持反对态度的，而其中也存在一些支持者。同时，大家对于此事的看法也是多种多样，既有批评指责的声音，也有赞扬认可的态度。此外，从发言者的角度来看，大多数人会选择转发这条消息来分享他们的想法与感受，而对于那些想要获取更多信息的人来说，则会通过评论的方式来获得更多的资讯。综上所述，我们可以看出这次事件引起了广泛的关注和热议，同时也引发了人们对于商业道德和社会责任等问题的思考。,0.25,0.2767857142857143,0.4732142857142857,0.3125,0.25,0.4375,0.25,0.0625,0.6875,0.0,0.0,1.0,0.0,0.0,1.0,0.0,0.0,1.0,0.0,0.0,1.0,0.0,0.0,1.0,0.0,0.0,1.0,0.0,0.0,1.0,0.0,0.0,1.0,0.0,0.0,1.0
7,【三星赔了苹果30卡车硬币】今天上午，30辆装满5美分硬币的卡车停在了加利福尼亚州苹果公司的总部。最初，苹果公司的安保部门以为是这些卡车转移错了地方，但是在数分钟之后，蒂姆·库克收到一个来自三星CEO的电话，电话中解释道这就是他们将要支付给美国苹果公司的10亿美元的罚款。,2208230144,哈哈故意整人吧!,用户内容以日常生活和个人情感为主，无明显政治立场倾向情绪宣泄，关注民生，自我中心，宏大叙事，底层共情该用户关注日常生活和个人情感，对政治和社会议题较少关注。在表达上，倾向于情绪宣泄和自我表达，同时也会关注家庭和孩子的成长。在社交网络上，该用户表现为一个普通参与者，偶尔分享个人生活点滴，对周围环境的变化反应较为直接。,根据以上的数据统计结果可以看出，在此次事件中，绝大多数网友都是持反对态度的，而其中也存在一些支持者。同时，大家对于此事的看法也是多种多样，既有批评指责的声音，也有赞扬认可的态度。此外，从发言者的角度来看，大多数人会选择转发这条消息来分享他们的想法与感受，而对于那些想要获取更多信息的人来说，则会通过评论的方式来获得更多的资讯。综上所述，我们可以看出这次事件引起了广泛的关注和热议，同时也引发了人们对于商业道德和社会责任等问题的思考。,0.25,0.2767857142857143,0.4732142857142857,0.3125,0.25,0.4375,0.25,0.0625,0.6875,0.0,0.0,1.0,0.0,0.0,1.0,0.0,0.0,1.0,0.0,0.0,1.0,0.0,0.0,1.0,0.0,0.0,1.0,0.0,0.0,1.0,0.0,0.0,1.0,0.0,0.0,1.0
7,【三星赔了苹果30卡车硬币】今天上午，30辆装满5美分硬币的卡车停在了加利福尼亚州苹果公司的总部。最初，苹果公司的安保部门以为是这些卡车转移错了地方，但是在数分钟之后，蒂姆·库克收到一个来自三星CEO的电话，电话中解释道这就是他们将要支付给美国苹果公司的10亿美元的罚款。,1853122892,[圍觀],用户内容以日常生活和个人情感为主，无明显政治立场倾向情绪宣泄，关注民生，自我中心，宏大叙事，底层共情该用户关注日常生活和个人情感，对政治和社会议题较少关注。在表达上，倾向于情绪宣泄和自我表达，同时也会关注家庭和孩子的成长。在社交网络上，该用户表现为一个普通参与者，偶尔分享个人生活点滴，对周围环境的变化反应较为直接。,根据以上的数据统计结果可以看出，在此次事件中，绝大多数网友都是持反对态度的，而其中也存在一些支持者。同时，大家对于此事的看法也是多种多样，既有批评指责的声音，也有赞扬认可的态度。此外，从发言者的角度来看，大多数人会选择转发这条消息来分享他们的想法与感受，而对于那些想要获取更多信息的人来说，则会通过评论的方式来获得更多的资讯。综上所述，我们可以看出这次事件引起了广泛的关注和热议，同时也引发了人们对于商业道德和社会责任等问题的思考。,0.25,0.2767857142857143,0.4732142857142857,0.3125,0.25,0.4375,0.25,0.0625,0.6875,0.0,0.0,1.0,0.0,0.0,1.0,0.0,0.0,1.0,0.0,0.0,1.0,0.0,0.0,1.0,0.0,0.0,1.0,0.0,0.0,1.0,0.0,0.0,1.0,0.0,0.0,1.0
7,【三星赔了苹果30卡车硬币】今天上午，30辆装满5美分硬币的卡车停在了加利福尼亚州苹果公司的总部。最初，苹果公司的安保部门以为是这些卡车转移错了地方，但是在数分钟之后，蒂姆·库克收到一个来自三星CEO的电话，电话中解释道这就是他们将要支付给美国苹果公司的10亿美元的罚款。,1407678052,//@台客圈奶油:[圍觀]//@aicogirlwithu: 哈哈故意整人吧!//@幾米林:[good]@Tommy流浪记 @aReThA_cHeNg @PeiShan珮姗 @aicogirlwithu @Lili-Wtnb,转发官方内容时表现出一般认同，但偶尔对某些现象表示反对，如对校服的评论显示对现状的不满情绪宣泄，关注民生，精英视角，自我中心，宏大叙事该用户关注社会现象和个人兴趣，对某些现象持有批评态度，但总体上倾向于温和的建制派立场。在表达上，喜欢情绪化的表达，同时也关注民生问题。在社交网络上，表现为普通参与者，偶尔发表个人观点，但整体上较为被动。,根据以上的数据统计结果可以看出，在此次事件中，绝大多数网友都是持反对态度的，而其中也存在一些支持者。同时，大家对于此事的看法也是多种多样，既有批评指责的声音，也有赞扬认可的态度。此外，从发言者的角度来看，大多数人会选择转发这条消息来分享他们的想法与感受，而对于那些想要获取更多信息的人来说，则会通过评论的方式来获得更多的资讯。综上所述，我们可以看出这次事件引起了广泛的关注和热议，同时也引发了人们对于商业道德和社会责任等问题的思考。,0.25,0.2767857142857143,0.4732142857142857,0.3125,0.25,0.4375,0.25,0.0625,0.6875,0.0,0.0,1.0,0.0,0.0,1.0,0.0,0.0,1.0,0.0,0.0,1.0,0.0,0.0,1.0,0.0,0.0,1.0,0.0,0.0,1.0,0.0,0.0,1.0,0.0,0.0,1.0
7,【三星赔了苹果30卡车硬币】今天上午，30辆装满5美分硬币的卡车停在了加利福尼亚州苹果公司的总部。最初，苹果公司的安保部门以为是这些卡车转移错了地方，但是在数分钟之后，蒂姆·库克收到一个来自三星CEO的电话，电话中解释道这就是他们将要支付给美国苹果公司的10亿美元的罚款。,1636314625,[哈哈],关注社会问题，对官方和体制持有一定程度的质疑和批评情绪宣泄，反讽嘲弄，关注民生，自我中心该用户关注社会问题，对官方和体制持有一定程度的质疑和批评。在表达上，他倾向于情绪宣泄和反讽嘲弄，同时关注民生问题，并表现出一定的自我中心倾向。他具有较高的活跃度，积极参与社会议题的讨论，希望通过舆论推动社会变革。,根据以上的数据统计结果可以看出，在此次事件中，绝大多数网友都是持反对态度的，而其中也存在一些支持者。同时，大家对于此事的看法也是多种多样，既有批评指责的声音，也有赞扬认可的态度。此外，从发言者的角度来看，大多数人会选择转发这条消息来分享他们的想法与感受，而对于那些想要获取更多信息的人来说，则会通过评论的方式来获得更多的资讯。综上所述，我们可以看出这次事件引起了广泛的关注和热议，同时也引发了人们对于商业道德和社会责任等问题的思考。,0.25,0.2767857142857143,0.4732142857142857,0.3125,0.25,0.4375,0.25,0.0625,0.6875,0.0,0.0,1.0,0.0,0.0,1.0,0.0,0.0,1.0,0.0,0.0,1.0,0.0,0.0,1.0,0.0,0.0,1.0,0.0,0.0,1.0,0.0,0.0,1.0,0.0,0.0,1.0
8,【三星赔了苹果30卡车硬币】今天上午，30辆装满5美分硬币的卡车停在了加利福尼亚州苹果公司的总部。最初，苹果公司的安保部门以为是这些卡车转移错了地方，但是在数分钟之后，蒂姆·库克收到一个来自三星CEO的电话，电话中解释道这就是他们将要支付给美国苹果公司的10亿美元的罚款。,2316172153,//@老男孩沐沐://@台客圈奶油:[圍觀]//@aicogirlwithu: 哈哈故意整人吧!//@幾米林:[good]@Tommy流浪记 @aReThA_cHeNg @PeiShan珮姗 @aicogirlwithu @Lili-Wtnb,用户内容以日常生活和个人情感为主，偶尔涉及社会话题，但表达较为消极和混沌情绪宣泄，悲观抱怨，关注民生，自我中心该用户关注个人生活和情感，对社会现象持消极态度，容易受到情绪的影响。在表达上，倾向于情绪宣泄和个人感受的分享，对社会事件的态度较为被动。在语言风格上，表现出自我中心的特征，关注点主要在于个人体验。,[''],0.2578125,0.2734375,0.46875,0.25,0.0625,0.6875,0.0,0.0,1.0,0.0,0.0,1.0,0.0,0.0,1.0,0.0,0.0,1.0,0.0,0.0,1.0,0.0,0.0,1.0,0.0,0.0,1.0,0.0,0.0,1.0,0.0,0.0,1.0,0.0,0.0,1.0
8,【三星赔了苹果30卡车硬币】今天上午，30辆装满5美分硬币的卡车停在了加利福尼亚州苹果公司的总部。最初，苹果公司的安保部门以为是这些卡车转移错了地方，但是在数分钟之后，蒂姆·库克收到一个来自三星CEO的电话，电话中解释道这就是他们将要支付给美国苹果公司的10亿美元的罚款。,2586598777,有意思,虽无明确政治立场，但对多种现象表现出反讽和不满。情绪宣泄，反讽嘲弄，关注民生，自我中心该用户表现出较高的活跃度，频繁发布个人生活、娱乐和情感相关的博文。其内容多带有反讽和不满情绪，对现实持有批判态度，但缺乏明确的政治立场。在表达上，喜欢使用情绪化的语言和反讽的修辞手法，关注个人感受和日常生活。,[''],0.2578125,0.2734375,0.46875,0.25,0.0625,0.6875,0.0,0.0,1.0,0.0,0.0,1.0,0.0,0.0,1.0,0.0,0.0,1.0,0.0,0.0,1.0,0.0,0.0,1.0,0.0,0.0,1.0,0.0,0.0,1.0,0.0,0.0,1.0,0.0,0.0,1.0
8,【三星赔了苹果30卡车硬币】今天上午，30辆装满5美分硬币的卡车停在了加利福尼亚州苹果公司的总部。最初，苹果公司的安保部门以为是这些卡车转移错了地方，但是在数分钟之后，蒂姆·库克收到一个来自三星CEO的电话，电话中解释道这就是他们将要支付给美国苹果公司的10亿美元的罚款。,2853959772,[哈哈],转发官方内容较多，但原创内容中表达了对个人情感和生活的关注，显示对个人情感的重视情绪宣泄，宏大叙事，关注民生，精英视角该用户在社交媒体上表现出温和的建制派立场，关注个人情感和社会稳定。在表达上，倾向于情绪宣泄和宏大叙事，同时关注民生和精英视角。在日常生活中，可能是一个注重个人情感体验，同时关注社会动态的普通参与者。,[''],0.2578125,0.2734375,0.46875,0.25,0.0625,0.6875,0.0,0.0,1.0,0.0,0.0,1.0,0.0,0.0,1.0,0.0,0.0,1.0,0.0,0.0,1.0,0.0,0.0,1.0,0.0,0.0,1.0,0.0,0.0,1.0,0.0,0.0,1.0,0.0,0.0,1.0
8,【三星赔了苹果30卡车硬币】今天上午，30辆装满5美分硬币的卡车停在了加利福尼亚州苹果公司的总部。最初，苹果公司的安保部门以为是这些卡车转移错了地方，但是在数分钟之后，蒂姆·库克收到一个来自三星CEO的电话，电话中解释道这就是他们将要支付给美国苹果公司的10亿美元的罚款。,1707736914,迅速占领苹果大楼。,虽是体制拥护派但对某些现象持批评态度情绪宣泄，反讽嘲弄，关注民生，自我中心该用户对体制持一定认同，但同时也关注社会现象，表达上带有情绪宣泄和反讽的成分，关注民生问题，同时表现出一定的自我中心。在处理不同类型事件时，可能会表现出对体制的批评，但在群体中更倾向于保持中立，不会过于激进。语言风格上，喜欢使用反讽和幽默，但同时也关注实际生活，对个人利益有较高的追求。,[''],0.2578125,0.2734375,0.46875,0.25,0.0625,0.6875,0.0,0.0,1.0,0.0,0.0,1.0,0.0,0.0,1.0,0.0,0.0,1.0,0.0,0.0,1.0,0.0,0.0,1.0,0.0,0.0,1.0,0.0,0.0,1.0,0.0,0.0,1.0,0.0,0.0,1.0
8,【三星赔了苹果30卡车硬币】今天上午，30辆装满5美分硬币的卡车停在了加利福尼亚州苹果公司的总部。最初，苹果公司的安保部门以为是这些卡车转移错了地方，但是在数分钟之后，蒂姆·库克收到一个来自三星CEO的电话，电话中解释道这就是他们将要支付给美国苹果公司的10亿美元的罚款。,1840304823,哈哈,转发内容多为官方或正面信息，表达方式较为温和，倾向于温和建制派情绪宣泄，关注民生，精英视角，底层共情，自我中心该用户表现出对体制的温和拥护，转发内容多与日常生活相关，表达方式带有一定的情绪色彩，同时关注民生和精英视角。在社交网络中活跃，乐于分享和参与讨论，但同时也表现出一定的自我中心倾向。对于不同类型的事件，预期其会从个人利益和社会稳定的角度出发，表达自己的观点。语言风格特征为关注民生，同时带有一定的精英视角和自我中心倾向。,[''],0.2578125,0.2734375,0.46875,0.25,0.0625,0.6875,0.0,0.0,1.0,0.0,0.0,1.0,0.0,0.0,1.0,0.0,0.0,1.0,0.0,0.0,1.0,0.0,0.0,1.0,0.0,0.0,1.0,0.0,0.0,1.0,0.0,0.0,1.0,0.0,0.0,1.0
