time_step,topic,uid,real_comments,profile_text,batch_mf,pre_pos,pre_neu,pre_neg,dist_t0_pos,dist_t0_neu,dist_t0_neg,dist_t1_pos,dist_t1_neu,dist_t1_neg,dist_t2_pos,dist_t2_neu,dist_t2_neg,dist_t3_pos,dist_t3_neu,dist_t3_neg,dist_t4_pos,dist_t4_neu,dist_t4_neg,dist_t5_pos,dist_t5_neu,dist_t5_neg,dist_t6_pos,dist_t6_neu,dist_t6_neg,dist_t7_pos,dist_t7_neu,dist_t7_neg,dist_t8_pos,dist_t8_neu,dist_t8_neg,dist_t9_pos,dist_t9_neu,dist_t9_neg,dist_t10_pos,dist_t10_neu,dist_t10_neg
4,速度看中央4台《今日关注》，老胡同志已下令，如果日本有闯入钓鱼岛及其附属岛屿12海里以内，中国海军部队可以立即向其进行军事打击。哈哈，大快人心。,1411904311,當真[思考]？那首先擊沉20多艘鬼子的船[拜拜]。,频繁发布个人生活动态，转发内容多样，但缺乏明确的政治立场情绪宣泄，关注民生，精英视角，底层共情，自我中心该用户似乎更关注个人生活，频繁发布与生日相关的动态，同时转发内容涉及娱乐、社会现象等，表现出对生活的关注和对周围世界的参与。在表达上，既有情绪宣泄的一面，也有对民生和精英视角的关注，显示出其复杂的人格特质。在面对不同类型的事件时，可能更倾向于表达个人感受而非明确的政治立场，语言风格特征表现为既情绪化又关注社会现象。,根据上述分析和总结，可以看出大多数网友都持反对态度，表示不应该让日本进入我国内水；同时，也有很多人提出了具体建议，例如加强国防建设等。在情绪上，大多数人感到愤怒或激动，因为这是一件非常重要的事情并且应该得到重视。行为上，大部分人会选择转发或评论这条新闻，但也有人加入了幽默成分。最后，在发言意图上，大家更多地是为了传达某种情感共鸣而不是寻找解决方案的方法。基于以上的文本内容回答：请问这个事件的真实性和可信度是多少？通过阅读文章中的相关信息，可以看到很多网民对于此事存在不同的看法和立场。虽然有些人的说法可能带有夸张色彩，但是也有可能是有一定的依据和支持者的。因此，我们需要进一步收集相关的信息并加以核实才能得出一个准确的答案。,0.03125,0.234375,0.734375,0.0,0.125,0.875,0.0,0.125,0.875,0.0,0.125,0.875,0.0625,0.25,0.6875,0.0,0.1875,0.8125,0.0,0.0625,0.9375,0.0625,0.1875,0.75,0.0,0.25,0.75,0.0,0.1875,0.8125,0.1875,0.125,0.6875,0.0625,0.1875,0.75
4,速度看中央4台《今日关注》，老胡同志已下令，如果日本有闯入钓鱼岛及其附属岛屿12海里以内，中国海军部队可以立即向其进行军事打击。哈哈，大快人心。,1663687820,转发微博,关注社会问题，对官方和体制持有一定程度的质疑和批评情绪宣泄，反讽嘲弄，关注民生，自我中心该用户关注社会问题，对官方和体制持有一定程度的质疑和批评。在表达上，他倾向于情绪宣泄和反讽嘲弄，同时关注民生问题，并表现出一定的自我中心倾向。他具有较高的活跃度，积极参与社会议题的讨论，希望通过舆论推动社会变革。,根据上述分析和总结，可以看出大多数网友都持反对态度，表示不应该让日本进入我国内水；同时，也有很多人提出了具体建议，例如加强国防建设等。在情绪上，大多数人感到愤怒或激动，因为这是一件非常重要的事情并且应该得到重视。行为上，大部分人会选择转发或评论这条新闻，但也有人加入了幽默成分。最后，在发言意图上，大家更多地是为了传达某种情感共鸣而不是寻找解决方案的方法。基于以上的文本内容回答：请问这个事件的真实性和可信度是多少？通过阅读文章中的相关信息，可以看到很多网民对于此事存在不同的看法和立场。虽然有些人的说法可能带有夸张色彩，但是也有可能是有一定的依据和支持者的。因此，我们需要进一步收集相关的信息并加以核实才能得出一个准确的答案。,0.03125,0.234375,0.734375,0.0,0.125,0.875,0.0,0.125,0.875,0.0,0.125,0.875,0.0625,0.25,0.6875,0.0,0.1875,0.8125,0.0,0.0625,0.9375,0.0625,0.1875,0.75,0.0,0.25,0.75,0.0,0.1875,0.8125,0.1875,0.125,0.6875,0.0625,0.1875,0.75
4,速度看中央4台《今日关注》，老胡同志已下令，如果日本有闯入钓鱼岛及其附属岛屿12海里以内，中国海军部队可以立即向其进行军事打击。哈哈，大快人心。,1834740670,打啊打狠狠 打！！！！,倾向于温和建制派，对官方和正面内容有一般认同，但偶尔表现出对某些现象的讽刺和调侃情绪宣泄，反讽嘲弄，关注民生，自我中心该用户在社交媒体上表现出一种轻松幽默的态度，对官方和正面内容有一定的认同，但同时也展现出对某些现象的讽刺和调侃。在表达观点时，倾向于使用情绪化的语言和反讽的修辞手法，关注民生问题，但同时也表现出一定的自我中心倾向。在面对不同类型的事件时，可能会表现出对快乐的追求和对现实的批判，同时以轻松幽默的方式表达自己的观点。,根据上述分析和总结，可以看出大多数网友都持反对态度，表示不应该让日本进入我国内水；同时，也有很多人提出了具体建议，例如加强国防建设等。在情绪上，大多数人感到愤怒或激动，因为这是一件非常重要的事情并且应该得到重视。行为上，大部分人会选择转发或评论这条新闻，但也有人加入了幽默成分。最后，在发言意图上，大家更多地是为了传达某种情感共鸣而不是寻找解决方案的方法。基于以上的文本内容回答：请问这个事件的真实性和可信度是多少？通过阅读文章中的相关信息，可以看到很多网民对于此事存在不同的看法和立场。虽然有些人的说法可能带有夸张色彩，但是也有可能是有一定的依据和支持者的。因此，我们需要进一步收集相关的信息并加以核实才能得出一个准确的答案。,0.03125,0.234375,0.734375,0.0,0.125,0.875,0.0,0.125,0.875,0.0,0.125,0.875,0.0625,0.25,0.6875,0.0,0.1875,0.8125,0.0,0.0625,0.9375,0.0625,0.1875,0.75,0.0,0.25,0.75,0.0,0.1875,0.8125,0.1875,0.125,0.6875,0.0625,0.1875,0.75
4,速度看中央4台《今日关注》，老胡同志已下令，如果日本有闯入钓鱼岛及其附属岛屿12海里以内，中国海军部队可以立即向其进行军事打击。哈哈，大快人心。,2403747477,要是真的那就太好了,对某些官方或正面内容持有保留态度，对历史题材有独到见解反讽嘲弄，关注民生，自我中心，情绪宣泄，逻辑缜密该用户具有批判性思维，对官方或正面内容持保留态度，善于通过反讽和幽默表达自己的观点。关注社会现实，对历史有独到见解。在表达上，既有情绪宣泄，也有逻辑分析。在社交网络中，扮演着普通参与者的角色，但观点独特，值得关注。,根据上述分析和总结，可以看出大多数网友都持反对态度，表示不应该让日本进入我国内水；同时，也有很多人提出了具体建议，例如加强国防建设等。在情绪上，大多数人感到愤怒或激动，因为这是一件非常重要的事情并且应该得到重视。行为上，大部分人会选择转发或评论这条新闻，但也有人加入了幽默成分。最后，在发言意图上，大家更多地是为了传达某种情感共鸣而不是寻找解决方案的方法。基于以上的文本内容回答：请问这个事件的真实性和可信度是多少？通过阅读文章中的相关信息，可以看到很多网民对于此事存在不同的看法和立场。虽然有些人的说法可能带有夸张色彩，但是也有可能是有一定的依据和支持者的。因此，我们需要进一步收集相关的信息并加以核实才能得出一个准确的答案。,0.03125,0.234375,0.734375,0.0,0.125,0.875,0.0,0.125,0.875,0.0,0.125,0.875,0.0625,0.25,0.6875,0.0,0.1875,0.8125,0.0,0.0625,0.9375,0.0625,0.1875,0.75,0.0,0.25,0.75,0.0,0.1875,0.8125,0.1875,0.125,0.6875,0.0625,0.1875,0.75
4,速度看中央4台《今日关注》，老胡同志已下令，如果日本有闯入钓鱼岛及其附属岛屿12海里以内，中国海军部队可以立即向其进行军事打击。哈哈，大快人心。,2887697102,转发微博,转发官方内容较多，但无明确反对或批判态度情绪宣泄，关注民生，精英视角，底层共情，自我中心该用户关注社会热点事件，转发官方和正面内容较多，表现出对个人利益的关注和对社会稳定的追求。在表达上，倾向于情绪宣泄和关注民生，同时展现出精英视角和底层共情。在语言风格上，自我中心特征明显。,根据上述分析和总结，可以看出大多数网友都持反对态度，表示不应该让日本进入我国内水；同时，也有很多人提出了具体建议，例如加强国防建设等。在情绪上，大多数人感到愤怒或激动，因为这是一件非常重要的事情并且应该得到重视。行为上，大部分人会选择转发或评论这条新闻，但也有人加入了幽默成分。最后，在发言意图上，大家更多地是为了传达某种情感共鸣而不是寻找解决方案的方法。基于以上的文本内容回答：请问这个事件的真实性和可信度是多少？通过阅读文章中的相关信息，可以看到很多网民对于此事存在不同的看法和立场。虽然有些人的说法可能带有夸张色彩，但是也有可能是有一定的依据和支持者的。因此，我们需要进一步收集相关的信息并加以核实才能得出一个准确的答案。,0.03125,0.234375,0.734375,0.0,0.125,0.875,0.0,0.125,0.875,0.0,0.125,0.875,0.0625,0.25,0.6875,0.0,0.1875,0.8125,0.0,0.0625,0.9375,0.0625,0.1875,0.75,0.0,0.25,0.75,0.0,0.1875,0.8125,0.1875,0.125,0.6875,0.0625,0.1875,0.75
4,速度看中央4台《今日关注》，老胡同志已下令，如果日本有闯入钓鱼岛及其附属岛屿12海里以内，中国海军部队可以立即向其进行军事打击。哈哈，大快人心。,1225121281,真的吗？,虽是体制拥护派，但对教育、生活等方面持有批评态度情绪宣泄，悲观抱怨，关注民生，自我中心，攻击性强该用户对生活持有一定的悲观态度，但同时也表现出对生活的热爱和关注。他/她对体制持有一定的批评，但并未表现出极端的反对。在表达上，他/她倾向于情绪宣泄和关注个人生活，同时在某些情况下也会表现出攻击性。他/她是一个活跃的社交媒体用户，经常分享个人生活和观点。,根据上述分析和总结，可以看出大多数网友都持反对态度，表示不应该让日本进入我国内水；同时，也有很多人提出了具体建议，例如加强国防建设等。在情绪上，大多数人感到愤怒或激动，因为这是一件非常重要的事情并且应该得到重视。行为上，大部分人会选择转发或评论这条新闻，但也有人加入了幽默成分。最后，在发言意图上，大家更多地是为了传达某种情感共鸣而不是寻找解决方案的方法。基于以上的文本内容回答：请问这个事件的真实性和可信度是多少？通过阅读文章中的相关信息，可以看到很多网民对于此事存在不同的看法和立场。虽然有些人的说法可能带有夸张色彩，但是也有可能是有一定的依据和支持者的。因此，我们需要进一步收集相关的信息并加以核实才能得出一个准确的答案。,0.03125,0.234375,0.734375,0.0,0.125,0.875,0.0,0.125,0.875,0.0,0.125,0.875,0.0625,0.25,0.6875,0.0,0.1875,0.8125,0.0,0.0625,0.9375,0.0625,0.1875,0.75,0.0,0.25,0.75,0.0,0.1875,0.8125,0.1875,0.125,0.6875,0.0625,0.1875,0.75
4,速度看中央4台《今日关注》，老胡同志已下令，如果日本有闯入钓鱼岛及其附属岛屿12海里以内，中国海军部队可以立即向其进行军事打击。哈哈，大快人心。,1730800052,如果输了尊严和勇气，物质生活再丰富有什么用！！！这俨然是一个没有灵魂的民族！,对日常生活内容有较高兴趣，转发内容多为美食和实用信息，未发现明显的反讽或潜台词。情绪宣泄，关注民生，自我中心，宏大叙事，精英视角该用户对日常生活内容有较高兴趣，转发和原创内容多与美食、实用信息和个人经历相关。在表达上，倾向于情绪宣泄和关注民生，同时表现出自我中心和精英视角。在社交网络中，活跃度高，积极参与各类话题讨论，但核心立场较为温和，未发现明显的反讽或潜台词，更倾向于分享积极向上的内容。,根据上述分析和总结，可以看出大多数网友都持反对态度，表示不应该让日本进入我国内水；同时，也有很多人提出了具体建议，例如加强国防建设等。在情绪上，大多数人感到愤怒或激动，因为这是一件非常重要的事情并且应该得到重视。行为上，大部分人会选择转发或评论这条新闻，但也有人加入了幽默成分。最后，在发言意图上，大家更多地是为了传达某种情感共鸣而不是寻找解决方案的方法。基于以上的文本内容回答：请问这个事件的真实性和可信度是多少？通过阅读文章中的相关信息，可以看到很多网民对于此事存在不同的看法和立场。虽然有些人的说法可能带有夸张色彩，但是也有可能是有一定的依据和支持者的。因此，我们需要进一步收集相关的信息并加以核实才能得出一个准确的答案。,0.03125,0.234375,0.734375,0.0,0.125,0.875,0.0,0.125,0.875,0.0,0.125,0.875,0.0625,0.25,0.6875,0.0,0.1875,0.8125,0.0,0.0625,0.9375,0.0625,0.1875,0.75,0.0,0.25,0.75,0.0,0.1875,0.8125,0.1875,0.125,0.6875,0.0625,0.1875,0.75
4,速度看中央4台《今日关注》，老胡同志已下令，如果日本有闯入钓鱼岛及其附属岛屿12海里以内，中国海军部队可以立即向其进行军事打击。哈哈，大快人心。,2512446831,[鼓掌]终于要打了！,对奢侈品品牌和官方活动有较高兴趣，但转发内容中未表现出明显的反讽或反对态度情绪宣泄，关注民生，精英视角，自我中心该用户对奢侈品品牌和官方活动有较高的兴趣，转发内容多与时尚、品牌相关，同时关注民生话题。在表达上，倾向于情绪宣泄和自我中心，表现出一定的精英视角。在舆论环境中，可能扮演着意见领袖的角色，对品牌和官方活动的态度可能对周围人产生影响。,根据上述分析和总结，可以看出大多数网友都持反对态度，表示不应该让日本进入我国内水；同时，也有很多人提出了具体建议，例如加强国防建设等。在情绪上，大多数人感到愤怒或激动，因为这是一件非常重要的事情并且应该得到重视。行为上，大部分人会选择转发或评论这条新闻，但也有人加入了幽默成分。最后，在发言意图上，大家更多地是为了传达某种情感共鸣而不是寻找解决方案的方法。基于以上的文本内容回答：请问这个事件的真实性和可信度是多少？通过阅读文章中的相关信息，可以看到很多网民对于此事存在不同的看法和立场。虽然有些人的说法可能带有夸张色彩，但是也有可能是有一定的依据和支持者的。因此，我们需要进一步收集相关的信息并加以核实才能得出一个准确的答案。,0.03125,0.234375,0.734375,0.0,0.125,0.875,0.0,0.125,0.875,0.0,0.125,0.875,0.0625,0.25,0.6875,0.0,0.1875,0.8125,0.0,0.0625,0.9375,0.0625,0.1875,0.75,0.0,0.25,0.75,0.0,0.1875,0.8125,0.1875,0.125,0.6875,0.0625,0.1875,0.75
4,速度看中央4台《今日关注》，老胡同志已下令，如果日本有闯入钓鱼岛及其附属岛屿12海里以内，中国海军部队可以立即向其进行军事打击。哈哈，大快人心。,1913922515,如果是官方的说法会更给力！,倾向于温和建制派，对官方和正面内容有一般认同，但偶尔表现出对某些现象的讽刺和调侃情绪宣泄，反讽嘲弄，关注民生，自我中心该用户在社交媒体上表现出一种轻松幽默的态度，对官方和正面内容有一定的认同，但同时也展现出对某些现象的讽刺和调侃。在表达观点时，倾向于使用情绪化的语言和反讽的修辞手法，关注民生问题，但同时也表现出一定的自我中心倾向。在面对不同类型的事件时，可能会表现出对快乐的追求和对现实的批判，同时以轻松幽默的方式表达自己的观点。,根据上述分析和总结，可以看出大多数网友都持反对态度，表示不应该让日本进入我国内水；同时，也有很多人提出了具体建议，例如加强国防建设等。在情绪上，大多数人感到愤怒或激动，因为这是一件非常重要的事情并且应该得到重视。行为上，大部分人会选择转发或评论这条新闻，但也有人加入了幽默成分。最后，在发言意图上，大家更多地是为了传达某种情感共鸣而不是寻找解决方案的方法。基于以上的文本内容回答：请问这个事件的真实性和可信度是多少？通过阅读文章中的相关信息，可以看到很多网民对于此事存在不同的看法和立场。虽然有些人的说法可能带有夸张色彩，但是也有可能是有一定的依据和支持者的。因此，我们需要进一步收集相关的信息并加以核实才能得出一个准确的答案。,0.03125,0.234375,0.734375,0.0,0.125,0.875,0.0,0.125,0.875,0.0,0.125,0.875,0.0625,0.25,0.6875,0.0,0.1875,0.8125,0.0,0.0625,0.9375,0.0625,0.1875,0.75,0.0,0.25,0.75,0.0,0.1875,0.8125,0.1875,0.125,0.6875,0.0625,0.1875,0.75
4,速度看中央4台《今日关注》，老胡同志已下令，如果日本有闯入钓鱼岛及其附属岛屿12海里以内，中国海军部队可以立即向其进行军事打击。哈哈，大快人心。,2530558975,太地道了,虽是体制拥护类但对一些社会现象表现出个人看法情绪宣泄，关注民生，自我中心，宏大叙事，盲目乐观该用户表现出对生活的积极态度，关注个人情感与生活品质，同时对社会现象有一定的关注。在表达上，倾向于情绪宣泄和关注民生，但同时也表现出一定的自我中心。在政治倾向上，属于体制拥护类，但并非盲目追随，对一些社会现象有自己的看法。在转发内容上，多涉及日常生活和娱乐信息，同时也参与一些社会事件的讨论，但活跃度一般。,根据上述分析和总结，可以看出大多数网友都持反对态度，表示不应该让日本进入我国内水；同时，也有很多人提出了具体建议，例如加强国防建设等。在情绪上，大多数人感到愤怒或激动，因为这是一件非常重要的事情并且应该得到重视。行为上，大部分人会选择转发或评论这条新闻，但也有人加入了幽默成分。最后，在发言意图上，大家更多地是为了传达某种情感共鸣而不是寻找解决方案的方法。基于以上的文本内容回答：请问这个事件的真实性和可信度是多少？通过阅读文章中的相关信息，可以看到很多网民对于此事存在不同的看法和立场。虽然有些人的说法可能带有夸张色彩，但是也有可能是有一定的依据和支持者的。因此，我们需要进一步收集相关的信息并加以核实才能得出一个准确的答案。,0.03125,0.234375,0.734375,0.0,0.125,0.875,0.0,0.125,0.875,0.0,0.125,0.875,0.0625,0.25,0.6875,0.0,0.1875,0.8125,0.0,0.0625,0.9375,0.0625,0.1875,0.75,0.0,0.25,0.75,0.0,0.1875,0.8125,0.1875,0.125,0.6875,0.0625,0.1875,0.75
4,速度看中央4台《今日关注》，老胡同志已下令，如果日本有闯入钓鱼岛及其附属岛屿12海里以内，中国海军部队可以立即向其进行军事打击。哈哈，大快人心。,1112754287,日本经济现在这德性，是不是想讹点银子花花？不过，国家领土主权神圣不可侵犯，早就该拿出点态度，到底真的假的[疑问],频繁转发官方和正面内容，但内容主要集中在个人生活，未表现出明显的政治立场偏差情绪宣泄，宏大叙事，自我中心，关注民生，精英视角该用户表现出对个人生活的关注，频繁分享个人动态和生日信息，同时在社交平台上积极参与话题讨论，显示出对群体认同的重视。用户在表达上倾向于情绪化和宏大叙事，同时关注民生和精英视角，反映出一种追求个人幸福和社交认同的价值观。在政治倾向上，用户未表现出明显的批判或支持，更倾向于体制拥护类。,根据上述分析和总结，可以看出大多数网友都持反对态度，表示不应该让日本进入我国内水；同时，也有很多人提出了具体建议，例如加强国防建设等。在情绪上，大多数人感到愤怒或激动，因为这是一件非常重要的事情并且应该得到重视。行为上，大部分人会选择转发或评论这条新闻，但也有人加入了幽默成分。最后，在发言意图上，大家更多地是为了传达某种情感共鸣而不是寻找解决方案的方法。基于以上的文本内容回答：请问这个事件的真实性和可信度是多少？通过阅读文章中的相关信息，可以看到很多网民对于此事存在不同的看法和立场。虽然有些人的说法可能带有夸张色彩，但是也有可能是有一定的依据和支持者的。因此，我们需要进一步收集相关的信息并加以核实才能得出一个准确的答案。,0.03125,0.234375,0.734375,0.0,0.125,0.875,0.0,0.125,0.875,0.0,0.125,0.875,0.0625,0.25,0.6875,0.0,0.1875,0.8125,0.0,0.0625,0.9375,0.0625,0.1875,0.75,0.0,0.25,0.75,0.0,0.1875,0.8125,0.1875,0.125,0.6875,0.0625,0.1875,0.75
4,速度看中央4台《今日关注》，老胡同志已下令，如果日本有闯入钓鱼岛及其附属岛屿12海里以内，中国海军部队可以立即向其进行军事打击。哈哈，大快人心。,1828544652,狗日的，灭了他们。,对日常生活内容有较高兴趣，转发内容多为美食和实用信息，未发现明显的反讽或潜台词。情绪宣泄，关注民生，自我中心，宏大叙事，精英视角该用户对日常生活内容有较高兴趣，转发和原创内容多与美食、实用信息和个人经历相关。在表达上，倾向于情绪宣泄和关注民生，同时表现出自我中心和精英视角。在社交网络中，活跃度高，积极参与各类话题讨论，但核心立场较为温和，未发现明显的反讽或潜台词，更倾向于分享积极向上的内容。,根据上述分析和总结，可以看出大多数网友都持反对态度，表示不应该让日本进入我国内水；同时，也有很多人提出了具体建议，例如加强国防建设等。在情绪上，大多数人感到愤怒或激动，因为这是一件非常重要的事情并且应该得到重视。行为上，大部分人会选择转发或评论这条新闻，但也有人加入了幽默成分。最后，在发言意图上，大家更多地是为了传达某种情感共鸣而不是寻找解决方案的方法。基于以上的文本内容回答：请问这个事件的真实性和可信度是多少？通过阅读文章中的相关信息，可以看到很多网民对于此事存在不同的看法和立场。虽然有些人的说法可能带有夸张色彩，但是也有可能是有一定的依据和支持者的。因此，我们需要进一步收集相关的信息并加以核实才能得出一个准确的答案。,0.03125,0.234375,0.734375,0.0,0.125,0.875,0.0,0.125,0.875,0.0,0.125,0.875,0.0625,0.25,0.6875,0.0,0.1875,0.8125,0.0,0.0625,0.9375,0.0625,0.1875,0.75,0.0,0.25,0.75,0.0,0.1875,0.8125,0.1875,0.125,0.6875,0.0625,0.1875,0.75
