time_step,topic,uid,real_comments,profile_text,batch_mf,pre_pos,pre_neu,pre_neg,dist_t0_pos,dist_t0_neu,dist_t0_neg,dist_t1_pos,dist_t1_neu,dist_t1_neg,dist_t2_pos,dist_t2_neu,dist_t2_neg,dist_t3_pos,dist_t3_neu,dist_t3_neg,dist_t4_pos,dist_t4_neu,dist_t4_neg,dist_t5_pos,dist_t5_neu,dist_t5_neg,dist_t6_pos,dist_t6_neu,dist_t6_neg,dist_t7_pos,dist_t7_neu,dist_t7_neg,dist_t8_pos,dist_t8_neu,dist_t8_neg,dist_t9_pos,dist_t9_neu,dist_t9_neg,dist_t10_pos,dist_t10_neu,dist_t10_neg
7,速度看中央4台《今日关注》，老胡同志已下令，如果日本有闯入钓鱼岛及其附属岛屿12海里以内，中国海军部队可以立即向其进行军事打击。哈哈，大快人心。,2422750270,真的吗,虽是体制拥护派但对部分社会现象持批判态度情绪宣泄，反讽嘲弄，关注民生，自我中心该用户表现出对日常生活和情感表达的浓厚兴趣，同时在转发和评论中展现出对社会现象的批判性思考。他/她倾向于使用反讽和情绪化的语言来表达观点，关注民生问题，并在社交媒体上活跃参与讨论。尽管倾向于体制拥护，但用户对某些社会现象持有批判态度，显示出复杂的政治倾向。,根据以上信息，我们可以得出如下结论：- 大多数网友都是反对日本进入我国内水的行为，认为这是严重挑衅和侵略行为；少数人则表达了不同的看法，如支持或者不置可否。- 讨论的主题涉及国家安全问题，引起了广泛的关注和热议。- 在情绪上，大多数网友表现出了强烈的不满和愤慨，而一些人则是感到担忧和不安。- 对于言论的内容，大多数人认为真实可靠，但也有人提出了一些疑问和批评。- 关于行动上的态度，绝大多数人都选择了转发和评论，以表达自己的立场和想法。综上所述，可以看出这次讨论是一个非常重要的事件，引发了广泛的争议和思考。虽然存在不同的人群有不同的看法和反应方式，但是大家都希望能够维护中国的主权和安全利益，同时也呼吁政府采取更加有力的措施来应对这一挑战。,0.0178571428571428,0.1875,0.7946428571428571,0.0625,0.25,0.6875,0.0,0.1875,0.8125,0.0,0.0625,0.9375,0.0625,0.1875,0.75,0.0,0.25,0.75,0.0,0.1875,0.8125,0.1875,0.125,0.6875,0.0625,0.1875,0.75,0.0,0.5,0.5,0.0,0.5,0.5,0.0,0.5,0.5
7,速度看中央4台《今日关注》，老胡同志已下令，如果日本有闯入钓鱼岛及其附属岛屿12海里以内，中国海军部队可以立即向其进行军事打击。哈哈，大快人心。,2153610067,[威武],倾向于体制内，但关注个人修养与内心世界情绪宣泄，宏大叙事，关注民生，精英视角该用户在社交媒体上表现出温和的建制派立场，关注个人修养与内心世界。在转发内容中，他倾向于分享与个人成长、精神修养相关的内容，同时也关注社会现象和公共话题。他的表达风格偏向情绪宣泄和宏大叙事，体现出对民生和精英视角的关注。作为普通参与者，他在社交媒体上的活跃度一般，但能够对特定话题产生共鸣。,根据以上信息，我们可以得出如下结论：- 大多数网友都是反对日本进入我国内水的行为，认为这是严重挑衅和侵略行为；少数人则表达了不同的看法，如支持或者不置可否。- 讨论的主题涉及国家安全问题，引起了广泛的关注和热议。- 在情绪上，大多数网友表现出了强烈的不满和愤慨，而一些人则是感到担忧和不安。- 对于言论的内容，大多数人认为真实可靠，但也有人提出了一些疑问和批评。- 关于行动上的态度，绝大多数人都选择了转发和评论，以表达自己的立场和想法。综上所述，可以看出这次讨论是一个非常重要的事件，引发了广泛的争议和思考。虽然存在不同的人群有不同的看法和反应方式，但是大家都希望能够维护中国的主权和安全利益，同时也呼吁政府采取更加有力的措施来应对这一挑战。,0.0178571428571428,0.1875,0.7946428571428571,0.0625,0.25,0.6875,0.0,0.1875,0.8125,0.0,0.0625,0.9375,0.0625,0.1875,0.75,0.0,0.25,0.75,0.0,0.1875,0.8125,0.1875,0.125,0.6875,0.0625,0.1875,0.75,0.0,0.5,0.5,0.0,0.5,0.5,0.0,0.5,0.5
7,速度看中央4台《今日关注》，老胡同志已下令，如果日本有闯入钓鱼岛及其附属岛屿12海里以内，中国海军部队可以立即向其进行军事打击。哈哈，大快人心。,1881351422,转发微博,转发内容多为娱乐、美食、生活相关，对政治话题较少涉及，显示温和的体制拥护态度情绪宣泄，关注民生，精英视角，自我中心该用户在社交媒体上以转发娱乐、美食等内容为主，表现出对生活细节的关注和追求个人情感体验的态度。在政治和社会问题上，该用户较为被动，倾向于旁观而非积极参与。语言风格偏向情绪化，表达上带有一定的自我中心倾向。,根据以上信息，我们可以得出如下结论：- 大多数网友都是反对日本进入我国内水的行为，认为这是严重挑衅和侵略行为；少数人则表达了不同的看法，如支持或者不置可否。- 讨论的主题涉及国家安全问题，引起了广泛的关注和热议。- 在情绪上，大多数网友表现出了强烈的不满和愤慨，而一些人则是感到担忧和不安。- 对于言论的内容，大多数人认为真实可靠，但也有人提出了一些疑问和批评。- 关于行动上的态度，绝大多数人都选择了转发和评论，以表达自己的立场和想法。综上所述，可以看出这次讨论是一个非常重要的事件，引发了广泛的争议和思考。虽然存在不同的人群有不同的看法和反应方式，但是大家都希望能够维护中国的主权和安全利益，同时也呼吁政府采取更加有力的措施来应对这一挑战。,0.0178571428571428,0.1875,0.7946428571428571,0.0625,0.25,0.6875,0.0,0.1875,0.8125,0.0,0.0625,0.9375,0.0625,0.1875,0.75,0.0,0.25,0.75,0.0,0.1875,0.8125,0.1875,0.125,0.6875,0.0625,0.1875,0.75,0.0,0.5,0.5,0.0,0.5,0.5,0.0,0.5,0.5
7,速度看中央4台《今日关注》，老胡同志已下令，如果日本有闯入钓鱼岛及其附属岛屿12海里以内，中国海军部队可以立即向其进行军事打击。哈哈，大快人心。,1402328750,//@GuoAn红庙群-陈曦: 求小日本速速接近钓鱼岛,关注社会问题，对官方和体制持有一定程度的质疑和批评情绪宣泄，反讽嘲弄，关注民生，自我中心该用户关注社会问题，对官方和体制持有一定程度的质疑和批评。在表达上，他倾向于情绪宣泄和反讽嘲弄，同时关注民生问题，并表现出一定的自我中心倾向。他具有较高的活跃度，积极参与社会议题的讨论，希望通过舆论推动社会变革。,根据以上信息，我们可以得出如下结论：- 大多数网友都是反对日本进入我国内水的行为，认为这是严重挑衅和侵略行为；少数人则表达了不同的看法，如支持或者不置可否。- 讨论的主题涉及国家安全问题，引起了广泛的关注和热议。- 在情绪上，大多数网友表现出了强烈的不满和愤慨，而一些人则是感到担忧和不安。- 对于言论的内容，大多数人认为真实可靠，但也有人提出了一些疑问和批评。- 关于行动上的态度，绝大多数人都选择了转发和评论，以表达自己的立场和想法。综上所述，可以看出这次讨论是一个非常重要的事件，引发了广泛的争议和思考。虽然存在不同的人群有不同的看法和反应方式，但是大家都希望能够维护中国的主权和安全利益，同时也呼吁政府采取更加有力的措施来应对这一挑战。,0.0178571428571428,0.1875,0.7946428571428571,0.0625,0.25,0.6875,0.0,0.1875,0.8125,0.0,0.0625,0.9375,0.0625,0.1875,0.75,0.0,0.25,0.75,0.0,0.1875,0.8125,0.1875,0.125,0.6875,0.0625,0.1875,0.75,0.0,0.5,0.5,0.0,0.5,0.5,0.0,0.5,0.5
7,速度看中央4台《今日关注》，老胡同志已下令，如果日本有闯入钓鱼岛及其附属岛屿12海里以内，中国海军部队可以立即向其进行军事打击。哈哈，大快人心。,2489887711,真的硬起来了？,转发内容多涉及官方和正面信息，显示对体制的认同，但偶尔转发涉及社会问题的内容，可能对某些政策或现象持有保留态度情绪宣泄，关注民生，精英视角，底层共情，自我中心该用户对体制持有一定程度的认同，但同时也关注社会问题，转发内容多涉及官方和正面信息，显示对群体压力的敏感性。在表达上，倾向于情绪宣泄和关注民生，同时具有精英视角和底层共情的特点。在政治倾向上，可能表现为对体制的复杂性有认识，对不同类型事件可能既有支持也有批判，语言风格特征为情绪化且关注社会现实。,根据以上信息，我们可以得出如下结论：- 大多数网友都是反对日本进入我国内水的行为，认为这是严重挑衅和侵略行为；少数人则表达了不同的看法，如支持或者不置可否。- 讨论的主题涉及国家安全问题，引起了广泛的关注和热议。- 在情绪上，大多数网友表现出了强烈的不满和愤慨，而一些人则是感到担忧和不安。- 对于言论的内容，大多数人认为真实可靠，但也有人提出了一些疑问和批评。- 关于行动上的态度，绝大多数人都选择了转发和评论，以表达自己的立场和想法。综上所述，可以看出这次讨论是一个非常重要的事件，引发了广泛的争议和思考。虽然存在不同的人群有不同的看法和反应方式，但是大家都希望能够维护中国的主权和安全利益，同时也呼吁政府采取更加有力的措施来应对这一挑战。,0.0178571428571428,0.1875,0.7946428571428571,0.0625,0.25,0.6875,0.0,0.1875,0.8125,0.0,0.0625,0.9375,0.0625,0.1875,0.75,0.0,0.25,0.75,0.0,0.1875,0.8125,0.1875,0.125,0.6875,0.0625,0.1875,0.75,0.0,0.5,0.5,0.0,0.5,0.5,0.0,0.5,0.5
7,速度看中央4台《今日关注》，老胡同志已下令，如果日本有闯入钓鱼岛及其附属岛屿12海里以内，中国海军部队可以立即向其进行军事打击。哈哈，大快人心。,1336479085,转发微博,对某些社会现象持有批判态度，但总体上倾向于温和改良情绪宣泄，关注民生，精英视角，底层共情，自我中心该用户关注社会现象，对某些问题持有批判态度，但总体上倾向于温和改良。在表达上，他倾向于关注民生问题，同时保持个人独立思考。在社交网络上，他属于普通参与者，转发内容多样，但缺乏强烈的个人观点。,根据以上信息，我们可以得出如下结论：- 大多数网友都是反对日本进入我国内水的行为，认为这是严重挑衅和侵略行为；少数人则表达了不同的看法，如支持或者不置可否。- 讨论的主题涉及国家安全问题，引起了广泛的关注和热议。- 在情绪上，大多数网友表现出了强烈的不满和愤慨，而一些人则是感到担忧和不安。- 对于言论的内容，大多数人认为真实可靠，但也有人提出了一些疑问和批评。- 关于行动上的态度，绝大多数人都选择了转发和评论，以表达自己的立场和想法。综上所述，可以看出这次讨论是一个非常重要的事件，引发了广泛的争议和思考。虽然存在不同的人群有不同的看法和反应方式，但是大家都希望能够维护中国的主权和安全利益，同时也呼吁政府采取更加有力的措施来应对这一挑战。,0.0178571428571428,0.1875,0.7946428571428571,0.0625,0.25,0.6875,0.0,0.1875,0.8125,0.0,0.0625,0.9375,0.0625,0.1875,0.75,0.0,0.25,0.75,0.0,0.1875,0.8125,0.1875,0.125,0.6875,0.0625,0.1875,0.75,0.0,0.5,0.5,0.0,0.5,0.5,0.0,0.5,0.5
7,速度看中央4台《今日关注》，老胡同志已下令，如果日本有闯入钓鱼岛及其附属岛屿12海里以内，中国海军部队可以立即向其进行军事打击。哈哈，大快人心。,1452140531,[威武],转发内容多为轻松愉快或实用信息，显示对现状的接受和认同，但偶尔对教育制度有所质疑情绪宣泄，关注民生，精英视角，底层共情，自我中心该用户关注日常生活和实用信息，转发内容多为轻松愉快或实用信息，显示对现状的接受和认同。在转发内容中，偶尔表现出对教育制度的质疑，但整体上保持中立。语言风格偏向于情绪宣泄和关注民生，同时带有一定的精英视角和底层共情。该用户在社交媒体上的活跃度一般，属于普通参与者。,根据以上信息，我们可以得出如下结论：- 大多数网友都是反对日本进入我国内水的行为，认为这是严重挑衅和侵略行为；少数人则表达了不同的看法，如支持或者不置可否。- 讨论的主题涉及国家安全问题，引起了广泛的关注和热议。- 在情绪上，大多数网友表现出了强烈的不满和愤慨，而一些人则是感到担忧和不安。- 对于言论的内容，大多数人认为真实可靠，但也有人提出了一些疑问和批评。- 关于行动上的态度，绝大多数人都选择了转发和评论，以表达自己的立场和想法。综上所述，可以看出这次讨论是一个非常重要的事件，引发了广泛的争议和思考。虽然存在不同的人群有不同的看法和反应方式，但是大家都希望能够维护中国的主权和安全利益，同时也呼吁政府采取更加有力的措施来应对这一挑战。,0.0178571428571428,0.1875,0.7946428571428571,0.0625,0.25,0.6875,0.0,0.1875,0.8125,0.0,0.0625,0.9375,0.0625,0.1875,0.75,0.0,0.25,0.75,0.0,0.1875,0.8125,0.1875,0.125,0.6875,0.0625,0.1875,0.75,0.0,0.5,0.5,0.0,0.5,0.5,0.0,0.5,0.5
7,速度看中央4台《今日关注》，老胡同志已下令，如果日本有闯入钓鱼岛及其附属岛屿12海里以内，中国海军部队可以立即向其进行军事打击。哈哈，大快人心。,2646062234,是真的吗、,对传统文化和历史有认同，同时表达了对现实的积极态度和对未来的乐观期望情绪宣泄，乐观积极，关注民生，宏大叙事这位用户表现出对传统文化的尊重和对现实的积极态度。他们经常分享关于节日、生活和未来的积极信息，表达了对家庭和社会和谐的重视。他们的语言风格充满乐观和正能量，经常使用宏大叙事来描述对未来的期望。这位用户在社交媒体上是一个活跃的参与者，他们的言论通常能够激发他人的积极情绪，并鼓励人们面对困难时保持乐观。,根据以上信息，我们可以得出如下结论：- 大多数网友都是反对日本进入我国内水的行为，认为这是严重挑衅和侵略行为；少数人则表达了不同的看法，如支持或者不置可否。- 讨论的主题涉及国家安全问题，引起了广泛的关注和热议。- 在情绪上，大多数网友表现出了强烈的不满和愤慨，而一些人则是感到担忧和不安。- 对于言论的内容，大多数人认为真实可靠，但也有人提出了一些疑问和批评。- 关于行动上的态度，绝大多数人都选择了转发和评论，以表达自己的立场和想法。综上所述，可以看出这次讨论是一个非常重要的事件，引发了广泛的争议和思考。虽然存在不同的人群有不同的看法和反应方式，但是大家都希望能够维护中国的主权和安全利益，同时也呼吁政府采取更加有力的措施来应对这一挑战。,0.0178571428571428,0.1875,0.7946428571428571,0.0625,0.25,0.6875,0.0,0.1875,0.8125,0.0,0.0625,0.9375,0.0625,0.1875,0.75,0.0,0.25,0.75,0.0,0.1875,0.8125,0.1875,0.125,0.6875,0.0625,0.1875,0.75,0.0,0.5,0.5,0.0,0.5,0.5,0.0,0.5,0.5
7,速度看中央4台《今日关注》，老胡同志已下令，如果日本有闯入钓鱼岛及其附属岛屿12海里以内，中国海军部队可以立即向其进行军事打击。哈哈，大快人心。,1145165372,//@王小星_虫子: [鼓掌]终于要打了！,虽是体制拥护派但对某些社会现象持有批评态度情绪宣泄，幽默风趣，关注民生，自我中心该用户表现出对体制的拥护，但同时也对某些社会现象持有批评态度。他善于用幽默和讽刺的方式表达自己的观点，关注民生问题，同时以自我为中心。在社交平台上，他活跃度高，经常转发和评论各类内容，以表达自己的看法。,根据以上信息，我们可以得出如下结论：- 大多数网友都是反对日本进入我国内水的行为，认为这是严重挑衅和侵略行为；少数人则表达了不同的看法，如支持或者不置可否。- 讨论的主题涉及国家安全问题，引起了广泛的关注和热议。- 在情绪上，大多数网友表现出了强烈的不满和愤慨，而一些人则是感到担忧和不安。- 对于言论的内容，大多数人认为真实可靠，但也有人提出了一些疑问和批评。- 关于行动上的态度，绝大多数人都选择了转发和评论，以表达自己的立场和想法。综上所述，可以看出这次讨论是一个非常重要的事件，引发了广泛的争议和思考。虽然存在不同的人群有不同的看法和反应方式，但是大家都希望能够维护中国的主权和安全利益，同时也呼吁政府采取更加有力的措施来应对这一挑战。,0.0178571428571428,0.1875,0.7946428571428571,0.0625,0.25,0.6875,0.0,0.1875,0.8125,0.0,0.0625,0.9375,0.0625,0.1875,0.75,0.0,0.25,0.75,0.0,0.1875,0.8125,0.1875,0.125,0.6875,0.0625,0.1875,0.75,0.0,0.5,0.5,0.0,0.5,0.5,0.0,0.5,0.5
7,速度看中央4台《今日关注》，老胡同志已下令，如果日本有闯入钓鱼岛及其附属岛屿12海里以内，中国海军部队可以立即向其进行军事打击。哈哈，大快人心。,1278636574,转发微博,转发官方内容时表现出一般认同，但偶尔对某些现象表示反对，如对校服的评论显示对现状的不满情绪宣泄，关注民生，精英视角，自我中心，宏大叙事该用户关注社会现象和个人兴趣，对某些现象持有批评态度，但总体上倾向于温和的建制派立场。在表达上，喜欢情绪化的表达，同时也关注民生问题。在社交网络上，表现为普通参与者，偶尔发表个人观点，但整体上较为被动。,根据以上信息，我们可以得出如下结论：- 大多数网友都是反对日本进入我国内水的行为，认为这是严重挑衅和侵略行为；少数人则表达了不同的看法，如支持或者不置可否。- 讨论的主题涉及国家安全问题，引起了广泛的关注和热议。- 在情绪上，大多数网友表现出了强烈的不满和愤慨，而一些人则是感到担忧和不安。- 对于言论的内容，大多数人认为真实可靠，但也有人提出了一些疑问和批评。- 关于行动上的态度，绝大多数人都选择了转发和评论，以表达自己的立场和想法。综上所述，可以看出这次讨论是一个非常重要的事件，引发了广泛的争议和思考。虽然存在不同的人群有不同的看法和反应方式，但是大家都希望能够维护中国的主权和安全利益，同时也呼吁政府采取更加有力的措施来应对这一挑战。,0.0178571428571428,0.1875,0.7946428571428571,0.0625,0.25,0.6875,0.0,0.1875,0.8125,0.0,0.0625,0.9375,0.0625,0.1875,0.75,0.0,0.25,0.75,0.0,0.1875,0.8125,0.1875,0.125,0.6875,0.0625,0.1875,0.75,0.0,0.5,0.5,0.0,0.5,0.5,0.0,0.5,0.5
7,速度看中央4台《今日关注》，老胡同志已下令，如果日本有闯入钓鱼岛及其附属岛屿12海里以内，中国海军部队可以立即向其进行军事打击。哈哈，大快人心。,2498786997,早就该如此了！[鼓掌][赞],关注民生，对经济政策持批评态度情绪宣泄，关注民生，精英视角，底层共情，自我中心该用户表现出对民生问题的关注，同时在转发和评论中展现出对经济政策的批评态度。他/她具有较高的活跃度，转发内容涉及多个领域，包括购物攻略、美食推荐、社会新闻等。用户在表达上倾向于情绪宣泄和自我中心，同时关注底层共情和精英视角。,根据以上信息，我们可以得出如下结论：- 大多数网友都是反对日本进入我国内水的行为，认为这是严重挑衅和侵略行为；少数人则表达了不同的看法，如支持或者不置可否。- 讨论的主题涉及国家安全问题，引起了广泛的关注和热议。- 在情绪上，大多数网友表现出了强烈的不满和愤慨，而一些人则是感到担忧和不安。- 对于言论的内容，大多数人认为真实可靠，但也有人提出了一些疑问和批评。- 关于行动上的态度，绝大多数人都选择了转发和评论，以表达自己的立场和想法。综上所述，可以看出这次讨论是一个非常重要的事件，引发了广泛的争议和思考。虽然存在不同的人群有不同的看法和反应方式，但是大家都希望能够维护中国的主权和安全利益，同时也呼吁政府采取更加有力的措施来应对这一挑战。,0.0178571428571428,0.1875,0.7946428571428571,0.0625,0.25,0.6875,0.0,0.1875,0.8125,0.0,0.0625,0.9375,0.0625,0.1875,0.75,0.0,0.25,0.75,0.0,0.1875,0.8125,0.1875,0.125,0.6875,0.0625,0.1875,0.75,0.0,0.5,0.5,0.0,0.5,0.5,0.0,0.5,0.5
8,速度看中央4台《今日关注》，老胡同志已下令，如果日本有闯入钓鱼岛及其附属岛屿12海里以内，中国海军部队可以立即向其进行军事打击。哈哈，大快人心。,1344567595,[鼓掌],对体制和政策持有批判态度，但未表现出极端反对情绪宣泄，反讽嘲弄，攻击性强，关注民生，自我中心该用户对体制和政策持有批判态度，经常转发和评论与政治和社会问题相关的微博。其表达方式以情绪宣泄和反讽为主，关注民生问题，并表现出一定的自我中心倾向。在社交媒体上，该用户活跃度高，经常参与讨论，对现实问题有较强的反应和表达欲望。,[''],0.0234375,0.1953125,0.78125,0.0,0.1875,0.8125,0.0,0.0625,0.9375,0.0625,0.1875,0.75,0.0,0.25,0.75,0.0,0.1875,0.8125,0.1875,0.125,0.6875,0.0625,0.1875,0.75,0.0,0.5,0.5,0.0,0.5,0.5,0.0,0.5,0.5,0.0,0.5,0.5
8,速度看中央4台《今日关注》，老胡同志已下令，如果日本有闯入钓鱼岛及其附属岛屿12海里以内，中国海军部队可以立即向其进行军事打击。哈哈，大快人心。,1807873211,是需要一场战争！,温和建制派，对日常生活话题有较强兴趣，转发内容多与娱乐、美食相关情绪宣泄，关注民生，自我中心，幽默风趣，攻击性强该用户表现出温和的体制拥护态度，对日常生活话题有浓厚兴趣，转发内容多涉及娱乐、美食等轻松话题。在表达上，善于使用幽默和情绪化的语言，关注个人情感和日常生活。作为高频活跃者，该用户在社交媒体上积极参与互动，展现出较强的社交活跃度。,[''],0.0234375,0.1953125,0.78125,0.0,0.1875,0.8125,0.0,0.0625,0.9375,0.0625,0.1875,0.75,0.0,0.25,0.75,0.0,0.1875,0.8125,0.1875,0.125,0.6875,0.0625,0.1875,0.75,0.0,0.5,0.5,0.0,0.5,0.5,0.0,0.5,0.5,0.0,0.5,0.5
8,速度看中央4台《今日关注》，老胡同志已下令，如果日本有闯入钓鱼岛及其附属岛屿12海里以内，中国海军部队可以立即向其进行军事打击。哈哈，大快人心。,1950274872,[奥特曼][奥特曼][威武],转发内容多样，包括旅行、社会现象、健康养生等，显示对生活有积极态度，但未表现出强烈的政治立场。情绪宣泄，关注民生，精英视角，底层共情，自我中心该用户关注生活各个方面，对健康养生有浓厚兴趣，转发内容多样，显示其关注社会现象和民生问题。在表达上，既有情绪宣泄，也有对生活的积极态度。在政治倾向上，较为温和，未表现出强烈的立场。,[''],0.0234375,0.1953125,0.78125,0.0,0.1875,0.8125,0.0,0.0625,0.9375,0.0625,0.1875,0.75,0.0,0.25,0.75,0.0,0.1875,0.8125,0.1875,0.125,0.6875,0.0625,0.1875,0.75,0.0,0.5,0.5,0.0,0.5,0.5,0.0,0.5,0.5,0.0,0.5,0.5
8,速度看中央4台《今日关注》，老胡同志已下令，如果日本有闯入钓鱼岛及其附属岛屿12海里以内，中国海军部队可以立即向其进行军事打击。哈哈，大快人心。,1835997027,打！！,表现出一定的消极情绪和对现状的不满，但未明确表现出强烈的政治立场情绪宣泄，悲观抱怨，关注民生，自我中心该用户表现出一定的消极情绪和对现状的不满，但同时也关注民生问题。在表达上，倾向于情绪宣泄和个人情感释放，同时表现出对自身利益的关注。在社交活动中，以普通参与者的身份出现，对事件的态度较为被动，更倾向于表达个人感受而非主动引导舆论。,[''],0.0234375,0.1953125,0.78125,0.0,0.1875,0.8125,0.0,0.0625,0.9375,0.0625,0.1875,0.75,0.0,0.25,0.75,0.0,0.1875,0.8125,0.1875,0.125,0.6875,0.0625,0.1875,0.75,0.0,0.5,0.5,0.0,0.5,0.5,0.0,0.5,0.5,0.0,0.5,0.5
