time_step,topic,uid,real_comments,profile_text,batch_mf,pre_pos,pre_neu,pre_neg,dist_t0_pos,dist_t0_neu,dist_t0_neg,dist_t1_pos,dist_t1_neu,dist_t1_neg,dist_t2_pos,dist_t2_neu,dist_t2_neg,dist_t3_pos,dist_t3_neu,dist_t3_neg,dist_t4_pos,dist_t4_neu,dist_t4_neg,dist_t5_pos,dist_t5_neu,dist_t5_neg,dist_t6_pos,dist_t6_neu,dist_t6_neg,dist_t7_pos,dist_t7_neu,dist_t7_neg,dist_t8_pos,dist_t8_neu,dist_t8_neg,dist_t9_pos,dist_t9_neu,dist_t9_neg,dist_t10_pos,dist_t10_neu,dist_t10_neg
19,洋毒食——国家质检总局进口不合格食品黑榜：挪威的大西洋鲑鱼，检出副溶血性弧菌，被销毁。韩国进口的乐天牌巧克力粒，德国进口的欧尚85%黑巧克力，均发现铜超标，被退货或销毁。丹麦奇新蓝罐有限公司生产的曲奇(饼干)，大肠菌群超标，被销毁。（北京晚报）tks@魔都吃货攻略,2938241033,天哪!这年头还能吃啥！,转发内容多为官方或正面信息，显示对体制的认同，但转发内容涉及面较广，可能对某些政策或现象持有保留态度情绪宣泄，关注民生，精英视角，底层共情，自我中心该用户对体制持认同态度，转发内容多为官方或正面信息，显示对稳定和秩序的追求。同时，用户关注民生问题，并保持自我中心的立场。在表达上，用户倾向于情绪宣泄和关注民生，同时展现出精英视角和底层共情。作为高频活跃者，用户在社交媒体上积极参与讨论，但可能缺乏独立思考，容易受到群体压力的影响。,根据上述资料可以得出如下结论：首先，在立场分布上，大多数网友持反对态度，认为进口食品存在质量问题或者安全隐患；其次，在观点分布上，大家普遍关注食品安全问题，希望政府加强对进口食品的安全监管力度；再次，在情绪分布上，大多数人感到担心和不满，少数人则表现出乐观的态度；最后，在行为分布上，多数网友选择转发相关信息以引起更多人的注意。从话题的真实性和发言意图来看，虽然部分网友表达了怀疑和不信任感，但整体而言，他们的目的是为了传递真实的信息，促进公众对食品安全的认知和重视。,0.0361842105263157,0.3289473684210526,0.6348684210526315,0.0,0.5,0.5,0.0625,0.1875,0.75,0.0,0.25,0.75,0.0,0.4375,0.5625,0.0625,0.375,0.5625,0.0,0.5,0.5,0.0,0.1111111111111111,0.8888888888888888,0.0,0.1111111111111111,0.8888888888888888,0.0,0.1111111111111111,0.8888888888888888,0.0,0.1111111111111111,0.8888888888888888,0.0,0.1111111111111111,0.8888888888888888
19,洋毒食——国家质检总局进口不合格食品黑榜：挪威的大西洋鲑鱼，检出副溶血性弧菌，被销毁。韩国进口的乐天牌巧克力粒，德国进口的欧尚85%黑巧克力，均发现铜超标，被退货或销毁。丹麦奇新蓝罐有限公司生产的曲奇(饼干)，大肠菌群超标，被销毁。（北京晚报）tks@魔都吃货攻略,1762702891,ou~~~~哎,对新技术和产品持积极态度，但对某些社会议题表现出批判性思考情绪宣泄，关注民生，精英视角，自我中心，逻辑缜密该用户对新技术和产品表现出浓厚的兴趣，乐于分享和体验。在表达个人观点时，既关注民生问题，又保持一定的精英视角。对社会议题持有批判性思考，但总体上倾向于温和建制派立场。在语言风格上，逻辑性强，但有时会表现出情绪化的倾向。作为高频活跃者，该用户在社交媒体上积极参与讨论，并具有一定的影响力。,根据上述资料可以得出如下结论：首先，在立场分布上，大多数网友持反对态度，认为进口食品存在质量问题或者安全隐患；其次，在观点分布上，大家普遍关注食品安全问题，希望政府加强对进口食品的安全监管力度；再次，在情绪分布上，大多数人感到担心和不满，少数人则表现出乐观的态度；最后，在行为分布上，多数网友选择转发相关信息以引起更多人的注意。从话题的真实性和发言意图来看，虽然部分网友表达了怀疑和不信任感，但整体而言，他们的目的是为了传递真实的信息，促进公众对食品安全的认知和重视。,0.0361842105263157,0.3289473684210526,0.6348684210526315,0.0,0.5,0.5,0.0625,0.1875,0.75,0.0,0.25,0.75,0.0,0.4375,0.5625,0.0625,0.375,0.5625,0.0,0.5,0.5,0.0,0.1111111111111111,0.8888888888888888,0.0,0.1111111111111111,0.8888888888888888,0.0,0.1111111111111111,0.8888888888888888,0.0,0.1111111111111111,0.8888888888888888,0.0,0.1111111111111111,0.8888888888888888
19,洋毒食——国家质检总局进口不合格食品黑榜：挪威的大西洋鲑鱼，检出副溶血性弧菌，被销毁。韩国进口的乐天牌巧克力粒，德国进口的欧尚85%黑巧克力，均发现铜超标，被退货或销毁。丹麦奇新蓝罐有限公司生产的曲奇(饼干)，大肠菌群超标，被销毁。（北京晚报）tks@魔都吃货攻略,2551241711,这不是马士基出品的么,用户内容以日常生活和个人情感为主，无明显政治立场倾向情绪宣泄，关注民生，自我中心，宏大叙事，底层共情该用户关注日常生活和个人情感，对政治和社会议题较少关注。在表达上，倾向于情绪宣泄和自我表达，同时也会关注家庭和孩子的成长。在社交网络上，该用户表现为一个普通参与者，偶尔分享个人生活点滴，对周围环境的变化反应较为直接。,根据上述资料可以得出如下结论：首先，在立场分布上，大多数网友持反对态度，认为进口食品存在质量问题或者安全隐患；其次，在观点分布上，大家普遍关注食品安全问题，希望政府加强对进口食品的安全监管力度；再次，在情绪分布上，大多数人感到担心和不满，少数人则表现出乐观的态度；最后，在行为分布上，多数网友选择转发相关信息以引起更多人的注意。从话题的真实性和发言意图来看，虽然部分网友表达了怀疑和不信任感，但整体而言，他们的目的是为了传递真实的信息，促进公众对食品安全的认知和重视。,0.0361842105263157,0.3289473684210526,0.6348684210526315,0.0,0.5,0.5,0.0625,0.1875,0.75,0.0,0.25,0.75,0.0,0.4375,0.5625,0.0625,0.375,0.5625,0.0,0.5,0.5,0.0,0.1111111111111111,0.8888888888888888,0.0,0.1111111111111111,0.8888888888888888,0.0,0.1111111111111111,0.8888888888888888,0.0,0.1111111111111111,0.8888888888888888,0.0,0.1111111111111111,0.8888888888888888
19,洋毒食——国家质检总局进口不合格食品黑榜：挪威的大西洋鲑鱼，检出副溶血性弧菌，被销毁。韩国进口的乐天牌巧克力粒，德国进口的欧尚85%黑巧克力，均发现铜超标，被退货或销毁。丹麦奇新蓝罐有限公司生产的曲奇(饼干)，大肠菌群超标，被销毁。（北京晚报）tks@魔都吃货攻略,2079503831,不要吃最好,对科技产品持开放态度，但对社会现象和政策有个人见解关注民生，精英视角，自我中心，情绪宣泄，宏大叙事该用户关注科技动态，对新产品和技术持开放态度，同时在个人生活中表现出对家庭和工作的重视。他善于表达个人情感，同时对社会现象和政策有自己的见解。在社交网络上，他活跃度高，乐于分享个人经历和观点，展现出自我中心的特征。,根据上述资料可以得出如下结论：首先，在立场分布上，大多数网友持反对态度，认为进口食品存在质量问题或者安全隐患；其次，在观点分布上，大家普遍关注食品安全问题，希望政府加强对进口食品的安全监管力度；再次，在情绪分布上，大多数人感到担心和不满，少数人则表现出乐观的态度；最后，在行为分布上，多数网友选择转发相关信息以引起更多人的注意。从话题的真实性和发言意图来看，虽然部分网友表达了怀疑和不信任感，但整体而言，他们的目的是为了传递真实的信息，促进公众对食品安全的认知和重视。,0.0361842105263157,0.3289473684210526,0.6348684210526315,0.0,0.5,0.5,0.0625,0.1875,0.75,0.0,0.25,0.75,0.0,0.4375,0.5625,0.0625,0.375,0.5625,0.0,0.5,0.5,0.0,0.1111111111111111,0.8888888888888888,0.0,0.1111111111111111,0.8888888888888888,0.0,0.1111111111111111,0.8888888888888888,0.0,0.1111111111111111,0.8888888888888888,0.0,0.1111111111111111,0.8888888888888888
19,洋毒食——国家质检总局进口不合格食品黑榜：挪威的大西洋鲑鱼，检出副溶血性弧菌，被销毁。韩国进口的乐天牌巧克力粒，德国进口的欧尚85%黑巧克力，均发现铜超标，被退货或销毁。丹麦奇新蓝罐有限公司生产的曲奇(饼干)，大肠菌群超标，被销毁。（北京晚报）tks@魔都吃货攻略,2826117290,转发微博,对某些官方或正面内容表示认同，但更倾向于分享个人情感和生活体验情绪宣泄，宏大叙事，关注民生，自我中心，阴阳怪气该用户表现出温和的建制派倾向，关注个人情感和生活体验的分享。在表达上，倾向于情绪宣泄和宏大叙事，同时关注民生问题。用户在转发内容时，更倾向于情感煽动，表现出对情感共鸣的追求。在政治倾向上，用户既关注个人情感，又认同社会秩序和稳定。,根据上述资料可以得出如下结论：首先，在立场分布上，大多数网友持反对态度，认为进口食品存在质量问题或者安全隐患；其次，在观点分布上，大家普遍关注食品安全问题，希望政府加强对进口食品的安全监管力度；再次，在情绪分布上，大多数人感到担心和不满，少数人则表现出乐观的态度；最后，在行为分布上，多数网友选择转发相关信息以引起更多人的注意。从话题的真实性和发言意图来看，虽然部分网友表达了怀疑和不信任感，但整体而言，他们的目的是为了传递真实的信息，促进公众对食品安全的认知和重视。,0.0361842105263157,0.3289473684210526,0.6348684210526315,0.0,0.5,0.5,0.0625,0.1875,0.75,0.0,0.25,0.75,0.0,0.4375,0.5625,0.0625,0.375,0.5625,0.0,0.5,0.5,0.0,0.1111111111111111,0.8888888888888888,0.0,0.1111111111111111,0.8888888888888888,0.0,0.1111111111111111,0.8888888888888888,0.0,0.1111111111111111,0.8888888888888888,0.0,0.1111111111111111,0.8888888888888888
19,洋毒食——国家质检总局进口不合格食品黑榜：挪威的大西洋鲑鱼，检出副溶血性弧菌，被销毁。韩国进口的乐天牌巧克力粒，德国进口的欧尚85%黑巧克力，均发现铜超标，被退货或销毁。丹麦奇新蓝罐有限公司生产的曲奇(饼干)，大肠菌群超标，被销毁。（北京晚报）tks@魔都吃货攻略,1992660072,转发微博,情绪宣泄，关注民生，精英视角该用户表现出温和的建制派倾向，关注家庭和社会的和谐。在转发内容中，表现出对明星家庭关系的关注，显示出对家庭温暖和亲情的向往。语言风格偏向情绪宣泄，关注民生问题，同时带有一定的精英视角。在社交活动中，该用户更倾向于作为普通参与者，对事件持温和态度，期待和谐的社会环境。,根据上述资料可以得出如下结论：首先，在立场分布上，大多数网友持反对态度，认为进口食品存在质量问题或者安全隐患；其次，在观点分布上，大家普遍关注食品安全问题，希望政府加强对进口食品的安全监管力度；再次，在情绪分布上，大多数人感到担心和不满，少数人则表现出乐观的态度；最后，在行为分布上，多数网友选择转发相关信息以引起更多人的注意。从话题的真实性和发言意图来看，虽然部分网友表达了怀疑和不信任感，但整体而言，他们的目的是为了传递真实的信息，促进公众对食品安全的认知和重视。,0.0361842105263157,0.3289473684210526,0.6348684210526315,0.0,0.5,0.5,0.0625,0.1875,0.75,0.0,0.25,0.75,0.0,0.4375,0.5625,0.0625,0.375,0.5625,0.0,0.5,0.5,0.0,0.1111111111111111,0.8888888888888888,0.0,0.1111111111111111,0.8888888888888888,0.0,0.1111111111111111,0.8888888888888888,0.0,0.1111111111111111,0.8888888888888888,0.0,0.1111111111111111,0.8888888888888888
19,洋毒食——国家质检总局进口不合格食品黑榜：挪威的大西洋鲑鱼，检出副溶血性弧菌，被销毁。韩国进口的乐天牌巧克力粒，德国进口的欧尚85%黑巧克力，均发现铜超标，被退货或销毁。丹麦奇新蓝罐有限公司生产的曲奇(饼干)，大肠菌群超标，被销毁。（北京晚报）tks@魔都吃货攻略,2391649842,那tmd我们连白米饭都吃不上了。,转发内容多涉及官方和正面信息，显示对体制的认同，但偶尔转发涉及社会问题的内容，可能对某些政策或现象持有保留态度情绪宣泄，关注民生，精英视角，底层共情，自我中心该用户对体制持有一定程度的认同，但同时也关注社会问题，转发内容多涉及官方和正面信息，显示对群体压力的敏感性。在表达上，倾向于情绪宣泄和关注民生，同时具有精英视角和底层共情的特点。在政治倾向上，可能表现为对体制的复杂性有认识，对不同类型事件可能既有支持也有批判，语言风格特征为情绪化且关注社会现实。,根据上述资料可以得出如下结论：首先，在立场分布上，大多数网友持反对态度，认为进口食品存在质量问题或者安全隐患；其次，在观点分布上，大家普遍关注食品安全问题，希望政府加强对进口食品的安全监管力度；再次，在情绪分布上，大多数人感到担心和不满，少数人则表现出乐观的态度；最后，在行为分布上，多数网友选择转发相关信息以引起更多人的注意。从话题的真实性和发言意图来看，虽然部分网友表达了怀疑和不信任感，但整体而言，他们的目的是为了传递真实的信息，促进公众对食品安全的认知和重视。,0.0361842105263157,0.3289473684210526,0.6348684210526315,0.0,0.5,0.5,0.0625,0.1875,0.75,0.0,0.25,0.75,0.0,0.4375,0.5625,0.0625,0.375,0.5625,0.0,0.5,0.5,0.0,0.1111111111111111,0.8888888888888888,0.0,0.1111111111111111,0.8888888888888888,0.0,0.1111111111111111,0.8888888888888888,0.0,0.1111111111111111,0.8888888888888888,0.0,0.1111111111111111,0.8888888888888888
20,洋毒食——国家质检总局进口不合格食品黑榜：挪威的大西洋鲑鱼，检出副溶血性弧菌，被销毁。韩国进口的乐天牌巧克力粒，德国进口的欧尚85%黑巧克力，均发现铜超标，被退货或销毁。丹麦奇新蓝罐有限公司生产的曲奇(饼干)，大肠菌群超标，被销毁。（北京晚报）tks@魔都吃货攻略,2802335120,算了切切之前阿拉一直买额静安面包房西点切切看切切看伐特班丫[偷笑][偷笑][偷笑],对体育明星的支持表现出对国家体育事业的认同，但具体政策态度不明情绪宣泄，关注民生，精英视角，自我中心，盲目乐观该用户表现出对体育事业的极大热情，尤其是对国乒运动员的支持。在表达上，情绪化较强，关注民生议题，同时具有精英视角和自我中心的倾向。在语言风格上，倾向于盲目乐观，对国家荣誉的追求是其言行的底层逻辑。作为高频活跃者，该用户在社交媒体上积极参与讨论，但具体政策态度和价值观有待进一步了解。,[''],0.034375,0.3375,0.628125,0.0625,0.1875,0.75,0.0,0.25,0.75,0.0,0.4375,0.5625,0.0625,0.375,0.5625,0.0,0.5,0.5,0.0,0.1111111111111111,0.8888888888888888,0.0,0.1111111111111111,0.8888888888888888,0.0,0.1111111111111111,0.8888888888888888,0.0,0.1111111111111111,0.8888888888888888,0.0,0.1111111111111111,0.8888888888888888,0.0,0.1111111111111111,0.8888888888888888
20,洋毒食——国家质检总局进口不合格食品黑榜：挪威的大西洋鲑鱼，检出副溶血性弧菌，被销毁。韩国进口的乐天牌巧克力粒，德国进口的欧尚85%黑巧克力，均发现铜超标，被退货或销毁。丹麦奇新蓝罐有限公司生产的曲奇(饼干)，大肠菌群超标，被销毁。（北京晚报）tks@魔都吃货攻略,1821076804,我还囤着一盒呢！,频繁发布与生日相关的博文，并转发娱乐内容，表现出一种轻松愉快的氛围，但缺乏明确的立场和价值观。情绪宣泄，盲目乐观，关注民生，自我中心这位用户似乎是一个追求快乐和轻松生活的人，经常在社交媒体上分享与生日、娱乐相关的内容。他们对于社会和政治问题缺乏明确的立场，更倾向于关注个人情感和娱乐活动。在语言风格上，他们表现出情绪化的特点，同时也有自我中心的倾向。,[''],0.034375,0.3375,0.628125,0.0625,0.1875,0.75,0.0,0.25,0.75,0.0,0.4375,0.5625,0.0625,0.375,0.5625,0.0,0.5,0.5,0.0,0.1111111111111111,0.8888888888888888,0.0,0.1111111111111111,0.8888888888888888,0.0,0.1111111111111111,0.8888888888888888,0.0,0.1111111111111111,0.8888888888888888,0.0,0.1111111111111111,0.8888888888888888,0.0,0.1111111111111111,0.8888888888888888
20,洋毒食——国家质检总局进口不合格食品黑榜：挪威的大西洋鲑鱼，检出副溶血性弧菌，被销毁。韩国进口的乐天牌巧克力粒，德国进口的欧尚85%黑巧克力，均发现铜超标，被退货或销毁。丹麦奇新蓝罐有限公司生产的曲奇(饼干)，大肠菌群超标，被销毁。（北京晚报）tks@魔都吃货攻略,2026688683,以后就啥都不要吃了,转发官方和正面内容较多，但未表现出明显的反讽或潜台词，倾向于温和建制派情绪宣泄，关注民生，精英视角，自我中心该用户表现出对生活的热爱和对娱乐的追求，转发内容以官方和正面信息为主，同时关注民生话题，体现出一定的精英视角。在表达上，情绪宣泄和自我中心的特点较为明显。对于不同类型的事件，该用户可能会表现出对个人兴趣的关注，同时也会对社会热点事件有所关注，并倾向于从个人角度出发进行评论。语言风格上，既有情绪化的表达，也有对生活细节的关注，体现出多元化的表达方式。,[''],0.034375,0.3375,0.628125,0.0625,0.1875,0.75,0.0,0.25,0.75,0.0,0.4375,0.5625,0.0625,0.375,0.5625,0.0,0.5,0.5,0.0,0.1111111111111111,0.8888888888888888,0.0,0.1111111111111111,0.8888888888888888,0.0,0.1111111111111111,0.8888888888888888,0.0,0.1111111111111111,0.8888888888888888,0.0,0.1111111111111111,0.8888888888888888,0.0,0.1111111111111111,0.8888888888888888
20,洋毒食——国家质检总局进口不合格食品黑榜：挪威的大西洋鲑鱼，检出副溶血性弧菌，被销毁。韩国进口的乐天牌巧克力粒，德国进口的欧尚85%黑巧克力，均发现铜超标，被退货或销毁。丹麦奇新蓝罐有限公司生产的曲奇(饼干)，大肠菌群超标，被销毁。（北京晚报）tks@魔都吃货攻略,1806762263,Oh，五好送咯！广而告之[衰][衰][衰],对奢侈品品牌和官方活动有较高兴趣，但转发内容中未表现出明显的反讽或反对态度情绪宣泄，关注民生，精英视角，自我中心该用户对奢侈品品牌和官方活动有较高的兴趣，转发内容多与时尚、品牌相关，同时关注民生话题。在表达上，倾向于情绪宣泄和自我中心，表现出一定的精英视角。在舆论环境中，可能扮演着意见领袖的角色，对品牌和官方活动的态度可能对周围人产生影响。,[''],0.034375,0.3375,0.628125,0.0625,0.1875,0.75,0.0,0.25,0.75,0.0,0.4375,0.5625,0.0625,0.375,0.5625,0.0,0.5,0.5,0.0,0.1111111111111111,0.8888888888888888,0.0,0.1111111111111111,0.8888888888888888,0.0,0.1111111111111111,0.8888888888888888,0.0,0.1111111111111111,0.8888888888888888,0.0,0.1111111111111111,0.8888888888888888,0.0,0.1111111111111111,0.8888888888888888
20,洋毒食——国家质检总局进口不合格食品黑榜：挪威的大西洋鲑鱼，检出副溶血性弧菌，被销毁。韩国进口的乐天牌巧克力粒，德国进口的欧尚85%黑巧克力，均发现铜超标，被退货或销毁。丹麦奇新蓝罐有限公司生产的曲奇(饼干)，大肠菌群超标，被销毁。（北京晚报）tks@魔都吃货攻略,2488116893,//@酷爱latte-小Jenny://@菩提之心存心中: [汗]蓝罐曲奇今天吃饭时还看见他广告做的轰轰烈烈呢,对个人生活有批判态度，对某些社会现象持有质疑和反思。情绪宣泄，反讽嘲弄，关注民生，自我中心该用户表现出对个人自由的强烈追求，对某些社会现象持有批判态度。在表达上，喜欢使用反讽和情绪化的语言，关注个人生活，同时表现出一定的自我中心倾向。在社交网络中活跃，经常转发和评论各种内容，显示出对各种话题的高度关注。,[''],0.034375,0.3375,0.628125,0.0625,0.1875,0.75,0.0,0.25,0.75,0.0,0.4375,0.5625,0.0625,0.375,0.5625,0.0,0.5,0.5,0.0,0.1111111111111111,0.8888888888888888,0.0,0.1111111111111111,0.8888888888888888,0.0,0.1111111111111111,0.8888888888888888,0.0,0.1111111111111111,0.8888888888888888,0.0,0.1111111111111111,0.8888888888888888,0.0,0.1111111111111111,0.8888888888888888
20,洋毒食——国家质检总局进口不合格食品黑榜：挪威的大西洋鲑鱼，检出副溶血性弧菌，被销毁。韩国进口的乐天牌巧克力粒，德国进口的欧尚85%黑巧克力，均发现铜超标，被退货或销毁。丹麦奇新蓝罐有限公司生产的曲奇(饼干)，大肠菌群超标，被销毁。（北京晚报）tks@魔都吃货攻略,1783312895,转发微博,关注军事动态，对政府楼盘点持批评态度，转发内容涉及媒体责任和环境保护问题，显示对现状的不满和对变革的渴望情绪宣泄，关注民生，批判性强，政治隐喻，关注社会问题该用户关注社会动态，对政府和社会问题持有批判态度，善于表达自己的情绪和观点。在转发和评论中，他经常表现出对社会不公和环境污染的关注，以及对媒体责任的质疑。他的语言风格带有一定的政治隐喻，表现出对社会现象的深刻洞察。在政治倾向上，他更倾向于批判变革类，但同时也展现出对民生问题的关注。,[''],0.034375,0.3375,0.628125,0.0625,0.1875,0.75,0.0,0.25,0.75,0.0,0.4375,0.5625,0.0625,0.375,0.5625,0.0,0.5,0.5,0.0,0.1111111111111111,0.8888888888888888,0.0,0.1111111111111111,0.8888888888888888,0.0,0.1111111111111111,0.8888888888888888,0.0,0.1111111111111111,0.8888888888888888,0.0,0.1111111111111111,0.8888888888888888,0.0,0.1111111111111111,0.8888888888888888
20,洋毒食——国家质检总局进口不合格食品黑榜：挪威的大西洋鲑鱼，检出副溶血性弧菌，被销毁。韩国进口的乐天牌巧克力粒，德国进口的欧尚85%黑巧克力，均发现铜超标，被退货或销毁。丹麦奇新蓝罐有限公司生产的曲奇(饼干)，大肠菌群超标，被销毁。（北京晚报）tks@魔都吃货攻略,1859479972,还好没买,关注民生，对特定事件有强烈情感反应，对政治事件有批判态度情绪宣泄，关注民生，攻击性强，宏大叙事，自我中心该用户表现出对民生问题的关注和对特定事件的强烈情感反应，同时在表达上具有攻击性和自我中心的特点。在政治事件上，该用户倾向于批判态度，同时受到情绪煽动的影响较大。该用户在社交媒体上活跃度高，喜欢分享个人观点和对社会事件的评论，表现出对群体利益的关注和对社会公正的追求。,[''],0.034375,0.3375,0.628125,0.0625,0.1875,0.75,0.0,0.25,0.75,0.0,0.4375,0.5625,0.0625,0.375,0.5625,0.0,0.5,0.5,0.0,0.1111111111111111,0.8888888888888888,0.0,0.1111111111111111,0.8888888888888888,0.0,0.1111111111111111,0.8888888888888888,0.0,0.1111111111111111,0.8888888888888888,0.0,0.1111111111111111,0.8888888888888888,0.0,0.1111111111111111,0.8888888888888888
20,洋毒食——国家质检总局进口不合格食品黑榜：挪威的大西洋鲑鱼，检出副溶血性弧菌，被销毁。韩国进口的乐天牌巧克力粒，德国进口的欧尚85%黑巧克力，均发现铜超标，被退货或销毁。丹麦奇新蓝罐有限公司生产的曲奇(饼干)，大肠菌群超标，被销毁。（北京晚报）tks@魔都吃货攻略,1742249355,以后都自己做,关注民生，对特定事件有强烈情感反应，对政治事件有批判态度情绪宣泄，关注民生，攻击性强，宏大叙事，自我中心该用户表现出对民生问题的关注和对特定事件的强烈情感反应，同时在表达上具有攻击性和自我中心的特点。在政治事件上，该用户倾向于批判态度，同时受到情绪煽动的影响较大。该用户在社交媒体上活跃度高，喜欢分享个人观点和对社会事件的评论，表现出对群体利益的关注和对社会公正的追求。,[''],0.034375,0.3375,0.628125,0.0625,0.1875,0.75,0.0,0.25,0.75,0.0,0.4375,0.5625,0.0625,0.375,0.5625,0.0,0.5,0.5,0.0,0.1111111111111111,0.8888888888888888,0.0,0.1111111111111111,0.8888888888888888,0.0,0.1111111111111111,0.8888888888888888,0.0,0.1111111111111111,0.8888888888888888,0.0,0.1111111111111111,0.8888888888888888,0.0,0.1111111111111111,0.8888888888888888
