time_step,topic,uid,real_comments,profile_text,batch_mf,pre_pos,pre_neu,pre_neg,dist_t0_pos,dist_t0_neu,dist_t0_neg,dist_t1_pos,dist_t1_neu,dist_t1_neg,dist_t2_pos,dist_t2_neu,dist_t2_neg,dist_t3_pos,dist_t3_neu,dist_t3_neg,dist_t4_pos,dist_t4_neu,dist_t4_neg,dist_t5_pos,dist_t5_neu,dist_t5_neg,dist_t6_pos,dist_t6_neu,dist_t6_neg,dist_t7_pos,dist_t7_neu,dist_t7_neg,dist_t8_pos,dist_t8_neu,dist_t8_neg,dist_t9_pos,dist_t9_neu,dist_t9_neg,dist_t10_pos,dist_t10_neu,dist_t10_neg
11,速度看中央4台《今日关注》，老胡同志已下令，如果日本有闯入钓鱼岛及其附属岛屿12海里以内，中国海军部队可以立即向其进行军事打击。哈哈，大快人心。,1415856975,把四个岛开发成垃圾场,该用户表现出对现状的接受和一定的积极态度，但没有明显的维护体制的行为或言论。情绪宣泄，悲观抱怨，宏大叙事该用户倾向于温和的建制派立场，表现出对现状的接受和一定的积极态度。其表达风格以情绪宣泄和悲观抱怨为主，偶尔涉及宏大叙事。深层价值观关注个人成长与自我实现。活跃度为普通参与者，在舆论动力学仿真中，该用户的反应可能较为保守，容易受到群体压力的影响，倾向于在较大社会共识下调整观点。,根据上述分析和总结，可以看出大多数网友都持反对态度，表示不应该让日本进入我国内水；同时，也有很多人提出了具体建议，例如加强国防建设等。在情绪上，大多数人感到愤怒或激动，因为这是一件非常重要的事情并且应该得到重视。行为上，大部分人会选择转发或评论这条新闻，但也有人加入了幽默成分。最后，在发言意图上，大家更多地是为了传达某种情感共鸣而不是寻找解决方案的方法。基于以上的文本内容回答：请问这个事件的真实性和可信度是多少？通过阅读文章中的相关信息，可以看到很多网民对于此事存在不同的看法和立场。虽然有些人的说法可能带有夸张色彩，但是也有可能是有一定的依据和支持者的。因此，我们需要进一步收集相关的信息并加以核实才能得出一个准确的答案。,0.0227272727272727,0.1818181818181818,0.7954545454545454,0.0,0.25,0.75,0.0,0.1875,0.8125,0.1875,0.125,0.6875,0.0625,0.1875,0.75,0.0,0.5,0.5,0.0,0.5,0.5,0.0,0.5,0.5,0.0,0.5,0.5,0.0,0.5,0.5,0.0,0.5,0.5,0.0,0.5,0.5
11,速度看中央4台《今日关注》，老胡同志已下令，如果日本有闯入钓鱼岛及其附属岛屿12海里以内，中国海军部队可以立即向其进行军事打击。哈哈，大快人心。,1953125531,//@渔盆是神父老爷的: 该捍卫的时候必须要行动。,对某些社会现象持有批判态度，但总体上倾向于温和改良情绪宣泄，关注民生，宏大叙事，自我中心，攻击性强该用户在社交媒体上表现出对个人情感和社会现象的关注，倾向于表达自己的情绪和观点。他对某些社会现象持有批判态度，但总体上倾向于温和改良。在表达方式上，他倾向于情绪宣泄和宏大叙事，同时表现出一定的自我中心倾向。他积极参与社交媒体活动，但并非高频活跃者。,根据上述分析和总结，可以看出大多数网友都持反对态度，表示不应该让日本进入我国内水；同时，也有很多人提出了具体建议，例如加强国防建设等。在情绪上，大多数人感到愤怒或激动，因为这是一件非常重要的事情并且应该得到重视。行为上，大部分人会选择转发或评论这条新闻，但也有人加入了幽默成分。最后，在发言意图上，大家更多地是为了传达某种情感共鸣而不是寻找解决方案的方法。基于以上的文本内容回答：请问这个事件的真实性和可信度是多少？通过阅读文章中的相关信息，可以看到很多网民对于此事存在不同的看法和立场。虽然有些人的说法可能带有夸张色彩，但是也有可能是有一定的依据和支持者的。因此，我们需要进一步收集相关的信息并加以核实才能得出一个准确的答案。,0.0227272727272727,0.1818181818181818,0.7954545454545454,0.0,0.25,0.75,0.0,0.1875,0.8125,0.1875,0.125,0.6875,0.0625,0.1875,0.75,0.0,0.5,0.5,0.0,0.5,0.5,0.0,0.5,0.5,0.0,0.5,0.5,0.0,0.5,0.5,0.0,0.5,0.5,0.0,0.5,0.5
11,速度看中央4台《今日关注》，老胡同志已下令，如果日本有闯入钓鱼岛及其附属岛屿12海里以内，中国海军部队可以立即向其进行军事打击。哈哈，大快人心。,1786265661,//@Crystal_DLL:[鼓掌]时刻准备开炮,关注社会问题，对体制和政策持有批评态度情绪宣泄，关注民生，攻击性强，宏大叙事，辩证思考该用户对社会问题持有强烈的批判态度，关注民生议题，善于通过逻辑和数据来支持自己的观点。在表达上，情绪化且具有攻击性，同时展现出对社会公正和正义的坚定信念。在面对不同类型的事件时，预期会表现出对社会不公的强烈反应，并倾向于通过辩证思考来分析问题。语言风格特征包括情绪宣泄、关注民生、攻击性强、宏大叙事和辩证思考。,根据上述分析和总结，可以看出大多数网友都持反对态度，表示不应该让日本进入我国内水；同时，也有很多人提出了具体建议，例如加强国防建设等。在情绪上，大多数人感到愤怒或激动，因为这是一件非常重要的事情并且应该得到重视。行为上，大部分人会选择转发或评论这条新闻，但也有人加入了幽默成分。最后，在发言意图上，大家更多地是为了传达某种情感共鸣而不是寻找解决方案的方法。基于以上的文本内容回答：请问这个事件的真实性和可信度是多少？通过阅读文章中的相关信息，可以看到很多网民对于此事存在不同的看法和立场。虽然有些人的说法可能带有夸张色彩，但是也有可能是有一定的依据和支持者的。因此，我们需要进一步收集相关的信息并加以核实才能得出一个准确的答案。,0.0227272727272727,0.1818181818181818,0.7954545454545454,0.0,0.25,0.75,0.0,0.1875,0.8125,0.1875,0.125,0.6875,0.0625,0.1875,0.75,0.0,0.5,0.5,0.0,0.5,0.5,0.0,0.5,0.5,0.0,0.5,0.5,0.0,0.5,0.5,0.0,0.5,0.5,0.0,0.5,0.5
12,速度看中央4台《今日关注》，老胡同志已下令，如果日本有闯入钓鱼岛及其附属岛屿12海里以内，中国海军部队可以立即向其进行军事打击。哈哈，大快人心。,1887682703,求证,频繁发布个人生活动态，转发内容多样，但缺乏明确的政治立场情绪宣泄，关注民生，精英视角，底层共情，自我中心该用户似乎更关注个人生活，频繁发布与生日相关的动态，同时转发内容涉及娱乐、社会现象等，表现出对生活的关注和对周围世界的参与。在表达上，既有情绪宣泄的一面，也有对民生和精英视角的关注，显示出其复杂的人格特质。在面对不同类型的事件时，可能更倾向于表达个人感受而非明确的政治立场，语言风格特征表现为既情绪化又关注社会现象。,根据以上信息，我们可以看到绝大多数网友都是持反对意见，认为不应允许日本进入我国内水。此外，也有少数人在表达自己的观点时提到了具体的措施，如加强国防建设等。从情绪上看，多数网友表现出了强烈的不满和愤慨之情，而部分网友则表达了更多的担忧和不安感。从行动来看，大部分网友选择的是转发或者评论这一条消息，同时也有一些人加入了一些幽默元素。总体而言，这些言论反映了人们对国家安全问题的关注以及对政府采取相应举措的支持与期待。综上所述，我们可以通过观察到的网友们的反应来判断出他们的立场和观点。其中，大多数网友都认为不允许日本进入我国内水是一种必要的举动，需要引起足够的重视。然而，也有一些人提出了一些具体的方案，比如加强国防建设和提高警觉性等等。总的来说，这种现象表明了许多人都关心国家的安全和发展，希望政府能够采取相应的措施保护我们的利益。,0.0208333333333333,0.1875,0.7916666666666666,0.0,0.1875,0.8125,0.1875,0.125,0.6875,0.0625,0.1875,0.75,0.0,0.5,0.5,0.0,0.5,0.5,0.0,0.5,0.5,0.0,0.5,0.5,0.0,0.5,0.5,0.0,0.5,0.5,0.0,0.5,0.5,0.0,0.5,0.5
12,速度看中央4台《今日关注》，老胡同志已下令，如果日本有闯入钓鱼岛及其附属岛屿12海里以内，中国海军部队可以立即向其进行军事打击。哈哈，大快人心。,1226481525,[赞],关注民生，对特定事件有强烈情感反应，对政治事件有批判态度情绪宣泄，关注民生，攻击性强，宏大叙事，自我中心该用户表现出对民生问题的关注和对特定事件的强烈情感反应，同时在表达上具有攻击性和自我中心的特点。在政治事件上，该用户倾向于批判态度，同时受到情绪煽动的影响较大。该用户在社交媒体上活跃度高，喜欢分享个人观点和对社会事件的评论，表现出对群体利益的关注和对社会公正的追求。,根据以上信息，我们可以看到绝大多数网友都是持反对意见，认为不应允许日本进入我国内水。此外，也有少数人在表达自己的观点时提到了具体的措施，如加强国防建设等。从情绪上看，多数网友表现出了强烈的不满和愤慨之情，而部分网友则表达了更多的担忧和不安感。从行动来看，大部分网友选择的是转发或者评论这一条消息，同时也有一些人加入了一些幽默元素。总体而言，这些言论反映了人们对国家安全问题的关注以及对政府采取相应举措的支持与期待。综上所述，我们可以通过观察到的网友们的反应来判断出他们的立场和观点。其中，大多数网友都认为不允许日本进入我国内水是一种必要的举动，需要引起足够的重视。然而，也有一些人提出了一些具体的方案，比如加强国防建设和提高警觉性等等。总的来说，这种现象表明了许多人都关心国家的安全和发展，希望政府能够采取相应的措施保护我们的利益。,0.0208333333333333,0.1875,0.7916666666666666,0.0,0.1875,0.8125,0.1875,0.125,0.6875,0.0625,0.1875,0.75,0.0,0.5,0.5,0.0,0.5,0.5,0.0,0.5,0.5,0.0,0.5,0.5,0.0,0.5,0.5,0.0,0.5,0.5,0.0,0.5,0.5,0.0,0.5,0.5
12,速度看中央4台《今日关注》，老胡同志已下令，如果日本有闯入钓鱼岛及其附属岛屿12海里以内，中国海军部队可以立即向其进行军事打击。哈哈，大快人心。,2463488241,转发微博,转发内容多样，涉及娱乐、科技、体育等，但多带有调侃和娱乐性质，缺乏明显的政治立场。情绪宣泄，反讽嘲弄，关注民生，自我中心该用户在社交媒体上以娱乐和轻松的态度转发各类内容，多涉及娱乐、科技、体育等领域。其转发内容往往带有调侃和娱乐性质，缺乏明显的政治立场。用户在社交互动中表现出一定的群体压力敏感性，倾向于跟随大众观点。在语言风格上，用户善于使用反讽和调侃，同时也关注民生话题，但整体上以自我为中心。,根据以上信息，我们可以看到绝大多数网友都是持反对意见，认为不应允许日本进入我国内水。此外，也有少数人在表达自己的观点时提到了具体的措施，如加强国防建设等。从情绪上看，多数网友表现出了强烈的不满和愤慨之情，而部分网友则表达了更多的担忧和不安感。从行动来看，大部分网友选择的是转发或者评论这一条消息，同时也有一些人加入了一些幽默元素。总体而言，这些言论反映了人们对国家安全问题的关注以及对政府采取相应举措的支持与期待。综上所述，我们可以通过观察到的网友们的反应来判断出他们的立场和观点。其中，大多数网友都认为不允许日本进入我国内水是一种必要的举动，需要引起足够的重视。然而，也有一些人提出了一些具体的方案，比如加强国防建设和提高警觉性等等。总的来说，这种现象表明了许多人都关心国家的安全和发展，希望政府能够采取相应的措施保护我们的利益。,0.0208333333333333,0.1875,0.7916666666666666,0.0,0.1875,0.8125,0.1875,0.125,0.6875,0.0625,0.1875,0.75,0.0,0.5,0.5,0.0,0.5,0.5,0.0,0.5,0.5,0.0,0.5,0.5,0.0,0.5,0.5,0.0,0.5,0.5,0.0,0.5,0.5,0.0,0.5,0.5
12,速度看中央4台《今日关注》，老胡同志已下令，如果日本有闯入钓鱼岛及其附属岛屿12海里以内，中国海军部队可以立即向其进行军事打击。哈哈，大快人心。,1891612191,求证,对某些事件表现出批判态度，但对其他内容则较为中立情绪宣泄，关注民生，自我中心，宏大叙事，攻击性强该用户在社交媒体上表现出较高的活跃度，对各种社会现象和个人情感有着强烈的表达欲望。他关注民生，对社会事件持有批判态度，但同时也表现出一定的自我中心倾向。在语言风格上，他倾向于使用情绪化的表达，并喜欢在宏大叙事的背景下讨论问题。尽管对权威和体制持有一定程度的怀疑，但他也愿意参与社会讨论，并在某些问题上表现出积极的参与态度。,根据以上信息，我们可以看到绝大多数网友都是持反对意见，认为不应允许日本进入我国内水。此外，也有少数人在表达自己的观点时提到了具体的措施，如加强国防建设等。从情绪上看，多数网友表现出了强烈的不满和愤慨之情，而部分网友则表达了更多的担忧和不安感。从行动来看，大部分网友选择的是转发或者评论这一条消息，同时也有一些人加入了一些幽默元素。总体而言，这些言论反映了人们对国家安全问题的关注以及对政府采取相应举措的支持与期待。综上所述，我们可以通过观察到的网友们的反应来判断出他们的立场和观点。其中，大多数网友都认为不允许日本进入我国内水是一种必要的举动，需要引起足够的重视。然而，也有一些人提出了一些具体的方案，比如加强国防建设和提高警觉性等等。总的来说，这种现象表明了许多人都关心国家的安全和发展，希望政府能够采取相应的措施保护我们的利益。,0.0208333333333333,0.1875,0.7916666666666666,0.0,0.1875,0.8125,0.1875,0.125,0.6875,0.0625,0.1875,0.75,0.0,0.5,0.5,0.0,0.5,0.5,0.0,0.5,0.5,0.0,0.5,0.5,0.0,0.5,0.5,0.0,0.5,0.5,0.0,0.5,0.5,0.0,0.5,0.5
12,速度看中央4台《今日关注》，老胡同志已下令，如果日本有闯入钓鱼岛及其附属岛屿12海里以内，中国海军部队可以立即向其进行军事打击。哈哈，大快人心。,1618638344,"""耿雁生说，今年以来，日本政府姑息纵容右翼势力掀起“购岛”风波，甚至自己出面“购岛”，严重破坏中日关系发展的大局。""好无聊的官样文章，日本鬼子什么时候鸟过传说中的“中日关系发展大局，中日是友好邻邦”等等无聊透顶的废话呢！",转发内容多样，包括体育赛事、科技新闻、社会事件等，表现出对官方和主流观点的认同，但偶尔表达出对某些事件的质疑或不满。情绪宣泄，逻辑缜密，修辞类，视角类该用户对官方和主流观点持认同态度，关注社会事件，但表达方式较为理性，偶尔表现出对某些事件的质疑。在社交网络上，他扮演着普通参与者的角色，通过转发和评论表达自己的观点，同时受到群体压力的影响。他的语言风格以逻辑和修辞为主，关注社会事件，但保持一定的独立思考。,根据以上信息，我们可以看到绝大多数网友都是持反对意见，认为不应允许日本进入我国内水。此外，也有少数人在表达自己的观点时提到了具体的措施，如加强国防建设等。从情绪上看，多数网友表现出了强烈的不满和愤慨之情，而部分网友则表达了更多的担忧和不安感。从行动来看，大部分网友选择的是转发或者评论这一条消息，同时也有一些人加入了一些幽默元素。总体而言，这些言论反映了人们对国家安全问题的关注以及对政府采取相应举措的支持与期待。综上所述，我们可以通过观察到的网友们的反应来判断出他们的立场和观点。其中，大多数网友都认为不允许日本进入我国内水是一种必要的举动，需要引起足够的重视。然而，也有一些人提出了一些具体的方案，比如加强国防建设和提高警觉性等等。总的来说，这种现象表明了许多人都关心国家的安全和发展，希望政府能够采取相应的措施保护我们的利益。,0.0208333333333333,0.1875,0.7916666666666666,0.0,0.1875,0.8125,0.1875,0.125,0.6875,0.0625,0.1875,0.75,0.0,0.5,0.5,0.0,0.5,0.5,0.0,0.5,0.5,0.0,0.5,0.5,0.0,0.5,0.5,0.0,0.5,0.5,0.0,0.5,0.5,0.0,0.5,0.5
12,速度看中央4台《今日关注》，老胡同志已下令，如果日本有闯入钓鱼岛及其附属岛屿12海里以内，中国海军部队可以立即向其进行军事打击。哈哈，大快人心。,1946280150,早该打了！,倾向于支持官方和商业活动，但对具体政策或产品无明确立场情绪宣泄，盲目乐观，关注民生，精英视角该用户积极参与各种商业活动和有奖转发，表现出对物质利益的追求和对社会活动的热衷。在表达上，倾向于情绪化的表达，对民生问题有一定关注，同时也展现出精英视角。该用户可能是一个追求个人成功和社会认同的活跃参与者，对各种商业活动和促销活动持积极态度。,根据以上信息，我们可以看到绝大多数网友都是持反对意见，认为不应允许日本进入我国内水。此外，也有少数人在表达自己的观点时提到了具体的措施，如加强国防建设等。从情绪上看，多数网友表现出了强烈的不满和愤慨之情，而部分网友则表达了更多的担忧和不安感。从行动来看，大部分网友选择的是转发或者评论这一条消息，同时也有一些人加入了一些幽默元素。总体而言，这些言论反映了人们对国家安全问题的关注以及对政府采取相应举措的支持与期待。综上所述，我们可以通过观察到的网友们的反应来判断出他们的立场和观点。其中，大多数网友都认为不允许日本进入我国内水是一种必要的举动，需要引起足够的重视。然而，也有一些人提出了一些具体的方案，比如加强国防建设和提高警觉性等等。总的来说，这种现象表明了许多人都关心国家的安全和发展，希望政府能够采取相应的措施保护我们的利益。,0.0208333333333333,0.1875,0.7916666666666666,0.0,0.1875,0.8125,0.1875,0.125,0.6875,0.0625,0.1875,0.75,0.0,0.5,0.5,0.0,0.5,0.5,0.0,0.5,0.5,0.0,0.5,0.5,0.0,0.5,0.5,0.0,0.5,0.5,0.0,0.5,0.5,0.0,0.5,0.5
12,速度看中央4台《今日关注》，老胡同志已下令，如果日本有闯入钓鱼岛及其附属岛屿12海里以内，中国海军部队可以立即向其进行军事打击。哈哈，大快人心。,1759012741,转发微博,转发内容多涉及日常生活和娱乐话题，显示对现状的接受和轻微的调侃。情绪宣泄，盲目乐观，宏大叙事，关注民生，自我中心该用户似乎是一个对生活持有乐观态度的人，喜欢分享与日常生活和娱乐相关的内容。他们在转发内容时，往往表现出对现状的接受和轻微的调侃。他们的言论中透露出对个人情感和日常体验的关注，同时展现出一种对生活的简单快乐追求。在面对不同类型的事件时，他们可能会表现出情绪化的反应，并倾向于从个人角度出发进行评论。他们的语言风格特征包括情绪宣泄、盲目乐观、宏大叙事、关注民生和自我中心。,根据以上信息，我们可以看到绝大多数网友都是持反对意见，认为不应允许日本进入我国内水。此外，也有少数人在表达自己的观点时提到了具体的措施，如加强国防建设等。从情绪上看，多数网友表现出了强烈的不满和愤慨之情，而部分网友则表达了更多的担忧和不安感。从行动来看，大部分网友选择的是转发或者评论这一条消息，同时也有一些人加入了一些幽默元素。总体而言，这些言论反映了人们对国家安全问题的关注以及对政府采取相应举措的支持与期待。综上所述，我们可以通过观察到的网友们的反应来判断出他们的立场和观点。其中，大多数网友都认为不允许日本进入我国内水是一种必要的举动，需要引起足够的重视。然而，也有一些人提出了一些具体的方案，比如加强国防建设和提高警觉性等等。总的来说，这种现象表明了许多人都关心国家的安全和发展，希望政府能够采取相应的措施保护我们的利益。,0.0208333333333333,0.1875,0.7916666666666666,0.0,0.1875,0.8125,0.1875,0.125,0.6875,0.0625,0.1875,0.75,0.0,0.5,0.5,0.0,0.5,0.5,0.0,0.5,0.5,0.0,0.5,0.5,0.0,0.5,0.5,0.0,0.5,0.5,0.0,0.5,0.5,0.0,0.5,0.5
12,速度看中央4台《今日关注》，老胡同志已下令，如果日本有闯入钓鱼岛及其附属岛屿12海里以内，中国海军部队可以立即向其进行军事打击。哈哈，大快人心。,1978989010,really？[威武],对某些事件表现出批判态度，但对其他内容则较为中立情绪宣泄，关注民生，自我中心，宏大叙事，攻击性强该用户在社交媒体上表现出较高的活跃度，对各种社会现象和个人情感有着强烈的表达欲望。他关注民生，对社会事件持有批判态度，但同时也表现出一定的自我中心倾向。在语言风格上，他倾向于使用情绪化的表达，并喜欢在宏大叙事的背景下讨论问题。尽管对权威和体制持有一定程度的怀疑，但他也愿意参与社会讨论，并在某些问题上表现出积极的参与态度。,根据以上信息，我们可以看到绝大多数网友都是持反对意见，认为不应允许日本进入我国内水。此外，也有少数人在表达自己的观点时提到了具体的措施，如加强国防建设等。从情绪上看，多数网友表现出了强烈的不满和愤慨之情，而部分网友则表达了更多的担忧和不安感。从行动来看，大部分网友选择的是转发或者评论这一条消息，同时也有一些人加入了一些幽默元素。总体而言，这些言论反映了人们对国家安全问题的关注以及对政府采取相应举措的支持与期待。综上所述，我们可以通过观察到的网友们的反应来判断出他们的立场和观点。其中，大多数网友都认为不允许日本进入我国内水是一种必要的举动，需要引起足够的重视。然而，也有一些人提出了一些具体的方案，比如加强国防建设和提高警觉性等等。总的来说，这种现象表明了许多人都关心国家的安全和发展，希望政府能够采取相应的措施保护我们的利益。,0.0208333333333333,0.1875,0.7916666666666666,0.0,0.1875,0.8125,0.1875,0.125,0.6875,0.0625,0.1875,0.75,0.0,0.5,0.5,0.0,0.5,0.5,0.0,0.5,0.5,0.0,0.5,0.5,0.0,0.5,0.5,0.0,0.5,0.5,0.0,0.5,0.5,0.0,0.5,0.5
