time_step,topic,uid,real_comments,profile_text,batch_mf,pre_pos,pre_neu,pre_neg,dist_t0_pos,dist_t0_neu,dist_t0_neg,dist_t1_pos,dist_t1_neu,dist_t1_neg,dist_t2_pos,dist_t2_neu,dist_t2_neg,dist_t3_pos,dist_t3_neu,dist_t3_neg,dist_t4_pos,dist_t4_neu,dist_t4_neg,dist_t5_pos,dist_t5_neu,dist_t5_neg,dist_t6_pos,dist_t6_neu,dist_t6_neg,dist_t7_pos,dist_t7_neu,dist_t7_neg,dist_t8_pos,dist_t8_neu,dist_t8_neg,dist_t9_pos,dist_t9_neu,dist_t9_neg,dist_t10_pos,dist_t10_neu,dist_t10_neg
7,洋毒食——国家质检总局进口不合格食品黑榜：挪威的大西洋鲑鱼，检出副溶血性弧菌，被销毁。韩国进口的乐天牌巧克力粒，德国进口的欧尚85%黑巧克力，均发现铜超标，被退货或销毁。丹麦奇新蓝罐有限公司生产的曲奇(饼干)，大肠菌群超标，被销毁。（北京晚报）tks@魔都吃货攻略,1169739100,[衰],对某些官方或正面内容持有保留态度，对历史题材有独到见解反讽嘲弄，关注民生，自我中心，情绪宣泄，逻辑缜密该用户具有批判性思维，对官方或正面内容持保留态度，善于通过反讽和幽默表达自己的观点。关注社会现实，对历史有独到见解。在表达上，既有情绪宣泄，也有逻辑分析。在社交网络中，扮演着普通参与者的角色，但观点独特，值得关注。,根据上述材料分析可知，本次话题涉及到了进口食品的质量安全问题，其中大部分网友表示担忧并提出了自己的看法和建议。在情感上，大部分人表现出了不安和忧虑的情绪，而较少的人们则是比较冷静地看待这个问题。此外，也有不少人通过转发等方式来传播相关消息，表明了其对于这个话题的关注度较高。综上所述，此次话题具有较高的关注度和参与度，同时也反映了人们对食品安全问题的高度关切与警惕。,0.0446428571428571,0.4375,0.5178571428571429,0.0625,0.5625,0.375,0.0625,0.1875,0.75,0.0,0.625,0.375,0.0,0.375,0.625,0.0,0.25,0.75,0.0,0.1875,0.8125,0.0,0.125,0.875,0.0,0.125,0.875,0.0,0.0625,0.9375,0.0625,0.1875,0.75,0.0625,0.3125,0.625
7,洋毒食——国家质检总局进口不合格食品黑榜：挪威的大西洋鲑鱼，检出副溶血性弧菌，被销毁。韩国进口的乐天牌巧克力粒，德国进口的欧尚85%黑巧克力，均发现铜超标，被退货或销毁。丹麦奇新蓝罐有限公司生产的曲奇(饼干)，大肠菌群超标，被销毁。（北京晚报）tks@魔都吃货攻略,2391179831,天呐，闺女吃过好多蓝罐…,对某些官方或正面内容持有保留态度，对历史题材有独到见解反讽嘲弄，关注民生，自我中心，情绪宣泄，逻辑缜密该用户具有批判性思维，对官方或正面内容持保留态度，善于通过反讽和幽默表达自己的观点。关注社会现实，对历史有独到见解。在表达上，既有情绪宣泄，也有逻辑分析。在社交网络中，扮演着普通参与者的角色，但观点独特，值得关注。,根据上述材料分析可知，本次话题涉及到了进口食品的质量安全问题，其中大部分网友表示担忧并提出了自己的看法和建议。在情感上，大部分人表现出了不安和忧虑的情绪，而较少的人们则是比较冷静地看待这个问题。此外，也有不少人通过转发等方式来传播相关消息，表明了其对于这个话题的关注度较高。综上所述，此次话题具有较高的关注度和参与度，同时也反映了人们对食品安全问题的高度关切与警惕。,0.0446428571428571,0.4375,0.5178571428571429,0.0625,0.5625,0.375,0.0625,0.1875,0.75,0.0,0.625,0.375,0.0,0.375,0.625,0.0,0.25,0.75,0.0,0.1875,0.8125,0.0,0.125,0.875,0.0,0.125,0.875,0.0,0.0625,0.9375,0.0625,0.1875,0.75,0.0625,0.3125,0.625
7,洋毒食——国家质检总局进口不合格食品黑榜：挪威的大西洋鲑鱼，检出副溶血性弧菌，被销毁。韩国进口的乐天牌巧克力粒，德国进口的欧尚85%黑巧克力，均发现铜超标，被退货或销毁。丹麦奇新蓝罐有限公司生产的曲奇(饼干)，大肠菌群超标，被销毁。（北京晚报）tks@魔都吃货攻略,1709570920,转发微博,对某些社会现象持批判态度，但并非极端反对派情绪宣泄，逻辑缜密，反讽嘲弄，攻击性强，关注民生该用户对社会现象持有批判态度，关注社会公平与正义，善于通过逻辑和数据进行分析。在表达上，喜欢使用反讽和嘲弄的手法，对权力和既得利益持强烈的批判态度。在社交网络上，活跃度高，积极参与讨论，但同时也表现出一定的攻击性。,根据上述材料分析可知，本次话题涉及到了进口食品的质量安全问题，其中大部分网友表示担忧并提出了自己的看法和建议。在情感上，大部分人表现出了不安和忧虑的情绪，而较少的人们则是比较冷静地看待这个问题。此外，也有不少人通过转发等方式来传播相关消息，表明了其对于这个话题的关注度较高。综上所述，此次话题具有较高的关注度和参与度，同时也反映了人们对食品安全问题的高度关切与警惕。,0.0446428571428571,0.4375,0.5178571428571429,0.0625,0.5625,0.375,0.0625,0.1875,0.75,0.0,0.625,0.375,0.0,0.375,0.625,0.0,0.25,0.75,0.0,0.1875,0.8125,0.0,0.125,0.875,0.0,0.125,0.875,0.0,0.0625,0.9375,0.0625,0.1875,0.75,0.0625,0.3125,0.625
7,洋毒食——国家质检总局进口不合格食品黑榜：挪威的大西洋鲑鱼，检出副溶血性弧菌，被销毁。韩国进口的乐天牌巧克力粒，德国进口的欧尚85%黑巧克力，均发现铜超标，被退货或销毁。丹麦奇新蓝罐有限公司生产的曲奇(饼干)，大肠菌群超标，被销毁。（北京晚报）tks@魔都吃货攻略,1934749462, @张玲艳angel @小加禾1213 @顾海荣Mars,转发官方内容较多，但原创内容中表达了对个人情感和生活的关注，显示对个人情感的重视情绪宣泄，宏大叙事，关注民生，精英视角该用户在社交媒体上表现出温和的建制派立场，关注个人情感和社会稳定。在表达上，倾向于情绪宣泄和宏大叙事，同时关注民生和精英视角。在日常生活中，可能是一个注重个人情感体验，同时关注社会动态的普通参与者。,根据上述材料分析可知，本次话题涉及到了进口食品的质量安全问题，其中大部分网友表示担忧并提出了自己的看法和建议。在情感上，大部分人表现出了不安和忧虑的情绪，而较少的人们则是比较冷静地看待这个问题。此外，也有不少人通过转发等方式来传播相关消息，表明了其对于这个话题的关注度较高。综上所述，此次话题具有较高的关注度和参与度，同时也反映了人们对食品安全问题的高度关切与警惕。,0.0446428571428571,0.4375,0.5178571428571429,0.0625,0.5625,0.375,0.0625,0.1875,0.75,0.0,0.625,0.375,0.0,0.375,0.625,0.0,0.25,0.75,0.0,0.1875,0.8125,0.0,0.125,0.875,0.0,0.125,0.875,0.0,0.0625,0.9375,0.0625,0.1875,0.75,0.0625,0.3125,0.625
7,洋毒食——国家质检总局进口不合格食品黑榜：挪威的大西洋鲑鱼，检出副溶血性弧菌，被销毁。韩国进口的乐天牌巧克力粒，德国进口的欧尚85%黑巧克力，均发现铜超标，被退货或销毁。丹麦奇新蓝罐有限公司生产的曲奇(饼干)，大肠菌群超标，被销毁。（北京晚报）tks@魔都吃货攻略,2452172014,[黑线],转发官方和正面内容较多，但未表现出明显的反讽或潜台词，倾向于温和建制派情绪宣泄，关注民生，精英视角，自我中心该用户表现出对生活的热爱和对娱乐的追求，转发内容以官方和正面信息为主，同时关注民生话题，体现出一定的精英视角。在表达上，情绪宣泄和自我中心的特点较为明显。对于不同类型的事件，该用户可能会表现出对个人兴趣的关注，同时也会对社会热点事件有所关注，并倾向于从个人角度出发进行评论。语言风格上，既有情绪化的表达，也有对生活细节的关注，体现出多元化的表达方式。,根据上述材料分析可知，本次话题涉及到了进口食品的质量安全问题，其中大部分网友表示担忧并提出了自己的看法和建议。在情感上，大部分人表现出了不安和忧虑的情绪，而较少的人们则是比较冷静地看待这个问题。此外，也有不少人通过转发等方式来传播相关消息，表明了其对于这个话题的关注度较高。综上所述，此次话题具有较高的关注度和参与度，同时也反映了人们对食品安全问题的高度关切与警惕。,0.0446428571428571,0.4375,0.5178571428571429,0.0625,0.5625,0.375,0.0625,0.1875,0.75,0.0,0.625,0.375,0.0,0.375,0.625,0.0,0.25,0.75,0.0,0.1875,0.8125,0.0,0.125,0.875,0.0,0.125,0.875,0.0,0.0625,0.9375,0.0625,0.1875,0.75,0.0625,0.3125,0.625
7,洋毒食——国家质检总局进口不合格食品黑榜：挪威的大西洋鲑鱼，检出副溶血性弧菌，被销毁。韩国进口的乐天牌巧克力粒，德国进口的欧尚85%黑巧克力，均发现铜超标，被退货或销毁。丹麦奇新蓝罐有限公司生产的曲奇(饼干)，大肠菌群超标，被销毁。（北京晚报）tks@魔都吃货攻略,1104984900,不至于吧,关注社会问题，对体制和政策持有批评态度情绪宣泄，关注民生，攻击性强，宏大叙事，辩证思考该用户对社会问题持有强烈的批判态度，关注民生议题，善于通过逻辑和数据来支持自己的观点。在表达上，情绪化且具有攻击性，同时展现出对社会公正和正义的坚定信念。在面对不同类型的事件时，预期会表现出对社会不公的强烈反应，并倾向于通过辩证思考来分析问题。语言风格特征包括情绪宣泄、关注民生、攻击性强、宏大叙事和辩证思考。,根据上述材料分析可知，本次话题涉及到了进口食品的质量安全问题，其中大部分网友表示担忧并提出了自己的看法和建议。在情感上，大部分人表现出了不安和忧虑的情绪，而较少的人们则是比较冷静地看待这个问题。此外，也有不少人通过转发等方式来传播相关消息，表明了其对于这个话题的关注度较高。综上所述，此次话题具有较高的关注度和参与度，同时也反映了人们对食品安全问题的高度关切与警惕。,0.0446428571428571,0.4375,0.5178571428571429,0.0625,0.5625,0.375,0.0625,0.1875,0.75,0.0,0.625,0.375,0.0,0.375,0.625,0.0,0.25,0.75,0.0,0.1875,0.8125,0.0,0.125,0.875,0.0,0.125,0.875,0.0,0.0625,0.9375,0.0625,0.1875,0.75,0.0625,0.3125,0.625
7,洋毒食——国家质检总局进口不合格食品黑榜：挪威的大西洋鲑鱼，检出副溶血性弧菌，被销毁。韩国进口的乐天牌巧克力粒，德国进口的欧尚85%黑巧克力，均发现铜超标，被退货或销毁。丹麦奇新蓝罐有限公司生产的曲奇(饼干)，大肠菌群超标，被销毁。（北京晚报）tks@魔都吃货攻略,2186014652,//@油油油122026:无,对林更新有强烈的个人喜爱，积极参与粉丝活动，对负面信息有强烈的反对态度情绪宣泄，关注民生，自我中心，宏大叙事，攻击性强这位用户是一位忠实的林更新粉丝，对偶像有着极高的喜爱和忠诚。在表达上，他/她经常表现出对偶像的强烈情感，同时也关注偶像的日常生活和事业。在遇到负面信息时，会表现出强烈的反对和情绪宣泄。在语言风格上，既有对偶像的宏大叙事，也有对个人情感的自我中心表达。他/她是一个活跃的社交媒体用户，经常参与各种粉丝活动，并在社交媒体上为偶像发声。,根据上述材料分析可知，本次话题涉及到了进口食品的质量安全问题，其中大部分网友表示担忧并提出了自己的看法和建议。在情感上，大部分人表现出了不安和忧虑的情绪，而较少的人们则是比较冷静地看待这个问题。此外，也有不少人通过转发等方式来传播相关消息，表明了其对于这个话题的关注度较高。综上所述，此次话题具有较高的关注度和参与度，同时也反映了人们对食品安全问题的高度关切与警惕。,0.0446428571428571,0.4375,0.5178571428571429,0.0625,0.5625,0.375,0.0625,0.1875,0.75,0.0,0.625,0.375,0.0,0.375,0.625,0.0,0.25,0.75,0.0,0.1875,0.8125,0.0,0.125,0.875,0.0,0.125,0.875,0.0,0.0625,0.9375,0.0625,0.1875,0.75,0.0625,0.3125,0.625
7,洋毒食——国家质检总局进口不合格食品黑榜：挪威的大西洋鲑鱼，检出副溶血性弧菌，被销毁。韩国进口的乐天牌巧克力粒，德国进口的欧尚85%黑巧克力，均发现铜超标，被退货或销毁。丹麦奇新蓝罐有限公司生产的曲奇(饼干)，大肠菌群超标，被销毁。（北京晚报）tks@魔都吃货攻略,2667142837,蓝冠不能吃了,关注社会问题，对体制和政策持有批评态度情绪宣泄，关注民生，攻击性强，宏大叙事，辩证思考该用户对社会问题持有强烈的批判态度，关注民生议题，善于通过逻辑和数据来支持自己的观点。在表达上，情绪化且具有攻击性，同时展现出对社会公正和正义的坚定信念。在面对不同类型的事件时，预期会表现出对社会不公的强烈反应，并倾向于通过辩证思考来分析问题。语言风格特征包括情绪宣泄、关注民生、攻击性强、宏大叙事和辩证思考。,根据上述材料分析可知，本次话题涉及到了进口食品的质量安全问题，其中大部分网友表示担忧并提出了自己的看法和建议。在情感上，大部分人表现出了不安和忧虑的情绪，而较少的人们则是比较冷静地看待这个问题。此外，也有不少人通过转发等方式来传播相关消息，表明了其对于这个话题的关注度较高。综上所述，此次话题具有较高的关注度和参与度，同时也反映了人们对食品安全问题的高度关切与警惕。,0.0446428571428571,0.4375,0.5178571428571429,0.0625,0.5625,0.375,0.0625,0.1875,0.75,0.0,0.625,0.375,0.0,0.375,0.625,0.0,0.25,0.75,0.0,0.1875,0.8125,0.0,0.125,0.875,0.0,0.125,0.875,0.0,0.0625,0.9375,0.0625,0.1875,0.75,0.0625,0.3125,0.625
7,洋毒食——国家质检总局进口不合格食品黑榜：挪威的大西洋鲑鱼，检出副溶血性弧菌，被销毁。韩国进口的乐天牌巧克力粒，德国进口的欧尚85%黑巧克力，均发现铜超标，被退货或销毁。丹麦奇新蓝罐有限公司生产的曲奇(饼干)，大肠菌群超标，被销毁。（北京晚报）tks@魔都吃货攻略,2733820741,扩散 名牌不少[汗],对某些官方或正面内容持有保留态度，对历史题材有独到见解反讽嘲弄，关注民生，自我中心，情绪宣泄，逻辑缜密该用户具有批判性思维，对官方或正面内容持保留态度，善于通过反讽和幽默表达自己的观点。关注社会现实，对历史有独到见解。在表达上，既有情绪宣泄，也有逻辑分析。在社交网络中，扮演着普通参与者的角色，但观点独特，值得关注。,根据上述材料分析可知，本次话题涉及到了进口食品的质量安全问题，其中大部分网友表示担忧并提出了自己的看法和建议。在情感上，大部分人表现出了不安和忧虑的情绪，而较少的人们则是比较冷静地看待这个问题。此外，也有不少人通过转发等方式来传播相关消息，表明了其对于这个话题的关注度较高。综上所述，此次话题具有较高的关注度和参与度，同时也反映了人们对食品安全问题的高度关切与警惕。,0.0446428571428571,0.4375,0.5178571428571429,0.0625,0.5625,0.375,0.0625,0.1875,0.75,0.0,0.625,0.375,0.0,0.375,0.625,0.0,0.25,0.75,0.0,0.1875,0.8125,0.0,0.125,0.875,0.0,0.125,0.875,0.0,0.0625,0.9375,0.0625,0.1875,0.75,0.0625,0.3125,0.625
7,洋毒食——国家质检总局进口不合格食品黑榜：挪威的大西洋鲑鱼，检出副溶血性弧菌，被销毁。韩国进口的乐天牌巧克力粒，德国进口的欧尚85%黑巧克力，均发现铜超标，被退货或销毁。丹麦奇新蓝罐有限公司生产的曲奇(饼干)，大肠菌群超标，被销毁。（北京晚报）tks@魔都吃货攻略,1765630624,转发微博。,用户表现出对日常琐事的关注，转发内容多涉及娱乐和体育，但评论较少，显示出一种消极和混沌的态度。情绪宣泄，关注民生，精英视角，底层共情，自我中心这位用户似乎更关注个人生活和娱乐，对社交媒体上的内容持一种轻松的态度。他/她转发的内容多与娱乐和体育相关，显示出对日常生活的兴趣。然而，用户在评论和表达观点方面相对较少，这可能表明他/她对更广泛的社会问题缺乏兴趣或参与。他/她的语言风格偏向于情绪化和自我中心，但同时也表现出对民生和精英视角的关注。,根据上述材料分析可知，本次话题涉及到了进口食品的质量安全问题，其中大部分网友表示担忧并提出了自己的看法和建议。在情感上，大部分人表现出了不安和忧虑的情绪，而较少的人们则是比较冷静地看待这个问题。此外，也有不少人通过转发等方式来传播相关消息，表明了其对于这个话题的关注度较高。综上所述，此次话题具有较高的关注度和参与度，同时也反映了人们对食品安全问题的高度关切与警惕。,0.0446428571428571,0.4375,0.5178571428571429,0.0625,0.5625,0.375,0.0625,0.1875,0.75,0.0,0.625,0.375,0.0,0.375,0.625,0.0,0.25,0.75,0.0,0.1875,0.8125,0.0,0.125,0.875,0.0,0.125,0.875,0.0,0.0625,0.9375,0.0625,0.1875,0.75,0.0625,0.3125,0.625
7,洋毒食——国家质检总局进口不合格食品黑榜：挪威的大西洋鲑鱼，检出副溶血性弧菌，被销毁。韩国进口的乐天牌巧克力粒，德国进口的欧尚85%黑巧克力，均发现铜超标，被退货或销毁。丹麦奇新蓝罐有限公司生产的曲奇(饼干)，大肠菌群超标，被销毁。（北京晚报）tks@魔都吃货攻略,1400445183,家里还有一大盒蓝罐[吃惊][吃惊],对日常生活细节关注较多，对官方和正面内容有一般认同，但也会表达个人观点。情绪宣泄，关注民生，精英视角，底层共情，自我中心该用户关注日常生活，对官方和正面内容有基本认同，但也会表达个人观点。在表达上，情绪宣泄和关注民生是其主要风格，同时展现出精英视角和底层共情。在社交活动中，该用户活跃度高，善于分享个人经历和感受，同时也关注社会热点。,根据上述材料分析可知，本次话题涉及到了进口食品的质量安全问题，其中大部分网友表示担忧并提出了自己的看法和建议。在情感上，大部分人表现出了不安和忧虑的情绪，而较少的人们则是比较冷静地看待这个问题。此外，也有不少人通过转发等方式来传播相关消息，表明了其对于这个话题的关注度较高。综上所述，此次话题具有较高的关注度和参与度，同时也反映了人们对食品安全问题的高度关切与警惕。,0.0446428571428571,0.4375,0.5178571428571429,0.0625,0.5625,0.375,0.0625,0.1875,0.75,0.0,0.625,0.375,0.0,0.375,0.625,0.0,0.25,0.75,0.0,0.1875,0.8125,0.0,0.125,0.875,0.0,0.125,0.875,0.0,0.0625,0.9375,0.0625,0.1875,0.75,0.0625,0.3125,0.625
7,洋毒食——国家质检总局进口不合格食品黑榜：挪威的大西洋鲑鱼，检出副溶血性弧菌，被销毁。韩国进口的乐天牌巧克力粒，德国进口的欧尚85%黑巧克力，均发现铜超标，被退货或销毁。丹麦奇新蓝罐有限公司生产的曲奇(饼干)，大肠菌群超标，被销毁。（北京晚报）tks@魔都吃货攻略,1880693782,这些 被销毁的东西，怎么市面上还买的到啊,转发内容多为娱乐、美食、生活相关，对政治话题较少涉及，显示温和的体制拥护态度情绪宣泄，关注民生，精英视角，自我中心该用户在社交媒体上以转发娱乐、美食等内容为主，表现出对生活细节的关注和追求个人情感体验的态度。在政治和社会问题上，该用户较为被动，倾向于旁观而非积极参与。语言风格偏向情绪化，表达上带有一定的自我中心倾向。,根据上述材料分析可知，本次话题涉及到了进口食品的质量安全问题，其中大部分网友表示担忧并提出了自己的看法和建议。在情感上，大部分人表现出了不安和忧虑的情绪，而较少的人们则是比较冷静地看待这个问题。此外，也有不少人通过转发等方式来传播相关消息，表明了其对于这个话题的关注度较高。综上所述，此次话题具有较高的关注度和参与度，同时也反映了人们对食品安全问题的高度关切与警惕。,0.0446428571428571,0.4375,0.5178571428571429,0.0625,0.5625,0.375,0.0625,0.1875,0.75,0.0,0.625,0.375,0.0,0.375,0.625,0.0,0.25,0.75,0.0,0.1875,0.8125,0.0,0.125,0.875,0.0,0.125,0.875,0.0,0.0625,0.9375,0.0625,0.1875,0.75,0.0625,0.3125,0.625
8,洋毒食——国家质检总局进口不合格食品黑榜：挪威的大西洋鲑鱼，检出副溶血性弧菌，被销毁。韩国进口的乐天牌巧克力粒，德国进口的欧尚85%黑巧克力，均发现铜超标，被退货或销毁。丹麦奇新蓝罐有限公司生产的曲奇(饼干)，大肠菌群超标，被销毁。（北京晚报）tks@魔都吃货攻略,2837483792, @喜欢小王子的左岸蓝,温和建制派，对日常生活话题有较强兴趣，转发内容多与娱乐、美食相关情绪宣泄，关注民生，自我中心，幽默风趣，攻击性强该用户表现出温和的体制拥护态度，对日常生活话题有浓厚兴趣，转发内容多涉及娱乐、美食等轻松话题。在表达上，善于使用幽默和情绪化的语言，关注个人情感和日常生活。作为高频活跃者，该用户在社交媒体上积极参与互动，展现出较强的社交活跃度。,[''],0.046875,0.453125,0.5,0.0625,0.1875,0.75,0.0,0.625,0.375,0.0,0.375,0.625,0.0,0.25,0.75,0.0,0.1875,0.8125,0.0,0.125,0.875,0.0,0.125,0.875,0.0,0.0625,0.9375,0.0625,0.1875,0.75,0.0625,0.3125,0.625,0.125,0.1875,0.6875
8,洋毒食——国家质检总局进口不合格食品黑榜：挪威的大西洋鲑鱼，检出副溶血性弧菌，被销毁。韩国进口的乐天牌巧克力粒，德国进口的欧尚85%黑巧克力，均发现铜超标，被退货或销毁。丹麦奇新蓝罐有限公司生产的曲奇(饼干)，大肠菌群超标，被销毁。（北京晚报）tks@魔都吃货攻略,2464734122,不是我们的那种吧？[晕][晕][晕][晕],关注民生，对一些社会现象持批判态度，但总体上倾向于温和改良情绪宣泄，关注民生，自我中心，宏大叙事，辩证思考该用户关注社会现象，对一些问题持有批判态度，但总体上倾向于温和改良。在表达上，善于情绪宣泄，关注民生问题，同时具有自我中心的倾向。在社交活动中，具有较高的活跃度，喜欢分享个人观点和对社会现象的思考。,[''],0.046875,0.453125,0.5,0.0625,0.1875,0.75,0.0,0.625,0.375,0.0,0.375,0.625,0.0,0.25,0.75,0.0,0.1875,0.8125,0.0,0.125,0.875,0.0,0.125,0.875,0.0,0.0625,0.9375,0.0625,0.1875,0.75,0.0625,0.3125,0.625,0.125,0.1875,0.6875
8,洋毒食——国家质检总局进口不合格食品黑榜：挪威的大西洋鲑鱼，检出副溶血性弧菌，被销毁。韩国进口的乐天牌巧克力粒，德国进口的欧尚85%黑巧克力，均发现铜超标，被退货或销毁。丹麦奇新蓝罐有限公司生产的曲奇(饼干)，大肠菌群超标，被销毁。（北京晚报）tks@魔都吃货攻略,1887766687,蓝罐啊。。。。。,关注民生，对特定事件有强烈情感反应，对政治事件有批判态度情绪宣泄，关注民生，攻击性强，宏大叙事，自我中心该用户表现出对民生问题的关注和对特定事件的强烈情感反应，同时在表达上具有攻击性和自我中心的特点。在政治事件上，该用户倾向于批判态度，同时受到情绪煽动的影响较大。该用户在社交媒体上活跃度高，喜欢分享个人观点和对社会事件的评论，表现出对群体利益的关注和对社会公正的追求。,[''],0.046875,0.453125,0.5,0.0625,0.1875,0.75,0.0,0.625,0.375,0.0,0.375,0.625,0.0,0.25,0.75,0.0,0.1875,0.8125,0.0,0.125,0.875,0.0,0.125,0.875,0.0,0.0625,0.9375,0.0625,0.1875,0.75,0.0625,0.3125,0.625,0.125,0.1875,0.6875
