time_step,topic,uid,real_comments,profile_text,batch_mf,pre_pos,pre_neu,pre_neg,dist_t0_pos,dist_t0_neu,dist_t0_neg,dist_t1_pos,dist_t1_neu,dist_t1_neg,dist_t2_pos,dist_t2_neu,dist_t2_neg,dist_t3_pos,dist_t3_neu,dist_t3_neg,dist_t4_pos,dist_t4_neu,dist_t4_neg,dist_t5_pos,dist_t5_neu,dist_t5_neg,dist_t6_pos,dist_t6_neu,dist_t6_neg,dist_t7_pos,dist_t7_neu,dist_t7_neg,dist_t8_pos,dist_t8_neu,dist_t8_neg,dist_t9_pos,dist_t9_neu,dist_t9_neg,dist_t10_pos,dist_t10_neu,dist_t10_neg
0,【 辽宁盘锦1村民被民警枪杀续：系政府违法强拆】 兴隆台区有关部门在没有和村民达成拆迁补偿协议、且没有法院判决的情况下违法强拆，导致矛盾迅速激化----,2164864917,【 辽宁盘锦1村民被民警枪杀续：系政府违法强拆】 兴隆台区有关部门在没有和村民达成拆迁补偿协议、且没有法院判决的情况下违法强拆，导致矛盾迅速激化----,转发内容多样，涉及个人经历、娱乐新闻、军事新闻等，但多带有消极情绪或对现状的不满。情绪宣泄，关注民生，自我中心，悲观抱怨，攻击性强该用户在社交媒体上表现出较高的活跃度，转发内容多样，但多带有消极情绪或对现状的不满。在表达个人观点时，倾向于情绪宣泄，关注个人经历和民生问题，同时表现出一定的自我中心倾向。在处理不同类型的事件时，可能更多地从个人情感和利益出发，对现状持有批评态度。语言风格上，具有较强的攻击性，但同时也表现出对民生问题的关注。,,0.0,1.0,0.0,0.0,0.3125,0.6875,0.0,0.0625,0.9375,0.0,0.0625,0.9375,0.25,0.125,0.625,0.0,0.5,0.5,0.0,0.5,0.5,0.0,0.4375,0.5625,0.0,0.4375,0.5625,0.0,0.375,0.625,0.125,0.25,0.625,0.0,0.25,0.75
0,【 辽宁盘锦1村民被民警枪杀续：系政府违法强拆】 兴隆台区有关部门在没有和村民达成拆迁补偿协议、且没有法院判决的情况下违法强拆，导致矛盾迅速激化----,2090280105,转发微博,对国家发展和军事力量持积极态度，但对某些社会现象和政策调整持有质疑。情绪宣泄，关注民生，精英视角，自我中心该用户对国家发展和军事力量持积极态度，转发相关内容时表现出对国家实力的自豪。同时，对某些社会现象和政策调整持有质疑，表现出一定的批判性思维。在表达上，倾向于情绪宣泄和关注民生，同时展现出精英视角和自我中心的特征。,,0.0,1.0,0.0,0.0,0.3125,0.6875,0.0,0.0625,0.9375,0.0,0.0625,0.9375,0.25,0.125,0.625,0.0,0.5,0.5,0.0,0.5,0.5,0.0,0.4375,0.5625,0.0,0.4375,0.5625,0.0,0.375,0.625,0.125,0.25,0.625,0.0,0.25,0.75
0,【 辽宁盘锦1村民被民警枪杀续：系政府违法强拆】 兴隆台区有关部门在没有和村民达成拆迁补偿协议、且没有法院判决的情况下违法强拆，导致矛盾迅速激化----,2164864917,拆----,频繁转发居家好物馆的内容，表现出对日常生活用品的实用性和便利性的关注，可能倾向于温和建制派。情绪宣泄，关注民生，精英视角，自我中心该用户表现出对日常生活用品的极大兴趣，频繁转发居家好物馆的内容，显示出对实用性和便利性的追求。其政治倾向可能较为温和，关注个人利益和舒适度。在语言风格上，该用户倾向于情绪宣泄，关注民生问题，并带有一定的精英视角和自我中心特征。,,0.0,1.0,0.0,0.0,0.3125,0.6875,0.0,0.0625,0.9375,0.0,0.0625,0.9375,0.25,0.125,0.625,0.0,0.5,0.5,0.0,0.5,0.5,0.0,0.4375,0.5625,0.0,0.4375,0.5625,0.0,0.375,0.625,0.125,0.25,0.625,0.0,0.25,0.75
0,【 辽宁盘锦1村民被民警枪杀续：系政府违法强拆】 兴隆台区有关部门在没有和村民达成拆迁补偿协议、且没有法院判决的情况下违法强拆，导致矛盾迅速激化----,1911188975,//@无差别社会: 拆----//@nurgl_富蕴电信:,对传统文化和历史有认同，同时表达了对现实的积极态度和对未来的乐观期望情绪宣泄，乐观积极，关注民生，宏大叙事这位用户表现出对传统文化的尊重和对现实的积极态度。他们经常分享关于节日、生活和未来的积极信息，表达了对家庭和社会和谐的重视。他们的语言风格充满乐观和正能量，经常使用宏大叙事来描述对未来的期望。这位用户在社交媒体上是一个活跃的参与者，他们的言论通常能够激发他人的积极情绪，并鼓励人们面对困难时保持乐观。,,0.0,1.0,0.0,0.0,0.3125,0.6875,0.0,0.0625,0.9375,0.0,0.0625,0.9375,0.25,0.125,0.625,0.0,0.5,0.5,0.0,0.5,0.5,0.0,0.4375,0.5625,0.0,0.4375,0.5625,0.0,0.375,0.625,0.125,0.25,0.625,0.0,0.25,0.75
0,【 辽宁盘锦1村民被民警枪杀续：系政府违法强拆】 兴隆台区有关部门在没有和村民达成拆迁补偿协议、且没有法院判决的情况下违法强拆，导致矛盾迅速激化----,1919068845,//@竹林居士-: //@无差别社会: 拆----//@nurgl_富蕴电信:,对传统文化和历史有认同，同时表达了对现实的积极态度和对未来的乐观期望情绪宣泄，乐观积极，关注民生，宏大叙事这位用户表现出对传统文化的尊重和对现实的积极态度。他们经常分享关于节日、生活和未来的积极信息，表达了对家庭和社会和谐的重视。他们的语言风格充满乐观和正能量，经常使用宏大叙事来描述对未来的期望。这位用户在社交媒体上是一个活跃的参与者，他们的言论通常能够激发他人的积极情绪，并鼓励人们面对困难时保持乐观。,,0.0,1.0,0.0,0.0,0.3125,0.6875,0.0,0.0625,0.9375,0.0,0.0625,0.9375,0.25,0.125,0.625,0.0,0.5,0.5,0.0,0.5,0.5,0.0,0.4375,0.5625,0.0,0.4375,0.5625,0.0,0.375,0.625,0.125,0.25,0.625,0.0,0.25,0.75
0,【 辽宁盘锦1村民被民警枪杀续：系政府违法强拆】 兴隆台区有关部门在没有和村民达成拆迁补偿协议、且没有法院判决的情况下违法强拆，导致矛盾迅速激化----,1844571934,转发微博,情绪宣泄，盲目乐观，岁月静好/吃瓜，关注民生，自我中心这位用户似乎对生活持有一种乐观而随和的态度，喜欢参与各种有奖转发活动，希望通过这些活动获得好运。他在转发内容时，往往表现出对生活的热爱和对简单快乐的追求。他的语言风格偏向于情绪化，关注民生，同时也带有一定的自我中心倾向。在参与社会舆论时，他更倾向于随大流，而不是表达自己的独立见解。,,0.0,1.0,0.0,0.0,0.3125,0.6875,0.0,0.0625,0.9375,0.0,0.0625,0.9375,0.25,0.125,0.625,0.0,0.5,0.5,0.0,0.5,0.5,0.0,0.4375,0.5625,0.0,0.4375,0.5625,0.0,0.375,0.625,0.125,0.25,0.625,0.0,0.25,0.75
0,【 辽宁盘锦1村民被民警枪杀续：系政府违法强拆】 兴隆台区有关部门在没有和村民达成拆迁补偿协议、且没有法院判决的情况下违法强拆，导致矛盾迅速激化----,1252371280,拆迁人，事件所有的得利者，你们家居住的房屋、你们驾驶的车辆、你们喝的水、你们吃的饭、你们坐的板凳，无不沾满鲜血，你们的每一寸皮肤，每一根血管，无附有死者的冤魂。,对行业现状持批判态度，对政策和企业行为有质疑情绪宣泄，逻辑缜密，反讽嘲弄，关注民生，精英视角该用户对通信行业和社会现象有深刻的洞察和批判，关注行业内部矛盾和社会不公。在表达上，他善于运用逻辑和数据支持自己的观点，同时也不乏情绪化的表达。他关注民生，对精英阶层的行为持质疑态度，强调个人价值和尊严。在面对不同事件时，他可能会表现出对不公平现象的强烈不满，同时也可能对一些社会问题提出建设性的解决方案。,,0.0,1.0,0.0,0.0,0.3125,0.6875,0.0,0.0625,0.9375,0.0,0.0625,0.9375,0.25,0.125,0.625,0.0,0.5,0.5,0.0,0.5,0.5,0.0,0.4375,0.5625,0.0,0.4375,0.5625,0.0,0.375,0.625,0.125,0.25,0.625,0.0,0.25,0.75
0,【 辽宁盘锦1村民被民警枪杀续：系政府违法强拆】 兴隆台区有关部门在没有和村民达成拆迁补偿协议、且没有法院判决的情况下违法强拆，导致矛盾迅速激化----,1693962091,//@暴雪下的青松: 拆迁人，事件所有的得利者，你们家居住的房屋、你们驾驶的车辆、你们喝的水、你们吃的饭、你们坐的板凳，无不沾满鲜血，你们的每一寸皮肤，每一根血管，无附有死者的冤魂。,虽是体制拥护派但对环境问题表达不满情绪宣泄，关注民生，精英视角，自我中心，宏大叙事该用户表现出对体制的基本认同，但同时也关注环境和个人健康问题。在表达上，他倾向于情绪宣泄和关注个人经历，同时展现出对宏观环境的关注。他参与度一般，更倾向于分享个人生活和工作经验，偶尔对公共话题发表意见。,,0.0,1.0,0.0,0.0,0.3125,0.6875,0.0,0.0625,0.9375,0.0,0.0625,0.9375,0.25,0.125,0.625,0.0,0.5,0.5,0.0,0.5,0.5,0.0,0.4375,0.5625,0.0,0.4375,0.5625,0.0,0.375,0.625,0.125,0.25,0.625,0.0,0.25,0.75
0,【 辽宁盘锦1村民被民警枪杀续：系政府违法强拆】 兴隆台区有关部门在没有和村民达成拆迁补偿协议、且没有法院判决的情况下违法强拆，导致矛盾迅速激化----,1497273824,who care?,转发活动微博并参与讨论，但原创内容偏向生活分享，未表现出明显的反建制或批判态度情绪宣泄，关注民生，精英视角，底层共情该用户关注社会现象，但表达观点较为温和，倾向于参与群体活动。在日常生活中，关注生活品质，对民生问题有所关注，但不会过于激进。语言风格偏向于关注民生和底层共情，同时展现出一定的精英视角。,,0.0,1.0,0.0,0.0,0.3125,0.6875,0.0,0.0625,0.9375,0.0,0.0625,0.9375,0.25,0.125,0.625,0.0,0.5,0.5,0.0,0.5,0.5,0.0,0.4375,0.5625,0.0,0.4375,0.5625,0.0,0.375,0.625,0.125,0.25,0.625,0.0,0.25,0.75
0,【 辽宁盘锦1村民被民警枪杀续：系政府违法强拆】 兴隆台区有关部门在没有和村民达成拆迁补偿协议、且没有法院判决的情况下违法强拆，导致矛盾迅速激化----,2245475751,//@龙取水城堡: //@暴雪下的青松: 拆迁人，事件所有的得利者，你们家居住的房屋、你们驾驶的车辆、你们喝的水、你们吃的饭、你们坐的板凳，无不沾满鲜血，你们的每一寸皮肤，每一根血管，无附有死者的冤魂。,对文化娱乐产业持开放态度，对经济政策有一定关注情绪宣泄，宏大叙事，关注民生，精英视角，自我中心该用户对文化娱乐产业持开放态度，关注个人兴趣与生活品质，同时对社会文化现象保持关注。在表达上，喜欢情绪宣泄和宏大叙事，展现出精英视角和自我中心的特征。在社交活动中，积极参与并乐于分享个人体验和观点，具有较高的活跃度。在面对不同类型的事件时，该用户可能表现出对文化娱乐产业的热情，对社会现象的关注，以及对个人成就的强调。语言风格上，倾向于使用情绪化的表达，并喜欢通过宏大叙事来展现个人观点。,,0.0,1.0,0.0,0.0,0.3125,0.6875,0.0,0.0625,0.9375,0.0,0.0625,0.9375,0.25,0.125,0.625,0.0,0.5,0.5,0.0,0.5,0.5,0.0,0.4375,0.5625,0.0,0.4375,0.5625,0.0,0.375,0.625,0.125,0.25,0.625,0.0,0.25,0.75
0,【 辽宁盘锦1村民被民警枪杀续：系政府违法强拆】 兴隆台区有关部门在没有和村民达成拆迁补偿协议、且没有法院判决的情况下违法强拆，导致矛盾迅速激化----,2598169055,//@龙取水城堡: //@暴雪下的青松: 拆迁人，事件所有的得利者，你们家居住的房屋、你们驾驶的车辆、你们喝的水、你们吃的饭、你们坐的板凳，无不沾满鲜血，你们的每一寸皮肤，每一根血管，无附有死者的冤魂。,虽是体制拥护派但对部分社会现象持批判态度情绪宣泄，反讽嘲弄，关注民生，自我中心该用户表现出对日常生活和情感表达的浓厚兴趣，同时在转发和评论中展现出对社会现象的批判性思考。他/她倾向于使用反讽和情绪化的语言来表达观点，关注民生问题，并在社交媒体上活跃参与讨论。尽管倾向于体制拥护，但用户对某些社会现象持有批判态度，显示出复杂的政治倾向。,,0.0,1.0,0.0,0.0,0.3125,0.6875,0.0,0.0625,0.9375,0.0,0.0625,0.9375,0.25,0.125,0.625,0.0,0.5,0.5,0.0,0.5,0.5,0.0,0.4375,0.5625,0.0,0.4375,0.5625,0.0,0.375,0.625,0.125,0.25,0.625,0.0,0.25,0.75
0,【 辽宁盘锦1村民被民警枪杀续：系政府违法强拆】 兴隆台区有关部门在没有和村民达成拆迁补偿协议、且没有法院判决的情况下违法强拆，导致矛盾迅速激化----,1093166354,血……………………,关注社会问题，对官方和体制持有一定程度的质疑和批评情绪宣泄，反讽嘲弄，关注民生，自我中心该用户关注社会问题，对官方和体制持有一定程度的质疑和批评。在表达上，他倾向于情绪宣泄和反讽嘲弄，同时关注民生问题，并表现出一定的自我中心倾向。他具有较高的活跃度，积极参与社会议题的讨论，希望通过舆论推动社会变革。,,0.0,1.0,0.0,0.0,0.3125,0.6875,0.0,0.0625,0.9375,0.0,0.0625,0.9375,0.25,0.125,0.625,0.0,0.5,0.5,0.0,0.5,0.5,0.0,0.4375,0.5625,0.0,0.4375,0.5625,0.0,0.375,0.625,0.125,0.25,0.625,0.0,0.25,0.75
0,【 辽宁盘锦1村民被民警枪杀续：系政府违法强拆】 兴隆台区有关部门在没有和村民达成拆迁补偿协议、且没有法院判决的情况下违法强拆，导致矛盾迅速激化----,1066544421,//@龙的传人_中国龙: //@龙取水城堡: //@暴雪下的青松: 拆迁人，事件所有的得利者，你们家居住的房屋、你们驾驶的车辆、你们喝的水、你们吃的饭、你们坐的板凳，无不沾满鲜血，你们的每一寸皮肤，每一根血管，无附有死者的冤魂。,虽是体制拥护派但对部分社会现象持批判态度情绪宣泄，反讽嘲弄，关注民生，自我中心该用户表现出对日常生活和情感表达的浓厚兴趣，同时在转发和评论中展现出对社会现象的批判性思考。他/她倾向于使用反讽和情绪化的语言来表达观点，关注民生问题，并在社交媒体上活跃参与讨论。尽管倾向于体制拥护，但用户对某些社会现象持有批判态度，显示出复杂的政治倾向。,,0.0,1.0,0.0,0.0,0.3125,0.6875,0.0,0.0625,0.9375,0.0,0.0625,0.9375,0.25,0.125,0.625,0.0,0.5,0.5,0.0,0.5,0.5,0.0,0.4375,0.5625,0.0,0.4375,0.5625,0.0,0.375,0.625,0.125,0.25,0.625,0.0,0.25,0.75
0,【 辽宁盘锦1村民被民警枪杀续：系政府违法强拆】 兴隆台区有关部门在没有和村民达成拆迁补偿协议、且没有法院判决的情况下违法强拆，导致矛盾迅速激化----,1834763637,[怒][转发][霹雳],关注移民政策、环保问题，对现状持批评态度，但未表现出极端反对情绪宣泄，宏大叙事，关注民生，政治隐喻，攻击性强该用户关注社会问题，尤其是移民政策和环境污染，对现状持批评态度。在表达上，倾向于情绪宣泄和宏大叙事，关注民生问题，并使用政治隐喻进行表达。该用户在社交媒体上活跃度高，经常转发和评论相关话题，表现出对环境和社会变革的追求。,,0.0,1.0,0.0,0.0,0.3125,0.6875,0.0,0.0625,0.9375,0.0,0.0625,0.9375,0.25,0.125,0.625,0.0,0.5,0.5,0.0,0.5,0.5,0.0,0.4375,0.5625,0.0,0.4375,0.5625,0.0,0.375,0.625,0.125,0.25,0.625,0.0,0.25,0.75
0,【 辽宁盘锦1村民被民警枪杀续：系政府违法强拆】 兴隆台区有关部门在没有和村民达成拆迁补偿协议、且没有法院判决的情况下违法强拆，导致矛盾迅速激化----,1911188975,//@以道治国: //@无差别社会: 拆----//@nurgl_富蕴电信:,关注移民政策、环保问题，对现状持批评态度，但未表现出极端反对情绪宣泄，宏大叙事，关注民生，政治隐喻，攻击性强该用户关注社会问题，尤其是移民政策和环境污染，对现状持批评态度。在表达上，倾向于情绪宣泄和宏大叙事，关注民生问题，并使用政治隐喻进行表达。该用户在社交媒体上活跃度高，经常转发和评论相关话题，表现出对环境和社会变革的追求。,,0.0,1.0,0.0,0.0,0.3125,0.6875,0.0,0.0625,0.9375,0.0,0.0625,0.9375,0.25,0.125,0.625,0.0,0.5,0.5,0.0,0.5,0.5,0.0,0.4375,0.5625,0.0,0.4375,0.5625,0.0,0.375,0.625,0.125,0.25,0.625,0.0,0.25,0.75
0,【 辽宁盘锦1村民被民警枪杀续：系政府违法强拆】 兴隆台区有关部门在没有和村民达成拆迁补偿协议、且没有法院判决的情况下违法强拆，导致矛盾迅速激化----,2088009581,政府违法强拆还动用警力，还开枪打死老百姓，天理何在！,对体制存在批判，但对经济政策持批评态度情绪宣泄，反讽嘲弄，关注民生，自我中心该用户对体制持有批判态度，关注社会公平与正义，善于通过转发和评论表达自己的观点。在表达上，他喜欢使用反讽和情绪化的语言，表现出对民生问题的关注和对个人尊严的重视。他积极参与网络讨论，活跃度高，但同时也表现出一定的自我中心倾向。,,0.0,1.0,0.0,0.0,0.3125,0.6875,0.0,0.0625,0.9375,0.0,0.0625,0.9375,0.25,0.125,0.625,0.0,0.5,0.5,0.0,0.5,0.5,0.0,0.4375,0.5625,0.0,0.4375,0.5625,0.0,0.375,0.625,0.125,0.25,0.625,0.0,0.25,0.75
1,【 辽宁盘锦1村民被民警枪杀续：系政府违法强拆】 兴隆台区有关部门在没有和村民达成拆迁补偿协议、且没有法院判决的情况下违法强拆，导致矛盾迅速激化----,1605560892, //@竹林居士-: //@以道治国: //@无差别社会: 拆----//@nurgl_富蕴电信:,对科技产品持开放态度，但对社会现象和政策有个人见解关注民生，精英视角，自我中心，情绪宣泄，宏大叙事该用户关注科技动态，对新产品和技术持开放态度，同时在个人生活中表现出对家庭和工作的重视。他善于表达个人情感，同时对社会现象和政策有自己的见解。在社交网络上，他活跃度高，乐于分享个人经历和观点，展现出自我中心的特征。,[''],0.0,0.3125,0.6875,0.0,0.0625,0.9375,0.0,0.0625,0.9375,0.25,0.125,0.625,0.0,0.5,0.5,0.0,0.5,0.5,0.0,0.4375,0.5625,0.0,0.4375,0.5625,0.0,0.375,0.625,0.125,0.25,0.625,0.0,0.25,0.75,0.0,0.125,0.875
1,【 辽宁盘锦1村民被民警枪杀续：系政府违法强拆】 兴隆台区有关部门在没有和村民达成拆迁补偿协议、且没有法院判决的情况下违法强拆，导致矛盾迅速激化----,1853029203,//@竹林居士-://@以道治国: //@无差别社会: 拆----//@nurgl_富蕴电信:,关注移民政策、环保问题，对现状持批评态度，但未表现出极端反对情绪宣泄，宏大叙事，关注民生，政治隐喻，攻击性强该用户关注社会问题，尤其是移民政策和环境污染，对现状持批评态度。在表达上，倾向于情绪宣泄和宏大叙事，关注民生问题，并使用政治隐喻进行表达。该用户在社交媒体上活跃度高，经常转发和评论相关话题，表现出对环境和社会变革的追求。,[''],0.0,0.3125,0.6875,0.0,0.0625,0.9375,0.0,0.0625,0.9375,0.25,0.125,0.625,0.0,0.5,0.5,0.0,0.5,0.5,0.0,0.4375,0.5625,0.0,0.4375,0.5625,0.0,0.375,0.625,0.125,0.25,0.625,0.0,0.25,0.75,0.0,0.125,0.875
1,【 辽宁盘锦1村民被民警枪杀续：系政府违法强拆】 兴隆台区有关部门在没有和村民达成拆迁补偿协议、且没有法院判决的情况下违法强拆，导致矛盾迅速激化----,1361437701,//@龙的传人_中国龙: //@龙取水城堡: //@暴雪下的青松: 拆迁人，事件所有的得利者，你们家居住的房屋、你们驾驶的车辆、你们喝的水、你们吃的饭、你们坐的板凳，无不沾满鲜血，你们的每一寸皮肤，每一根血管，无附有死者的冤魂。,对新技术和娱乐内容持开放态度，但对政治和社会问题较为谨慎情绪宣泄，关注民生，自我中心，宏大叙事，幽默风趣一位对新技术和娱乐内容充满好奇的温和建制派用户，善于表达个人情感和观点。在社交平台上活跃，关注民生问题，同时以幽默风趣的方式分享生活点滴。对社会现象有自己独特的见解，但不会过于激进。,[''],0.0,0.3125,0.6875,0.0,0.0625,0.9375,0.0,0.0625,0.9375,0.25,0.125,0.625,0.0,0.5,0.5,0.0,0.5,0.5,0.0,0.4375,0.5625,0.0,0.4375,0.5625,0.0,0.375,0.625,0.125,0.25,0.625,0.0,0.25,0.75,0.0,0.125,0.875
1,【 辽宁盘锦1村民被民警枪杀续：系政府违法强拆】 兴隆台区有关部门在没有和村民达成拆迁补偿协议、且没有法院判决的情况下违法强拆，导致矛盾迅速激化----,1269285350,"人民的积怨太深，执法者的粗暴,富人财产受保护,穷人的财产肆意践踏。@龙的传人_中国龙:",对传统文化和历史有认同，同时表达了对现实的积极态度和对未来的乐观期望情绪宣泄，乐观积极，关注民生，宏大叙事这位用户表现出对传统文化的尊重和对现实的积极态度。他们经常分享关于节日、生活和未来的积极信息，表达了对家庭和社会和谐的重视。他们的语言风格充满乐观和正能量，经常使用宏大叙事来描述对未来的期望。这位用户在社交媒体上是一个活跃的参与者，他们的言论通常能够激发他人的积极情绪，并鼓励人们面对困难时保持乐观。,[''],0.0,0.3125,0.6875,0.0,0.0625,0.9375,0.0,0.0625,0.9375,0.25,0.125,0.625,0.0,0.5,0.5,0.0,0.5,0.5,0.0,0.4375,0.5625,0.0,0.4375,0.5625,0.0,0.375,0.625,0.125,0.25,0.625,0.0,0.25,0.75,0.0,0.125,0.875
1,【 辽宁盘锦1村民被民警枪杀续：系政府违法强拆】 兴隆台区有关部门在没有和村民达成拆迁补偿协议、且没有法院判决的情况下违法强拆，导致矛盾迅速激化----,1945953645,枪又响了,虽是体制拥护派但对部分社会现象持批判态度情绪宣泄，反讽嘲弄，关注民生，自我中心该用户表现出对日常生活和情感表达的浓厚兴趣，同时在转发和评论中展现出对社会现象的批判性思考。他/她倾向于使用反讽和情绪化的语言来表达观点，关注民生问题，并在社交媒体上活跃参与讨论。尽管倾向于体制拥护，但用户对某些社会现象持有批判态度，显示出复杂的政治倾向。,[''],0.0,0.3125,0.6875,0.0,0.0625,0.9375,0.0,0.0625,0.9375,0.25,0.125,0.625,0.0,0.5,0.5,0.0,0.5,0.5,0.0,0.4375,0.5625,0.0,0.4375,0.5625,0.0,0.375,0.625,0.125,0.25,0.625,0.0,0.25,0.75,0.0,0.125,0.875
1,【 辽宁盘锦1村民被民警枪杀续：系政府违法强拆】 兴隆台区有关部门在没有和村民达成拆迁补偿协议、且没有法院判决的情况下违法强拆，导致矛盾迅速激化----,2431035101,卡扎菲被民警干掉？还是在中国盘锦？博主配图太有才了,对传统文化和历史有认同，同时表达了对现实的积极态度和对未来的乐观期望情绪宣泄，乐观积极，关注民生，宏大叙事这位用户表现出对传统文化的尊重和对现实的积极态度。他们经常分享关于节日、生活和未来的积极信息，表达了对家庭和社会和谐的重视。他们的语言风格充满乐观和正能量，经常使用宏大叙事来描述对未来的期望。这位用户在社交媒体上是一个活跃的参与者，他们的言论通常能够激发他人的积极情绪，并鼓励人们面对困难时保持乐观。,[''],0.0,0.3125,0.6875,0.0,0.0625,0.9375,0.0,0.0625,0.9375,0.25,0.125,0.625,0.0,0.5,0.5,0.0,0.5,0.5,0.0,0.4375,0.5625,0.0,0.4375,0.5625,0.0,0.375,0.625,0.125,0.25,0.625,0.0,0.25,0.75,0.0,0.125,0.875
1,【 辽宁盘锦1村民被民警枪杀续：系政府违法强拆】 兴隆台区有关部门在没有和村民达成拆迁补偿协议、且没有法院判决的情况下违法强拆，导致矛盾迅速激化----,2192730365,转发微博,对体制和政策持有批判态度，但未表现出极端反对情绪宣泄，反讽嘲弄，攻击性强，关注民生，自我中心该用户对体制和政策持有批判态度，经常转发和评论与政治和社会问题相关的微博。其表达方式以情绪宣泄和反讽为主，关注民生问题，并表现出一定的自我中心倾向。在社交媒体上，该用户活跃度高，经常参与讨论，对现实问题有较强的反应和表达欲望。,[''],0.0,0.3125,0.6875,0.0,0.0625,0.9375,0.0,0.0625,0.9375,0.25,0.125,0.625,0.0,0.5,0.5,0.0,0.5,0.5,0.0,0.4375,0.5625,0.0,0.4375,0.5625,0.0,0.375,0.625,0.125,0.25,0.625,0.0,0.25,0.75,0.0,0.125,0.875
1,【 辽宁盘锦1村民被民警枪杀续：系政府违法强拆】 兴隆台区有关部门在没有和村民达成拆迁补偿协议、且没有法院判决的情况下违法强拆，导致矛盾迅速激化----,2824166562,我们的民警这么重口，当场击毙之后还顺便爆了个菊？仔细一看，这不是卡大佐吗？,虽是体制拥护派但对部分社会现象持批判态度情绪宣泄，反讽嘲弄，关注民生，自我中心该用户表现出对日常生活和情感表达的浓厚兴趣，同时在转发和评论中展现出对社会现象的批判性思考。他/她倾向于使用反讽和情绪化的语言来表达观点，关注民生问题，并在社交媒体上活跃参与讨论。尽管倾向于体制拥护，但用户对某些社会现象持有批判态度，显示出复杂的政治倾向。,[''],0.0,0.3125,0.6875,0.0,0.0625,0.9375,0.0,0.0625,0.9375,0.25,0.125,0.625,0.0,0.5,0.5,0.0,0.5,0.5,0.0,0.4375,0.5625,0.0,0.4375,0.5625,0.0,0.375,0.625,0.125,0.25,0.625,0.0,0.25,0.75,0.0,0.125,0.875
