time_step,topic,uid,real_comments,profile_text,batch_mf,pre_pos,pre_neu,pre_neg,dist_t0_pos,dist_t0_neu,dist_t0_neg,dist_t1_pos,dist_t1_neu,dist_t1_neg,dist_t2_pos,dist_t2_neu,dist_t2_neg,dist_t3_pos,dist_t3_neu,dist_t3_neg,dist_t4_pos,dist_t4_neu,dist_t4_neg,dist_t5_pos,dist_t5_neu,dist_t5_neg,dist_t6_pos,dist_t6_neu,dist_t6_neg,dist_t7_pos,dist_t7_neu,dist_t7_neg,dist_t8_pos,dist_t8_neu,dist_t8_neg,dist_t9_pos,dist_t9_neu,dist_t9_neg,dist_t10_pos,dist_t10_neu,dist_t10_neg
12,【 辽宁盘锦1村民被民警枪杀续：系政府违法强拆】 兴隆台区有关部门在没有和村民达成拆迁补偿协议、且没有法院判决的情况下违法强拆，导致矛盾迅速激化----,1895788417,[怒][怒][怒][怒],关注民生，对某些政策持批评态度，但总体上倾向于温和改良情绪宣泄，关注民生，精英视角，底层共情，自我中心该用户关注民生问题，对某些政策持批评态度，但总体上倾向于温和改良。他善于表达个人情感，关注社会问题，同时也有一定的自我中心倾向。在社交网络上，他积极参与讨论，但并非意见领袖。他的语言风格偏向于情绪宣泄和关注民生，同时也表现出精英视角和底层共情的特点。,针对上述问题的回答如下：1. 立场分布：大多数网友持反对态度，认为警方的行为不合法；少数人则表示理解或同情。2. 观点分布：主要有以下几个方面的看法：一是认为这是非法暴力事件，应该追究相关人员的责任；二是认为这是一起冤案，不应该受到如此严厉的惩罚；三是认为这是一个政治迫害案件，与法律无关。3. 情绪分布：绝大多数网友感到愤怒、不满和失望，但也有一些人表达了宽容和支持的心态。4. 行为分布：多数网友选择转发这条消息，表达自己的立场和情绪；也有部分网友选择了评论，进一步阐述了自己的观点和理由。5. 话题真实度：从目前的情况来看，这个话题的真实性和可信性存在争议。一方面，许多人都关注到了这一事件的发生和发展过程，但另一方面，也有人对此产生了怀疑和疑问。6. 发言意图：总体来说，网友们,0.03125,0.2864583333333333,0.6822916666666666,0.25,0.25,0.5,0.0,0.3125,0.6875,0.0,0.0,1.0,0.0,0.0,1.0,0.0,0.0,1.0,0.0,0.0,1.0,0.0,0.0,1.0,0.0,0.0,1.0,0.0,0.0,1.0,0.0,0.0,1.0,0.0,0.0,1.0
12,【 辽宁盘锦1村民被民警枪杀续：系政府违法强拆】 兴隆台区有关部门在没有和村民达成拆迁补偿协议、且没有法院判决的情况下违法强拆，导致矛盾迅速激化----,1686294965,本人证实，此微博为捏造微博！这张图片是巴基斯坦反美示威演变骚乱的其中一张照片的截图！和所谓的强拆、村民被杀根本毫无关联！！详见：http://t.cn/zl267lB无差别社会:,对现实持有一定的不满和讽刺态度，但缺乏明确的立场和目标情绪宣泄，悲观抱怨，反讽嘲弄，关注民生，自我中心该用户在社交媒体上表现出较高的活跃度，经常转发和评论各种内容，表达对现实的不满和对个人情绪的关注。其言论中带有明显的讽刺和反讽，对传统价值观持有怀疑态度，同时关注民生问题。在语言风格上，该用户倾向于使用情绪化的表达，并表现出一定的自我中心倾向。,针对上述问题的回答如下：1. 立场分布：大多数网友持反对态度，认为警方的行为不合法；少数人则表示理解或同情。2. 观点分布：主要有以下几个方面的看法：一是认为这是非法暴力事件，应该追究相关人员的责任；二是认为这是一起冤案，不应该受到如此严厉的惩罚；三是认为这是一个政治迫害案件，与法律无关。3. 情绪分布：绝大多数网友感到愤怒、不满和失望，但也有一些人表达了宽容和支持的心态。4. 行为分布：多数网友选择转发这条消息，表达自己的立场和情绪；也有部分网友选择了评论，进一步阐述了自己的观点和理由。5. 话题真实度：从目前的情况来看，这个话题的真实性和可信性存在争议。一方面，许多人都关注到了这一事件的发生和发展过程，但另一方面，也有人对此产生了怀疑和疑问。6. 发言意图：总体来说，网友们,0.03125,0.2864583333333333,0.6822916666666666,0.25,0.25,0.5,0.0,0.3125,0.6875,0.0,0.0,1.0,0.0,0.0,1.0,0.0,0.0,1.0,0.0,0.0,1.0,0.0,0.0,1.0,0.0,0.0,1.0,0.0,0.0,1.0,0.0,0.0,1.0,0.0,0.0,1.0
12,【 辽宁盘锦1村民被民警枪杀续：系政府违法强拆】 兴隆台区有关部门在没有和村民达成拆迁补偿协议、且没有法院判决的情况下违法强拆，导致矛盾迅速激化----,1792743660,//@冤案世界: //@四川打工维权者张伟: 伟大的政府啊。钓鱼岛你们没敢开一枪让人了。打了砸了人家的东西你们钱也赔了。要抢中国人民的命根子人家不肯了开枪了.是何道理。难道你们手中的枪是拿来对付自己国家公民的,对房产市场持关注态度，倾向于官方叙事关注民生，精英视角，数据考据，宏大叙事，逻辑缜密该用户对无锡房产市场动态高度关注，倾向于官方叙事，注重数据与事实。在表达上，他展现出对民生的关注和精英视角，逻辑缜密，善于分析。在面对不同事件时，他预期会以理性客观的态度进行评论，并强调数据与事实的重要性。其语言风格特征表现为宏大叙事和逻辑性强的特点。,针对上述问题的回答如下：1. 立场分布：大多数网友持反对态度，认为警方的行为不合法；少数人则表示理解或同情。2. 观点分布：主要有以下几个方面的看法：一是认为这是非法暴力事件，应该追究相关人员的责任；二是认为这是一起冤案，不应该受到如此严厉的惩罚；三是认为这是一个政治迫害案件，与法律无关。3. 情绪分布：绝大多数网友感到愤怒、不满和失望，但也有一些人表达了宽容和支持的心态。4. 行为分布：多数网友选择转发这条消息，表达自己的立场和情绪；也有部分网友选择了评论，进一步阐述了自己的观点和理由。5. 话题真实度：从目前的情况来看，这个话题的真实性和可信性存在争议。一方面，许多人都关注到了这一事件的发生和发展过程，但另一方面，也有人对此产生了怀疑和疑问。6. 发言意图：总体来说，网友们,0.03125,0.2864583333333333,0.6822916666666666,0.25,0.25,0.5,0.0,0.3125,0.6875,0.0,0.0,1.0,0.0,0.0,1.0,0.0,0.0,1.0,0.0,0.0,1.0,0.0,0.0,1.0,0.0,0.0,1.0,0.0,0.0,1.0,0.0,0.0,1.0,0.0,0.0,1.0
12,【 辽宁盘锦1村民被民警枪杀续：系政府违法强拆】 兴隆台区有关部门在没有和村民达成拆迁补偿协议、且没有法院判决的情况下违法强拆，导致矛盾迅速激化----,1679428183,转发微博,转发内容多样，包括官方内容、正能量内容、生活感悟等，显示对体制的认同，但对一些社会现象持幽默态度情绪宣泄，关注民生，精英视角，幽默风趣，自我中心该用户关注社会现象，转发内容多样，包括官方内容、正能量内容、生活感悟等，显示对体制的认同。在表达上，喜欢用幽默的方式看待问题，同时关注民生，具有一定的精英视角。在语言风格上，幽默风趣，但有时也表现出自我中心的特点。,针对上述问题的回答如下：1. 立场分布：大多数网友持反对态度，认为警方的行为不合法；少数人则表示理解或同情。2. 观点分布：主要有以下几个方面的看法：一是认为这是非法暴力事件，应该追究相关人员的责任；二是认为这是一起冤案，不应该受到如此严厉的惩罚；三是认为这是一个政治迫害案件，与法律无关。3. 情绪分布：绝大多数网友感到愤怒、不满和失望，但也有一些人表达了宽容和支持的心态。4. 行为分布：多数网友选择转发这条消息，表达自己的立场和情绪；也有部分网友选择了评论，进一步阐述了自己的观点和理由。5. 话题真实度：从目前的情况来看，这个话题的真实性和可信性存在争议。一方面，许多人都关注到了这一事件的发生和发展过程，但另一方面，也有人对此产生了怀疑和疑问。6. 发言意图：总体来说，网友们,0.03125,0.2864583333333333,0.6822916666666666,0.25,0.25,0.5,0.0,0.3125,0.6875,0.0,0.0,1.0,0.0,0.0,1.0,0.0,0.0,1.0,0.0,0.0,1.0,0.0,0.0,1.0,0.0,0.0,1.0,0.0,0.0,1.0,0.0,0.0,1.0,0.0,0.0,1.0
12,【 辽宁盘锦1村民被民警枪杀续：系政府违法强拆】 兴隆台区有关部门在没有和村民达成拆迁补偿协议、且没有法院判决的情况下违法强拆，导致矛盾迅速激化----,1642235854,警察就是穿了一身黄皮的走狗,温和建制派，对日常生活话题有较强兴趣，转发内容多与娱乐、美食相关情绪宣泄，关注民生，自我中心，幽默风趣，攻击性强该用户表现出温和的体制拥护态度，对日常生活话题有浓厚兴趣，转发内容多涉及娱乐、美食等轻松话题。在表达上，善于使用幽默和情绪化的语言，关注个人情感和日常生活。作为高频活跃者，该用户在社交媒体上积极参与互动，展现出较强的社交活跃度。,针对上述问题的回答如下：1. 立场分布：大多数网友持反对态度，认为警方的行为不合法；少数人则表示理解或同情。2. 观点分布：主要有以下几个方面的看法：一是认为这是非法暴力事件，应该追究相关人员的责任；二是认为这是一起冤案，不应该受到如此严厉的惩罚；三是认为这是一个政治迫害案件，与法律无关。3. 情绪分布：绝大多数网友感到愤怒、不满和失望，但也有一些人表达了宽容和支持的心态。4. 行为分布：多数网友选择转发这条消息，表达自己的立场和情绪；也有部分网友选择了评论，进一步阐述了自己的观点和理由。5. 话题真实度：从目前的情况来看，这个话题的真实性和可信性存在争议。一方面，许多人都关注到了这一事件的发生和发展过程，但另一方面，也有人对此产生了怀疑和疑问。6. 发言意图：总体来说，网友们,0.03125,0.2864583333333333,0.6822916666666666,0.25,0.25,0.5,0.0,0.3125,0.6875,0.0,0.0,1.0,0.0,0.0,1.0,0.0,0.0,1.0,0.0,0.0,1.0,0.0,0.0,1.0,0.0,0.0,1.0,0.0,0.0,1.0,0.0,0.0,1.0,0.0,0.0,1.0
12,【 辽宁盘锦1村民被民警枪杀续：系政府违法强拆】 兴隆台区有关部门在没有和村民达成拆迁补偿协议、且没有法院判决的情况下违法强拆，导致矛盾迅速激化----,1992100255,记得柴奥赛斯库的下场么？,转发内容多样，对某些事件有个人看法，但整体上倾向于温和改良派立场情绪宣泄，关注民生，精英视角，底层共情该用户关注社会热点事件，对某些事件有强烈的个人情感反应，同时也会转发一些与民生相关的内容。在表达上，既有情绪宣泄的一面，也有对民生问题的关注。整体上，该用户表现出一定的社会参与意识，但并非意见领袖，更倾向于作为一个普通参与者。,针对上述问题的回答如下：1. 立场分布：大多数网友持反对态度，认为警方的行为不合法；少数人则表示理解或同情。2. 观点分布：主要有以下几个方面的看法：一是认为这是非法暴力事件，应该追究相关人员的责任；二是认为这是一起冤案，不应该受到如此严厉的惩罚；三是认为这是一个政治迫害案件，与法律无关。3. 情绪分布：绝大多数网友感到愤怒、不满和失望，但也有一些人表达了宽容和支持的心态。4. 行为分布：多数网友选择转发这条消息，表达自己的立场和情绪；也有部分网友选择了评论，进一步阐述了自己的观点和理由。5. 话题真实度：从目前的情况来看，这个话题的真实性和可信性存在争议。一方面，许多人都关注到了这一事件的发生和发展过程，但另一方面，也有人对此产生了怀疑和疑问。6. 发言意图：总体来说，网友们,0.03125,0.2864583333333333,0.6822916666666666,0.25,0.25,0.5,0.0,0.3125,0.6875,0.0,0.0,1.0,0.0,0.0,1.0,0.0,0.0,1.0,0.0,0.0,1.0,0.0,0.0,1.0,0.0,0.0,1.0,0.0,0.0,1.0,0.0,0.0,1.0,0.0,0.0,1.0
12,【 辽宁盘锦1村民被民警枪杀续：系政府违法强拆】 兴隆台区有关部门在没有和村民达成拆迁补偿协议、且没有法院判决的情况下违法强拆，导致矛盾迅速激化----,1718951165,太血腥了,情绪宣泄，盲目乐观，岁月静好/吃瓜，关注民生，自我中心这位用户似乎对生活持有一种乐观而随和的态度，喜欢参与各种有奖转发活动，希望通过这些活动获得好运。他在转发内容时，往往表现出对生活的热爱和对简单快乐的追求。他的语言风格偏向于情绪化，关注民生，同时也带有一定的自我中心倾向。在参与社会舆论时，他更倾向于随大流，而不是表达自己的独立见解。,针对上述问题的回答如下：1. 立场分布：大多数网友持反对态度，认为警方的行为不合法；少数人则表示理解或同情。2. 观点分布：主要有以下几个方面的看法：一是认为这是非法暴力事件，应该追究相关人员的责任；二是认为这是一起冤案，不应该受到如此严厉的惩罚；三是认为这是一个政治迫害案件，与法律无关。3. 情绪分布：绝大多数网友感到愤怒、不满和失望，但也有一些人表达了宽容和支持的心态。4. 行为分布：多数网友选择转发这条消息，表达自己的立场和情绪；也有部分网友选择了评论，进一步阐述了自己的观点和理由。5. 话题真实度：从目前的情况来看，这个话题的真实性和可信性存在争议。一方面，许多人都关注到了这一事件的发生和发展过程，但另一方面，也有人对此产生了怀疑和疑问。6. 发言意图：总体来说，网友们,0.03125,0.2864583333333333,0.6822916666666666,0.25,0.25,0.5,0.0,0.3125,0.6875,0.0,0.0,1.0,0.0,0.0,1.0,0.0,0.0,1.0,0.0,0.0,1.0,0.0,0.0,1.0,0.0,0.0,1.0,0.0,0.0,1.0,0.0,0.0,1.0,0.0,0.0,1.0
12,【 辽宁盘锦1村民被民警枪杀续：系政府违法强拆】 兴隆台区有关部门在没有和村民达成拆迁补偿协议、且没有法院判决的情况下违法强拆，导致矛盾迅速激化----,1252371280,辽宁盘锦当局称农民用火点燃自己的衣服，然后跑向警察，我看这个农民的衣服没有哪点被着火呀。,对某些社会现象持批判态度，但并非极端反对派情绪宣泄，关注民生，自我中心，政治隐喻，逻辑缜密该用户对社会现象持有批判态度，关注民生问题，善于表达个人观点。在社交媒体上活跃，转发和评论内容涉及社会热点和科技话题，表现出对公共事务的关注。语言风格上，既有情绪宣泄，也有逻辑分析，善于使用政治隐喻来表达自己的观点。,针对上述问题的回答如下：1. 立场分布：大多数网友持反对态度，认为警方的行为不合法；少数人则表示理解或同情。2. 观点分布：主要有以下几个方面的看法：一是认为这是非法暴力事件，应该追究相关人员的责任；二是认为这是一起冤案，不应该受到如此严厉的惩罚；三是认为这是一个政治迫害案件，与法律无关。3. 情绪分布：绝大多数网友感到愤怒、不满和失望，但也有一些人表达了宽容和支持的心态。4. 行为分布：多数网友选择转发这条消息，表达自己的立场和情绪；也有部分网友选择了评论，进一步阐述了自己的观点和理由。5. 话题真实度：从目前的情况来看，这个话题的真实性和可信性存在争议。一方面，许多人都关注到了这一事件的发生和发展过程，但另一方面，也有人对此产生了怀疑和疑问。6. 发言意图：总体来说，网友们,0.03125,0.2864583333333333,0.6822916666666666,0.25,0.25,0.5,0.0,0.3125,0.6875,0.0,0.0,1.0,0.0,0.0,1.0,0.0,0.0,1.0,0.0,0.0,1.0,0.0,0.0,1.0,0.0,0.0,1.0,0.0,0.0,1.0,0.0,0.0,1.0,0.0,0.0,1.0
12,【 辽宁盘锦1村民被民警枪杀续：系政府违法强拆】 兴隆台区有关部门在没有和村民达成拆迁补偿协议、且没有法院判决的情况下违法强拆，导致矛盾迅速激化----,1463350204,//@暴雪下的青松:辽宁盘锦当局称农民用火点燃自己的衣服，然后跑向警察，我看这个农民的衣服没有哪点被着火呀。,对官方和正面内容持一般认同态度，但也会转发一些具有新看点的内容，显示对新鲜事物的关注。关注民生，精英视角，自我中心，情绪宣泄，理性客观该用户对官方和正面内容持一般认同态度，但同时也关注社会发展和新鲜事物。在表达上，他关注民生，具有精英视角，同时表现出一定的自我中心情绪。他善于理性客观地分析问题，并在社交媒体上保持高频活跃。在面对不同类型的事件时，他可能会表现出情绪宣泄的一面，但总体上保持理性。,针对上述问题的回答如下：1. 立场分布：大多数网友持反对态度，认为警方的行为不合法；少数人则表示理解或同情。2. 观点分布：主要有以下几个方面的看法：一是认为这是非法暴力事件，应该追究相关人员的责任；二是认为这是一起冤案，不应该受到如此严厉的惩罚；三是认为这是一个政治迫害案件，与法律无关。3. 情绪分布：绝大多数网友感到愤怒、不满和失望，但也有一些人表达了宽容和支持的心态。4. 行为分布：多数网友选择转发这条消息，表达自己的立场和情绪；也有部分网友选择了评论，进一步阐述了自己的观点和理由。5. 话题真实度：从目前的情况来看，这个话题的真实性和可信性存在争议。一方面，许多人都关注到了这一事件的发生和发展过程，但另一方面，也有人对此产生了怀疑和疑问。6. 发言意图：总体来说，网友们,0.03125,0.2864583333333333,0.6822916666666666,0.25,0.25,0.5,0.0,0.3125,0.6875,0.0,0.0,1.0,0.0,0.0,1.0,0.0,0.0,1.0,0.0,0.0,1.0,0.0,0.0,1.0,0.0,0.0,1.0,0.0,0.0,1.0,0.0,0.0,1.0,0.0,0.0,1.0
12,【 辽宁盘锦1村民被民警枪杀续：系政府违法强拆】 兴隆台区有关部门在没有和村民达成拆迁补偿协议、且没有法院判决的情况下违法强拆，导致矛盾迅速激化----,2132483722,//@万天飞律师: //@暴雪下的青松:辽宁盘锦当局称农民用火点燃自己的衣服，然后跑向警察，我看这个农民的衣服没有哪点被着火呀。,对体制和政策持有批判态度，但未表现出极端反对情绪宣泄，反讽嘲弄，攻击性强，关注民生，自我中心该用户对体制和政策持有批判态度，经常转发和评论与政治和社会问题相关的微博。其表达方式以情绪宣泄和反讽为主，关注民生问题，并表现出一定的自我中心倾向。在社交媒体上，该用户活跃度高，经常参与讨论，对现实问题有较强的反应和表达欲望。,针对上述问题的回答如下：1. 立场分布：大多数网友持反对态度，认为警方的行为不合法；少数人则表示理解或同情。2. 观点分布：主要有以下几个方面的看法：一是认为这是非法暴力事件，应该追究相关人员的责任；二是认为这是一起冤案，不应该受到如此严厉的惩罚；三是认为这是一个政治迫害案件，与法律无关。3. 情绪分布：绝大多数网友感到愤怒、不满和失望，但也有一些人表达了宽容和支持的心态。4. 行为分布：多数网友选择转发这条消息，表达自己的立场和情绪；也有部分网友选择了评论，进一步阐述了自己的观点和理由。5. 话题真实度：从目前的情况来看，这个话题的真实性和可信性存在争议。一方面，许多人都关注到了这一事件的发生和发展过程，但另一方面，也有人对此产生了怀疑和疑问。6. 发言意图：总体来说，网友们,0.03125,0.2864583333333333,0.6822916666666666,0.25,0.25,0.5,0.0,0.3125,0.6875,0.0,0.0,1.0,0.0,0.0,1.0,0.0,0.0,1.0,0.0,0.0,1.0,0.0,0.0,1.0,0.0,0.0,1.0,0.0,0.0,1.0,0.0,0.0,1.0,0.0,0.0,1.0
12,【 辽宁盘锦1村民被民警枪杀续：系政府违法强拆】 兴隆台区有关部门在没有和村民达成拆迁补偿协议、且没有法院判决的情况下违法强拆，导致矛盾迅速激化----,1688108832,//@龚伟力://@听从我心: //@冤案世界://@四川打工维权者张伟: 伟大的政府啊。钓鱼岛你们没敢开一枪让人了。打了砸了人家的东西你们钱也赔了。要抢中国人民的命根子人家不肯了开枪了.是何道理。难道你们手中的枪是拿来对付自己国家公民的,转发内容多样，对某些事件有个人看法，但整体上倾向于温和改良派立场情绪宣泄，关注民生，精英视角，底层共情该用户关注社会热点事件，对某些事件有强烈的个人情感反应，同时也会转发一些与民生相关的内容。在表达上，既有情绪宣泄的一面，也有对民生问题的关注。整体上，该用户表现出一定的社会参与意识，但并非意见领袖，更倾向于作为一个普通参与者。,针对上述问题的回答如下：1. 立场分布：大多数网友持反对态度，认为警方的行为不合法；少数人则表示理解或同情。2. 观点分布：主要有以下几个方面的看法：一是认为这是非法暴力事件，应该追究相关人员的责任；二是认为这是一起冤案，不应该受到如此严厉的惩罚；三是认为这是一个政治迫害案件，与法律无关。3. 情绪分布：绝大多数网友感到愤怒、不满和失望，但也有一些人表达了宽容和支持的心态。4. 行为分布：多数网友选择转发这条消息，表达自己的立场和情绪；也有部分网友选择了评论，进一步阐述了自己的观点和理由。5. 话题真实度：从目前的情况来看，这个话题的真实性和可信性存在争议。一方面，许多人都关注到了这一事件的发生和发展过程，但另一方面，也有人对此产生了怀疑和疑问。6. 发言意图：总体来说，网友们,0.03125,0.2864583333333333,0.6822916666666666,0.25,0.25,0.5,0.0,0.3125,0.6875,0.0,0.0,1.0,0.0,0.0,1.0,0.0,0.0,1.0,0.0,0.0,1.0,0.0,0.0,1.0,0.0,0.0,1.0,0.0,0.0,1.0,0.0,0.0,1.0,0.0,0.0,1.0
12,【 辽宁盘锦1村民被民警枪杀续：系政府违法强拆】 兴隆台区有关部门在没有和村民达成拆迁补偿协议、且没有法院判决的情况下违法强拆，导致矛盾迅速激化----,2534706290,//@龚伟力: //@听从我心: //@冤案世界://@四川打工维权者张伟: 伟大的政府啊。钓鱼岛你们没敢开一枪让人了。打了砸了人家的东西你们钱也赔了。要抢中国人民的命根子人家不肯了开枪了.是何道理。难道你们手中的枪是拿来对付自己国家公民的,情绪宣泄，宏大叙事，关注民生，精英视角，底层共情这位用户热爱生活，喜欢分享生活中的点滴，对自然景观和美食有着浓厚的兴趣。他关注社会现象，但更倾向于以旁观者的角度去观察和思考。他的语言风格偏向于情绪宣泄和宏大叙事，同时也能体现出对民生和精英视角的关注。他是一位普通参与者，活跃度不高，但能带来积极向上的氛围。,针对上述问题的回答如下：1. 立场分布：大多数网友持反对态度，认为警方的行为不合法；少数人则表示理解或同情。2. 观点分布：主要有以下几个方面的看法：一是认为这是非法暴力事件，应该追究相关人员的责任；二是认为这是一起冤案，不应该受到如此严厉的惩罚；三是认为这是一个政治迫害案件，与法律无关。3. 情绪分布：绝大多数网友感到愤怒、不满和失望，但也有一些人表达了宽容和支持的心态。4. 行为分布：多数网友选择转发这条消息，表达自己的立场和情绪；也有部分网友选择了评论，进一步阐述了自己的观点和理由。5. 话题真实度：从目前的情况来看，这个话题的真实性和可信性存在争议。一方面，许多人都关注到了这一事件的发生和发展过程，但另一方面，也有人对此产生了怀疑和疑问。6. 发言意图：总体来说，网友们,0.03125,0.2864583333333333,0.6822916666666666,0.25,0.25,0.5,0.0,0.3125,0.6875,0.0,0.0,1.0,0.0,0.0,1.0,0.0,0.0,1.0,0.0,0.0,1.0,0.0,0.0,1.0,0.0,0.0,1.0,0.0,0.0,1.0,0.0,0.0,1.0,0.0,0.0,1.0
