time_step,topic,uid,real_comments,profile_text,batch_mf,pre_pos,pre_neu,pre_neg,dist_t0_pos,dist_t0_neu,dist_t0_neg,dist_t1_pos,dist_t1_neu,dist_t1_neg,dist_t2_pos,dist_t2_neu,dist_t2_neg,dist_t3_pos,dist_t3_neu,dist_t3_neg,dist_t4_pos,dist_t4_neu,dist_t4_neg,dist_t5_pos,dist_t5_neu,dist_t5_neg,dist_t6_pos,dist_t6_neu,dist_t6_neg,dist_t7_pos,dist_t7_neu,dist_t7_neg,dist_t8_pos,dist_t8_neu,dist_t8_neg,dist_t9_pos,dist_t9_neu,dist_t9_neg,dist_t10_pos,dist_t10_neu,dist_t10_neg
3,【 辽宁盘锦1村民被民警枪杀续：系政府违法强拆】 兴隆台区有关部门在没有和村民达成拆迁补偿协议、且没有法院判决的情况下违法强拆，导致矛盾迅速激化----,1957997483,CHINA=“拆那”！[哈哈]就是木有底气去钓鱼岛拆个把标志！,频繁发布个人生活动态，转发内容多样，但缺乏明确的政治立场情绪宣泄，关注民生，精英视角，底层共情，自我中心该用户似乎更关注个人生活，频繁发布与生日相关的动态，同时转发内容涉及娱乐、社会现象等，表现出对生活的关注和对周围世界的参与。在表达上，既有情绪宣泄的一面，也有对民生和精英视角的关注，显示出其复杂的人格特质。在面对不同类型的事件时，可能更倾向于表达个人感受而非明确的政治立场，语言风格特征表现为既情绪化又关注社会现象。,要求：答案要涵盖上述所有方面的要点。立场分布：大多数网友持反对态度，认为政府不应该强制拆除居民住宅并造成人员伤亡；部分网友则表示愤怒或不满，指责政府的行为不合法合理。观点分布：主要有以下几个观点：①政府应该尊重人民的权利与自由，不应强行拆除居民住宅；②政府应采取更为合理的措施解决纠纷问题，避免暴力冲突的发生；③警方应对违法行为做出公正处理，保障人民群众的生命安全和社会秩序稳定。情绪分布：多数网友感到愤慨和不安，因为政府行为造成了严重的后果，包括人身伤害和财产损失等。同时也有少数网友表达了担忧和疑虑，担心类似的事情会再次发生。行动分布：绝大多数网友选择通过社交媒体平台表达自己的看法和支持反拆迁运动，而较少有人参与实际的抗议活动。真实度分布：大多数人认为这个话题的真实程度较高，因为它涉及到公共利益和个人权利的问题，而且已经引起了广泛关注和,0.0,0.1458333333333333,0.8541666666666666,0.25,0.125,0.625,0.0,0.5,0.5,0.0,0.5,0.5,0.0,0.4375,0.5625,0.0,0.4375,0.5625,0.0,0.375,0.625,0.125,0.25,0.625,0.0,0.25,0.75,0.0,0.125,0.875,0.25,0.25,0.5,0.0,0.3125,0.6875
3,【 辽宁盘锦1村民被民警枪杀续：系政府违法强拆】 兴隆台区有关部门在没有和村民达成拆迁补偿协议、且没有法院判决的情况下违法强拆，导致矛盾迅速激化----,1746902097,谁给他们杀人的权利?/,对一些社会现象持有批评态度，但对体制总体上持支持立场情绪宣泄，逻辑缜密，修辞类，视角类该用户关注社会现象，对一些问题持有自己的看法，并能够通过逻辑和数据进行分析。在表达上，既有情绪宣泄的一面，也有理性客观的一面。对社会问题持有批判态度，但对体制总体上持支持立场。在参与话题时，通常以普通参与者的身份出现，偶尔会发表自己的观点。,要求：答案要涵盖上述所有方面的要点。立场分布：大多数网友持反对态度，认为政府不应该强制拆除居民住宅并造成人员伤亡；部分网友则表示愤怒或不满，指责政府的行为不合法合理。观点分布：主要有以下几个观点：①政府应该尊重人民的权利与自由，不应强行拆除居民住宅；②政府应采取更为合理的措施解决纠纷问题，避免暴力冲突的发生；③警方应对违法行为做出公正处理，保障人民群众的生命安全和社会秩序稳定。情绪分布：多数网友感到愤慨和不安，因为政府行为造成了严重的后果，包括人身伤害和财产损失等。同时也有少数网友表达了担忧和疑虑，担心类似的事情会再次发生。行动分布：绝大多数网友选择通过社交媒体平台表达自己的看法和支持反拆迁运动，而较少有人参与实际的抗议活动。真实度分布：大多数人认为这个话题的真实程度较高，因为它涉及到公共利益和个人权利的问题，而且已经引起了广泛关注和,0.0,0.1458333333333333,0.8541666666666666,0.25,0.125,0.625,0.0,0.5,0.5,0.0,0.5,0.5,0.0,0.4375,0.5625,0.0,0.4375,0.5625,0.0,0.375,0.625,0.125,0.25,0.625,0.0,0.25,0.75,0.0,0.125,0.875,0.25,0.25,0.5,0.0,0.3125,0.6875
3,【 辽宁盘锦1村民被民警枪杀续：系政府违法强拆】 兴隆台区有关部门在没有和村民达成拆迁补偿协议、且没有法院判决的情况下违法强拆，导致矛盾迅速激化----,1993598934,//@卓兰小姐: 谁给他们杀人的权利?///@任食: 警察不是在“依法执法”，本次开枪属违法！,温和建制派，对日常生活话题有较强兴趣，转发内容多与娱乐、美食相关情绪宣泄，关注民生，自我中心，幽默风趣，攻击性强该用户表现出温和的体制拥护态度，对日常生活话题有浓厚兴趣，转发内容多涉及娱乐、美食等轻松话题。在表达上，善于使用幽默和情绪化的语言，关注个人情感和日常生活。作为高频活跃者，该用户在社交媒体上积极参与互动，展现出较强的社交活跃度。,要求：答案要涵盖上述所有方面的要点。立场分布：大多数网友持反对态度，认为政府不应该强制拆除居民住宅并造成人员伤亡；部分网友则表示愤怒或不满，指责政府的行为不合法合理。观点分布：主要有以下几个观点：①政府应该尊重人民的权利与自由，不应强行拆除居民住宅；②政府应采取更为合理的措施解决纠纷问题，避免暴力冲突的发生；③警方应对违法行为做出公正处理，保障人民群众的生命安全和社会秩序稳定。情绪分布：多数网友感到愤慨和不安，因为政府行为造成了严重的后果，包括人身伤害和财产损失等。同时也有少数网友表达了担忧和疑虑，担心类似的事情会再次发生。行动分布：绝大多数网友选择通过社交媒体平台表达自己的看法和支持反拆迁运动，而较少有人参与实际的抗议活动。真实度分布：大多数人认为这个话题的真实程度较高，因为它涉及到公共利益和个人权利的问题，而且已经引起了广泛关注和,0.0,0.1458333333333333,0.8541666666666666,0.25,0.125,0.625,0.0,0.5,0.5,0.0,0.5,0.5,0.0,0.4375,0.5625,0.0,0.4375,0.5625,0.0,0.375,0.625,0.125,0.25,0.625,0.0,0.25,0.75,0.0,0.125,0.875,0.25,0.25,0.5,0.0,0.3125,0.6875
4,【 辽宁盘锦1村民被民警枪杀续：系政府违法强拆】 兴隆台区有关部门在没有和村民达成拆迁补偿协议、且没有法院判决的情况下违法强拆，导致矛盾迅速激化----,1752991470,惨,对日常生活细节关注较多，对官方和正面内容有一般认同，但也会表达个人观点。情绪宣泄，关注民生，精英视角，底层共情，自我中心该用户关注日常生活，对官方和正面内容有基本认同，但也会表达个人观点。在表达上，情绪宣泄和关注民生是其主要风格，同时展现出精英视角和底层共情。在社交活动中，该用户活跃度高，善于分享个人经历和感受，同时也关注社会热点。,首先需要明确的是，在这段文字中，我们看到了很多不同类型的网民对于同一个议题的看法和反应。其中，我们可以看到一些比较正面的态度，比如“赞同”、“理解”，也有一些负面的情绪，如“气愤”、“失望”。此外，还有一些人在谈论这个问题时采用了不同的方式，有的只是简单地分享他们的想法，有些则是更加深入地探讨了一些细节或者提出了一些建议等等。总的来说，这些网民们的意见都是基于各自的经验和知识背景的不同而产生的，因此我们需要认真听取每一个人的声音，才能更好地理解和解决问题。,0.0625,0.140625,0.796875,0.0,0.5,0.5,0.0,0.5,0.5,0.0,0.4375,0.5625,0.0,0.4375,0.5625,0.0,0.375,0.625,0.125,0.25,0.625,0.0,0.25,0.75,0.0,0.125,0.875,0.25,0.25,0.5,0.0,0.3125,0.6875,0.0,0.0,1.0
4,【 辽宁盘锦1村民被民警枪杀续：系政府违法强拆】 兴隆台区有关部门在没有和村民达成拆迁补偿协议、且没有法院判决的情况下违法强拆，导致矛盾迅速激化----,1761610071,[怒],虽是体制拥护派，但对教育、生活等方面持有批评态度情绪宣泄，悲观抱怨，关注民生，自我中心，攻击性强该用户对生活持有一定的悲观态度，但同时也表现出对生活的热爱和关注。他/她对体制持有一定的批评，但并未表现出极端的反对。在表达上，他/她倾向于情绪宣泄和关注个人生活，同时在某些情况下也会表现出攻击性。他/她是一个活跃的社交媒体用户，经常分享个人生活和观点。,首先需要明确的是，在这段文字中，我们看到了很多不同类型的网民对于同一个议题的看法和反应。其中，我们可以看到一些比较正面的态度，比如“赞同”、“理解”，也有一些负面的情绪，如“气愤”、“失望”。此外，还有一些人在谈论这个问题时采用了不同的方式，有的只是简单地分享他们的想法，有些则是更加深入地探讨了一些细节或者提出了一些建议等等。总的来说，这些网民们的意见都是基于各自的经验和知识背景的不同而产生的，因此我们需要认真听取每一个人的声音，才能更好地理解和解决问题。,0.0625,0.140625,0.796875,0.0,0.5,0.5,0.0,0.5,0.5,0.0,0.4375,0.5625,0.0,0.4375,0.5625,0.0,0.375,0.625,0.125,0.25,0.625,0.0,0.25,0.75,0.0,0.125,0.875,0.25,0.25,0.5,0.0,0.3125,0.6875,0.0,0.0,1.0
4,【 辽宁盘锦1村民被民警枪杀续：系政府违法强拆】 兴隆台区有关部门在没有和村民达成拆迁补偿协议、且没有法院判决的情况下违法强拆，导致矛盾迅速激化----,2651304460,转发微博,转发内容多涉及日常生活和娱乐话题，显示对现状的接受和轻微的调侃。情绪宣泄，盲目乐观，宏大叙事，关注民生，自我中心该用户似乎是一个对生活持有乐观态度的人，喜欢分享与日常生活和娱乐相关的内容。他们在转发内容时，往往表现出对现状的接受和轻微的调侃。他们的言论中透露出对个人情感和日常体验的关注，同时展现出一种对生活的简单快乐追求。在面对不同类型的事件时，他们可能会表现出情绪化的反应，并倾向于从个人角度出发进行评论。他们的语言风格特征包括情绪宣泄、盲目乐观、宏大叙事、关注民生和自我中心。,首先需要明确的是，在这段文字中，我们看到了很多不同类型的网民对于同一个议题的看法和反应。其中，我们可以看到一些比较正面的态度，比如“赞同”、“理解”，也有一些负面的情绪，如“气愤”、“失望”。此外，还有一些人在谈论这个问题时采用了不同的方式，有的只是简单地分享他们的想法，有些则是更加深入地探讨了一些细节或者提出了一些建议等等。总的来说，这些网民们的意见都是基于各自的经验和知识背景的不同而产生的，因此我们需要认真听取每一个人的声音，才能更好地理解和解决问题。,0.0625,0.140625,0.796875,0.0,0.5,0.5,0.0,0.5,0.5,0.0,0.4375,0.5625,0.0,0.4375,0.5625,0.0,0.375,0.625,0.125,0.25,0.625,0.0,0.25,0.75,0.0,0.125,0.875,0.25,0.25,0.5,0.0,0.3125,0.6875,0.0,0.0,1.0
4,【 辽宁盘锦1村民被民警枪杀续：系政府违法强拆】 兴隆台区有关部门在没有和村民达成拆迁补偿协议、且没有法院判决的情况下违法强拆，导致矛盾迅速激化----,1764695033,暴政……,转发官方内容较多，但无明确反对或批判态度情绪宣泄，关注民生，精英视角，底层共情，自我中心该用户关注社会热点事件，转发官方和正面内容较多，表现出对个人利益的关注和对社会稳定的追求。在表达上，倾向于情绪宣泄和关注民生，同时展现出精英视角和底层共情。在语言风格上，自我中心特征明显。,首先需要明确的是，在这段文字中，我们看到了很多不同类型的网民对于同一个议题的看法和反应。其中，我们可以看到一些比较正面的态度，比如“赞同”、“理解”，也有一些负面的情绪，如“气愤”、“失望”。此外，还有一些人在谈论这个问题时采用了不同的方式，有的只是简单地分享他们的想法，有些则是更加深入地探讨了一些细节或者提出了一些建议等等。总的来说，这些网民们的意见都是基于各自的经验和知识背景的不同而产生的，因此我们需要认真听取每一个人的声音，才能更好地理解和解决问题。,0.0625,0.140625,0.796875,0.0,0.5,0.5,0.0,0.5,0.5,0.0,0.4375,0.5625,0.0,0.4375,0.5625,0.0,0.375,0.625,0.125,0.25,0.625,0.0,0.25,0.75,0.0,0.125,0.875,0.25,0.25,0.5,0.0,0.3125,0.6875,0.0,0.0,1.0
4,【 辽宁盘锦1村民被民警枪杀续：系政府违法强拆】 兴隆台区有关部门在没有和村民达成拆迁补偿协议、且没有法院判决的情况下违法强拆，导致矛盾迅速激化----,2035124285,请不要将巴基斯坦警察抗暴游行死人的图片张冠李戴.请大家看凤皇网新闻网.做人要诚实.欺骗网友不道德.,对体制和政策持有批判态度，但未表现出极端反对情绪宣泄，反讽嘲弄，攻击性强，关注民生，自我中心该用户对体制和政策持有批判态度，经常转发和评论与政治和社会问题相关的微博。其表达方式以情绪宣泄和反讽为主，关注民生问题，并表现出一定的自我中心倾向。在社交媒体上，该用户活跃度高，经常参与讨论，对现实问题有较强的反应和表达欲望。,首先需要明确的是，在这段文字中，我们看到了很多不同类型的网民对于同一个议题的看法和反应。其中，我们可以看到一些比较正面的态度，比如“赞同”、“理解”，也有一些负面的情绪，如“气愤”、“失望”。此外，还有一些人在谈论这个问题时采用了不同的方式，有的只是简单地分享他们的想法，有些则是更加深入地探讨了一些细节或者提出了一些建议等等。总的来说，这些网民们的意见都是基于各自的经验和知识背景的不同而产生的，因此我们需要认真听取每一个人的声音，才能更好地理解和解决问题。,0.0625,0.140625,0.796875,0.0,0.5,0.5,0.0,0.5,0.5,0.0,0.4375,0.5625,0.0,0.4375,0.5625,0.0,0.375,0.625,0.125,0.25,0.625,0.0,0.25,0.75,0.0,0.125,0.875,0.25,0.25,0.5,0.0,0.3125,0.6875,0.0,0.0,1.0
4,【 辽宁盘锦1村民被民警枪杀续：系政府违法强拆】 兴隆台区有关部门在没有和村民达成拆迁补偿协议、且没有法院判决的情况下违法强拆，导致矛盾迅速激化----,2393670752,[蜡烛][蜡烛][蜡烛],关注民生，对特定事件有强烈情感反应，对政治事件有批判态度情绪宣泄，关注民生，攻击性强，宏大叙事，自我中心该用户表现出对民生问题的关注和对特定事件的强烈情感反应，同时在表达上具有攻击性和自我中心的特点。在政治事件上，该用户倾向于批判态度，同时受到情绪煽动的影响较大。该用户在社交媒体上活跃度高，喜欢分享个人观点和对社会事件的评论，表现出对群体利益的关注和对社会公正的追求。,首先需要明确的是，在这段文字中，我们看到了很多不同类型的网民对于同一个议题的看法和反应。其中，我们可以看到一些比较正面的态度，比如“赞同”、“理解”，也有一些负面的情绪，如“气愤”、“失望”。此外，还有一些人在谈论这个问题时采用了不同的方式，有的只是简单地分享他们的想法，有些则是更加深入地探讨了一些细节或者提出了一些建议等等。总的来说，这些网民们的意见都是基于各自的经验和知识背景的不同而产生的，因此我们需要认真听取每一个人的声音，才能更好地理解和解决问题。,0.0625,0.140625,0.796875,0.0,0.5,0.5,0.0,0.5,0.5,0.0,0.4375,0.5625,0.0,0.4375,0.5625,0.0,0.375,0.625,0.125,0.25,0.625,0.0,0.25,0.75,0.0,0.125,0.875,0.25,0.25,0.5,0.0,0.3125,0.6875,0.0,0.0,1.0
4,【 辽宁盘锦1村民被民警枪杀续：系政府违法强拆】 兴隆台区有关部门在没有和村民达成拆迁补偿协议、且没有法院判决的情况下违法强拆，导致矛盾迅速激化----,2260705107,操，妈的,对新技术和产品持积极态度，但对某些社会议题表现出批判性思考情绪宣泄，关注民生，精英视角，自我中心，逻辑缜密该用户对新技术和产品表现出浓厚的兴趣，乐于分享和体验。在表达个人观点时，既关注民生问题，又保持一定的精英视角。对社会议题持有批判性思考，但总体上倾向于温和建制派立场。在语言风格上，逻辑性强，但有时会表现出情绪化的倾向。作为高频活跃者，该用户在社交媒体上积极参与讨论，并具有一定的影响力。,首先需要明确的是，在这段文字中，我们看到了很多不同类型的网民对于同一个议题的看法和反应。其中，我们可以看到一些比较正面的态度，比如“赞同”、“理解”，也有一些负面的情绪，如“气愤”、“失望”。此外，还有一些人在谈论这个问题时采用了不同的方式，有的只是简单地分享他们的想法，有些则是更加深入地探讨了一些细节或者提出了一些建议等等。总的来说，这些网民们的意见都是基于各自的经验和知识背景的不同而产生的，因此我们需要认真听取每一个人的声音，才能更好地理解和解决问题。,0.0625,0.140625,0.796875,0.0,0.5,0.5,0.0,0.5,0.5,0.0,0.4375,0.5625,0.0,0.4375,0.5625,0.0,0.375,0.625,0.125,0.25,0.625,0.0,0.25,0.75,0.0,0.125,0.875,0.25,0.25,0.5,0.0,0.3125,0.6875,0.0,0.0,1.0
4,【 辽宁盘锦1村民被民警枪杀续：系政府违法强拆】 兴隆台区有关部门在没有和村民达成拆迁补偿协议、且没有法院判决的情况下违法强拆，导致矛盾迅速激化----,1881956372,转发微博,关注健康、生活小技巧，同时表达对成功的看法，显示对生活的积极态度。情绪宣泄，关注民生，宏大叙事，自我中心，阴阳怪气该用户关注健康生活，分享生活小技巧，同时表达对成功和人生的看法。其言论中透露出对生活的积极态度，同时带有一定的幽默感和自我反思。在表达个人观点时，会结合生活实际，体现出对民生的关注。该用户在社交平台上的活跃度一般，属于普通参与者。,首先需要明确的是，在这段文字中，我们看到了很多不同类型的网民对于同一个议题的看法和反应。其中，我们可以看到一些比较正面的态度，比如“赞同”、“理解”，也有一些负面的情绪，如“气愤”、“失望”。此外，还有一些人在谈论这个问题时采用了不同的方式，有的只是简单地分享他们的想法，有些则是更加深入地探讨了一些细节或者提出了一些建议等等。总的来说，这些网民们的意见都是基于各自的经验和知识背景的不同而产生的，因此我们需要认真听取每一个人的声音，才能更好地理解和解决问题。,0.0625,0.140625,0.796875,0.0,0.5,0.5,0.0,0.5,0.5,0.0,0.4375,0.5625,0.0,0.4375,0.5625,0.0,0.375,0.625,0.125,0.25,0.625,0.0,0.25,0.75,0.0,0.125,0.875,0.25,0.25,0.5,0.0,0.3125,0.6875,0.0,0.0,1.0
4,【 辽宁盘锦1村民被民警枪杀续：系政府违法强拆】 兴隆台区有关部门在没有和村民达成拆迁补偿协议、且没有法院判决的情况下违法强拆，导致矛盾迅速激化----,1707517131,//@good钢钢的: 强拆就不合法，出警就已违规，之后的所有行为，包括使用枪械，焉有自卫之理？//@张迟艺术: +1//@zhongqing582:血淋淋，在控诉什么.....[泪][蜡烛][蜡烛][蜡烛]//@丁存来v: //@竹林居士-: //@以道治国: //@无差别社会: 拆----//@nurgl_富蕴电信:,对现实持有一定的不满和讽刺态度，但缺乏明确的立场和目标情绪宣泄，悲观抱怨，反讽嘲弄，关注民生，自我中心该用户在社交媒体上表现出较高的活跃度，经常转发和评论各种内容，表达对现实的不满和对个人情绪的关注。其言论中带有明显的讽刺和反讽，对传统价值观持有怀疑态度，同时关注民生问题。在语言风格上，该用户倾向于使用情绪化的表达，并表现出一定的自我中心倾向。,首先需要明确的是，在这段文字中，我们看到了很多不同类型的网民对于同一个议题的看法和反应。其中，我们可以看到一些比较正面的态度，比如“赞同”、“理解”，也有一些负面的情绪，如“气愤”、“失望”。此外，还有一些人在谈论这个问题时采用了不同的方式，有的只是简单地分享他们的想法，有些则是更加深入地探讨了一些细节或者提出了一些建议等等。总的来说，这些网民们的意见都是基于各自的经验和知识背景的不同而产生的，因此我们需要认真听取每一个人的声音，才能更好地理解和解决问题。,0.0625,0.140625,0.796875,0.0,0.5,0.5,0.0,0.5,0.5,0.0,0.4375,0.5625,0.0,0.4375,0.5625,0.0,0.375,0.625,0.125,0.25,0.625,0.0,0.25,0.75,0.0,0.125,0.875,0.25,0.25,0.5,0.0,0.3125,0.6875,0.0,0.0,1.0
4,【 辽宁盘锦1村民被民警枪杀续：系政府违法强拆】 兴隆台区有关部门在没有和村民达成拆迁补偿协议、且没有法院判决的情况下违法强拆，导致矛盾迅速激化----,1010395495,"官方新闻说村民先动的手，民警开枪就合法,混蛋理论.强盗逻辑!",对科技产品持开放态度，但对社会现象和政策有个人见解关注民生，精英视角，自我中心，情绪宣泄，宏大叙事该用户关注科技动态，对新产品和技术持开放态度，同时在个人生活中表现出对家庭和工作的重视。他善于表达个人情感，同时对社会现象和政策有自己的见解。在社交网络上，他活跃度高，乐于分享个人经历和观点，展现出自我中心的特征。,首先需要明确的是，在这段文字中，我们看到了很多不同类型的网民对于同一个议题的看法和反应。其中，我们可以看到一些比较正面的态度，比如“赞同”、“理解”，也有一些负面的情绪，如“气愤”、“失望”。此外，还有一些人在谈论这个问题时采用了不同的方式，有的只是简单地分享他们的想法，有些则是更加深入地探讨了一些细节或者提出了一些建议等等。总的来说，这些网民们的意见都是基于各自的经验和知识背景的不同而产生的，因此我们需要认真听取每一个人的声音，才能更好地理解和解决问题。,0.0625,0.140625,0.796875,0.0,0.5,0.5,0.0,0.5,0.5,0.0,0.4375,0.5625,0.0,0.4375,0.5625,0.0,0.375,0.625,0.125,0.25,0.625,0.0,0.25,0.75,0.0,0.125,0.875,0.25,0.25,0.5,0.0,0.3125,0.6875,0.0,0.0,1.0
4,【 辽宁盘锦1村民被民警枪杀续：系政府违法强拆】 兴隆台区有关部门在没有和村民达成拆迁补偿协议、且没有法院判决的情况下违法强拆，导致矛盾迅速激化----,2646699341,公安本应不参与拆迁所以违法。,转发官方内容较多，但未表现出明显的反讽或反对态度关注民生，精英视角，底层共情，情绪宣泄，政治隐喻该用户表现出对官方和精英观点的关注，同时在转发内容中体现出对民生问题的关心。用户在表达上较为情绪化，但总体上倾向于温和的建制派立场。在社交活动中，该用户活跃度高，可能是一个意见领袖，对群体观点有较强的影响力。,首先需要明确的是，在这段文字中，我们看到了很多不同类型的网民对于同一个议题的看法和反应。其中，我们可以看到一些比较正面的态度，比如“赞同”、“理解”，也有一些负面的情绪，如“气愤”、“失望”。此外，还有一些人在谈论这个问题时采用了不同的方式，有的只是简单地分享他们的想法，有些则是更加深入地探讨了一些细节或者提出了一些建议等等。总的来说，这些网民们的意见都是基于各自的经验和知识背景的不同而产生的，因此我们需要认真听取每一个人的声音，才能更好地理解和解决问题。,0.0625,0.140625,0.796875,0.0,0.5,0.5,0.0,0.5,0.5,0.0,0.4375,0.5625,0.0,0.4375,0.5625,0.0,0.375,0.625,0.125,0.25,0.625,0.0,0.25,0.75,0.0,0.125,0.875,0.25,0.25,0.5,0.0,0.3125,0.6875,0.0,0.0,1.0
